,channel_title,video_id,title,description,publishedAt,duration_iso,duration_seconds,duration_hms,url
241,CNN,Tz5qQ9XUxVs,Americans scramble to leave Israel,"Commercial airlines have, for days now, halted all flights in and out of Israel due to the ongoing conflict with Iran. CNN spoke to multiple Americans in central Israel who are still struggling to leave the country. #cnn #cnnnews",2025-06-21T18:19:34Z,PT1M6S,66,0:01:06,https://www.youtube.com/watch?v=Tz5qQ9XUxVs
242,CNN,ascJqkmb7P8,Mahmoud Khalil met with cheers at airport in New Jersey,"A crowd erupted into cheers for Mahmoud Khalil, his wife and child as they arrived at Newark Airport on Saturday following Khalil’s released on bail from a Louisiana ICE detention center, more than three months after he was arrested outside his apartment on Columbia University’s campus. CNN’s Gloria Pazmino was at the airport for his arrival, which included the presence of Congresswoman Alexandria Ocasio-Cortez. #cnn #news",2025-06-21T18:17:21Z,PT41S,41,0:00:41,https://www.youtube.com/watch?v=ascJqkmb7P8
243,CNN,33y2D1i6fOA,Hot air balloon accident kills at least 8 in #Brazil,"A video posted to social media showed a hot air balloon catching fire in the sky before plummeting to the ground in Brazil on Saturday. Eight of the 21 people on board died in the incident, according to the local governor. #cnn #news #brazil #hotairballoon",2025-06-21T16:45:04Z,PT24S,24,0:00:24,https://www.youtube.com/watch?v=33y2D1i6fOA
244,CNN,06Nz__OCk04,Wounded Iranians describe Israeli strikes in Tehran,"The Israeli military has repeatedly said it has “only” targeted military installations yet the Iranian government insists that there have been more than 400 deaths, the majority of whom are civilians. CNN’s Fred Pleitgen visited a hospital in the Iranian capital of Tehran to hear from residents injured in airstrikes. #cnn #news #iran #tehran #israel",2025-06-21T14:39:50Z,PT1M36S,96,0:01:36,https://www.youtube.com/watch?v=06Nz__OCk04
245,CNN,hyqrHLSOPSk,Palestinian boy’s emotional plea for food in Gaza,"A Palestinian boy asked a journalist to share his message about the realities of food distribution in Gaza. He was on his way to a flour distribution site in Gaza City with his father, who gave permission for the boy to be filmed. #CNN #News #Gaza",2025-06-21T10:56:49Z,PT1M29S,89,0:01:29,https://www.youtube.com/watch?v=hyqrHLSOPSk
246,CNN,iwO3POX-4-M,Caves near China’s ‘Avatar Mountains’ found packed with decade-old trash,"A hidden environmental crisis is unfolding in ancient caves near China's Zhangjiajie Forest Park, famed for its massive quartz-sandstone pillar formations, which are said to have inspired the floating scenery that appears in the 2009 Hollywood blockbuster “Avatar.” Viral social media videos showing piles of trash in the area, some reportedly dumped over a decade ago, are prompting a mass cleanup of the karst caves. #CNN #News",2025-06-21T04:04:18Z,PT1M,60,0:01:00,https://www.youtube.com/watch?v=iwO3POX-4-M
247,CNN,oukyU4Lkn-c,Here's the latest look at US military assets in the Middle East amid Israel-Iran conflict,"President Donald Trump says Iran has a ""maximum"" of two weeks for a diplomatic solution as he weighs whether or not to involve US military assets. CNN looks at where the fighting stands, and what shifting US military assets into the Middle East means for the conflict ahead. #CNN #News",2025-06-21T03:00:52Z,PT6M31S,391,0:06:31,https://www.youtube.com/watch?v=oukyU4Lkn-c
248,CNN,H87eoxlTFDI,Video shows missiles from Iran streaking skies of Israel,"CNN's Anderson Cooper reports live from Tel Aviv, as Israel's military says it identified missiles launched from Iran and that defense systems are working to intercept them. The military called on the public to ""enter a protected space"" and stay there until further notice. Israel has also begun a new wave of attacks in Iran, its military said Saturday.",2025-06-21T02:15:52Z,PT32S,32,0:00:32,https://www.youtube.com/watch?v=H87eoxlTFDI
249,CNN,6uJ0l8hfp2U,Mahmoud Khalil speaks after being released from ICE detention center,"Palestinian activist Mahmoud Khalil was released on bail on Friday from a Louisiana ICE detention center, more than three months after he was arrested outside his apartment on Columbia University’s campus. The judge found Khalil is not a flight risk or a danger to public safety, saying it’s “highly unusual” to be seeking his detention at this point.",2025-06-21T01:12:28Z,PT37S,37,0:00:37,https://www.youtube.com/watch?v=6uJ0l8hfp2U
250,CNN,0S3ewSbGOsQ,Enforce laws or we 'send in' the guard: Vance visits LA amid immigration tension,Vice President JD Vance gave remarks in Los Angeles following a meet a greet with marines. The visit comes a day after agents were spotted in the parking lot outside Dodger Stadium. #CNN #News,2025-06-21T01:04:44Z,PT10M48S,648,0:10:48,https://www.youtube.com/watch?v=0S3ewSbGOsQ
251,CNN,jVIrhG7x2pU,Why Fareed Zakaria thinks Trump has ‘FOMO' foreign policy,CNN’s Fareed Zakaria analyzes what may be motivating President Trump’s foreign policy: a fear of missing out.,2025-06-20T23:54:12Z,PT45S,45,0:00:45,https://www.youtube.com/watch?v=jVIrhG7x2pU
252,CNN,ZEz9WW7PAiU,Trump: Gabbard is 'wrong' on Iran nuclear intelligence,"President Donald Trump took direct aim at his director of national intelligence, saying Tulsi Gabbard “is wrong” about Iran’s efforts on obtaining a nuclear weapon. The comment comes as Gabbard’s standing in the administration diminishes, according to sources who spoke with CNN. #CNN #News",2025-06-20T23:46:11Z,PT8M41S,521,0:08:41,https://www.youtube.com/watch?v=ZEz9WW7PAiU
253,CNN,LV0c7KLLbBw,Border patrol agents arrest US citizen standing up for detained maintenance worker,"A US citizen has been arrested after a physical altercation with immigration agents after they detained a maintenance worker at a shopping center in Pico Rivera, California. #CNN #news #immigration #borderpatrol",2025-06-20T22:47:20Z,PT1M34S,94,0:01:34,https://www.youtube.com/watch?v=LV0c7KLLbBw
254,CNN,ztYfCyz2cmE,Israel and Iran vow to keep fighting,Both Iran and Israel's UN ambassadors say that their countries will continue to fight during a tense UN Security Council meeting.,2025-06-20T22:42:43Z,PT1M26S,86,0:01:26,https://www.youtube.com/watch?v=ztYfCyz2cmE
255,CNN,9_o4bFmsnHA,Judge orders release of pro-Palestinian activist at the center of long-running deportation fight,A federal judge has ordered that Palestinian activist Mahmoud Khalil be granted release on bail from a Louisiana ICE detention center – more than three months after he was arrested outside his apartment on Columbia University’s campus. #CNN #News,2025-06-20T22:13:42Z,PT9M12S,552,0:09:12,https://www.youtube.com/watch?v=9_o4bFmsnHA
256,CNN,M4UZrME1MF8,Inside the room of the Geneva-Iran talks,"Talks between European and Iranian officials in Geneva, Switzerland were ""very tense"" at first, but then became much more positive. CNN's Matthew Chance takes us inside the room where these talks took place.",2025-06-20T22:05:51Z,PT2M5S,125,0:02:05,https://www.youtube.com/watch?v=M4UZrME1MF8
257,CNN,1RVJdQ8rvNc,Man arrested after GOP congressman says he was run off the road and threatened,"An Ohio man has been arrested and charged after allegedly threatening Rep. Max Miller during an incident in which the Republican US congressman says he was driven off the road. Feras S. Hamdan, 36, of Westlake, Ohio, was arrested after Miller filed and signed a complaint with police for aggravated menacing, as well as requested a protective order against him, according to police in Rocky River, a suburb of Cleveland. #CNN #News",2025-06-20T21:30:00Z,PT10M5S,605,0:10:05,https://www.youtube.com/watch?v=1RVJdQ8rvNc
258,CNN,x6Sa2lo8zHM,What happens next in Iran?,"CNN’s Christiane Amanpour examines what could happen next in Iran as the country exchanges strikes with Israel and Israeli Prime Minister Benjamin Netanyahu threatens to topple the current regime.

Editor’s note: This video has been updated to reflect Iranian missiles directly striking a hospital in Beer Sheva, Israel.",2025-06-20T21:08:24Z,PT2M40S,160,0:02:40,https://www.youtube.com/watch?v=x6Sa2lo8zHM
259,CNN,0KHouyllHRw,Trump says his intel chief Tulsi Gabbard is ‘wrong’ about Iran,"President Donald Trump took direct aim at his director of national intelligence, saying that Tulsi Gabbard “is wrong” about Iran’s efforts toward obtaining a nuclear weapon, as CNN has reported that Gabbard’s standing inside the Trump administration has diminished.",2025-06-20T21:07:55Z,PT22S,22,0:00:22,https://www.youtube.com/watch?v=0KHouyllHRw
260,CNN,TVL3uKU2ztw,Trump creates ‘breathing space’ for Iran,"After President Donald Trump announced he would make a decision on military action against Iran within two weeks, European and Iranian officials are meeting for discussions in Geneva, Switzerland. CNN's Global Affairs Correspondent Matthew Chance gives his analysis on the diplomatic talks and what comes next.

#CNN #News",2025-06-20T21:07:32Z,PT1M2S,62,0:01:02,https://www.youtube.com/watch?v=TVL3uKU2ztw
261,CNN,3rO36SZjmWI,Why aren't tariffs causing inflation?,"For the past year, many economists warned that tariffs would increase prices, but inflation is lower today than when President Trump took office. CNN's Matt Egan breaks down why this might be the case and how economists expect that to change in the coming months.",2025-06-20T20:29:01Z,PT1M9S,69,0:01:09,https://www.youtube.com/watch?v=3rO36SZjmWI
262,CNN,pra5DffEIw8,Trump: 'Very hard' to ask Israel to end Iran strikes as he pursues diplomacy,"President Donald Trump said it would be difficult for him to request Israel stop its airstrikes in Iran, even as he pursues a diplomatic solution to end the conflict. “I think it’s very hard to make that request right now if somebody is winning,” the president told reporters. #CNN #News",2025-06-20T20:24:04Z,PT10M38S,638,0:10:38,https://www.youtube.com/watch?v=pra5DffEIw8
263,CNN,LzAAsZw3oAw,What is a heat dome?,"The hottest temperatures of the year so far will soon reach the eastern half of the United States as a brutal heat dome starts to build over the weekend. Dangerous, record-breaking heat will impact millions next week. CNN's Tyler Mauldin explains.",2025-06-20T19:10:56Z,PT53S,53,0:00:53,https://www.youtube.com/watch?v=LzAAsZw3oAw
264,CNN,4VeBNtJ9KbM,Could there be radioactive fallout in Iran?,"Laura Holgate, Former US Ambassador to the United Nations International Organizations in Vienna weighs in on the likelihood of nuclear fallout if the US strikes the Fordow nuclear enrichment plant in Iran.",2025-06-20T19:10:17Z,PT2M35S,155,0:02:35,https://www.youtube.com/watch?v=4VeBNtJ9KbM
265,CNN,4jz6BQzECjo,Trump vowed to make Juneteenth a holiday. This year he ignored it.,President Donald Trump took to Truth Social on Juneteenth this year to criticize the number of 'non-working holidays.' CNN's Abby Phillip talks about the notable change from when the president once vowed to make it a federal holiday. #juneteenth #shorts,2025-06-20T19:07:32Z,PT1M8S,68,0:01:08,https://www.youtube.com/watch?v=4jz6BQzECjo
266,CNN,cUs1M4Zc_VY,What happens next in Iran?,"CNN’s Christiane Amanpour examines what could happen next in Iran as the country exchanges strikes with Israel and Israeli Prime Minister Benjamin Netanyahu threatens to topple the current regime. Editor’s note: This video has been updated to reflect Iranian missiles directly striking a hospital in Beer Sheeva, Israel.",2025-06-20T18:38:22Z,PT2M40S,160,0:02:40,https://www.youtube.com/watch?v=cUs1M4Zc_VY
267,CNN,8WE95Wxux2o,Europe backs Trump on Iran: French official confirms ‘zero enrichment’ push,"French Foreign Ministry Spokesperson Christophe Lemoine confirms that Europe has aligned with the US on a ""zero enrichment"" stance in nuclear negotiations with Iran. Speaking with Becky Anderson as Iranian Foreign Minister Araghchi meets with EU, UK, French, and German officials in Geneva, Lemoine outlines France’s broad diplomatic package.  #CNN #News",2025-06-20T18:34:06Z,PT10M14S,614,0:10:14,https://www.youtube.com/watch?v=8WE95Wxux2o
268,CNN,BZhTW7EJmng,Man arrested after Ohio GOP congressman says he was ‘run off the road’ and threatened,"A man in Ohio has been arrested and charged after allegedly threatening US Republican Rep. Max Miller during an incident in which Miller says he was driven off the road, a source familiar with the investigation told CNN.  #CNN #News",2025-06-20T17:53:09Z,PT10M46S,646,0:10:46,https://www.youtube.com/watch?v=BZhTW7EJmng
269,CNN,in-6_7YSwWg,CNN on the ground in Tehran as protesters take to the streets,Protesters take to the streets of central Tehran against Israel's strikes on Iran as well as the Trump administration. CNN's Fred Pleitgen reports what he sees on the ground.#CNN #News,2025-06-20T17:20:19Z,PT8M3S,483,0:08:03,https://www.youtube.com/watch?v=in-6_7YSwWg
270,CNN,KhlrsBsBUy4,Iranian Nobel laureate’s message to Trump from inside Iran,Nobel Peace Prize laureate and human rights activist Narges Mohammadi shares a message for President Donald Trump recorded from a safe shelter in Iran.,2025-06-20T17:07:33Z,PT1M12S,72,0:01:12,https://www.youtube.com/watch?v=KhlrsBsBUy4
271,CNN,b8sNYrPdI8o,CNN's Fred Pleitgen asks Iranian official about possible US involvement in conflict,"CNN's Fred Pleitgen is the first western journalist to enter Iran since the latest conflict with Israel started. He interviewed Majid Farahani, an official with the Iranian presidency, about the escalating tensions with Israel, Iran's nuclear program and what happens if the US gets directly involved in the conflict.",2025-06-20T16:58:56Z,PT2M25S,145,0:02:25,https://www.youtube.com/watch?v=b8sNYrPdI8o
272,CNN,rMurwnycSjQ,"Crowds in Iran protest Israel, Trump",Protesters take to the streets of central Tehran against Israel's strikes on Iran as well as the Trump administration. CNN's Fred Pleitgen reports what he sees on the ground. #CNN #news #Iran,2025-06-20T16:52:18Z,PT1M28S,88,0:01:28,https://www.youtube.com/watch?v=rMurwnycSjQ
273,CNN,M3ZmAhW36iU,Anderson Cooper reports from a bomb shelter in Israel,CNN’s Anderson Cooper reports from a bomb shelter in the basement of a hotel in Tel Aviv as Iran fires another round of missiles at Israel. #cnn #news #world,2025-06-20T16:49:03Z,PT1M14S,74,0:01:14,https://www.youtube.com/watch?v=M3ZmAhW36iU
274,CNN,3H6EvUczOAs,Anderson Cooper reports from a bomb shelter in Tel Aviv,CNN’s Anderson Cooper reports from a bomb shelter in the basement of a hotel in Tel Aviv as Iran fires another round of missiles at Israel. #CNN #News,2025-06-20T16:21:14Z,PT10M20S,620,0:10:20,https://www.youtube.com/watch?v=3H6EvUczOAs
275,CNN,aunMZg5H5ko,Aftermath of Iranian strike on Haifa,"CNN's Nic Robertson shows the aftermath of an Iranian strike on Haifa, Israel, less than an hour after it made impact. The strike wounded at least 17 people according to Israeli national emergency service MDA. #cnn #news #israel #haifa #iran",2025-06-20T15:28:08Z,PT49S,49,0:00:49,https://www.youtube.com/watch?v=aunMZg5H5ko
276,CNN,Fi3FLED7zCE,"Iran launches fresh missile barrage toward Israel, military says","At least 17 people were wounded in Israel on Friday after Iran launched a fresh missile salvo, according to health and emergency officials. CNN’s Nic Robertson reports.  #CNN #News",2025-06-20T15:19:23Z,PT11M,660,0:11:00,https://www.youtube.com/watch?v=Fi3FLED7zCE
277,CNN,4CKbwIC9zO0,‘Trump has lost the political battle’: Enten on polling for Trump's LA protests response,CNN chief data analyst Harry Enten examines public polling on President Donald Trump’s response to ICE raid protests in Los Angeles #CNN #News,2025-06-20T13:44:42Z,PT10M29S,629,0:10:29,https://www.youtube.com/watch?v=4CKbwIC9zO0
278,CNN,ift_rFEM8U0,CNN follows Israeli rescue team into Tel Aviv high rise struck by Iranian missile,CNN's Jeremy Diamond follows an elite Israeli military rescue unit tasked with responding to attacks in central Israel.  #CNN #News,2025-06-20T12:35:05Z,PT10M42S,642,0:10:42,https://www.youtube.com/watch?v=ift_rFEM8U0
279,CNN,w3D5gVKoI9A,Jewish GOP Congressman says he was 'run off the road',"GOP Rep. Max Miller said he was “run off the road” on his way to work in Ohio by an individual who yelled ""Death to Israel"" and had a Palestinian flag. Miller is Jewish and describes himself as a staunch defender of Israel. #cnn #news",2025-06-20T12:33:31Z,PT51S,51,0:00:51,https://www.youtube.com/watch?v=w3D5gVKoI9A
280,CNN,FExPMBZwEjQ,Iran’s foreign minister responds to Trump’s call for negotiations,"After President Trump opened a two-week negotiating window before he decides whether to strike Iran, Iranian Foreign Minister Abbas Araghchi says the country is not seeking negotiations with the United States.",2025-06-20T11:56:27Z,PT17S,17,0:00:17,https://www.youtube.com/watch?v=FExPMBZwEjQ
281,CNN,Hp9M6kEjjKo,Trump criticizes ‘non-working holidays’ on Juneteenth,"President Donald Trump took to social media on Juneteenth, a federal holiday, to criticize the number of “non-working holidays” in the United States.  #CNN #News",2025-06-20T11:50:58Z,PT6M21S,381,0:06:21,https://www.youtube.com/watch?v=Hp9M6kEjjKo
282,CNN,PfkFGNykJ4I,Erick makes landfall as Category 3 hurricane in Mexico,"Hurricane Erick slammed into Mexico’s Oaxaca state as a dangerous Category 3 storm Thursday morning, unleashing powerful winds along the coast and spreading heavy rain over the region. #CNN #news #hurricaneerick #mexico",2025-06-20T10:36:35Z,PT58S,58,0:00:58,https://www.youtube.com/watch?v=PfkFGNykJ4I
283,CNN,2Rwrpsj56XA,Brownstein on MAGA split regarding Trump and Iran,CNN senior political analyst Ron Brownstein joins CNN’s MJ Lee on “Early Start” to weigh in on the backlash President Donald Trump is drawing from MAGA supporters over potential US strikes on Iran.  #CNN #News,2025-06-20T10:30:02Z,PT5M43S,343,0:05:43,https://www.youtube.com/watch?v=2Rwrpsj56XA
284,CNN,WcZeDJratIc,How much protein do you really need? | Chasing Life,"Americans are protein obsessed, but should we be? Renowned nutritionist Dr. Tim Spector sits down with Dr. Sanjay Gupta to share why the focus on protein may mean we’re missing out on another crucial nutrient.

Listen to the full episode of CNN's Chasing Life podcast: https://link.chtbl.com/HL8Qzh4n

#cnn #news #health #protein",2025-06-20T10:01:03Z,PT35M20S,2120,0:35:20,https://www.youtube.com/watch?v=WcZeDJratIc
285,CNN,GNMRKrUlFhM,Iranian missile strikes tech park housing Microsoft office in southern Israel,"First responders are searching buildings for people wounded after an Iranian missile struck close to a tech park in the Israeli city of Beer Sheva, according to Israel’s emergency services agency Magen David Adom (MDA). #CNN #News #Israel #Iran",2025-06-20T06:22:50Z,PT36S,36,0:00:36,https://www.youtube.com/watch?v=GNMRKrUlFhM
286,CNN,VaMRFsviBN0,Appeals court rules Trump can keep control of CA National Guard,"A federal appeals court is allowing President Donald Trump to continue to have control of 4,000 guardsman from California. The state's Gov. Gavin Newsom argued the President violated federal law when he seized control of part of his state's militia. #CNN #News",2025-06-20T03:30:36Z,PT11M2S,662,0:11:02,https://www.youtube.com/watch?v=VaMRFsviBN0
287,CNN,lS9NbN79FfU,Obama's energy secretary on Iran's ability to make a nuclear bomb,"CNN's Erin Burnett speaks with Ernest Moniz, the former US energy secretary under Obama and negotiator of the Iran nuclear deal, about the country's nuclear capabilities.",2025-06-20T02:49:43Z,PT2M4S,124,0:02:04,https://www.youtube.com/watch?v=lS9NbN79FfU
288,CNN,-Iazr0daJq4,Federal agents draw protesters outside Dodger stadium,CNN's Natasha Chen reports from outside Dodger Stadium in Los Angeles where federal agents were posted after being denied access to the stadium according the the Dodgers. The Department of Homeland Security stated that the agents who were at Dodger Stadium were not from ICE and their presence wasn’t related to the immigration crackdown throughout Los Angeles.,2025-06-20T02:39:58Z,PT51S,51,0:00:51,https://www.youtube.com/watch?v=-Iazr0daJq4
289,CNN,YL5uNgYJ3zI,Netanyahu: Israel will 'strike all the nuclear facilities' in Iran,"Israeli Prime Minister Benjamin Netanyahu warned his military will “strike all the nuclear facilities” in Iran. This as a major hospital in Israel’s south has sustained “extensive damage” from a wave of Iranian missiles, according to officials. Iran said it targeted a nearby technology park it claims was used by the Israeli military. #CNN #News",2025-06-20T02:10:49Z,PT9M22S,562,0:09:22,https://www.youtube.com/watch?v=YL5uNgYJ3zI
290,CNN,iwz4onK8W64,"CDC official resigns, makes dire warning",Former infectious disease expert Dr. Fiona Havers speaks with CNN’s Jake Tapper after resigning from the CDC citing concerns about changes to the agency’s vaccine processes under US Health and Human Services Secretary Robert F. Kennedy Jr. #cnn #news #cdc #shorts,2025-06-20T01:57:10Z,PT1M3S,63,0:01:03,https://www.youtube.com/watch?v=iwz4onK8W64
291,CNN,NR1hV7pDO2g,CNN witnesses Iranian air defenses firing over Tehran,"CNN’s Fred Pleitgen is in Tehran, where the streets are nearly empty amid the sounds of sporadic thuds and outgoing anti-aircraft fire. #CNN #News",2025-06-20T00:52:56Z,PT10M37S,637,0:10:37,https://www.youtube.com/watch?v=NR1hV7pDO2g
292,CNN,h7QH459CsHA,Scores killed in Gaza in latest Israeli strikes,"Israeli strikes in Gaza killed more than 70 people on Thursday, with multiple children dying. Injured children, screaming in pain, were brought to Baptist Hospital in Gaza City and other children appeared lifeless as they were carried into the ward.",2025-06-20T00:07:34Z,PT46S,46,0:00:46,https://www.youtube.com/watch?v=h7QH459CsHA
293,CNN,6zVOctwW068,CNN team hears increase in aerial activity over skies in Tehran,"CNN's Fred Pleitgen reports on the ground in Tehran, Iran, and witnesses increased aerial activity over the city as the Israel-Iran conflict continues.

#CNN #News",2025-06-19T23:57:12Z,PT1M3S,63,0:01:03,https://www.youtube.com/watch?v=6zVOctwW068
294,CNN,LhzNAesXRk4,50 years of 'Jaws' and shark attacks,"As Steven Spielberg's summer blockbuster 'Jaws' turns 50, CNN's Harry Enten figures out how likely it is to be attacked by a shark and whether we should fear the waters.",2025-06-19T23:36:52Z,PT1M58S,118,0:01:58,https://www.youtube.com/watch?v=LhzNAesXRk4
295,CNN,wa7DDfufdH0,Militant group threatens US bases as Iran tensions rise,An Iran-backed powerful Shiite militia in Iraq vowed on Thursday to attack US military bases in the Middle East if the Trump administration enters the Israel-Iran conflict. #CNN #News,2025-06-19T23:24:10Z,PT9M,540,0:09:00,https://www.youtube.com/watch?v=wa7DDfufdH0
296,CNN,lnhn3098XmQ,CDC vaccine expert resigns after RFK Jr. purges advisers,A leading scientist and vaccine expert at the CDC has resigned after RFK Jr. fired all 17 members of a CDC advisory committee. #CNN #News,2025-06-19T22:11:38Z,PT6M27S,387,0:06:27,https://www.youtube.com/watch?v=lnhn3098XmQ
297,CNN,NB3nAl7PFcI,Analyzing the impact of Israel’s strikes on Iran,"Israel’s strikes not only took out top Iranian leaders, they also caused civilian deaths. CNN’s Katie Polglase breaks down the human toll at the locations where top Iranian officials were killed. #CNN #news #Iran #Israel",2025-06-19T22:09:56Z,PT1M24S,84,0:01:24,https://www.youtube.com/watch?v=NB3nAl7PFcI
298,CNN,rm97Io-xDoc,'Trust in President Trump': White House on US involvement in the Middle East,White House press secretary Karoline Leavitt answered reporters’ questions on the Israel-Iran conflict and possible US involvement during a news briefing. Leavitt urged supporters to “trust in President Trump” after some MAGA allies criticized the administration’s consideration of increased US involvement in the conflict. #CNN #News,2025-06-19T21:30:11Z,PT8M59S,539,0:08:59,https://www.youtube.com/watch?v=rm97Io-xDoc
299,CNN,8W2GbsyyBNM,FDA approves twice-a-year shot to prevent HIV,A drug already used to treat HIV has now been given FDA approval to prevent new infections. CNN's Jacqueline Howard explains just how effective the drug is. #cnn #news #health #HIV,2025-06-19T21:21:23Z,PT1M21S,81,0:01:21,https://www.youtube.com/watch?v=8W2GbsyyBNM
300,CNN,wyY_RXMRKOg,CNN joins UFO hunters in the California desert,"UFO hunters, telepathists, and crystal skull readers - CNN's Donie O'Sullivan heads to the California desert to the largest event for extraterrestrial enthusiasts on this planet #CNN #News",2025-06-19T20:42:14Z,PT8M48S,528,0:08:48,https://www.youtube.com/watch?v=wyY_RXMRKOg
301,CNN,2Au_-eooZB4,Analysis: What Israeli officials say publicly vs. privately on US involvement,Israeli Prime Minister Benjamin Netanyahu reasserted President Donald Trump is ‘a tremendous friend of Israel’ after Iranian missiles struck Soroka Hospital. CNN’s Clarissa Ward reports from Tel Aviv on what officials are saying publicly and privately.,2025-06-19T20:03:05Z,PT1M33S,93,0:01:33,https://www.youtube.com/watch?v=2Au_-eooZB4
302,CNN,DxICEOyO7AM,Trump to allow two weeks before deciding on US strike in Iran,"In a White House briefing, Press Secretary Karoline Leavitt shared a statement from President Donald Trump regarding a US strike on Iran.",2025-06-19T18:59:33Z,PT33S,33,0:00:33,https://www.youtube.com/watch?v=DxICEOyO7AM
303,CNN,o1RaqBjEbTg,Trump admin. to end 988 suicide prevention service for LGBTQ+ youth,The Trump administration is ending the 988 Suicide & Crisis Lifeline’s specialized services for LGBTQ+ youth on July 17. CNN's Jacqueline Howard reports. #CNN #News,2025-06-19T18:34:00Z,PT1M2S,62,0:01:02,https://www.youtube.com/watch?v=o1RaqBjEbTg
