,channel_title,video_id,title,description,publishedAt,duration_iso,duration_seconds,duration_hms,url
591,CNN,y13lL9nDAK8,Erin Burnett at scene of police-protester standoff in LA,"CNN’s Erin Burnett reports a mix of state law enforcement and US military present at a standoff between protesters and police as of 5pm local time in Los Angeles. The situation escalated when a protester threw a water bottle, prompting police to draw weapons, causing panic among the crowd. Tensions have been heightened by the deployment of the National Guard troops by President Donald Trump, which has led to legal action from California’s Governor Gavin Newsom against the president’s decision."" #CNN #News #losangeles",2025-06-10T04:01:30Z,PT2M11S,131,0:02:11,https://www.youtube.com/watch?v=y13lL9nDAK8
592,CNN,47qQYIbgMFs,Trump suggests border czar should arrest Newsom. See Homan's reaction,White House border czar Tom Homan joined CNN’s Kaitlan Collins to discuss comments President Donald Trump made suggesting Homan arrest California Governor Gavin Newsom. #CNN #News,2025-06-10T02:15:29Z,PT10M14S,614,0:10:14,https://www.youtube.com/watch?v=47qQYIbgMFs
593,CNN,2CIuB5c9nTs,Blake Lively's lawyer on Taylor Swift's role in legal fight,CNN's Jake Tapper speaks with Blake Lively's attorney Michael Gottlieb about how Taylor Swift was brought into the legal fight between Lively and Justin Baldoni.,2025-06-10T01:40:20Z,PT1M5S,65,0:01:05,https://www.youtube.com/watch?v=2CIuB5c9nTs
594,CNN,FWqoEPLWcJE,Tom Homan says Newsom hasn’t done anything to warrant arrest,White House border czar Tom Homan joined CNN’s Kaitlan Collins to discuss comments President Donald Trump made suggesting Homan arrest California Governor Gavin Newsom.,2025-06-10T01:04:34Z,PT1M7S,67,0:01:07,https://www.youtube.com/watch?v=FWqoEPLWcJE
595,CNN,E_rYISnChok,About 700 Marines being mobilized in response to LA protests,"Active-duty Marines in California have been mobilized to support the National Guard and local law enforcement in Los Angeles, following days of protests lashing out at immigration enforcement actions by the Trump administration. California’s governor calls the move “unwarranted.”",2025-06-10T00:47:34Z,PT1M20S,80,0:01:20,https://www.youtube.com/watch?v=E_rYISnChok
596,CNN,8i2Lhezeclw,Why Los Angeles is a hotspot for immigration protests,"Los Angeles is home to a large population of Hispanic and Latinos -- nearly half of the population, in fact – according to census data. CNN's Gonzalo Alvarado explains how LA's demographics are playing an influential role in fueling immigration protests. #cnn #news #losangeles #LA #immigration",2025-06-10T00:23:02Z,PT56S,56,0:00:56,https://www.youtube.com/watch?v=8i2Lhezeclw
597,CNN,36GW_NY3Yno,"Newsom: 2,000 more troops to be deployed in LA by Trump administration","California Gov. Gavin Newsom said he was informed that President Donald Trump is deploying an additional 2,000 National Guard troops to Los Angeles. #CNN #News",2025-06-10T00:16:26Z,PT8M22S,502,0:08:22,https://www.youtube.com/watch?v=36GW_NY3Yno
598,CNN,hprUMbzKX6s,Protests continue in downtown LA,Protests are in their fourth day in Los Angeles in response to the Trump administration's immigration crackdown. CNN's Kyung Lah reports from the center of the demonstrations.,2025-06-09T23:28:44Z,PT1M57S,117,0:01:57,https://www.youtube.com/watch?v=hprUMbzKX6s
599,CNN,J6_7VNiDDWA,"Judge dismisses Justin Baldoni’s $400 million defamation lawsuit against Blake Lively, Ryan Reynolds","A judge dismissed Justin Baldoni’s $400 million defamation lawsuit against Hollywood power couple Blake Lively and Ryan Reynolds, a major development in the ongoing civil litigation between former co-stars Lively and Baldoni. #CNN #News",2025-06-09T23:18:32Z,PT5M43S,343,0:05:43,https://www.youtube.com/watch?v=J6_7VNiDDWA
600,CNN,6qX3mknem6Q,What would it take for Trump to send active military to streets of LA?,President Donald Trump deployed about 300 National Guard troops to Los Angeles to protect federal personnel and property as clashes broke out between demonstrators and police this weekend. CNN Chief Law Enforcement and Intelligence Analyst John Miller analyzes what it might take for Trump to deploy active military to a major city.,2025-06-09T21:59:28Z,PT1M56S,116,0:01:56,https://www.youtube.com/watch?v=6qX3mknem6Q
601,CNN,CTXRh0_UpkY,About 700 Marines being mobilized as California vows to sue Trump administration,"Roughly 700 Marines based out of the Marine Corps Air Ground Combat Center in California have been mobilized to respond to the protests in Los Angeles, according to three people familiar with the matter, and will join the National Guard troops that were activated by Trump over the weekend without the consent of California’s governor or the city’s mayor. #CNN #News",2025-06-09T21:30:15Z,PT10M53S,653,0:10:53,https://www.youtube.com/watch?v=CTXRh0_UpkY
602,CNN,_I4YIIyZ_F0,Journalist explains ‘huge win’ for Blake Lively in Baldoni lawsuit,"A judge dismissed Justin Baldoni’s $400 million defamation lawsuit against Hollywood power couple Blake Lively and Ryan Reynolds, a major development in the ongoing civil litigation between former co-stars Lively and Baldoni. Executive editor for Deadline Hollywood Dominic Patten joins CNN's Brianna Keilar to discuss.",2025-06-09T20:47:50Z,PT36S,36,0:00:36,https://www.youtube.com/watch?v=_I4YIIyZ_F0
603,CNN,V6MHfo1XsiE,'An unmistakable step toward authoritarianism': Newsom reacts to Trump's push for his arrest,"Trump suggested ""border czar"" Tom Homan should arrest Gov. Gavin Newsom, saying, “I would do it if I were Tom.” Newsom in an interview on MSNBC dared Homan to go through with an arrest and responded to Trump’s suggestion he could be arrested. “This is a day I hoped I would never see in America. I don’t care if you’re a Democrat or a Republican this is a line we cannot cross as a nation — this is an unmistakable step toward authoritarianism,” Newsom wrote on X. #CNN #News",2025-06-09T20:28:08Z,PT9M23S,563,0:09:23,https://www.youtube.com/watch?v=V6MHfo1XsiE
604,CNN,LTuSUcTSG9c,Dr. Phil was embedded with ICE during controversial Los Angeles immigration raids,"As federal agents prepared to fan out in Los Angeles for a controversial immigration crackdown, the officers were greeted by a familiar face: Dr. Phil McGraw. The television personality and his camera crew were on hand before and after the raids that took place on Friday and triggered several days of street protests. CNN’s Brian Stelter reports.  #CNN #News",2025-06-09T19:12:39Z,PT10M23S,623,0:10:23,https://www.youtube.com/watch?v=LTuSUcTSG9c
605,CNN,tCfHXwna24c,Trump suggests border czar should arrest Newsom,"California Gov. Gavin Newsom said the state will sue the Trump administration over the deployment of National Guard troops in Los Angeles, which he and LA Mayor Karen Bass have called inflammatory. Trump’s border czar Tom Homan tried to clarify today he wasn’t calling for Newsom’s arrest, saying, “there was no discussion about arresting Newsom.” But while Homan tried to walk back his earlier remarks, Trump suggested he should arrest the governor, saying, “I would do it if I were Tom.”   #CNN #News",2025-06-09T17:50:11Z,PT9M37S,577,0:09:37,https://www.youtube.com/watch?v=tCfHXwna24c
606,CNN,ORz6QkBj95k,Hear Mexico president’s response to LA protests,Mexican President Claudia Sheinbaum said she does not agree with the violent immigration protests in Los Angeles and urged Mexicans in California to “not fall into provocations.” The president emphasized that Mexicans in the US “are good men and women.” #CNN #news #LosAngeles #Mexico,2025-06-09T17:09:59Z,PT37S,37,0:00:37,https://www.youtube.com/watch?v=ORz6QkBj95k
607,CNN,j88LBflmZk0,'Nothing was happening here': LA mayor blames immigration raid for violence,"The situation in Los Angeles has calmed down after protesters clashed with police over the weekend. CNN witnessed police using flash-bangs and tear gas to disperse crowds, with some hitting protesters, as well as protesters setting self-driving cars on fire. The city's mayor, Karen Bass, says she blames federal immigration raids for the escalating tensions.

 #CNN #News",2025-06-09T16:37:30Z,PT11M2S,662,0:11:02,https://www.youtube.com/watch?v=j88LBflmZk0
608,CNN,paHkEKLDZL4,Rep. Maxine Waters denied entry into LA detention center,"Rep. Maxine Waters (D-CA) was denied entry to the Metropolitan Detention Center in Los Angeles while trying to speak with David Huerta, leader of the Service Employees International Union California. Huerta was arrested by federal agents after prosecutors say he tried to obstruct their access to a worksite. He has called actions taken against protesters an ""injustice."" CNN's Wolf Blitzer speaks with Rep. Waters. #CNN #News",2025-06-09T15:57:49Z,PT10M58S,658,0:10:58,https://www.youtube.com/watch?v=paHkEKLDZL4
609,CNN,nLfGxwH0Qk8,Tennessee sheriff's office airlifts escaped zebra to safety,"A zebra, that escaped from its owner in Christiana, Tennessee was captured on Sunday and airlifted to safety by the local sheriff's office. The animal, named Ed, had been reported missing just a day after he was acquired by its owners in Rutherford County. They have since been reunited.
#CNN #News",2025-06-09T15:44:24Z,PT36S,36,0:00:36,https://www.youtube.com/watch?v=nLfGxwH0Qk8
610,CNN,DXLVKUH8pJY,Retired colonel details ‘danger signs’ as Russia claims to advance deeper into Ukraine,"Russia claimed that its forces are, for the first time, pushing into the central Ukrainian region of Dnipropetrovsk — an area it has been trying to reach for months — in a move that could create new problems for Kyiv’s much-stretched forces. Retired Air Force Col. Cedric Leighton reacts to Russia’s claim.  #CNN #News",2025-06-09T15:20:01Z,PT8M14S,494,0:08:14,https://www.youtube.com/watch?v=DXLVKUH8pJY
611,CNN,Z_jIL8qsYqA,Ukrainian boxer to Trump: 'Open your eyes',"World heavyweight boxing champion Oleksandr Usyk shared a message for President Trump in an interview with CNN, asking him to help Ukraine as it continues its fight against a full-scale Russian invasion.",2025-06-09T15:10:51Z,PT55S,55,0:00:55,https://www.youtube.com/watch?v=Z_jIL8qsYqA
612,CNN,NTIUXXcB-gY,Enten: 'The American electorate believe the Democrats don't have a clue' on immigration,CNN chief data analyst Harry Enten runs the numbers and unpacks why President Trump is happy to talk about immigration. #CNN #News,2025-06-09T14:36:05Z,PT8M8S,488,0:08:08,https://www.youtube.com/watch?v=NTIUXXcB-gY
613,CNN,WqQkB8BBHeE,Trump's sweeping new travel ban takes effect,"A sweeping new travel ban on citizens from a dozen nations took effect Monday, reviving a defining effort from the first Trump administration to crack down on entries from specific countries.

CNN senior White House reporter Kevin Liptak reports, and CNN's Sara Sidner talks with AfghanEvac president Shawn VanDiver.
 #CNN #News",2025-06-09T13:45:03Z,PT10M43S,643,0:10:43,https://www.youtube.com/watch?v=WqQkB8BBHeE
614,CNN,kUwvieP8Jx4,He called for protests over ICE raid. Hear his reaction to violent escalation,"CNN's Rosemary Church asks Pablo Alvarado, the co-executive director of the National Day Laborer Organizing Network who called for peaceful protests to protect vulnerable immigrant communities, what he thinks about the violent protests in Los Angeles.  #CNN #News",2025-06-09T13:06:02Z,PT10M31S,631,0:10:31,https://www.youtube.com/watch?v=kUwvieP8Jx4
615,CNN,z-FJBGhszRs,Israel intercepts Gaza-bound aid ship,"Israel has intercepted a Gaza-bound aid ship carrying Greta Thunberg and other prominent activists, detaining those onboard, according to the Freedom Flotilla Coalition (FFC), with Israel’s foreign ministry saying activists have been taken to Israel. #CNN #news",2025-06-09T12:54:34Z,PT1M24S,84,0:01:24,https://www.youtube.com/watch?v=z-FJBGhszRs
616,CNN,8rX9f9NkiVI,All of Downtown Los Angeles has been declared an unlawful assembly area,"CNN witnessed police using flash-bangs and tear gas to disperse crowds, with some hitting protesters, as well as protesters setting self-driving cars on fire. Police have declared all of Downtown Los Angeles an unlawful assembly area after arresting dozens over the weekend.  #CNN #News",2025-06-09T11:53:04Z,PT11M2S,662,0:11:02,https://www.youtube.com/watch?v=8rX9f9NkiVI
617,CNN,ln8Gnt-uEKE,Why Trump is on billboards in Syria’s capital city,"Billboards thanking President Trump have popped up across Damascus, Syria’s capital city. CNN’s Clarissa Ward meets the woman trying to “Make Syria Great Again.” #cnn #news #syria #damascus #trump",2025-06-09T10:30:32Z,PT1M19S,79,0:01:19,https://www.youtube.com/watch?v=ln8Gnt-uEKE
618,CNN,DWxk_VJA4tY,LA protests - how did we get here?,"CNN takes a look at protests in Los Angeles over the weekend in response to immigration raids. Immigration authorities and demonstrators clashed over the weekend with unrest beginning Friday after dozens of people were detained by federal immigration agents across different locations. President Donald Trump has deployed 2,000 National Guardsmen to the city to disperse protests. #cnn #news #LA #LAprotests #ICEprotest",2025-06-09T08:19:55Z,PT1M31S,91,0:01:31,https://www.youtube.com/watch?v=DWxk_VJA4tY
619,CNN,brq2cynmUEQ,Self-driving cars set on fire during LA protests,CNN's Kyung Lah reports on self-driving cars being set on fire and vandalized during protests against immigration raids in Los Angeles.,2025-06-09T03:26:05Z,PT54S,54,0:00:54,https://www.youtube.com/watch?v=brq2cynmUEQ
620,CNN,kIzokZOZfvs,Rep. Maxine Waters denied entry into detention center,Democratic Rep. Maxine Waters of California was denied entry to the Metropolitan Detention Center in Los Angeles while trying to speak with David Huerta. The leader of the Service Employees International Union California was arrested by federal agents after prosecutors say he tried to obstruct their access to a worksite. He has called actions taken against protesters an “injustice.”,2025-06-09T02:37:42Z,PT56S,56,0:00:56,https://www.youtube.com/watch?v=kIzokZOZfvs
621,CNN,zM4gJcm8k-E,Pepper balls used against protesters in Los Angeles,"Law enforcement has launched pepper balls, spray, and tear gas into the crowd outside of the Metropolitan Detention Center to disperse protesters, who have been clashing with National Guard, ICE and DHS agents outside of the detention center in Los Angeles.",2025-06-09T00:45:35Z,PT1M10S,70,0:01:10,https://www.youtube.com/watch?v=zM4gJcm8k-E
622,CNN,U0Cv50oMPYA,Aerial video shows Los Angeles protest,"Demonstrators flood the streets, including freeways, near an initial protest site at the Metropolitan Detention Center after the assembly was declared unlawful by the Los Angeles Police Department. CNN affiliate KABC captured aerial video from the scene.",2025-06-09T00:44:59Z,PT1M1S,61,0:01:01,https://www.youtube.com/watch?v=U0Cv50oMPYA
623,CNN,sKfnpwwRGZ4,National Guard on the ground in LA after Trump's deployment order,"About 300 National Guardsmen are deployed at three locations around Los Angeles, the California governor’s office said. It follows a presidential memorandum signed by President Donald Trump Saturday, sending 2,000 National Guardsmen to disperse protests sparked by immigration raids. 

Watch CNN for more:
0:00 CNN senior investigative correspondent Kyung Lah shares the LAPD's statement on protests outside of the Metropolitan Detention Center in Los Angeles, while CNN senior White House correspondent Betsy Klein gives the Trump administration's response. CNN chief law enforcement and intelligence analyst John Miller also reacts to the National Guard's deployment.
10:52 CNN military analyst retired Col. Cedric Leighton tells CNN's Victor Blackwell whether he thinks the deployment is an ""overreaction.""
16:19 CNN national security analyst Juliette Kayyem talks with CNN's Manu Raju about the significance of utilizing the National Guard.
20:51 Rep. Nanette Barragán (D-CA), who represents Paramount, CA, talks with CNN's Dana Bash about what’s happening on the ground.
27:27 Rep. Mike Lawler (R-NY) provides his take on the situation.
28:42 CNN's Victor Blackwell discusses the protests and the administration's response with his ""CNN This Morning"" panel.
 #CNN #News",2025-06-08T21:41:54Z,PT31M36S,1896,0:31:36,https://www.youtube.com/watch?v=sKfnpwwRGZ4
624,CNN,xbCszBCIPUE,What does Ukraine's drone attack on Russia say about the future of warfare?,CNN's Fareed Zakaria talks with former NATO Supreme Allied Commander retired Adm. James Stavridis and military strategist Christopher Kirchhoff about the future of war. #CNN #News,2025-06-08T20:23:06Z,PT10M53S,653,0:10:53,https://www.youtube.com/watch?v=xbCszBCIPUE
625,CNN,nLLp25duNUU,Palestinians in Gaza show CNN what’s inside their aid boxes,"Palestinians at the Netzarim aid distribution point in Gaza shared their frustrations with the system, telling CNN they don’t think the aid boxes are being distributed fairly. The Gaza Humanitarian Foundation has said the aid boxes are designed to feed one family in Gaza for 3.5 days. #cnn #news #gaza #palestinians #aid #humanitarianaid",2025-06-08T19:18:39Z,PT43S,43,0:00:43,https://www.youtube.com/watch?v=nLLp25duNUU
626,CNN,8X-N1emuKqk,Fareed's Take: America's CEOs used to criticize government policies,"CNN's Fareed Zakaria shares his take on the Trump administration's ""big, beautiful bill"" and why CEOs are staying quiet. #CNN #News",2025-06-08T18:32:35Z,PT5M58S,358,0:05:58,https://www.youtube.com/watch?v=8X-N1emuKqk
627,CNN,QW1lRejs1Mk,"GOP Sen. Johnson: Trump's 'big, beautiful bill' won't pass Senate","Sen. Ron Johnson (R-WI) sits down with CNN's Dana Bash on ""State of the Union"" to discuss the LA immigration protests, Medicaid funding and President Trump's agenda. #CNN #News",2025-06-08T16:59:56Z,PT7M34S,454,0:07:34,https://www.youtube.com/watch?v=QW1lRejs1Mk
628,CNN,MtUYiCY4UY4,Bernie Sanders: President Trump ‘wants all of the power’,"Senator Bernie Sanders (I-VT) spoke with CNN's Dana Bash on ""State of the Union. He criticized President Donald Trump’s decision to deploy National Guard troops in Los Angeles, claiming that Trump “wants all the power” and is rapidly moving the US “into authoritarianism.” #CNN #News",2025-06-08T15:52:00Z,PT7M23S,443,0:07:23,https://www.youtube.com/watch?v=MtUYiCY4UY4
629,CNN,f4pUyYel86M,Bernie Sanders: Trump 'wants all the power',"Senator Bernie Sanders (I-VT) criticized President Donald Trump’s decision to deploy National Guard troops in Los Angeles, claiming that Trump “wants all of the power” and is rapidly moving the US “into authoritarianism.” #CNN #News",2025-06-08T15:38:23Z,PT59S,59,0:00:59,https://www.youtube.com/watch?v=f4pUyYel86M
630,CNN,ftoUlyIPoTI,Mullin: LA protesters 'carrying a foreign flag. That is absolutely insane',"Sen. Markwayne Mullin (R-OK) sits down with CNN's Dana Bash on ""State of the Union"" to discuss the LA immigration protests, Medicaid funding, and the feud between President Trump and Elon Musk. #CNN #News",2025-06-08T15:17:00Z,PT9M38S,578,0:09:38,https://www.youtube.com/watch?v=ftoUlyIPoTI
631,CNN,-LsX2-gFBP4,"Listen to Sir David Attenborough, says Prince William in plea on World Oceans Day","On World Oceans Day, Prince William pleaded to an international audience to “think big in your actions,” as the Prince of Wales outlined an agreement that seeks to protect 30% of land and sea by 2030. It comes after a conversation between the prince and Sir David Attenborough was shared this weekend in which the biologist said that what humans have done to oceans ""is just unspeakably awful."" #cnn #news #worldoceansday #climatechange #climate #ocean",2025-06-08T14:38:00Z,PT54S,54,0:00:54,https://www.youtube.com/watch?v=-LsX2-gFBP4
632,CNN,TU37YJFZpe8,Tanks arrive in DC ahead of US Army parade,"As the 250th anniversary celebration for the US Army approaches, a freight train of tanks was seen making its way into the nation's capital. The long-planned celebration in Washington will coincide with Trump's 79th birthday and include thousands of troops. The Army had said it has no plans to recognize the president's birthday.

#cnn #news #usarmy #trump",2025-06-08T13:00:38Z,PT41S,41,0:00:41,https://www.youtube.com/watch?v=TU37YJFZpe8
633,CNN,wCQR3bikv6E,Colombian presidential hopeful Miguel Uribe shot in Bogota,"A Colombian senator and presidential hopeful is in a critical condition after being shot twice at an event in Bogota, according to national police and prosecutors. Police arrested a 15-year-old carrying a Glock pistol, according to the Attorney General’s Office. Miguel Uribe expressed intentions to run in the 2026 presidential election for the country’s largest opposition party, the center-right Centro Democrático, or Democratic Center. #cnn #news #colombia #migueluribe",2025-06-08T07:33:39Z,PT1M5S,65,0:01:05,https://www.youtube.com/watch?v=wCQR3bikv6E
634,CNN,UR0nXL_av20,Immigration protests break out in Los Angeles,"President Donald Trump signed a presidential memorandum deploying 2,000 National Guardsmen to disperse the protests that began in the Los Angeles area in response to immigration raids. Law enforcement authorities and demonstrators have clashed for two days. CNN's Julia Vargas Jones reports.
#CNN #News #shorts",2025-06-08T04:09:14Z,PT1M35S,95,0:01:35,https://www.youtube.com/watch?v=UR0nXL_av20
635,CNN,vBQN0Oq4g_8,Scott Pelley: 'You cannot have democracy without journalism',"CNN's Anderson Cooper speaks with ""60 Minutes"" anchor Scott Pelley about the importance of journalism and the First Amendment. #CNN #News",2025-06-08T03:35:03Z,PT11M,660,0:11:00,https://www.youtube.com/watch?v=vBQN0Oq4g_8
636,CNN,YDq2DYFcHUE,Trump deploys National Guard amid Los Angeles immigration protests,"President Donald Trump has signed a presidential memorandum deploying 2,000 National Guardsmen to Los Angeles to disperse protests that began in response to immigration raids, the White House said in a statement Saturday night. CNN's Julia Vargas Jones reports and CNN national security analyst Juliette Kayyem reacts. #CNN #News",2025-06-08T02:56:26Z,PT9M51S,591,0:09:51,https://www.youtube.com/watch?v=YDq2DYFcHUE
637,CNN,YMdtWL7JV6I,'We have a responsibility to facts': CNN's Abby Phillip on journalism,"CNN's Anderson Cooper discusses ""Good Night, and Good Luck"" and its contemporary resonances, with a distinguished panel: journalist and author Walter Isaacson, former anchor Connie Chung, CNN contributor and podcaster Kara Swisher, former Univision anchor Jorge Ramos, CNN anchor Abby Phillip, and New York Times opinion columnist Bret Stephens. #CNN #News",2025-06-08T01:47:24Z,PT10M28S,628,0:10:28,https://www.youtube.com/watch?v=YMdtWL7JV6I
638,CNN,vlO6viqQmqk,"Director shares what he wants audience to take away from 'Good Night, and Good Luck'","CNN's Pamela Brown speaks with some of the creative team behind ""Good Night, and Good Luck."" Director David Cromer shares the importance of history and what he wants audiences to take away from the Broadway production. Grant Heslov, co-writer and producer, describes how the play came together. #CNN #News",2025-06-08T00:50:44Z,PT8M12S,492,0:08:12,https://www.youtube.com/watch?v=vlO6viqQmqk
639,CNN,hf0AeVCD_ww,Coco Gauff reacts to winning the French Open,"Coco Gauff claimed her second career grand slam singles title, defeating world No. 1 Aryna Sabalenka in the French Open women’s final.",2025-06-08T00:28:52Z,PT47S,47,0:00:47,https://www.youtube.com/watch?v=hf0AeVCD_ww
640,CNN,OW5hiTxzCrE,Who was Edward R. Murrow?,"CNN's John Berman examines the life and career of the real Edward R. Murrow, a legendary figure in the history of broadcast journalism. CNN chief media analyst Brian Stelter also discusses today's media landscape. #CNN #News",2025-06-07T23:49:46Z,PT8M29S,509,0:08:29,https://www.youtube.com/watch?v=OW5hiTxzCrE
641,CNN,J6sBaBp9RZg,Journalist on the parallels between the McCarthy era and today,"New York Times journalist Clay Risen, author of ""Red Scare: Blacklists, McCarthyism and the Making of Modern America"" speaks with CNN's Bianna Golodryga about the resonances of the 1950s in current life.. #CNN #News",2025-06-07T22:57:30Z,PT9M44S,584,0:09:44,https://www.youtube.com/watch?v=J6sBaBp9RZg
642,CNN,OOMIiINxY_Q,FBI investigating Los Angeles protests over ICE raids,"For a second consecutive day, tear gas and flash bangs have been used to disperse protests over immigration activity in the Los Angeles area.

On Saturday, protesters gathered in Paramount, California. Assemblymember José Luis Solache spoke with CNN's Jessica Dean, and CNN correspondent Julia Vargas Jones reports. #CNN #News",2025-06-07T22:24:27Z,PT9M24S,564,0:09:24,https://www.youtube.com/watch?v=OOMIiINxY_Q
643,CNN,cEHfjTko5OM,Young men are bailing on Democrats,"A new study shows young men have moved away from Democrats in 2024. Ilyse Hogue, co-founder of the Speaking with American Men Project, tells Michael Smerconish that while many men still support progressive values, they don’t always see themselves represented in the Democratic party. #cnn #news #republicans #democrats #youngmen",2025-06-07T21:38:40Z,PT1M17S,77,0:01:17,https://www.youtube.com/watch?v=cEHfjTko5OM
644,CNN,rddSbkdq_Lg,World #Pride marks 50th anniversary in DC,"The 50th anniversary of Pride celebrations has kicked off in the nation’s capital this weekend with World Pride 2025. CNN's Julia Benbrook spoke to members and supporters of the LGBTQ community as they gathered in Washington, DC, to hear why some traveled hundreds of miles to attend. #cnn #news #pride #lgbtq #worldpride",2025-06-07T18:22:45Z,PT1M7S,67,0:01:07,https://www.youtube.com/watch?v=rddSbkdq_Lg
