,channel_title,video_id,title,description,publishedAt,duration_iso,duration_seconds,duration_hms,url
0,CNN,HQqCycHX3QA,Sheriff gives Idaho firefighter update after shocking attack,"Kootenai County Sheriff Bob Norris says that suspect Wess Roley, who ambushed firefighters, later shot himself. Records show that the sheriff’s office and Coeur D’Alene Police had five minor interactions with the 20-year-old. The Sheriff’s office also learned that Roley had ambitions to become a firefighter.",2025-06-30T23:47:44Z,PT1M17S,77,0:01:17,https://www.youtube.com/watch?v=HQqCycHX3QA
1,CNN,CB9E-IQCKnU,"Bryan Kohberger agrees to plea deal, avoids trial in 2022 Idaho student murders","30-year-old Bryan Kohberger, accused of fatally stabbing four University of Idaho students in their apartment in 2022, has agreed to a plea deal to avoid trial in his quadruple murder case. #CNN #News",2025-06-30T23:39:11Z,PT8M3S,483,0:08:03,https://www.youtube.com/watch?v=CB9E-IQCKnU
2,CNN,xz-wmfqvG64,Meet the livestreamers covering the ‘Diddy’ trial,"Over the duration of the Sean “Diddy” Combs trial, influencers have decided to cover the trial by livestreaming from outside the Manhattan courthouse where Combs has appeared. CNN’s Brynn Gingras spoke with some of the influencers who covered the “Diddy” trial.",2025-06-30T23:22:37Z,PT1M48S,108,0:01:48,https://www.youtube.com/watch?v=xz-wmfqvG64
3,CNN,dlo98w-9VTc,White House: Harvard in 'violent violation' of Civil Rights Act,"A Trump administration investigation has found Harvard University in “violent violation” of the Civil Rights Act, once more escalating its battle with the school days after President Donald Trump suggested a deal was in sight to end its targeting of the university. #CNN #News",2025-06-30T23:01:34Z,PT9M10S,550,0:09:10,https://www.youtube.com/watch?v=dlo98w-9VTc
4,CNN,QxeEjupq19U,"Senate 'vote-a-rama' debates Trump megabill changes, inches closer to final vote","A marathon voting session on amendments, known as a “vote-a-rama,” is underway in the Senate. Lawmakers are offering changes to President Donald Trump’s “big, beautiful bill” before a final vote. #CNN #News",2025-06-30T21:26:43Z,PT8M48S,528,0:08:48,https://www.youtube.com/watch?v=QxeEjupq19U
5,CNN,aih7vsC5XVI,Inside the Starbucks of the future,"Starbucks is trying to get back to its roots as a local coffee shop as part of its turnaround plan. The company is redesigning stores with comfortable seats and tables, new espresso bars and other elements to try to draw customers back. CNN goes inside a new store in Bridgehampton, New York that's a model for Starbucks' plans.",2025-06-30T20:39:18Z,PT1M47S,107,0:01:47,https://www.youtube.com/watch?v=aih7vsC5XVI
6,CNN,lj7oxd97AwE,"'On this, Elon's right': Sen. Kelly echoes Musk's criticism of Trump's megabill","The Senate continues its ""vote-a-rama"" on President Trump's ""big, beautiful bill."" CNN's Brianna Keilar speaks with Sen. Mark Kelly (D-AZ) about Elon Musk's and Sen. Thom Tillis' criticisms of the bill. #CNN #News",2025-06-30T20:23:14Z,PT8M45S,525,0:08:45,https://www.youtube.com/watch?v=lj7oxd97AwE
7,CNN,Zz56c8woyEs,Dad jumps into ocean after his daughter falls overboard on cruise ship,A father jumped into the ocean after his daughter fell overboard from a Disney cruise ship returning to Florida. Both were rescued by the crew aboard the Disney Dream and back to the ship safely.,2025-06-30T19:38:10Z,PT35S,35,0:00:35,https://www.youtube.com/watch?v=Zz56c8woyEs
8,CNN,TLvMsSrR1tk,Hottest opening day in Wimbledon’s history,"As Wimbledon gets under way, temperatures have soared in the UK. The high temperature on opening day surpassed the 2001 tournament for the warmest opening day in the tournament’s 147-year history. #CNN #news #Wimbledon",2025-06-30T19:28:09Z,PT43S,43,0:00:43,https://www.youtube.com/watch?v=TLvMsSrR1tk
9,CNN,iCDrtx-i7ZA,Trump and the unitary executive: Yates and Gonzales on presidential power,"Fareed Zakaria talks with former Acting Attorney General Sally Yates and former Attorney General Alberto Gonzales about recent Supreme Court rulings, the 14th Amendment and the powers of the presidency. #CNN #News",2025-06-30T19:15:02Z,PT11M,660,0:11:00,https://www.youtube.com/watch?v=iCDrtx-i7ZA
10,CNN,jQ9_L6rpinI,"Underscored Explores: More Sneakers — super-rare kicks, iconic designs, and a women’s game changer","We just couldn’t get enough of sneaker culture in one episode, so we had to go back for more. This time, we’re digging in a bit deeper, from a personal collection that would make any sneakerhead drool to an iconic sneaker designer breaking down exactly how a shoe goes from sketch to shelves. We’re also meeting up with the founder of a brand making footwear specifically for women athletes. This episode is all about more kicks.

This episode of Underscored Explores is brought to you by DSW: https://dsw.am3t9s.net/3JzLqM

--------------------------------------

0:00 – Intro
0:30 – Puneet’s super- rare sneaker collection
3:40 – Jeff Staple breaks down the art of design
7:30 – Moolah Kicks: Women’s game changer

--------------------------------------------------------------------
When you buy through our links, we may earn a commission. 

Moolah NEOVOLT PRO V2 GROCERY PACK:
https://www.kqzyfj.com/click-8314883-17036155?sid=063025sneakersyoutube&url=https%3A%2F%2Fwww.dickssportinggoods.com%2Fp%2Fmoolah-womens-neovolt-pro-v2-basketball-shoes-25rovwnvltprv2blbftw%2F25rovwnvltprv2blbftw%3Fcolor%3DBlue%252FGray 

Brooks x STAPLE ADRENALINE GTS4:
https://brooksrunning.sjv.io/c/1442537/1980738/24286?u=https%3A%2F%2Fwww.brooksrunning.com%2Fen_us%2Fwomens%2Fshoes%2Flifestyle-shoes%2Fstaple-x-adrenaline-gts-4%2F120497.html&subId1=063025sneakersyoutube 

Staple Varick.01:
https://fave.co/3TiqkGH 

Staple Centre.01:
https://fave.co/45JBlID 

Staple x Zellerfeld Sapienz:
https://fave.co/45JdaKk 


-------------------------------------------------------

Check out our full review here:
https://www.cnn.com/cnn-underscored/reviews/best-trail-running-shoes

https://www.cnn.com/cnn-underscored/reviews/the-best-marathon-training-shoes-tried-and-tested

https://www.cnn.com/cnn-underscored/reviews/best-running-shoes-for-beginners

https://www.cnn.com/cnn-underscored/health-fitness/best-walking-shoes

https://www.cnn.com/cnn-underscored/reviews/best-barefoot-shoes

https://www.cnn.com/cnn-underscored/reviews/best-waterproof-shoes-for-women

https://www.cnn.com/cnn-underscored/fashion/most-comfortable-sneakers

Check out our other reviews here:
https://www.cnn.com/cnn-underscored

CNN Underscored IG:
https://www.instagram.com/cnnunderscored/

CNN Underscored TikTok:
https://www.tiktok.com/@cnnunderscored

Sign-up for the CNN Underscored newsletter and the CNN Underscored Deals newsletter to receive product reviews and deals straight to your inbox.

#cnn #cnnunderscored #underscored #sneakers #nike #airjordan #sneakerheads #legacysneakerboutique #virgilabloh #offwhitenike #buffaloexchange #nycthrift #thriftshopping #airmax #nike #jordans #jordans1#moolahkicks #wmba #pigeondunks #staple #jeffstaple #moolah #dsw",2025-06-30T18:41:23Z,PT10M34S,634,0:10:34,https://www.youtube.com/watch?v=jQ9_L6rpinI
11,CNN,ZWpKIRMQGuY,Authorities identify suspect in firefighter ambush,"Investigators have confirmed the identity of the suspect found dead on Canfield Mountain on Sunday as 20-year-old Wess Roley, according to a law enforcement official. #CNN #News",2025-06-30T18:41:17Z,PT5M37S,337,0:05:37,https://www.youtube.com/watch?v=ZWpKIRMQGuY
12,CNN,DaGVd4hdqZk,Jury begins deliberations in the Sean ‘Diddy’ Combs trial,"Jurors are now deliberating in Sean “Diddy” Combs’ federal criminal trial. Combs has pleaded not guilty to federal charges that include racketeering conspiracy and sex trafficking. If convicted on all counts, he could face up to life in prison. CNN's Elizabeth Wagmeister reports. #cnn #news #diddy #diddytrial",2025-06-30T17:51:39Z,PT1M11S,71,0:01:11,https://www.youtube.com/watch?v=DaGVd4hdqZk
13,CNN,XEeYqTXpeOU,Latino influencers stick by Trump,"Tony Delgado and Gabriela Berrospi, entrepreneurs and founders of multimedia brand Latino Wall Street, helped rally the Latino vote for President Donald Trump in 2024. As the administration has escalated ICE raids and deportations this year, they visited Washington D.C. and the White House to advocate for their community and immigration reform. #CNN #News",2025-06-30T17:46:57Z,PT2M28S,148,0:02:28,https://www.youtube.com/watch?v=XEeYqTXpeOU
14,CNN,ImgahmKRu4Y,‘This is not a luxury’: Families in Trump states agonize over GOP’s proposed Medicaid cuts,"Courtney Leader is a mother of five children, one of whom has cerebral palsy and relies on Medicaid assistance in addition to private insurance to help keep her daughter alive. CNN's Jeff Zeleny speaks to families and organizations in Missouri about the potential cuts to Medicaid, food programs and rural hospitals in President Donald Trump's domestic policy bill.  #CNN #News",2025-06-30T17:20:32Z,PT5M49S,349,0:05:49,https://www.youtube.com/watch?v=ImgahmKRu4Y
15,CNN,2dfD_NS6eTo,"'Wildly, categorically inaccurate': CNN fact check of Trump's claims about 'big, beautiful bill'","As the Senate ""vote-a-rama"" on President Trump's ""big, beautiful bill"" gets underway, CNN senior reporter Daniel Dale fact checks Trump's claims about what the sweeping domestic policy bill contains. #CNN #News",2025-06-30T16:45:01Z,PT9M15S,555,0:09:15,https://www.youtube.com/watch?v=2dfD_NS6eTo
16,CNN,d7Lojn-Fk5Y,UN nuclear watchdog: Iran could again begin enriching uranium in ‘matter of months’,"The head of the UN’s nuclear watchdog says US strikes on Iran fell short of causing total damage to its nuclear program and that Tehran could restart enriching uranium “in a matter of months,” contradicting President Donald Trump’s claims the US set Tehran’s ambitions back by decades.  #CNN #News",2025-06-30T16:12:50Z,PT10M,600,0:10:00,https://www.youtube.com/watch?v=d7Lojn-Fk5Y
17,CNN,luSmyQ_duqs,Senate kicks off marathon voting session on Trump’s megabill,"After a weekend of negotiations and delays, the Senate has kicked off its marathon voting session on President Donald Trump’s sweeping domestic policy bill. CNN's Pamela Brown speaks with Rep. Ryan Zinke (R-MT)  about the ""big, beautiful bill"", Sen. Thom Tillis's objections, and public opinion. #CNN #News",2025-06-30T15:40:02Z,PT8M54S,534,0:08:54,https://www.youtube.com/watch?v=luSmyQ_duqs
18,CNN,CQDityZ_L5E,Severe heatwave hits Europe,"Heatwaves have pushed temperatures above 104 degrees Fahrenheit (40 degrees Celsius) in countries across Europe, including Spain, Greece, Portugal and Italy. Firefighters battled a wildfire near Athens late last week, and regions of Portugal were under high alert on Sunday. According to experts, the extreme weather is linked to climate change. #cnn #news #europe #heatwave",2025-06-30T15:23:53Z,PT58S,58,0:00:58,https://www.youtube.com/watch?v=CQDityZ_L5E
19,CNN,vs91oOP3ruM,Jury set to begin deliberations in the Sean ‘Diddy’ Combs trial,"The Sean ""Diddy"" Combs trial heads to the jury today, after they receive instructions from Judge Arun Subramanian. The panel heard closing arguments from the defense and prosecution last week. Combs has pleaded not guilty to federal charges that include racketeering conspiracy and sex trafficking. If convicted on all counts, he could face up to life in prison. CNN's Sara Sidner speaks to trial attorney Kelly Hyman about the jury instructions, and CNN's Kara Scannell previews the next developments. #CNN #News",2025-06-30T14:30:51Z,PT8M51S,531,0:08:51,https://www.youtube.com/watch?v=vs91oOP3ruM
20,CNN,QChlIFAEK1k,Fareed’s take: US strikes on Iran might make the world less safe,"The only way to ensure Iran does not acquire a nuclear weapon is through diplomacy, Fareed says. While America’s attacks on Iranian nuclear sites were impactful, they won’t keep Iran from a weapon in the long run — and they undermine the rules-based international order.  #CNN #News",2025-06-30T14:06:58Z,PT9M16S,556,0:09:16,https://www.youtube.com/watch?v=QChlIFAEK1k
21,CNN,-Zjg80PuDUI,See swarms of 'lovebugs' invade South Korea,"Video posted on social media shows thousands of 'lovebugs' blanketing hiking trails on the Gyeyangsan mountain. South Korea is wrestling with an outbreak of the insects, which have been driven into warmer urban areas like Seoul due to climate change, according to a 2022 study.",2025-06-30T13:36:38Z,PT43S,43,0:00:43,https://www.youtube.com/watch?v=-Zjg80PuDUI
22,CNN,x94bzp-xfdA,"Watch GOP senator's scathing speech about Trump's 'big, beautiful bill'","In a fiery speech, Sen. Thom Tillis (R-NC) warned President Trump and Republicans that the Senate version of the sweeping ""big, beautiful bill"" will break a promise Trump made to not cut Medicaid. Tillis also announced Sunday that he will not seek re-election in 2026.  #CNN #News",2025-06-30T12:50:15Z,PT8M9S,489,0:08:09,https://www.youtube.com/watch?v=x94bzp-xfdA
23,CNN,R8TyQBtsxWg,"Tillis gives fiery speech about Trump's 'big, beautiful bill'","Sen. Thom Tillis (R-NC) warned President Trump and Republicans that the Senate version of the sweeping ""big, beautiful bill"" will break a promise Trump made to not cut Medicaid. Tillis also announced Sunday that he will not seek re-election in 2026. #CNN #News",2025-06-30T12:36:36Z,PT1M19S,79,0:01:19,https://www.youtube.com/watch?v=R8TyQBtsxWg
24,CNN,lLE3gROuXLY,"'Terrible': Enten on Trump's 'big, beautiful bill' approval numbers",CNN's chief data analyst Harry Enten breaks down new polls on how Americans view President Donald Trump’s “big beautiful bill.”  #CNN #News,2025-06-30T12:08:19Z,PT10M16S,616,0:10:16,https://www.youtube.com/watch?v=lLE3gROuXLY
25,CNN,9KPH8IC1xu8,Police in Idaho say a gunman started a brush fire so he could ambush firefighters,A man believed to have fatally shot two firefighters after starting a brush fire on Idaho’s Canfield Mountain was found dead Sunday evening –– ending what authorities describe as a sniper attack on fire personnel and responding police. CNN's Julia Vargas Jones reports. #CNN #News,2025-06-30T11:34:24Z,PT9M19S,559,0:09:19,https://www.youtube.com/watch?v=9KPH8IC1xu8
26,CNN,Zye2ghtFStk,"Idaho suspected shooter intentionally set fire, police say","Two firefighters were fatally shot while responding to a brush fire in Coeur d’Alene, Idaho. Another man found dead with a firearm on Canfield Mountain is believed to be the only shooter in Sunday’s attacks, according to Kootenai County Sheriff Bob Norris. #cnn #news #idaho #idahoshooting",2025-06-30T07:08:28Z,PT1M10S,70,0:01:10,https://www.youtube.com/watch?v=Zye2ghtFStk
27,CNN,BJLaENk1Y40,Beyoncé’s 'flying' car prop tilts midair,"A technical mishap led to Beyoncé’s “flying” car prop to tilt during a Cowboy Carter concert in Houston, with fans capturing the moment on video. The singer was quickly lowered down and without injury, according to Beyoncé’s entertainment and management company.#cnn #beyonce #cowboycarter",2025-06-30T02:26:12Z,PT58S,58,0:00:58,https://www.youtube.com/watch?v=BJLaENk1Y40
28,CNN,Fq2gWQWJNY8,Multiple shot while responding to brush fire in Idaho,"Two people, believed to be fire personnel, were fatally shot and others injured while responding to a brush fire in Coeur d’Alene, Idaho, and at least one active shooter continues to fire at law enforcement with high-powered rifles, according to Kootenai County Sheriff Robert Norris.",2025-06-30T00:39:34Z,PT59S,59,0:00:59,https://www.youtube.com/watch?v=Fq2gWQWJNY8
29,CNN,ygb0_kOlnlQ,Multiple people shot in Idaho while responding to brush fire,"At least two people were fatally shot and others injured while responding to a brush fire in Coeur d’Alene, Idaho. At least one active shooter continues to fire at law enforcement with high-powered rifles, according to Kootenai County Sheriff Robert Norris. CNN senior law enforcement analyst chief Charles Ramsey and former Boston Police commissioner Chief Ed Davis join CNN’s Omar Jimenez to discuss. #CNN #News",2025-06-30T00:39:20Z,PT10M1S,601,0:10:01,https://www.youtube.com/watch?v=ygb0_kOlnlQ
30,CNN,8GhPxB7Q-F0,Colombians celebrate Pride in defiance against LGBTQ violence,"Thousands of Colombians take to the streets of Bogota in celebration of Pride, as well as an act of defiance against violence in the country towards community members.",2025-06-29T23:22:52Z,PT42S,42,0:00:42,https://www.youtube.com/watch?v=8GhPxB7Q-F0
31,CNN,YXKzdC2gTRA,Watch 'Somebody Feed Phil' at the Food & Wine Classic in Aspen,"From Chicago-style profiteroles to Tyler Florence's truffle-stuffed Wagyu beef, Phil Rosenthal gets everyone to shove delicious food into his mouth in Aspen, Colorado. #cnn #news #travel #aspen #colorado #cooking #wagyu #beef #lifestyle #besttowns #foodie #foodlover #philrosenthal #tylerflorence",2025-06-29T10:52:17Z,PT2M,120,0:02:00,https://www.youtube.com/watch?v=YXKzdC2gTRA
32,CNN,Ad88GJ24fRU,Thousands defy ban on Budapest Pride,"Protesters in Budapest are marching against a ban on Pride events across Hungary. People came from 30 different countries to show support under scorching heat, organizers said. #cnn #budapest #hungary #pride #news",2025-06-29T07:49:10Z,PT54S,54,0:00:54,https://www.youtube.com/watch?v=Ad88GJ24fRU
33,CNN,9t9WpsOhv7E,Why Thailand U-turned its cannabis policy,"Three years since Thailand became the first country in Asia to decriminalize cannabis, the government this week imposed new rules designed to rein in the country’s “green rush.” #cnn #news #thailand #weed #cannabis",2025-06-29T07:19:35Z,PT1M32S,92,0:01:32,https://www.youtube.com/watch?v=9t9WpsOhv7E
34,CNN,0UcFhmA-sWo,Two men reunite baby bird with its mother,"Two men were walking in their neighborhood when they heard chirping near a sewer. When they approached, they could see a baby bird trapped inside the sewer.",2025-06-29T00:55:57Z,PT1M18S,78,0:01:18,https://www.youtube.com/watch?v=0UcFhmA-sWo
35,CNN,UDFoSO0JkPg,Iowa anchor has been missing for 30 years,"CNN’s Randi Kaye investigates the mystery of journalist Jodi Huisentruit’s disappearance in 1995. Now thirty years later, police are still tracking down clues.

#CNN #News",2025-06-29T00:36:50Z,PT1M32S,92,0:01:32,https://www.youtube.com/watch?v=UDFoSO0JkPg
36,CNN,KxODO5Y9FYo,Newlyweds Bezos and Sanchez spotted on boat ride,"CNN’s Melissa Bell reports from Venice, Italy, following newlyweds Jeff Bezos and Lauren Sanchez as they wave at spectators during their boat ride through the city. #CNN #News",2025-06-28T21:53:11Z,PT46S,46,0:00:46,https://www.youtube.com/watch?v=KxODO5Y9FYo
37,CNN,hQxr_z172eI,Protesters march in Venice against Bezos-Sanchez wedding,"Demonstrators with the “No Space for Bezos” group marched through the streets of Venice on the final day of the extravagant wedding celebrations of Jeff Bezos and Lauren Sanchez. CNN’s Melissa Bell reports from the protest.

#CNN #News #venice #bezoswedding",2025-06-28T19:54:24Z,PT43S,43,0:00:43,https://www.youtube.com/watch?v=hQxr_z172eI
38,CNN,yX9uBTc96eM,Tens of thousands of protesters at Hostages Square call for an end to the Gaza war,CNN's Nic Robertson reports from Tel Aviv where tens of thousands of anti-war protesters packed Hostages Square to call for an end to the Gaza war and the return of the remaining hostages.,2025-06-28T19:23:48Z,PT44S,44,0:00:44,https://www.youtube.com/watch?v=yX9uBTc96eM
39,CNN,P1BovFqX_14,"Don Jr.: 'Affirmative Action' is why Obama won Nobel, not Trump","President Trump's desire for a Nobel Prize is no secret and he often blames politics as the reason he hasn't yet won. In an X post, Donald Trump Jr. claimed President Obama won his because of ""affirmative action."" Abby Phillip and CNN's Table for Five panel debates. #cnn  #News",2025-06-28T15:34:38Z,PT5M58S,358,0:05:58,https://www.youtube.com/watch?v=P1BovFqX_14
40,CNN,Xi_F10zpd1o,Is Chinese history repeating itself in the US?,Scholars and commentators in both the US and China are drawing comparisons between the early months of President Donald Trump’s second term and communist dictator Mao Zedong’s Cultural Revolution. But some believe the way of Mao is unlikely to take root in America. CNN's Kristie Lu Stout explores the similarities and differences between the two leaders. #cnn #news,2025-06-28T15:17:10Z,PT2M56S,176,0:02:56,https://www.youtube.com/watch?v=Xi_F10zpd1o
41,CNN,tiR0aGb3qns,What to expect on the last day of the extravagant Bezos-Sanchez wedding,"After tying the knot in a private ceremony on Friday, Jeff Bezos and Lauren Sanchez’s three-day-long Venetian extravaganza will come to a close on Saturday with a final star-studded party. #cnn #news",2025-06-28T15:06:30Z,PT1M28S,88,0:01:28,https://www.youtube.com/watch?v=tiR0aGb3qns
42,CNN,u8owuFSoYhw,Hundreds of women offer babies as martyrs in Tehran ceremony,"CNN’s Frederik Pleitgen witnesses the ‘Hosseini Infants Ceremony’ in Tehran where hundreds of women hold their babies into the air to show they are willing to offer their children to God and to Imam Hossein. The ceremony is held on the first Friday of the month in Islamic calendar.

#CNN #News #Iran #Tehran",2025-06-28T14:50:42Z,PT1M42S,102,0:01:42,https://www.youtube.com/watch?v=u8owuFSoYhw
43,CNN,sbauulqs0qc,NewsNight 'Off Menu': Bezos-Sanchez Venetian Nuptials,"In a CNN NewsNight web exclusive, Abby Phillip and the panel discusses Amazon founder Jeff Bezos' star studded Venetian wedding. #cnn #news #jeffbezos #venice 





 #CNN #News",2025-06-28T11:30:50Z,PT5M37S,337,0:05:37,https://www.youtube.com/watch?v=sbauulqs0qc
44,CNN,BMnkvPPhkWY,CNN reports from the huge crowds attending state funerals in Tehran,"CNN's Frederik Pleitgen describes the scene as thousands of Iranians gathered to mourn military leaders, nuclear scientists and civilians during the country’s 12-day conflict with Israel. #CNN #News #Iran",2025-06-28T10:45:33Z,PT1M40S,100,0:01:40,https://www.youtube.com/watch?v=BMnkvPPhkWY
45,CNN,v2kC7WTrgqs,Iran mourns victims of conflict with Israel,"Iran held a state funeral for IRGC commanders, nuclear scientists and civilians killed during the country’s 12-day conflict with Israel. At least 60 people will be buried at the funeral in Tehran, according to state-affiliated media. #CNN #News #Iran",2025-06-28T07:27:48Z,PT53S,53,0:00:53,https://www.youtube.com/watch?v=v2kC7WTrgqs
46,CNN,orRFqZF5JDc,Video shows woman clinging to tree as immigration agents try to detain her,A bystander captured on video the moment immigration agents in street clothes chased a woman across the street trying to detain her outside of a Home Depot where she had been selling food in West Los Angeles just moments prior.,2025-06-28T02:39:51Z,PT2M8S,128,0:02:08,https://www.youtube.com/watch?v=orRFqZF5JDc
47,CNN,XjQATmx8AOY,3-month-old baby's death in Gaza sheds light on humanitarian crisis,"Despite lifting its 11-week total blockade of Gaza in May, Israel continues to restrict the types of aid allowed into Gaza. CNN's Jeremy Diamond reports on Gaza's most vulnerable.",2025-06-28T02:17:10Z,PT1M28S,88,0:01:28,https://www.youtube.com/watch?v=XjQATmx8AOY
48,CNN,sBDoGGX8124,Trump: Canada's new tax is a 'blatant attack' on US,"President Donald Trump said he has put an end to trade talks with Canada and will soon announce a new tariff rate for that country, he said in a Truth Social post. The decision to end negotiations, which have been ongoing for several months, came after Canada announced a digital service tax, Trump said, calling it “a direct and blatant attack on our Country.”
 #CNN #News",2025-06-28T02:02:48Z,PT8M3S,483,0:08:03,https://www.youtube.com/watch?v=sBDoGGX8124
49,CNN,R56xQYHXw50,NYC Mayor Eric Adams responds to low poll numbers,New York City Mayor Eric Adams joins CNN's Jake Tapper to discuss poll numbers that indicate dissatisfaction with his job performance.,2025-06-28T01:32:05Z,PT1M5S,65,0:01:05,https://www.youtube.com/watch?v=R56xQYHXw50
50,CNN,jSi3FWtt2pQ,Key lines from UVA president’s resignation letter,"University of Virginia president James Ryan announced his resignation amid pressure from the US Department of Justice to dismantle the university’s diversity, equity and inclusion programs. CNN's Betsy Klein reports.",2025-06-28T01:15:45Z,PT1M10S,70,0:01:10,https://www.youtube.com/watch?v=jSi3FWtt2pQ
51,CNN,OF3qG4mfdic,House members briefed on US strikes on Iran nuclear sites,"House representatives received a classified briefing on Iran today. As CNN spoke to them after the briefing concluded, lawmakers appeared divided along party lines, with Republicans reinforcing their belief that the US strikes were effective and some Democrats expressing skepticism. #CNN #News",2025-06-28T01:01:57Z,PT10M11S,611,0:10:11,https://www.youtube.com/watch?v=OF3qG4mfdic
52,CNN,1zhyTVo57Tg,Lauren Sanchez reveals wedding dress,Lauren Sanchez revealed her highly-anticipated wedding dress in an exclusive interview with Vogue where she shared the craftsmanship and inspiration behind her custom Dolce & Gabbana gown.,2025-06-28T00:49:33Z,PT43S,43,0:00:43,https://www.youtube.com/watch?v=1zhyTVo57Tg
53,CNN,sMWA2MalSz4,Persian Jews find refuge in 'Tehrangeles',"CNN's Nick Watt reports from Westwood Boulevard in Los Angeles, situated in a neighborhood known as ""Tehrangeles"" for its population of Iranians and Persian Jews.

#CNN #News",2025-06-28T00:13:00Z,PT1M7S,67,0:01:07,https://www.youtube.com/watch?v=sMWA2MalSz4
54,CNN,5LWK3LrYWxM,Eric Adams denies rumored deal with Trump over dropped 'bogus charges',CNN's Jake Tapper speaks with New York Mayor Eric Adams (D) about his 2025 re-election bid as an Independent and whether he made a deal with Donald Trump. #CNN #News,2025-06-27T23:33:49Z,PT7M33S,453,0:07:33,https://www.youtube.com/watch?v=5LWK3LrYWxM
