Unnamed: 0,channel_title,video_id,title,description,publishedAt,duration_iso,duration_seconds,duration_hms,url,section,merged_section,subsection
0,NowThis Impact,iP6dz5sF2Ek,The Impact of Defunding Planned Parenthood,"This was the plan all along, as outlined in Project 2025: Defund Planned Parenthood and instead funnel funding into so-called ‘crisis pregnancy centers’ — clinics that spread misinformation and don’t actually support public health, but exist to promote the MAGA agenda.",2025-06-30 22:30:30+00:00,PT1M22S,82,0:01:22,https://www.youtube.com/watch?v=iP6dz5sF2Ek,Politics,Politics,Reproductive Rights
1,NowThis Impact,o7xlcYyu0Hk,Who Are Republicans Really Working For?,"After criticizing Trump’s bill for taking from the poor to give to the rich, Sen. Warnock asks a crucial question: If 64% of Americans aren’t in favor of the bill, then who are Republicans in Congress really working for?",2025-06-30 21:00:43+00:00,PT1M13S,73,0:01:13,https://www.youtube.com/watch?v=o7xlcYyu0Hk,Politics,Politics,Taxes
2,NowThis Impact,SzQxrdigINI,Supreme Court's Impact on Birthright Citizenship,MSNBC host Symone Sanders erupted following the Supreme Court’s ruling that allows Trump’s unconstitutional executive orders — like his order to halt birthright citizenship guaranteed under the 14th Amendment — to go into effect in jurisdictions that don’t directly challenge the action in court. This could mean citizenship rules vary by state. She went on to say the ruling is an ‘existential threat to the rule of law.’,2025-06-30 19:30:29+00:00,PT21S,21,0:00:21,https://www.youtube.com/watch?v=SzQxrdigINI,Politics,Politics,Immigration
3,NowThis Impact,f3g6wMyF6y4,Performers Protest Trump with One Gay More Parody,"In defiance of Trump’s cancellation of other Pride Month events at the Kennedy Center, Senator Hickenlooper held a celebration anyway last week. The performers wrapped up the night with a parody of ‘One Day More’ from Les Miserables, aptly renamed ‘One Gay More.’",2025-06-30 19:01:04+00:00,PT1M59S,119,0:01:59,https://www.youtube.com/watch?v=f3g6wMyF6y4,Entertainment,Entertainment,
4,NowThis Impact,UHasH8TDj_o,"The Harmful Impact of the GOP’s Big, Ugly Bill","Rep. Brendan Boyle is 100% right. According to multiple independent analyses, including from the Nonpartisan Congressional Budget Office, the GOP’s ‘Big, Ugly Bill’ would kick 13.7 million people off of their health insurance by 2034 to pay for tax cuts that mostly benefit billionaires and the ultra-rich. Ultimately, the bill would result in the largest transfer of wealth from the poor to the rich in U.S. history.",2025-06-30 18:00:48+00:00,PT33S,33,0:00:33,https://www.youtube.com/watch?v=UHasH8TDj_o,Politics,Politics,Healthcare
5,NowThis Impact,VYCW7RpU28w,Comedian Patton Oswalt Takes Aim at ICE in Brutal Takedown,Doesn't a snack sound good?,2025-06-29 16:00:51+00:00,PT1M29S,89,0:01:29,https://www.youtube.com/watch?v=VYCW7RpU28w,Lifestyle,Lifestyle,
6,NowThis Impact,Gp7iB9X1N3k,Scarlett Johansson Speaks Out: Why Planned Parenthood Matters,"As Republicans attempt to defund Planned Parenthood, remember — these clinics provide essential health care for millions of women.",2025-06-28 16:00:39+00:00,PT46S,46,0:00:46,https://www.youtube.com/watch?v=Gp7iB9X1N3k,Politics,Politics,Reproductive Rights
7,NowThis Impact,P0GXXVFwPZM,Queen of the Netherlands Mocks Trump,"Queen Máxima of the Netherlands, we applaud you",2025-06-28 00:00:32+00:00,PT12S,12,0:00:12,https://www.youtube.com/watch?v=P0GXXVFwPZM,Royalty,Royalty,
8,NowThis Impact,SCN-KluP_Qs,CPCs Ordered to Stop Interfering in Ectopic Pregnancy Diagnoses,Crisis pregnancy centers have recently been told to stop performing ultrasounds for ectopic pregnancies.,2025-06-27 23:00:36+00:00,PT1M36S,96,0:01:36,https://www.youtube.com/watch?v=SCN-KluP_Qs,Health,Health,
9,NowThis Impact,2p-pZJ90i84,Murkowski’s Book Launch Interrupted by Activists Urging Climate Action,"Climate Defiance activists showed up at Alaska Sen. Lisa Murkowski’s book launch to call on her to vote against Trump’s tax and spending bill — legislation that would defund initiatives aimed at protecting the environment and combating climate change.

Murkowski, a Republican who has recently considered becoming a Democrat or Independent, is a crucial vote in determining whether the bill passes and is still undecided.",2025-06-27 22:00:48+00:00,PT54S,54,0:00:54,https://www.youtube.com/watch?v=2p-pZJ90i84,Politics,Politics,Environment
10,NowThis Impact,LXpc1YiXDoQ,Why Is a Man Unsure About Humanity’s Worth Helping Design Its Digital Future?,"Billionaire Peter Thiel is the co-founder of Palantir, the dystopian AI company gaining more influence within the U.S. government. That’s why it’s worrisome that, in an exclusive interview with the New York Times, Thiel hesitated to say whether he prefers the human race to endure.",2025-06-27 18:00:45+00:00,PT16S,16,0:00:16,https://www.youtube.com/watch?v=LXpc1YiXDoQ,Technology,Technology,
11,NowThis Impact,YiOPjzHrngw,Pete Hegseth’s Pattern of Misogyny: From Abuse Allegations to On-Air Attacks,"Have you noticed Pete Hegseth mostly targets women? His own mother called him ‘an abuser of women.’

His aggressive behavior puts the many allegations against him into perspective. He’s been accused of violent sexual assault, which he paid $50,000 to settle out of court. His former sister-in-law also alleged that he was abusive toward his second wife, according to a sworn affidavit to the Senate. She claimed his ex-wife had to develop an ‘escape plan’ involving a safe word which was used at least once. Hegseth has also been accused of making extreme statements about women and religious minorities while drunk.

His interaction with a reporter calling her ‘about the worst’ for simply asking questions gives us a glimpse into who he really is.",2025-06-27 17:00:54+00:00,PT29S,29,0:00:29,https://www.youtube.com/watch?v=YiOPjzHrngw,Politics,Politics,Crime
12,NowThis Impact,fdTe68nHR0Q,Miller's ICE Contractor Ties Raise Corruption Claims,Just another example of clear corruption from the Trump admin.,2025-06-27 00:01:09+00:00,PT1M14S,74,0:01:14,https://www.youtube.com/watch?v=fdTe68nHR0Q,Politics,Politics,Trump Administration
13,NowThis Impact,wNjVD9dppuk,U.S. Citizen. No Crime. Still Arrested.,"‘Just because of the color of our skin, they think we’re criminals’ — Andrea Velez, a U.S. citizen, was arrested by federal agents on her way to work in Los Angeles.",2025-06-26 23:00:40+00:00,PT2M2S,122,0:02:02,https://www.youtube.com/watch?v=wNjVD9dppuk,Social Justice,Social Issues,
14,NowThis Impact,XcHVTQKZJeI,The Ending of This is Perfect,We whole heartedly reject 'Daddy Trump',2025-06-26 22:00:38+00:00,PT42S,42,0:00:42,https://www.youtube.com/watch?v=XcHVTQKZJeI,Politics,Politics,Trump Administration
15,NowThis Impact,j_UL23Z7P6w,MAGA Regret? Candace Owens Says She’s ‘Embarrassed’ by Trump,It was an open-book test,2025-06-26 21:00:45+00:00,PT27S,27,0:00:27,https://www.youtube.com/watch?v=j_UL23Z7P6w,Education,Education,
16,NowThis Impact,-APur3w0Fhw,Trump’s Bill Could Gut Maternity Care Nationwide,"Hospitals — including labor and delivery departments, OB-GYN services, and pediatric units — are set to close because of Trump’s Big, Ugly Bill. Rep. Trahan called out RFK Jr. for lying about the bill’s impact on Medicaid, warning that it will force these essential services to shut down.",2025-06-26 20:00:39+00:00,PT1M24S,84,0:01:24,https://www.youtube.com/watch?v=-APur3w0Fhw,Health News,Health,
17,NowThis Impact,Dc9pdvc8sPs,SCOTUS Just Gave States the Green Light to Gut Planned Parenthood,"SCOTUS just made it easier for states to block millions of people from accessing life-saving care — like cancer screenings, STI testing, and more. This move is a major step toward completely defunding Planned Parenthood. This is how abortion access gets taken away, without an outright ban.",2025-06-26 19:00:49+00:00,PT1M24S,84,0:01:24,https://www.youtube.com/watch?v=Dc9pdvc8sPs,Health Care Policy,Health Care Policy,
18,NowThis Impact,KvQ5Hyz7FTE,Jaime Greene Joins the GOP Hypocrisy Parade,Michigan State Rep. Jaime Greene is just another hypocrite in the GOP.,2025-06-26 17:00:52+00:00,PT16S,16,0:00:16,https://www.youtube.com/watch?v=KvQ5Hyz7FTE,Politics,Politics,Politician
19,NowThis Impact,uqCEBBCYtc8,One Year Since Kaitlyn’s Testimony. Still No Justice.,Kaitlyn Joshua became an outspoken advocate for abortion access after her own harrowing experience being denied care in Louisiana. Almost a year after her brave testimony at the Democratic National Convention — and as another anniversary of the overturning of Roe v. Wade passes — has anything gotten better for women? Shocker: Nope.,2025-06-26 16:01:41+00:00,PT1M13S,73,0:01:13,https://www.youtube.com/watch?v=uqCEBBCYtc8,Health,Health,
20,NowThis Impact,PUAax9Y_bVo,Voting for the Economy Shouldn’t Mean Voting Against Women,Does he realize most of us can’t even afford rent? We definitely don’t have money for things like smartwatches or fitness trackers.,2025-06-26 01:00:28+00:00,PT14S,14,0:00:14,https://www.youtube.com/watch?v=PUAax9Y_bVo,Economy,Business & Economy,
21,NowThis Impact,J6NwMj6m9H0,Texas Pushes a New Mental Health Narrative,File this under things we already knew were going to happen.,2025-06-26 00:00:41+00:00,PT1M19S,79,0:01:19,https://www.youtube.com/watch?v=J6NwMj6m9H0,Opinion,Opinion,
22,NowThis Impact,oT5Hyre43LI,Even Joe Rogan Gets It: $7.25 Isn’t a Living Wage,Joe Rogan and Bernie Sanders agree — the $7.25 minimum wage is unlivable.,2025-06-25 23:00:33+00:00,PT48S,48,0:00:48,https://www.youtube.com/watch?v=oT5Hyre43LI,Economy,Business & Economy,
23,NowThis Impact,S_9LVP8GsqY,JD Vance Gives Middle Finger,Is the charisma in the room with us?,2025-06-25 21:00:38+00:00,PT18S,18,0:00:18,https://www.youtube.com/watch?v=S_9LVP8GsqY,Entertainment,Entertainment,
24,NowThis Impact,CdOVYlCt5ZY,Immigrants Are the Backbone of Our Economy — And Our Communities,"The economic contribution of immigrants can’t be denied — but above all, they’re human beings and deserve respect.",2025-06-25 20:00:47+00:00,PT1M4S,64,0:01:04,https://www.youtube.com/watch?v=CdOVYlCt5ZY,Immigration,World,
25,NowThis Impact,J9CjGlRZ3ZM,She Chose to Live for Her Daughter. Abortion Made That Possible.,"Caroline Williams was 17 weeks pregnant when she checked into the hospital, unable to form words. She was diagnosed with glioblastoma, one of the deadliest cancers. Williams made the difficult decision to terminate her pregnancy so she could receive treatment and be there for her first daughter. Now, three years later, she’s here — thanks to the abortion she was able to get, right before Florida’s near-total ban.",2025-06-25 19:30:44+00:00,PT1M31S,91,0:01:31,https://www.youtube.com/watch?v=J9CjGlRZ3ZM,Health,Health,
26,NowThis Impact,LoyMjeD9c88,"A Veteran’s Sacrifice, Repaid With Deportation","After living in the U.S. for nearly 50 years, Purple Heart Army veteran Sae Joon Park was forced to self-deport to South Korea because of the Trump administration. He worries he may never see his mom, who has dementia, or his adult children again.",2025-06-25 19:00:54+00:00,PT1M29S,89,0:01:29,https://www.youtube.com/watch?v=LoyMjeD9c88,National News,Politics,Immigration
27,NowThis Impact,ylaKPe3u32c,"Full Control, Zero Solutions","Republicans currently control the House, Senate, and presidency — and they’re still choosing to act like this...",2025-06-25 18:00:45+00:00,PT13S,13,0:00:13,https://www.youtube.com/watch?v=ylaKPe3u32c,Politics,Politics,Biden Administration
28,NowThis Impact,75fThDRxKXo,Mamdani Gets Real About What It Takes to Live in New York,"Zohran Mamdani saw and addressed what New Yorkers are truly facing — that to live comfortably in the city, you need to make at least $96,500.",2025-06-25 17:00:54+00:00,PT1M3S,63,0:01:03,https://www.youtube.com/watch?v=75fThDRxKXo,Economy,Business & Economy,
29,NowThis Impact,z-Z6HYTLL0M,Don't Let Trump Distract You,"Trump is trying to distract us, and it's working.",2025-06-25 01:00:39+00:00,PT1M22S,82,0:01:22,https://www.youtube.com/watch?v=z-Z6HYTLL0M,Politics,Politics,Trump Administration
30,NowThis Impact,7FPAH6liuO4,"Republicans Ban Abortion, Then Complain When It Affects Them","Once again, MAGA Republicans prove ‘fine for me, but not for thee.’ Republicans are the ones who put in the ban that caused the delay in this GOP rep’s abortion care. But somehow, she’s blaming Democrats?",2025-06-24 23:30:30+00:00,PT1M28S,88,0:01:28,https://www.youtube.com/watch?v=7FPAH6liuO4,Politics,Politics,Reproductive Rights
31,NowThis Impact,Umfm6bq6_Ic,Cecily Strong Delivers SNL’s Most Powerful Abortion Sketch Yet,Three years later and this clip is still gold,2025-06-24 20:00:44+00:00,PT2M30S,150,0:02:30,https://www.youtube.com/watch?v=Umfm6bq6_Ic,Entertainment,Entertainment,
32,NowThis Impact,KFkPLTpcXQs,Immigrant Mother Separated from Breastfeeding Baby,This is heartbreaking,2025-06-24 17:15:39+00:00,PT1M53S,113,0:01:53,https://www.youtube.com/watch?v=KFkPLTpcXQs,Opinion,Opinion,
33,NowThis Impact,8xJWoUeaCuE,"Rubio Channels Trump, Disregards U.S. Intelligence on Iran","Secretary of State Marco Rubio, echoing the Trump administration’s disregard for facts, dismissed U.S. intelligence on Iran as ‘irrelevant.’",2025-06-24 16:45:34+00:00,PT29S,29,0:00:29,https://www.youtube.com/watch?v=8xJWoUeaCuE,Politics,Politics,Foreign Policy
34,NowThis Impact,zVJZjeTJ0pc,Trump’s Qatar Deal Tied to Ex-Foreign Agent Pam Bondi,"Donald Trump’s acquisition of a $400M luxury jet from Qatar has raised serious ethical concerns, as Pam Bondi — who previously served as a registered foreign agent for Qatar— played a key role in approving the deal without explicitly listing her prior lobbying for Qatar as a conflict of interest in her official disclosures.",2025-06-24 16:15:49+00:00,PT59S,59,0:00:59,https://www.youtube.com/watch?v=zVJZjeTJ0pc,Politics,Politics,Trump Administration
35,NowThis Impact,Uw3hRI5JzD4,Afghan Interpreter Detained Amid Global Tensions,While we all watch what’s happening in Iran — don’t forget what’s happening on US soil.,2025-06-24 00:00:36+00:00,PT1M30S,90,0:01:30,https://www.youtube.com/watch?v=Uw3hRI5JzD4,Politics,Politics,Democracy
36,NowThis Impact,-chz2FEEmp4,Straight Pride Isn't Needed,"Only about 50 people showed up to ‘Hetero Awesome Fest’ in Boise, Idaho over the weekend, proving again just how unnecessary straight pride really is.",2025-06-23 23:00:36+00:00,PT18S,18,0:00:18,https://www.youtube.com/watch?v=-chz2FEEmp4,Entertainment,Entertainment,
37,NowThis Impact,9Zt2LMQg3wY,Immigrant Father Detained by ICE,"Narciso Barranco, an immigrant dad of three U.S. Marines, was violently detained by masked ICE agents while working a landscaping job. One of his sons, Alejandro Barranco, spoke out after witnessing ICE agents punch his father repeatedly.

Now, Narciso is being held at a Los Angeles detention facility. A GoFundMe for his legal fees has already raised nearly $100,000 toward its $150,000 goal.",2025-06-23 22:30:31+00:00,PT1M23S,83,0:01:23,https://www.youtube.com/watch?v=9Zt2LMQg3wY,Immigration,World,
38,NowThis Impact,g8RlgorMfXw,Woman Defends Immigrants at Torrance Car Wash,"The business owner and a bystander stepped in as uniformed officers walked into a car wash in Torrance, CA.",2025-06-23 21:01:08+00:00,PT3M31S,211,0:03:31,https://www.youtube.com/watch?v=g8RlgorMfXw,Local News,Local News,
39,NowThis Impact,QeVKPUP4Lek,Theo Von’s Podcast and Trump’s Support,Podcaster Theo Von is being credited with boosting Trump’s support among men after the former president appeared on his podcast during the campaign.,2025-06-23 20:00:51+00:00,PT1M49S,109,0:01:49,https://www.youtube.com/watch?v=QeVKPUP4Lek,Politics,Politics,Elections
40,NowThis Impact,1kwhFyBgOY8,Tulsi Gabbard’s Bold Claim About Kamala and WWIII,It’s honestly shocking how wrong Tulsi Gabbard can be.,2025-06-23 19:00:39+00:00,PT21S,21,0:00:21,https://www.youtube.com/watch?v=1kwhFyBgOY8,Politics,Politics,Politician
41,NowThis Impact,MnCqDBLy9rw,Why Most Americans Oppose Military Action in Iran,This is why most Americans don’t support U.S. military action in Iran.,2025-06-23 18:45:39+00:00,PT1M24S,84,0:01:24,https://www.youtube.com/watch?v=MnCqDBLy9rw,Politics,Politics,Foreign Policy
42,NowThis Impact,8Gsuh1Gxd5k,Syrian Activist Released After Detention,"Mahmoud Khalil, a Syrian-born Columbia University graduate student and pro-Palestinian activist, was illegally targeted and detained by the Trump administration for over three months because of his advocacy — despite being a legal U.S. resident.

A judge has recently ordered his release from an immigration detention center as his immigration proceedings continue.",2025-06-23 18:00:51+00:00,PT33S,33,0:00:33,https://www.youtube.com/watch?v=8Gsuh1Gxd5k,Immigration News,World,
43,NowThis Impact,KPuZHGCeXRs,JD Vance Says We're Tired of War—What Does That Really Mean?,Who is going to tell him that Trump was president for some of those 25 years?,2025-06-23 17:00:51+00:00,PT18S,18,0:00:18,https://www.youtube.com/watch?v=KPuZHGCeXRs,Politics,Politics,Trump Administration
44,NowThis Impact,oY7HTPxbrHA,Hillary Clinton Warned Us,"All the way back in 2016, Hillary Clinton was trying to warn us about Trump and Iran.",2025-06-23 16:35:27+00:00,PT22S,22,0:00:22,https://www.youtube.com/watch?v=oY7HTPxbrHA,Politics,Politics,Foreign Policy
45,NowThis Impact,eHn3cAoU3Tk,Kentucky's Baby Olivia Video Mandate,"The ‘Baby Olivia’ video is now required viewing in some schools by law — even for students as young as those below third grade. The propaganda video, created by a pro-life organization, isn’t based on facts and is designed to influence the next generation of pro-life voters.",2025-06-22 15:00:47+00:00,PT1M17S,77,0:01:17,https://www.youtube.com/watch?v=eHn3cAoU3Tk,Education,Education,
46,NowThis Impact,znE7NE9AW74,Minnesota Assassinations Highlight Activist Dangers,The political assassinations in Minnesota are a stark reminder of how dangerous it is to stand up against MAGA.,2025-06-21 18:00:48+00:00,PT1M50S,110,0:01:50,https://www.youtube.com/watch?v=znE7NE9AW74,Politics,Politics,Crime
47,NowThis Impact,l_G_6BYyKXA,Changemakers Inspire at Make Good Famous Summit,These changemakers shared reasons to hold onto hope at the Elevate Prize Foundation’s Make Good Famous Summit.,2025-06-21 15:01:16+00:00,PT40S,40,0:00:40,https://www.youtube.com/watch?v=l_G_6BYyKXA,Human Interest,Human Interest,
48,NowThis Impact,bLPKvbmmDWg,Trump’s National Guard Test,Was Trump deploying the National Guard to Los Angeles just a test to see what he could get away with?,2025-06-20 22:00:44+00:00,PT1M12S,72,0:01:12,https://www.youtube.com/watch?v=bLPKvbmmDWg,Politics,Politics,Trump Administration
49,NowThis Impact,MnOt81VA2Ew,Schwarzenegger Slams GOP on Immigration,The GOP has refused to fix our overly complicated immigration process so they can keep using it as a campaign talking point.,2025-06-20 21:00:53+00:00,PT1M9S,69,0:01:09,https://www.youtube.com/watch?v=MnOt81VA2Ew,Politics,Politics,Immigration
50,NowThis Impact,kWsHE2DLvio,SpaceX's Billion-Dollar Failures and No Accountability,"SpaceX’s rocket exploded yet again, but instead of accountability, the U.S. government keeps handing Elon Musk’s company billions — over $20 billion so far. If NASA had this track record, there’d be immediate investigations. But Musk — protected by Republican politicians afraid of his money and power — faces no consequences.",2025-06-20 19:00:50+00:00,PT24S,24,0:00:24,https://www.youtube.com/watch?v=kWsHE2DLvio,Politics,Politics,Biden Administration
51,NowThis Impact,ScXEG1dcx5A,Abortion Ban Advocate's Dilemma,How can you make the same argument and still not get it?,2025-06-20 18:00:57+00:00,PT1M30S,90,0:01:30,https://www.youtube.com/watch?v=ScXEG1dcx5A,Opinion,Opinion,
52,NowThis Impact,pQwUVKl1x5I,Protecting Employees from ICE Raids,"Businesses are stepping up to protect their employees against ICE raids. Over 100 workplaces have pledged to become 4th Amendment Workplaces and have trained their staff on what to do if ICE shows up. Learn more: https://4thworkplace.org/

(with @siembranc6840)",2025-06-18 23:30:39+00:00,PT1M12S,72,0:01:12,https://www.youtube.com/watch?v=pQwUVKl1x5I,Immigration,World,
53,NowThis Impact,wsXM-csUzFc,The Danger of Fabricated Facts,The ‘facts don’t care about your feelings’ crowd is once again making up their own facts to make themselves feel better.,2025-06-18 22:30:43+00:00,PT1M30S,90,0:01:30,https://www.youtube.com/watch?v=wsXM-csUzFc,Opinion,Opinion,
54,NowThis Impact,PQVrQalDu9A,Ginny & Georgia’s Abortion Storyline,"‘Ginny & Georgia,’ the number one show on Netflix, features an abortion storyline this season that we have to talk about.",2025-06-18 20:00:38+00:00,PT1M35S,95,0:01:35,https://www.youtube.com/watch?v=PQVrQalDu9A,Entertainment,Entertainment,
55,NowThis Impact,mudtqjlIjrA,Tucker Carlson and Ted Cruz in Political Discourse,How are these two considered leading thinkers within a political party?,2025-06-18 19:00:53+00:00,PT1M26S,86,0:01:26,https://www.youtube.com/watch?v=mudtqjlIjrA,Politics,Politics,Politician
56,NowThis Impact,6XqLrJQSfXQ,Trump’s 2018 Video Sheds Light on Parade Anger,"Trump is reportedly angry with Pete Hegseth and U.S. soldiers over his disastrous birthday parade. A secretly recorded video from 2018, where Trump praised North Korea Supreme Leader Kim Jong Un, could shed some light on the situation.",2025-06-18 18:00:37+00:00,PT11S,11,0:00:11,https://www.youtube.com/watch?v=6XqLrJQSfXQ,Politics,Politics,Trump Administration
57,NowThis Impact,d6WNWnCw4LE,Impact of Abortion Storyline in Ginny & Georgia,"‘Ginny & Georgia,’ the number one show on Netflix, features an abortion storyline this season that we have to talk about.",2025-06-17 23:00:44+00:00,PT1M30S,90,0:01:30,https://www.youtube.com/watch?v=d6WNWnCw4LE,Entertainment,Entertainment,
58,NowThis Impact,ps5m5JYDFyQ,The Nationwide Impact of Banning the Abortion Pill,"This state has classified medications used in medication abortions as controlled substances, making it harder for people to access the care they need. Imagine what it would look like if this happened across the country?",2025-06-17 22:00:50+00:00,PT1M22S,82,0:01:22,https://www.youtube.com/watch?v=ps5m5JYDFyQ,Health News,Health,
59,NowThis Impact,LS2SLsquHZA,Trump Upset with Soldiers and Pete Hegseth Over Parade,"Trump is reportedly pissed at the soldiers, and Pete Hegseth over his lackluster birthday parade.",2025-06-17 20:30:34+00:00,PT1M37S,97,0:01:37,https://www.youtube.com/watch?v=LS2SLsquHZA,Politics,Politics,Trump Administration
60,NowThis Impact,h4riAfwrlCI,The Right's Obsession with Trans People,It’s just scapegoating.,2025-06-17 19:31:39+00:00,PT1M29S,89,0:01:29,https://www.youtube.com/watch?v=h4riAfwrlCI,Politics,Politics,Biden Administration
61,NowThis Impact,v4ol6Neyu5U,Jon Stewart Responds to Mike Lee's Controversial Tweet,People were outraged and heartbroken after Senator Mike Lee’s tweet blaming ‘Marxists’ for the Minnesota assassination.,2025-06-17 19:00:50+00:00,PT1M50S,110,0:01:50,https://www.youtube.com/watch?v=v4ol6Neyu5U,Politics,Politics,Crime
62,NowThis Impact,qpDlOWkAztI,Vivian Jenna Wilson’s Drag Debut for Immigrant Defense,"Vivian Jenna Wilson, the 21-year-old transgender daughter of Elon Musk, made her drag debut at a benefit event in Los Angeles, performing for a packed crowd and raising funds for immigrant legal defense.",2025-06-17 18:30:34+00:00,PT16S,16,0:00:16,https://www.youtube.com/watch?v=qpDlOWkAztI,Entertainment,Entertainment,
63,NowThis Impact,QRPj2drh4p8,Roblox Joins the Movement Against ICE Protests,The protests against ICE are so widespread they’ve now reached Roblox.,2025-06-17 18:00:47+00:00,PT59S,59,0:00:59,https://www.youtube.com/watch?v=QRPj2drh4p8,News,General News,
64,NowThis Impact,zECUwNtu8d0,Joe Rogan’s Favorite Guest Just Flipped on Trump”,‘I supported [Trump] this last year. I apologize for doing so... He should be impeached and removed.’,2025-06-17 16:45:27+00:00,PT1M19S,79,0:01:19,https://www.youtube.com/watch?v=zECUwNtu8d0,Politics,Politics,Trump Administration
65,NowThis Impact,8M2KPM1U0yE,Minnesota Shooter's Anti-Choice Influence,"While we don’t know all the motivations of the Minnesota shooter yet, it’s clear that being anti-choice played a role in his actions.",2025-06-16 23:00:46+00:00,PT1M19S,79,0:01:19,https://www.youtube.com/watch?v=8M2KPM1U0yE,Crime,Crime,
66,NowThis Impact,wQ3jF3tBf_4,Trump Orders Deportations in Democratic Cities,"Right after the ‘No Kings’ protest, which drew millions nationwide, Trump ordered ICE to focus its resources on deporting migrants from Democratic cities — and not from areas that impact his base.

Yes, that might be unconstitutional. But it also shows just how scared he is of our collective power.",2025-06-16 22:30:45+00:00,PT1M,60,0:01:00,https://www.youtube.com/watch?v=wQ3jF3tBf_4,Politics,Politics,Immigration
67,NowThis Impact,QhoI5EjrtPs,Supporting Adriana Smith's Family During Tragedy,"Adriana Smith is being kept alive after being declared brain dead because she is still pregnant — and abortion is banned in Georgia.

Now her family, already grieving, has to cover the costs of keeping her on life support.",2025-06-16 22:00:53+00:00,PT1M33S,93,0:01:33,https://www.youtube.com/watch?v=QhoI5EjrtPs,Health,Health,
