Unnamed: 0,channel_title,video_id,title,description,publishedAt,duration_iso,duration_seconds,duration_hms,url,section,merged_section,subsection
131,NowThis Impact,Oe6ta4udoZ0,MAGA Supporter Removed from Love Island USA,"Yulissa has left the villa.

She was abruptly removed from ‘Love Island USA’ shortly after the premiere due to resurfaced videos of her using racial slurs — specifically the N-word — during past podcast appearances.

Maybe this is a reminder that just because you legally ‘can’ say something doesn’t mean you ‘should.’ Actions have consequences.",2025-06-05 18:00:39+00:00,PT13S,13,0:00:13,https://www.youtube.com/watch?v=Oe6ta4udoZ0,Entertainment News,Entertainment,
132,NowThis Impact,_wpgVe6oeeQ,Trump’s Not In It for Himself? Let’s Talk Facts.,Karoline Leavitt claimed Trump isn’t using the presidency for his own benefit. Here’s why that’s not true — and how MAGA justifies his corruption.,2025-06-05 17:01:54+00:00,PT1M30S,90,0:01:30,https://www.youtube.com/watch?v=_wpgVe6oeeQ,Politics,Politics,Trump Administration
133,NowThis Impact,Zp3E53iPeo8,When the Education Secretary Doesn’t Know Education History…,"Despite being the actual secretary of education, Linda McMahon couldn’t answer a basic question about the history of the U.S. education system. Yikes.",2025-06-05 02:00:18+00:00,PT17S,17,0:00:17,https://www.youtube.com/watch?v=Zp3E53iPeo8,Education,Education,
134,NowThis Impact,pFdq0Zr5vJ0,"Healthcare for Who? Not You, If Trump Gets His Way","Thank you to The Audrey & Jeremy Podcast for breaking down why access to health care matters. Trump’s Big, Beautiful, Bill would cost millions of people the care they need — especially those with disabilities who rely on government programs.",2025-06-05 00:00:45+00:00,PT1M2S,62,0:01:02,https://www.youtube.com/watch?v=pFdq0Zr5vJ0,Health Care,Health,
135,NowThis Impact,LNXXSb6RhQ8,The Cost of Corporate Greed,Congressman Greg Casar asks Secretary of Education Linda McMahon: How is it worth it for kids to lose access to health care just so the ultra-rich can get even richer?,2025-06-04 23:00:50+00:00,PT1M38S,98,0:01:38,https://www.youtube.com/watch?v=LNXXSb6RhQ8,Politics,Politics,Healthcare
136,NowThis Impact,ocVheViN8ww,Rep. Casar Schools McMahon on What Kids Actually Need,"If kids don’t have a roof over their heads, access to food, or quality health care, how are they supposed to get a good education? That was Congressman Casar's question for Secretary of Education Linda McMahon, who’s been called out for being seriously underqualified — but definitely overpaid.",2025-06-04 22:15:24+00:00,PT1M24S,84,0:01:24,https://www.youtube.com/watch?v=ocVheViN8ww,Education,Education,
137,NowThis Impact,rRuUQqI2P9g,"Dying Sooner Isn’t a Policy Plan, Senator Ernst",Perfect response to Sen. Joni Ernst carelessly saying ‘we all are going to die’ while trying to defend Medicaid cuts.,2025-06-04 21:00:42+00:00,PT37S,37,0:00:37,https://www.youtube.com/watch?v=rRuUQqI2P9g,Politics,Politics,Healthcare
138,NowThis Impact,j7aQUMVqlYA,Cutting Priorities to Fuel Tax Breaks for the Wealthy,The priorities are clear when you see what we’re cutting — all in the name of tax cuts for the wealthy.,2025-06-03 23:00:42+00:00,PT1M24S,84,0:01:24,https://www.youtube.com/watch?v=j7aQUMVqlYA,Politics,Politics,Taxes
139,NowThis Impact,TkEWLgnQXXY,Teen Arrested by ICE Sparks Student Walkout,"Marcelo Gomes da Silva, a Brazilian teenager, was arrested by ICE on his way to volleyball practice. He was supposed to play in the Milford High School band at graduation the next day.

ICE officials admitted he was not the target of the operation, and no local officials were notified of the raid.

Students at Gomes da Silva’s high school responded by staging a walkout, holding signs that said, ‘Free Marcelo.’ Other members of his community have spoken out, pleading for his release.",2025-06-03 19:15:40+00:00,PT2M46S,166,0:02:46,https://www.youtube.com/watch?v=TkEWLgnQXXY,Local News,Local News,
140,NowThis Impact,P0T0aP7KZIk,Texas Bill Threatens Romeo and Juliet with Book Ban,"Texas Republicans passed a bill banning books that are ‘inconsistent with community values’ in schools — whatever that means. The law would put school boards, not librarians, in charge of deciding what books are allowed in libraries.

When Rep. James Talarico questioned the bill’s author, he admitted the law could even ban ‘Romeo and Juliet.’

This is what lawmakers are focused on while most Americans are living paycheck to paycheck.",2025-06-03 19:00:41+00:00,PT27S,27,0:00:27,https://www.youtube.com/watch?v=P0T0aP7KZIk,Education,Education,
141,NowThis Impact,uSzdqEW994s,Peter Thiel Builds America’s Biggest Surveillance System,"Meet Peter Thiel, co-founder of Palantir — the tech company Trump has enlisted to build the largest government surveillance system in U.S. history.",2025-06-03 18:00:49+00:00,PT1M28S,88,0:01:28,https://www.youtube.com/watch?v=uSzdqEW994s,Technology,Technology,
142,NowThis Impact,EPain8bPB_4,Elon Musk Walks Away from White House Role,Elon Musk has left his role at the White House and doesn’t want to talk about it anymore.,2025-06-02 19:00:46+00:00,PT38S,38,0:00:38,https://www.youtube.com/watch?v=EPain8bPB_4,Politics,Politics,Biden Administration
143,NowThis Impact,hXh59PcI1G8,"Promise Broken, Truth Exposed",The lie detector test determined … it was all a lie.,2025-06-02 18:00:45+00:00,PT37S,37,0:00:37,https://www.youtube.com/watch?v=hXh59PcI1G8,Crime,Crime,
144,NowThis Impact,ohXY7o6dJwo,Todd Chrisley Calls Out Prison Racism,This is........ Unexpected.,2025-06-02 17:00:43+00:00,PT40S,40,0:00:40,https://www.youtube.com/watch?v=ohXY7o6dJwo,Breaking News,Breaking News,
145,NowThis Impact,jDO88kviKp8,MAGA Sparks Outrage Over This,MAGA is really upset about this one.,2025-06-01 16:00:38+00:00,PT55S,55,0:00:55,https://www.youtube.com/watch?v=jDO88kviKp8,Politics,Politics,Trump Administration
