username,created_at,text,likes,reposts,section
CNN,2025-05-22 18:02:23,"They hailed from different parts of the world, but their paths led them both to pursue careers in diplomacy and to the Israeli embassy in Washington, DC.

Their love story was tragically cut short when a gunman fatally shot the couple as they were leaving an event at the Capital Jewish Museum.",81,17,Breaking News
CNN,2025-05-22 17:52:55,"Clownfish, a small orange and white species made famous by the “Finding Nemo” movies, have been found to shrink in order to boost their chances of surviving marine heat waves, according to a new study. cnn.it/4kpX24q",137,19,Science
CNN,2025-05-22 17:36:02,A federal judge has blocked the Trump administration from terminating the legal status that allows foreign students to study at colleges and universities in the US.,300,56,Education
CNN,2025-05-22 17:02:59,"The Supreme Court said President Donald Trump doesn't have to rehire senior officials he fired from two independent federal labor agencies that enforce worker protections, while the officials continue fighting in court to reverse their terminations.",55,20,Politics
CNN,2025-05-22 16:54:54,"JUST IN: The man accused of killing two Israeli Embassy staffers in Washington, DC, has been charged with murder",64,12,Crime
CNN,2025-05-22 16:53:56,Nike is returning to Amazon after an absence of more than five years and hiking prices on some products as its new CEO works to reverse a revenue slump. cnn.it/3Fpml7T,49,7,Business
CNN,2025-05-22 16:11:54,"Directives from Trump and Pete Hegseth set off a sweeping effort in recent months to scour course offerings and syllabuses, cancelling two classes, cutting some readings and reviewing books for possible removal from the library as well as cancelling clubs for students of color and women.",63,24,Education
CNN,2025-05-22 15:51:45,"Eight migrant detainees who were on a US flight destined for South Sudan are currently at a US military base in Djibouti, awaiting next steps as details over their case are hammered out in court, two US officials told CNN.",76,35,International News
CNN,2025-05-22 15:29:11,"Growing concern about the national debt impacted home borrowing rates this week.

Mortgage rates track the benchmark 10-year Treasury yield, which climbed higher as bonds sold off after US federal debt was downgraded from a perfect rating by Moody’s Ratings on Friday. cnn.it/3Shn6Tn",61,24,Economy
CNN,2025-05-22 15:18:33,"The British government will roll out the use of medication to suppress the sex drive of sex offenders, as part of a package of measures to reduce the risk of reoffending and alleviate the pressures on the prison system, which is running out of space.",137,38,Crime and Justice
CNN,2025-05-22 14:35:41,"The Trump administration on Thursday revoked Harvard University’s ability to enroll international students, marking a sharp escalation in the ongoing back-and-forth between the White House and the university. cnn.it/4kqKTNj",100,40,Education
CNN,2025-05-22 13:36:50,"At the heart of the situation is the fact that air traffic control over Newark was transferred to a facility in Philadelphia last July, leaving controllers more than 100 miles away to rely on data flowing through telecom lines to stay connected to what’s happening in Newark’s airspace.",111,43,Transportation
CNN,2025-05-22 13:07:10,"Ultraprocessed foods, toxins and poor diet are contributing to a rise in chronic illnesses, particularly among children, MAHA health report finds. cnn.it/4mro4dy",203,51,Health
CNN,2025-05-22 12:30:30,A federal judge on Thursday blocked President Donald Trump’s executive order to shut down the Education Department and ordered the agency to reinstate employees who were fired in mass layoffs. cnn.it/4k1Xgio,353,72,Politics
CNN,2025-05-22 12:05:45,"Staring down another above-average hurricane season, America’s weather forecasting and disaster response agencies are more hollowed out than ever before – and that could leave tens of millions of Americans more vulnerable to these massive storms. cnn.it/3ZpQESz",85,34,Weather
CNN,2025-05-22 11:27:13,"Multiple people onboard a business jet that crashed into a San Diego neighborhood that houses military families are dead, authorities say.",136,66,Breaking News
CNN,2025-05-22 11:23:02,"Here’s a visual timeline of how 10 inmates used strategic planning, bad infrastructure and sheer luck to escape a jail in the heart of New Orleans. cnn.it/4dtDny8",32,4,Crime
CNN,2025-05-22 11:03:11,Treasury Department will phase out production of pennies and will soon stop putting new one-cent coins into circulation. cnn.it/4kAGxmq,75,28,Economy
CNN,2025-05-22 10:31:12,Supreme Court leaves in place a ruling to block the nation's first religious charter school. Justice Amy Coney Barrett recused herself from the case.,164,30,Education
CNN,2025-05-22 09:08:54,"Small plane crashes in a San Diego neighborhood, setting homes and cars on fire",138,56,Local News
CNN,2025-05-22 06:59:42,BREAKING: The House passes Trump's domestic policy bill after GOP leaders win over holdouts. It next goes to the Senate.,35,20,Politics
CNN,2025-05-22 06:12:19,Air traffic controllers say recent issues at Newark Liberty International Airport are rooted in a plan from Trump’s first term: cnn.it/3HjVWsB,298,108,Politics
CNN,2025-05-22 05:52:15,"The plaintiffs, all over the age of 40, claim that they submitted hundreds of job applications through Workday and were rejected each time — sometimes within minutes or hours. They blame Workday's algorithm.",142,48,Business
CNN,2025-05-22 05:49:07,"North Korea’s newest warship was severely damaged during a launch ceremony, with leader Kim Jong Un, who witnessed the accident, saying it brought shame to the nation’s prestige and vowing to punish those found responsible, state media reported",111,16,World News
CNN,2025-05-22 05:35:05,"The decidedly unsexy bond market is usually pretty quiet. But when they want to, bond investors can send a loud, clear message to Washington. They did just that Thursday.",1043,302,Finance
CNN,2025-05-22 04:46:51,"Todd Harder voted for Donald Trump and knows firsthand his community would benefit if the president can deliver on his promise of a quick American manufacturing renaissance.

But Harder doesn’t believe he will ever see it. cnn.it/4mnINz3",66,13,Politics
CNN,2025-05-22 00:23:02,"Two staff members at the Israeli Embassy in Washington, DC, were killed Wednesday night near the Capital Jewish Museum, Secretary of Homeland Security Kristi Noem said.",81,27,Breaking News
CNN,2025-05-21 22:35:08,"US and European authorities announced a major crackdown on a prolific hacking tool that has been used by hundreds of hackers in damaging ransomware attacks, bank thefts and other digital crimes.",89,26,Cybersecurity
CNN,2025-05-21 21:46:44,"A 24-year-old man was arrested for allegedly forging documents to enroll in an Ohio high school, where he studied for over a year before the identity fraud was discovered, authorities said.",35,4,Crime
CNN,2025-05-21 21:14:52,"Foreign nationals with $5 million to spare will soon be able to register for a new “gold card” visa that would give them the right to live and work permanently in the United States, Commerce Secretary Howard Lutnick said.",97,71,Immigration
CNN,2025-05-21 20:24:39,"JUST IN: Indianapolis Colts owner and CEO Jim Irsay has died at the age of 65, the team announced. cnn.it/439YHWf",63,16,Sports News
CNN,2025-05-21 20:10:32,"A federal agent, an expert on abuse trauma and a former executive assistant testified Wednesday in Sean “Diddy” Combs’ federal racketeering and sex trafficking trial.",40,7,Crime
CNN,2025-05-21 19:36:10,"Moments before President Trump escorted his South African counterpart into the Oval Office, White House aides could be seen wheeling two large-screen televisions down the driveway and into the West Wing.

Little could have prepared President Cyril Ramaphosa for what he was about to see.",155,45,Politics
CNN,2025-05-21 18:55:06,The sensitive interior of human teeth might have originated from a seemingly unlikely place: sensory tissue in fish that were swimming in Earth’s oceans 465 million years ago. cnn.it/4doNuEq,98,13,Science
CNN,2025-05-21 18:21:23,"Secretary of Defense Pete Hegseth hosted a Christian prayer service at the Pentagon for employees that included a sermon by his hometown pastor who said President Donald Trump had been “sovereignly appointed.”

Hegseth told the audience that the service would be a monthly event.",169,70,Politics
CNN,2025-05-21 17:50:07,"Tottenham Hotspur defeated Manchester United 1-0 to win the Europa League final in Bilbao, Spain.

The victory secured Spurs its first cup title in 17 years. cnn.it/4k2PtRn",275,40,Sports
CNN,2025-05-21 17:19:45,"Armed men hijacked a tourist boat in the Amazon rainforest in Peru, robbed all 14 people on board and forced them to empty their bank accounts via mobile apps, according to one of the victims.",84,30,Crime
CNN,2025-05-21 16:47:40,"Donald Trump Jr. teased a future run for the presidency during an appearance at the Qatar Economic Forum, saying “that calling is there” when asked if he would “consider picking up the reins” and “run for office” when his father, President Donald Trump, leaves the White House.",59,17,Politics
CNN,2025-05-21 16:13:19,"JUST IN: US stocks, bonds and the dollar fell on Wednesday as concerns mount about the premier status of American assets. cnn.it/44NJCuE",647,181,Finance
CNN,2025-05-21 15:37:35,"The Italian government has this week enacted a law that makes it impossible for anyone to get Italian citizenship through their great-grandparents, dashing the hopes of those who have already paid money to start the process. cnn.it/3YUk4Z5",88,27,Politics
CNN,2025-05-21 14:58:01,"As President Donald Trump works to muscle his sweeping tax and spending cuts package through Congress, a network of conservative groups has undertaken a multimillion-dollar advertising blitz to spread his message to voters and pressure recalcitrant lawmakers to get in line.",57,26,Politics
CNN,2025-05-21 14:23:37,"JUST IN: The Trump administration ""unquestionably"" violated a court order with a possible deportation flight to South Sudan, a federal judge has ruled.",362,121,Politics
CNN,2025-05-21 14:23:29,"Amid growing concerns within the Federal Emergency Management Agency that internal turmoil has left it unprepared for the fast-approaching hurricane season, the agency is taking significant steps to bolster its disaster response workforce and training infrastructure.",81,19,Disaster Management
CNN,2025-05-21 13:48:05,"The Pentagon has accepted a Boeing 747 jet from Qatar to be used by President Trump after the aircraft is modified to include ""proper security measures."" cnn.it/4jdcsrG",98,43,Politics
CNN,2025-05-21 13:19:03,"President Trump pushes unsubstantiated claims of ""White genocide"" in South Africa during tense White House meeting with the nation's president. cnn.it/3F5w6bo",128,43,Politics
CNN,2025-05-21 13:06:26,"Years before recent communications blackouts led to widespread chaos at Newark Liberty International Airport, air traffic controllers and pilots around the country repeatedly reported equipment failures that left them scrambling to avoid mid-air collisions and other catastrophes. cnn.it/3YTZXdo",72,22,Aviation News
CNN,2025-05-21 12:33:54,"The controversial “tush push” play will not be banned for the upcoming NFL season, according to multiple reporters covering the owners’ meeting in Minnesota. cnn.it/4k90G35",49,4,Sports
CNN,2025-05-21 11:57:55,Ties between both nations have been fraught since Trump froze aid to South Africa in February over claims it was mistreating its minority White population.,45,6,International Relations
CNN,2025-05-21 11:29:47,"In total, African countries lost 60 million euros in rejected visa fees in 2024, analysis from the LAGO Collective shows.

Africans have long complained about inconsistent, sometimes baffling decisions about who gets approved or denied while applying for European visas.",42,15,International News
CNN,2025-05-21 10:46:06,"The Trump administration is dismissing investigations into several major US police departments, as well as consent decrees in Louisville and Minneapolis reached following the fatal shooting of Breonna Taylor and police killing of George Floyd.",88,58,Politics
CNN,2025-05-21 10:22:21,"FDA crackdown on off-brand Ozempic products set to take effect, threatening supply and access for many: cnn.it/3Fc29GD",68,23,Health
CNN,2025-05-21 09:46:53,"The Trump administration cut funding for flood prevention projects in blue states across the country while creating new water construction opportunities in red states, undoing a Biden-era proposal that would have allocated money more evenly, according to analysis prepared by Democratic staffers",194,112,Politics
CNN,2025-05-21 08:56:37,"JUST IN: Democratic Rep. Gerry Connolly of Virginia has died at age 75, according to a statement from his family. cnn.it/4kwOid2",378,81,Obituaries
CNN,2025-05-21 07:56:45,Target was already facing a very public revolt from some of its most loyal customers. Now it’s warning about tariffs: cnn.it/3SeHgxu,156,42,Business
CNN,2025-05-21 07:22:19,Intercepted Russian radio chatter obtained by CNN appears to correspond with drone footage showing the suspected execution of Ukrainian prisoners of war last year. The killing of surrendering Ukrainian troops is alleged by Kyiv and international experts to be part of an orchestrated Russian policy.,280,115,War and Conflict
CNN,2025-05-21 07:02:58,"Former senior aide to ex-Ukrainian president Viktor Yanukovych shot dead outside the American School in Madrid, Spanish police source says",86,23,World News
CNN,2025-05-21 06:17:48,"Tax experts, IRS employees and former Treasury officials are all warning that the US government could lose hundreds of billions of dollars in revenue because of staffing cuts to the tax agency, undercutting claims that the sweeping jobs cuts will save the government money: cnn.it/4jchdSk",255,97,Economy
CNN,2025-05-21 06:00:28,"Despite a brief market scare, the richest 10 Americans got $365 billion richer over the past year, according to a new analysis from Oxfam.",180,97,Business
CNN,2025-05-21 05:11:58,"The US has been talking with Hamas through an American intermediary in Doha this week in hopes of brokering an Israel-Gaza ceasefire agreement, according to a source, as US officials say President Donald Trump is growing increasingly frustrated with Israel’s handling of the conflict.",59,13,International News
CNN,2025-05-21 05:06:08,"A sizeable share of the US population depends on these programs. More than 71 million people are enrolled in Medicaid, and roughly 42 million Americans receive food stamps, according to the federal agencies that oversee them.",142,63,Social Services
CNN,2025-05-21 02:48:56,"JUST IN: Russian President Vladimir Putin visited Kursk for the first time since Moscow claimed to have completely recaptured the region following a surprise incursion by Ukrainian forces last year, Russian state news agency TASS reported",34,8,World News
CNN,2025-05-21 02:00:07,"President Donald Trump has laid out new details of his ambitious plan for a multibillion-dollar “Golden Dome” missile defense system to protect the United States from foreign attacks, saying it should be complete before he leaves office. cnn.it/4k5mInp",36,9,National Security
CNN,2025-05-21 01:52:48,"Amid an antitrust battle with the Justice Department, global entertainment company Live Nation is adding one of President Trump’s closest advisors to its board of directors.",34,15,Business
CNN,2025-05-20 21:45:23,"The Justice Department has opened an investigation into former New York Gov. Andrew Cuomo after Republicans accused him of lying to Congress in a Covid-19 testimony, a source says.

Read more: cnn.it/44NyWfA",75,24,Politics
CNN,2025-05-20 21:17:40,"A fifth inmate was recaptured following the jail break in New Orleans last week. Five escapees remain on the loose.

Read more: cnn.it/43qlFXV",69,10,Crime
CNN,2025-05-20 20:56:59,"Epic Games’ wildly popular multiplayer shooter game “Fortnite” was available again on Apple’s app store in the US, capping a ban of nearly five years and marking a major win for the video company.

Details: cnn.it/4kxUfqa",37,12,Technology
CNN,2025-05-20 19:22:45,"A former assistant to Sean “Diddy” Combs, Cassie Ventura’s mother and an exotic dancer nicknamed “The Punisher” all testified during Combs’ federal criminal trial as the prosecution continued to make its case against the hip-hop mogul.",34,7,Entertainment News
CNN,2025-05-20 18:13:38,"The US has obtained new intelligence suggesting that Israel is making preparations to strike Iranian nuclear facilities, even as the Trump administration has been pursuing a diplomatic deal with Tehran.",150,84,International Relations
CNN,2025-05-20 17:55:22,"Ten gold bracelets, 17 cigar cases, a powder compact, a comb, and a whopping 598 gold coins: The items are all part of a valuable and somewhat mysterious stash, found by chance by two hikers in the northeastern Czech Republic.

Read more: cnn.it/4kxINea",122,21,Lifestyle
CNN,2025-05-20 17:15:31,"Newly freed Israeli-American hostage Edan Alexander provided new information about Israeli hostage Matan Zangauker, confirming that he is alive but suffering from significant weight loss, abdominal pain and mental distress, according to Zangauker’s family.",67,10,World News
CNN,2025-05-20 16:42:23,"NFL owners have voted to allow players in the league to participate in the flag football competition at the upcoming 2028 Olympic Games in Los Angeles. 

Details: cnn.it/43qa0bw",70,12,Sports
CNN,2025-05-20 16:21:45,"George Wendt, an actor and comedian who was beloved for his performance as Norm Peterson on the long-running comedy series “Cheers” has died, his family announced.

Read more: cnn.it/4k7chQ9",1191,159,Obituaries
CNN,2025-05-20 15:14:09,Angel Reese praised the WNBA for taking up an investigation into alleged abuse aimed at the Chicago Sky player and the way the league and her team have had her back.,123,20,Sports News
CNN,2025-05-20 14:40:13,"Google’s AI push comes as publishers – particularly independent ones – have raised concerns about how the prominence of AI-generated answers could threaten their businesses.

Read more: cnn.it/3Fr4htY",47,9,Technology
CNN,2025-05-20 14:20:59,"Tariffs and tensions between governments are driving a wedge between Americans and Canadians, even in Point Roberts, Washington, where the ties have been deep for generations.",89,16,International Relations
CNN,2025-05-20 14:08:51,President Donald Trump delivered a blunt message to House Republicans Tuesday morning: Stop negotiating and move ahead with his massive domestic policy bill.,61,17,Politics
CNN,2025-05-20 13:39:44,"Elon Musk, who spent a record amount of money to help elect President Trump, says he plans to spend a lot less on politics in the future.",99,11,Politics
CNN,2025-05-20 10:54:14,"Authorities have arrested an Orleans Parish Sheriff’s Office employee following the escape of 10 inmates, the Louisiana Attorney General’s office confirmed Tuesday, The Associated Press reported.",47,10,Crime
CNN,2025-05-20 10:32:37,UK pauses trade negotiations with Israel over its military operation in Gaza and settler violence in the West Bank.,155,29,International Relations
CNN,2025-05-20 10:05:11,At least four people from Donald Trump’s first term who were deemed too extreme or politically toxic to win Senate confirmation – or even keep their jobs – are now back in the fold and in some cases with more power than before.,79,30,Politics
CNN,2025-05-20 09:38:53,"After the US lost its last perfect credit rating on Friday, Republicans and Democrats responded by pointing fingers at each other.",87,17,Politics
CNN,2025-05-20 08:50:37,"In the final two years of his presidency, Joe Biden was hidden from the public eye to shield the extent of his decline, according to a new book from CNN’s Jake Tapper and Axios’ Alex Thompson.",54,9,Politics
CNN,2025-05-20 06:21:46,"The Trump administration intends to use a civil anti-fraud law to investigate and potentially punish and withdraw federal funding from universities that promote diversity and inclusion policies, the Department of Justice announced.",101,51,Politics
CNN,2025-05-20 05:18:02,"""It's been a full year since Google's AI overview tool went viral for encouraging people to eat glue and put rocks on pizza,"" writes Allison Morrow. ""At the time, the mood around the coverage seemed to be: Oh that silly AI is just hallucinating again."" cnn.it/4mu13qw",99,32,Technology
CNN,2025-05-20 04:15:58,"Despite a 90-day truce in its trade war with the United States, China appears to be maintaining tight control over its rare earth exports – preserving a key source of leverage in future negotiations amid intensifying strategic rivalry with Washington.",100,25,International Relations
CNN,2025-05-20 01:34:11,"The Senate voted to advance first-of-its-kind legislation to regulate “stablecoins,” a kind of cryptocurrency. Democrats had initially voted to block the bill earlier this month amid concerns over President Donald Trump’s cryptocurrency deals.",71,14,Finance
CNN,2025-05-19 21:59:46,"A close call earlier this month at LaGuardia Airport in New York City between two commercial jets is under investigation, the FAA and National Transportation Safety Board confirmed.",104,30,Aviation News
CNN,2025-05-19 21:24:48,A Harvard Medical School professor who works with the Veterans Affairs Department to assess veterans’ risk of suicide hopes his project can survive a fierce internal debate at the department on whether to cancel research contracts with Harvard.,294,93,Health
CNN,2025-05-19 20:56:02,JUST IN: The DOJ has charged Democratic Rep. LaMonica McIver with assaulting law enforcement during a chaotic skirmish outside of an ICE detention facility,128,68,Politics
CNN,2025-05-19 20:40:40,"JUST IN: A fourth criminal has been captured in the manhunt for 10 escapees from a New Orleans jail that has local, state and federal authorities scrambling",67,17,Crime
CNN,2025-05-19 20:03:08,"US homebuilders pulled back on projects in April amid whipsaw tariff announcements and growing fears of economic stress, new data on Friday revealed.",172,62,Economy
CNN,2025-05-19 19:55:10,President Donald Trump’s decision to impose a steep tax on most goods that come into America has tested the mettle of small business owners whose companies are reliant on global trade.,110,31,Economy
CNN,2025-05-19 19:53:40,"Authorities in El Salvador have arrested a prominent attorney critical of President Nayib Bukele, in a move criticized by rights groups who say it reflects an increasing trend of “authoritarianism” in the country.",446,203,Politics
CNN,2025-05-19 19:42:54,"Contrary to the narrative from the president, sources say that the Trump administration was the one that approached Qatar about acquiring a Boeing 747.",1526,601,Politics
CNN,2025-05-19 19:12:54,A federal judge said that she had concerns about being “hoodwinked” by plans put forward in her courtroom by a Trump appointee to rebuild three offices focused on civil rights oversight within the Department of Homeland Security that were eviscerated with mass layoffs set to take effect this week.,137,59,Politics
CNN,2025-05-19 18:56:19,"Cassie Ventura is no longer on the stand, but she was the central character in testimony from three witnesses on Monday in the federal criminal case against Sean “Diddy” Combs.",48,6,Crime
CNN,2025-05-19 18:19:10,What’s happening in southwest Memphis reveals the tension between two very different narratives of what AI can bring US communities. cnn.it/4k3pMQX,259,82,Technology
CNN,2025-05-19 18:01:23,"The first flight carrying migrants who chose to self-deport from the United States as part of a new Department of Homeland Security initiative offering free flights and $1,000 stipends has landed in Honduras.",72,24,Immigration
CNN,2025-05-19 17:48:14,A divided federal appeals court rejected a request from the Trump administration to put on hold a judge’s order requiring the government to “facilitate” the return of a 20-year-old Venezuelan refugee who was deported earlier this year to El Salvador.,151,35,Politics
CNN,2025-05-19 17:26:41,"The jury in Sean ""Diddy"" Combs' racketeering and sex-trafficking trial has been dismissed for the day after hearing testimony from three witnesses. Here's a recap.",33,7,Crime
CNN,2025-05-19 16:20:34,"The Trump administration has agreed to pay nearly $5 million to the family of Ashli Babbitt, a pro-Donald Trump rioter who was shot and killed after breaching the US Capitol on January 6, 2021, according to a person familiar with the matter.",87,36,Politics
CNN,2025-05-19 15:55:16,"In recent years, people ranging from Taylor Swift and Rep. Alexandria Ocasio-Cortez to high school girls around the country have been victims of non-consensual, explicit deepfakes.

Now there is federal law criminalizing the sharing of those images. cnn.it/4mpboE6",245,62,Technology and Law
CNN,2025-05-19 15:17:53,The FAA is investigating another radio outage at the troubled air traffic approach control facility responsible for flights approaching and departing Newark Liberty International Airport.,90,32,Aviation News
CNN,2025-05-19 14:59:03,"President Donald Trump is considering nominating Emil Bove, his former personal attorney who currently holds a senior role at the Justice Department, as a federal appeals judge, a person familiar with the matter confirmed to CNN.",44,19,Politics
