username,created_at,text,likes,reposts,section
CNN,2025-05-14 17:17:45,"A significant overhaul of the National Security Council at the White House is expected in the coming days, including a staff reduction and a reinforced top-down approach with decision-making concentrated at the highest levels, three senior Trump administration officials told CNN: cnn.it/4jmCCsp",67,14,Politics
CNN,2025-05-14 17:11:31,"Some members of Biden's Cabinet did not believe he could be relied upon in a 2 a.m. emergency by the last year of his presidency, new book reveals",46,9,Politics
CNN,2025-05-14 17:09:34,"JUST IN: Harvard president to take a 25% pay cut as the university says it is ""blacklisted"" from getting federal funding",247,58,Education
CNN,2025-05-14 16:39:01,The Supreme Court is set to take up a case that could decide how quickly President Donald Trump can implement his second term agenda as it hears arguments about nationwide injunctions that allow a single judge to block a policy for the entire country: cnn.it/43f3pR3,60,19,Politics
CNN,2025-05-14 15:39:09,"A Wisconsin judge charged with helping a man who is in the country illegally evade US immigration agents who were trying to detain him at her courthouse filed a motion to dismiss the case Wednesday, arguing that there’s no legal basis for it.",751,154,Immigration Law
CNN,2025-05-14 14:52:53,"Cassie Ventura testifies about the alleged abuse she endured from the music mogul and how ""Freak Offs"" led to medical issues. Follow live updates:",37,10,Entertainment News
CNN,2025-05-14 13:47:52,A Venezuelan toddler who had been kept in US government custody after her parents were deported has been returned to Venezuela.,122,39,Immigration
CNN,2025-05-14 13:11:33,"A judge in Virginia ordered the release of Georgetown University scholar Badar Khan Suri, marking at least the third time a detained student or academic targeted by the Trump administration because of their protest activity or affiliation was released from immigration detention. cnn.it/4dlC30o",325,64,Immigration News
CNN,2025-05-14 10:20:02,"US drug overdose deaths dropped last year by 27%, but experts warn federal cuts could threaten that progress",99,31,Health
CNN,2025-05-14 09:52:28,"The Trump administration has effectively “blacklisted” Harvard University from getting federal funding as part of its ongoing battle over discrimination and ideology, the university says in a new court filing.",156,53,Politics
CNN,2025-05-14 08:49:31,"For the last few years, the home renovation space has been booming, but Washington’s ever-shifting tariff policies threaten to change that.",43,5,Economy
CNN,2025-05-14 07:57:51,US ports are facing a dramatic slowdown in cargo – but they could see the exact opposite in a matter of weeks.,64,21,Economy
CNN,2025-05-14 07:24:03,"If you’re planning to upgrade your iPhone this fall, you may need to prepare to pay more — even if the sticker price doesn’t change.",38,7,Technology
CNN,2025-05-14 06:25:20,Here's what we know about this year's Canadian wildfire forecast and how impacts could cross the border. cnn.it/43uho70,87,21,Environment
CNN,2025-05-14 05:49:05,"The Social Security Administration is combing through its databases to check whether beneficiaries are alive or dead. It has already added dates of death to millions of people’s records.

The problem: Some people who have recently been declared dead are actually alive.",247,92,Health
CNN,2025-05-14 04:27:28,"BREAKING: US President Trump has met with Syria's leader, a day after Trump announced plans to lift sanctions on the country. Follow live updates. cnn.it/4dfQkMd",59,9,Politics
CNN,2025-05-14 04:08:38,"“The goal is to have a manageable number of flights land at Newark,” Transportation Secretary Sean Duffy told reporters at a news conference. “Families shouldn’t have to wait four or five hours for a flight that never takes off.”",47,9,Transportation
CNN,2025-05-14 01:52:52,"Nearly half a century after a young California woman was strangled to death, officials say a thumbprint on a carton of cigarettes has led to an arrest.",119,6,Crime
CNN,2025-05-13 22:09:12,"Rescue boats were used to evacuate an elementary school in Allegany County, Maryland as heavy rains brought flooding to the region, the county’s emergency services department said.",117,45,Local News
CNN,2025-05-13 21:17:36,"The Trump administration plans to deploy hundreds more federal personnel to ramp up arrests of undocumented immigrants as soon as this week, according to two sources familiar with the planning.",71,37,Immigration
CNN,2025-05-13 20:55:59,"A judge resentenced Erik and Lyle Menendez to 50 years to life in prison for the 1989 murders of their parents, ruling Tuesday the brothers will be eligible for parole.

Read more: cnn.it/43sjwvU",65,6,Crime
CNN,2025-05-13 18:40:06,"A judge struck down Michigan’s 24-hour waiting period before an abortion, saying it conflicts with a voter-approved amendment that locked abortion rights in the state constitution in 2022.",1317,252,Politics
CNN,2025-05-13 18:16:25,"Converting a luxury jet gifted by Qatar to President Donald Trump into a replacement for Air Force One could potentially cost hundreds of millions of dollars and take up to two years to install the necessary security equipment, communications, and defensive capabilities. cnn.it/3S2UahW",281,97,Politics
CNN,2025-05-13 17:33:04,The S&P 500 benchmark stock index hit another milestone in its remarkable march higher from the brink of a bear market in recent weeks: It has now erased all its losses for this year.,67,11,Finance
CNN,2025-05-13 17:00:23,"Boston Celtics star Jayson Tatum ruptured his right Achilles tendon in Monday night’s playoff game and will be out for an extended period of time, the team announced.",46,5,Sports
CNN,2025-05-13 16:37:22,"Major League Baseball has removed Pete Rose and ""Shoeless"" Joe Jackson, two of the sport's most famous players who were previously kicked out of baseball for gambling on the game, from the league's permanently ineligible list.

Read more: cnn.it/43ntihY",77,9,Sports
CNN,2025-05-13 16:18:21,Several family members of Mexican drug trafficker Joaquín “El Chapo” Guzmán have entered the US as part of negotiations in a case against one of his sons.,64,26,Crime
CNN,2025-05-13 15:43:47,"For months, President Donald Trump has falsely claimed that egg prices are tumbling. It wasn’t true then, but it’s true now.

Read more: cnn.it/43t0PrZ",73,10,Politics
CNN,2025-05-13 15:11:06,"Nearly a decade ago, Airbnb envisioned being more than just an app to book a home for a vacation. Its latest redesign could be a major push toward becoming the kind of “end-to-end travel app,” that CEO Brian Chesky has said he wants to create. 

Read more: cnn.it/4de3OYC",32,6,Technology
CNN,2025-05-13 14:28:22,"Four ex-military friends are planning to summit Everest without the usual lengthy acclimatization period, relying on inhalations of noble gas xenon to prepare them. 

Critics warn that this method may be unsafe and unethical.",49,5,Health
CNN,2025-05-13 14:11:43,"Pressed into a piece of rock is the flattened, 47 million-year-old body of a cicada.

Measuring about 1 inch long with a wingspan of 2.7 inches, its fossilized form is nearly intact, with its veined wings spread wide. cnn.it/4k19ZCc",180,27,Science
CNN,2025-05-13 13:03:52,"Israel targeted Hamas leader Mohammad Sinwar in a strike on a hospital in Gaza, months after killing his brother Yahya Sinwar.",44,11,World News
CNN,2025-05-13 12:56:18,"President Donald Trump announced Tuesday that he plans to lift sanctions on Syria following the fall of the Assad regime, which he said will “give them a chance at greatness.”",43,11,Politics
CNN,2025-05-13 11:11:43,"Cassie Ventura, a key prosecution witness and Sean ""Diddy"" Combs' ex-girlfriend, takes the stand in the music mogul's sex trafficking trial.

Follow live updates: cnn.it/3FfefP3",39,6,Crime
CNN,2025-05-13 10:41:11,The Trump administration is cutting another $450 million in federal grants to Harvard University – on top of $2.2 billion already slashed – tightening even further its ideological pressure on America’s oldest and wealthiest university amid a broader battle over control of US college campuses.,97,48,Education
CNN,2025-05-13 10:07:33,"Former President Joe Biden's physical deterioration was severe enough that aides discussed putting him in a wheelchair if he won a second term, new book says: cnn.it/457f2vV",67,13,Politics
CNN,2025-05-13 08:44:49,"Annual US inflation slowed more than expected in April, a welcome sign at a time when Trump's tariff threats are stoking concern",46,5,Economy
CNN,2025-05-13 08:16:43,"Three years after it seized control of Mariupol following a brutal 86-day siege, Russia is using a more subtle power to keep its grip on the Ukrainian port city: social media influencers. cnn.it/4jTcMNq",70,20,International News
CNN,2025-05-13 08:00:52,"Andrew Witty, who helped steer UnitedHealth Group after the 2024 murder of CEO Brian Thompson, is stepping down for ""personal reasons""",104,21,Business News
CNN,2025-05-13 07:44:20,Kim Kardashian arrived at a Paris court to testify in the trial of the burglars accused of tying up and robbing her at gunpoint nearly nine years ago. cnn.it/459yici,36,0,Crime
CNN,2025-05-13 07:10:25,"Former President Joe Biden’s physical deterioration was severe enough in the second half of his presidency that his aides privately discussed putting him in a wheelchair for his second term, according to a new book from CNN’s Jake Tapper and Axios’ Alex Thompson.",157,24,Politics
CNN,2025-05-13 04:41:05,French film star Gérard Depardieu found guilty of sexual assault by a Paris court,146,38,Entertainment News
CNN,2025-05-13 03:06:58,"JUST IN: US President Trump arrives in Saudi Arabia to kickstart his Middle East trip, as he tries to position himself as global dealmaker. Follow live updates.",35,8,Politics
CNN,2025-05-13 01:00:49,"Chinese leader Xi Jinping has hit out at “bullying” and “hegemonism,” in his first public remarks since a temporary truce over tariffs was agreed in the trade war between the United States and China.",234,60,International News
CNN,2025-05-12 22:04:30,Many people like to play something to quiet their thoughts as they fall asleep. Experts share how to do it while preserving your sleep quality.,85,13,Health
CNN,2025-05-12 21:23:48,"“Indefensible.” “It’s a bribe.” “Such a stain” on the administration.

Some of President Donald Trump’s staunchest supporters are among the loudest critics of his plan to accept a jet from Qatar for use as Air Force One.",531,137,Politics
CNN,2025-05-12 20:43:42,"While Harvard and the Trump administration share “common ground” on issues such as ending antisemitism and other bigotry on campus and encouraging a “multiplicity of viewpoints” at the school, the “overreach” of the federal government has hindered those objectives, the university’s president wrote.",128,27,Education
CNN,2025-05-12 20:14:04,"Coercion or consent?

That is the central question posed to a federal jury on the first day of testimony in Sean “Diddy” Combs' racketeering and sex trafficking trial in New York City.",44,6,Crime
CNN,2025-05-12 19:37:32,"JUST IN: The Dallas Mavericks have won the NBA draft lottery, giving them the No. 1 overall pick in the 2025 NBA draft.",73,11,Sports
CNN,2025-05-12 19:20:14,"AMC Theatres, the world’s largest theater chain, will be offering even more discounts to moviegoers starting this summer. cnn.it/3ZfoZDM",193,46,Entertainment
CNN,2025-05-12 19:00:56,"Rapper Tory Lanez was hospitalized after an attack at a California prison where he’s serving a 10-year sentence for shooting hip-hop star Megan Thee Stallion in the feet, authorities said.",59,3,Entertainment News
CNN,2025-05-12 18:39:16,"The curator Koyo Kouoh, a giant of the contemporary art world who tirelessly championed African artists and became the first woman from the continent to curate the Venice Biennale, died on Saturday at age 57. cnn.it/4iWd5FV",213,70,Obituaries
CNN,2025-05-12 18:32:13,"A Florida State University student accused of killing two people and injuring six others on campus has been released from the hospital and faces murder charges, according to Tallahassee police.",79,11,Crime
CNN,2025-05-12 18:17:50,"Two senior Justice Department officials appointed by President Donald Trump to run the Library of Congress were denied access on Monday, according to a person familiar with the interaction.",309,49,Politics
CNN,2025-05-12 17:31:36,A federal judge won’t block a controversial Trump administration initiative to share highly sensitive taxpayer information with federal immigration authorities in hopes of tracking down undocumented immigrants and quickly deporting them out of the country.,101,70,Immigration
CNN,2025-05-12 17:01:31,"As tensions ratcheted up over the last week of fighting, Pakistan did not consider deploying nuclear warheads to strike India, the country’s foreign minister Ishaq Dar told CNN on Monday.",51,12,International Relations
CNN,2025-05-12 16:38:05,"McDonald’s is seeking to hire up to 375,000 people ahead of the busy summer season, marking one of its biggest employment initiatives in five years. cnn.it/3S3btPY",75,11,Business
CNN,2025-05-12 14:46:41,"A flight carrying a group of 59 White South Africans granted refugee status in the US by the Trump administration arrived at Washington Dulles airport on Monday, a State Department official said.",63,34,Immigration
CNN,2025-05-12 11:58:41,"JUST IN: Hamas hands Edan Alexander, the last known living American hostage in Gaza, to the Red Cross",150,28,World News
CNN,2025-05-12 11:15:29,"Delays continue to affect flights at Newark Liberty International Airport, due to an air traffic control staffing shortage.

As CNN previously reported, at least five controllers there took 45 days of trauma leave after losing radar and radio communication on April 28.",521,156,Transportation
CNN,2025-05-12 10:27:46,"Dozens of boxes of Nazi material confiscated by Argentinean authorities during World War II were recently rediscovered in the Supreme Court's basement, the court reveals.",113,36,History
CNN,2025-05-12 09:42:28,"Dow soars over 1,000 points at open after US and China agree to temporarily roll back tariffs for 90 days.",44,8,Business
CNN,2025-05-12 09:31:56,"While Trump's tariffs may help some small US businesses, many others will feel the pain.",49,10,Economy
CNN,2025-05-12 08:29:42,"As Donald Trump shakes up the very institutions, alliances, and free trade order that have underpinned America's global dominance since World War II, some in China are reminded of their own former leader — one who wielded revolutionary zeal to tear down the old world more than half a century ago.",80,28,International Relations
CNN,2025-05-12 07:25:34,"Sean ""Diddy"" Combs will have the support of his family as opening statements in his sex-trafficking trial are set to begin in downtown Manhattan.",32,3,Entertainment News
CNN,2025-05-12 06:25:52,The United States aviation industry continues to grapple with the worst air traffic controller shortage in nearly 30 years as a recent spate of incidents has thrust the high-stress profession into the spotlight.,125,45,Business
CNN,2025-05-12 05:22:56,President Donald Trump embarks on the first major international trip of his second term — an opportunity to shore up relations with a trio of key Middle Eastern allies and prove his might as a dealmaker on the world stage.,47,4,International News
CNN,2025-05-12 04:20:12,"The Kurdistan Workers Party militia have announced its decision to dissolve the group, a historic move after decades of conflict with Turkey that have killed tens of thousands of people.",70,20,World News
CNN,2025-05-12 03:21:06,"US and China agree to drastically roll back tariffs for an initial 90-day period, according to a joint statement.",79,30,Economy
CNN,2025-05-11 22:02:43,The governor of the Mexican state of Baja California says the United States has withdrawn tourist visas from her and her husband.,444,171,Politics
CNN,2025-05-11 21:30:14,Mónica got pregnant last year around the same time President Donald Trump was elected to a second term. And that is when her race against the calendar began.,82,19,Politics
CNN,2025-05-11 20:33:03,"In June 2023, Jon Halper started selling THC beverages at Top Ten Liquors, his chain of Minnesota stores. The drinks, which contain the main intoxicating chemical compound found in cannabis, were a massive hit.

After just two years, THC beverages make up about 15% of overall sales, he said.",109,10,Business
CNN,2025-05-11 19:42:15,"JUST IN: President Donald Trump announced he'll sign an executive order on Monday that aims to cut drug prices, resurrecting a controversial policy from his first term.",110,25,Politics
CNN,2025-05-11 18:58:59,"Stock futures rose after Treasury Secretary Scott Bessent said “substantial progress” was made in trade negotiations with Chinese officials, potentially thawing tensions kickstarted by Trump’s escalating tariff policy.",55,11,Finance
CNN,2025-05-11 18:05:35,"Four people have died and four are critically injured after a fire broke out at a multistory apartment building in Milwaukee’s Concordia neighborhood Sunday morning, CNN affiliates report.",91,18,Breaking News
CNN,2025-05-11 16:54:15,"May’s full moon, known by its popular nickname as the flower moon to signify the many blossoms of spring, will be bright in the sky on Sunday night — despite it being a “micromoon.”",172,28,Science/Environment
CNN,2025-05-11 15:27:11,"JUST IN: Hamas announces the imminent release of the last known living American hostage held in Gaza, Edan Alexander. cnn.it/43gcZDz",283,51,Breaking News
CNN,2025-05-11 15:06:10,"The direct ancestor of Tyrannosaurus rex would have arrived in North America after crossing a land bridge from Asia, according to a new study. The report is the latest to weigh in on the fierce debate among paleontologists over the origins of the king of the dinosaurs: cnn.it/3H0Gz8i",122,18,Science
CNN,2025-05-11 14:33:09,"Despite its reputation as ironclad, it was possible to escape Alcatraz. All it took was brains, guts and 50 raincoats: cnn.it/3EPPSrg",93,10,Crime
CNN,2025-05-11 13:46:24,Democrats involved in tense encounter at ICE facility say the Trump administration is trying to intimidate them: cnn.it/44uzJBX,249,51,Politics
CNN,2025-05-11 13:03:25,"The Trump administration is set to accept a luxury plane from the Qatari royal family that will be retrofitted and used as Air Force One during his second term, two people familiar with the agreement told CNN: cnn.it/4mcO4JE",189,56,Politics
CNN,2025-05-11 12:50:21,Top US officials emerge from China trade talks touting ‘substantial progress’ and a ‘deal’: cnn.it/3EPTbyG,46,12,Business
CNN,2025-05-11 11:47:42,"""Kai is such a fighter"": Liev Schreiber shows his support for his trans daughter",646,54,Entertainment
CNN,2025-05-11 10:14:38,Another air traffic control equipment outage at Newark airport caused the FAA to implement a brief ground stop for inbound flights today,232,88,Transportation
CNN,2025-05-11 10:11:47,"Combs and Ventura’s longterm relationship, which played out between 2007 and 2018, is at the heart of the criminal case against him. 

Ventura could be called to the witness stand during his trial as early as Monday. cnn.it/3Zbn5Ec",35,4,Crime
CNN,2025-05-11 09:02:50,"""Several of the key voter groups that provided President Donald Trump’s most important electoral gains in November are recoiling from him as his term moves past the 100-day mark. But it remains unclear how much Democrats can benefit from these growing doubts,"" writes Ronald Brownstein | Analysis",95,20,Politics
CNN,2025-05-11 06:29:40,The pontiff steps out onto the balcony of St. Peter's Basilica to deliver his first Sunday blessing since his election,262,20,Religion
CNN,2025-05-10 21:14:11,"Russian President Vladimir Putin has proposed holding “direct talks” with Ukraine on Thursday in Istanbul, as European leaders and the United States attempt to put pressure on Moscow to agree to a 30-day ceasefire",135,25,International News
CNN,2025-05-10 20:57:13,"Researchers working to decipher the contents of a burned, still-rolled scroll uncovered both the author and the title of the text nearly 2,000 years after it was buried in the Mount Vesuvius eruption: cnn.it/42U4crX",166,32,Science
CNN,2025-05-10 20:09:44,Tufts University student Rümeysa Öztürk arrives back home after spending six weeks at a Louisiana detention center.,1240,180,Education
CNN,2025-05-10 18:58:43,"Three members of Congress from New Jersey, along with protesters, faced off with Department of Homeland Security officers on Friday after visiting a local ICE detention facility.",254,68,Politics
CNN,2025-05-10 17:25:47,The future of habeas corpus has been pushed into the spotlight as President Donald Trump has been involved in discussions inside his administration over potentially taking the extreme step of suspending the procedure.,176,86,Legal News
CNN,2025-05-10 16:16:43,"Across the country, K-12 schools and universities have denied information to the public – even to parents of injured students – citing student privacy or FERPA, the Family Educational Rights and Privacy Act.",62,19,Education
CNN,2025-05-10 15:54:21,"Combs has pleaded not guilty to five counts, including one count of racketeering conspiracy, two counts of sex trafficking and two counts of transportation to engage in prostitution. If convicted, he could face a sentence of up to life in prison.",64,13,Crime
CNN,2025-05-10 15:29:20,"Indian foreign secretary accuses Pakistan of violating ceasefire, Pakistan denies any violation of the agreement. 

Follow live updates.",62,9,International News
CNN,2025-05-10 11:58:22,"The morning after John Prevost watched his younger brother Robert become Pope Leo XIV, he received a familiar phone call.",161,22,Religion
CNN,2025-05-10 10:53:35,"After months of contending with the Trump administration’s multipronged effort to downsize the federal workforce, government employees are now facing the possibility of another major change that could push even more of them out the door.",120,44,Politics
CNN,2025-05-10 10:10:55,"Pope Leo XIV indicated that his papacy will follow closely in the footsteps of the late Pope Francis, telling church cardinals that they should take up that “precious legacy” and identifying artificial intelligence as a main challenge for working people and “human dignity.”",517,85,Vatican News
CNN,2025-05-10 09:41:58,"A mild 4.1 magnitude earthquake in Tennessee was felt across the southeastern US, including in North Carolina and the Atlanta metropolitan area",148,46,Earthquake News
CNN,2025-05-10 09:33:36,"Many K-12 schools and universities have denied information to the public, citing student privacy – even when those details involve safety concerns or parents’ own children.",48,11,Education
CNN,2025-05-10 08:47:04,There are more ways than ever to rub elbows with President Donald Trump and his inner circle — especially for those willing to pay.,98,37,Politics
CNN,2025-05-10 08:43:22,"A Soviet-era spacecraft that was designed to make a soft landing on Venus – but instead remained trapped in Earth orbit for decades – likely fell from the sky early this morning, according to the European Space Agency: cnn.it/3RUXYBN",144,27,Science
CNN,2025-05-10 08:18:05,"BREAKING: India and Pakistan have agreed to a ""full and immediate ceasefire"" following a night of talks mediated by the US, President Trump says.

Follow live updates: cnn.it/43eqa7W",99,33,International News
CNN,2025-05-10 07:48:49,"Ukraine and its European allies call for Russia to agree to a 30-day ceasefire, starting as early as Monday, after meeting in Kyiv",235,42,International News
CNN,2025-05-10 06:31:06,US-China trade talks have begun in Geneva: cnn.it/4kbfq0N,55,11,Business
CNN,2025-05-10 06:05:56,"On Friday morning, West Coast port officials told CNN about a startling sight: Not a single cargo vessel had left China with goods for the two major West Coast ports in the past 12 hours. That hasn’t happened since the pandemic. cnn.it/3YA0Rf6",1202,518,Business
CNN,2025-05-10 03:10:36,"The US Postal Service Board of Governors announced that David Steiner, a board member at FedEx, will be the next postmaster general – a move that comes amid concerns the Trump administration will push for privatization of the independent government agency: cnn.it/3RUGOnR",189,102,Politics
CNN,2025-05-09 21:49:01,"A federal judge is halting the Trump administration from carrying out, under a February executive order, mass firings or major reorganizations of multiple agencies going forward.",526,108,Politics
CNN,2025-05-09 21:19:58,"President Trump has been involved in talks over potentially suspending habeas corpus, which allows people to challenge their detention, sources say.",213,96,Politics
CNN,2025-05-09 20:54:57,"Newark Mayor Ras Baraka has been released from ICE custody after being arrested at an immigration detention center where he was protesting its opening. 

Read more: cnn.it/4jRo0lN",695,139,Local News
CNN,2025-05-09 20:09:50,Taylor Swift has been subpoenaed in the case between Blake Lively and Justin Baldoni.,97,20,Entertainment News
CNN,2025-05-09 18:41:41,Tufts University student Rümeysa Öztürk has been released from an immigration detention center following a federal judge's order.,1259,208,Immigration News
CNN,2025-05-09 18:28:34,"Researchers have found pages of a rare medieval manuscript masquerading as a cover and stitched into the binding of another book, according to experts at the Cambridge University Library in England. 

Read more: cnn.it/4m5ku8Z",430,74,Arts & Culture
