username,created_at,text,likes,reposts,section,merged_section
HuffPost,2025-05-15 17:54:54,"Kennedy called a flawed, conservative think tank-backed study on abortion medication ""alarming.""",12,6,Politics,Politics
HuffPost,2025-05-15 17:38:26,"The president explained to Sheikh Mohammed bin Zayed Al Nahyan that a very common word was ""an old-fashioned sound.""",21,5,Politics,Politics
HuffPost,2025-05-15 17:22:19,Robinson faces a $50 million lawsuit from four former housekeepers who alleged he sexually assaulted them multiple times over several years.,3,1,Crime,Crime
HuffPost,2025-05-15 16:56:48,"Honored that this story won a @nypressclub.bsky.social award, and is a finalist for an @lapressclub.bsky.social award — I want to take the opportunity to share an update on Tremane's case nypressclub2024media.s3.amazonaws.com/wp-content/u...
lapressclub.org/wp-content/u...",19,8,Awards/Recognition,Awards/Recognition
HuffPost,2025-05-15 17:16:57,"The Texas mother and her 13-year-old son were taken into custody after a family member found live ammunition and a make-shift explosive device, police said.",20,7,Crime,Crime
HuffPost,2025-05-15 17:03:17,"NEW: I talked to Sen. Angela Alsobrooks (D-Md.) + fired federal scientists about RFK's bizarre insistence yesterday that he hasn't fired ""any working scientists"" -- after he's fired hundreds if not thousands of them. 

Alsobrooks flat-out said he lied.
www.huffpost.com/entry/rfk-fi...",1857,707,Politics,Politics
HuffPost,2025-05-15 17:05:26,"I'm honored to receive a @nypressclub.bsky.social award for my feature on in-depth interviews with Hamas leaders

Thank you to editors & readers who've supported my work + incredible colleagues like fellow winner @jessicaschulberg.bsky.social 🙏🧿

nypressclub2024media.s3.amazonaws.com/wp-content/u...",28,6,Awards/Recognition,Awards/Recognition
HuffPost,2025-05-15 17:00:23,“ZING!” one X user said about Rep. Bennie Thompson’s (Miss.) burn.,22,8,Politics,Politics
HuffPost,2025-05-15 16:54:24,"The HHS secretary ""clearly believes that the more he tells a lie, the more it becomes the truth,” Sen. Angela Alsobrooks (D-Md.) told HuffPost.",41,11,Politics,Politics
HuffPost,2025-05-15 16:31:51,The total number of in-custody deaths is just three deaths short of the same number seen in all of last year.,31,15,Crime,Crime
HuffPost,2025-05-15 16:15:51,RAINN's decision to stop referring callers to resources for immigrants and LGBTQ+ people reportedly comes in response to Trump's DEI-related threats.,10,5,Politics,Politics
HuffPost,2025-05-15 15:47:11,"It works indoors or out, with an easy setup that gets high marks from reviewers.",3,0,Product Reviews,Product Reviews
HuffPost,2025-05-15 15:13:25,"The ""Avengers"" actor teased payback plans for a vulgar bit Che made her husband Colin Jost deliver on ""SNL"" last December.",17,2,Entertainment,Entertainment
HuffPost,2025-05-15 15:07:35,"The comedian called Colbert a misogynist ""dick"" on Tuesday for his unwelcome line of questioning during their 2018 interview over Griffin's infamous photo.",7,1,Entertainment News,Entertainment
HuffPost,2025-05-15 14:55:46,Marjorie Taylor Greene and Mike Lawler went at it over the need to appease GOP voters in blue states.,16,5,Politics,Politics
HuffPost,2025-05-15 14:20:31,Trump was downright giddy to tell the president of the United Arab Emirates about his new favorite word: groceries.,17,4,Politics,Politics
HuffPost,2025-05-15 13:57:29,JD Vance will attend Pope Leo XIV's first mass at the Vatican on Sunday.,15,2,Religion,Religion
HuffPost,2025-05-15 13:46:50,"""It’s been comfortable sleeping ever since, which is a relationship booster at any age!""  one wrote",1,0,Lifestyle,Lifestyle
HuffPost,2025-05-15 13:46:48,"Adriana Smith's mother says the delay, caused by her pregnancy, has been ""torture"" for the family.",14,3,Health,Health
HuffPost,2025-05-15 13:37:57,"Now leading HuffPost:

www.huffpost.com/entry/suprem...",6,1,Politics,Politics
HuffPost,2025-05-15 13:24:18,"The 29-year-old said that ""this isn’t my first rodeo with this.""",7,2,Entertainment,Entertainment
HuffPost,2025-05-15 13:13:33,"Just drop a tablet into the water tank, no scrubbing required.",0,0,Home & Garden,Lifestyle
HuffPost,2025-05-15 13:07:25,"The arguments hinged on a procedural question about the powers of lower courts, but one that could create a patchwork of access to rights across the country.",14,7,Legal News,Crime
HuffPost,2025-05-15 13:03:12,JUST IN: At least five conservative Supreme Court justices appeared ready to rule that Trump’s birthright citizenship restriction may go into effect.,56,34,Politics,Politics
HuffPost,2025-05-15 12:53:27,Tyler Perry is back with another film and Taraji P. Henson stars as a single mother whose world spirals into utter chaos.,9,1,Entertainment,Entertainment
HuffPost,2025-05-15 12:51:06,"Brown has been linked to multiple assaults over the years, including a highly publicized altercation with then-girlfriend Rihanna in 2009.",10,3,Entertainment News,Entertainment
HuffPost,2025-05-15 12:50:01,"The series has been raved about for its representation, tackling pertinent issues and unpacking generational traumas.",8,1,Entertainment,Entertainment
HuffPost,2025-05-15 12:47:53,"If you missed “The Brutalist” in theaters, here’s your chance to watch one of the best films of the decade.",8,1,Entertainment,Entertainment
HuffPost,2025-05-15 12:19:34,"Now leading HuffPost:

www.huffpost.com/entry/walmar...",13,1,Business,Business & Economy
HuffPost,2025-05-15 12:05:12,"Hair stylists have seen warning signs of a recession for months. I spoke to them about how they're weathering the economic downturn, how clients can get the most out of their color and cut and how to make ""recession blonde"" work. 

www.huffpost.com/entry/hair-s...",11,5,Lifestyle,Lifestyle
HuffPost,2025-05-15 12:01:46,"""Mr. Moore... Mr. Moore?""",5,2,Entertainment,Entertainment
HuffPost,2025-05-15 11:59:40,"NEW -- Trump's White House is hiding the vast majority of the transcripts of his remarks.

Why? The White House won't say...

But maybe reading the following might offer a clue:

www.huffpost.com/entry/trump-...",1930,650,Politics,Politics
HuffPost,2025-05-15 11:11:17,"The cult-favorite pants are perfect for work, travel and everything in between.",0,0,Fashion,Arts & Culture
HuffPost,2025-05-15 11:06:00,"From sunscreens to soothing aloe gel, stock up now before you hit the summer sunshine.",0,0,Lifestyle,Lifestyle
HuffPost,2025-05-15 10:54:18,While there is nothing wrong with eating a healthy diet — it’s a great way to bolster your well-being — there is a line that healthy eating can cross. www.huffpost.com/entry/orthor...,1,1,Health,Health
HuffPost,2025-05-15 10:49:14,"Fox News host Sean Hannity joined President Donald Trump aboard Air Force One earlier this week for what critics are calling an embarrassing ""love fest.""",16,2,Politics,Politics
HuffPost,2025-05-15 10:43:18,"The president also complimented Sean Duffy, Buttigieg’s successor as transportation secretary, by boasting about his ability to climb trees.",31,11,Politics,Politics
HuffPost,2025-05-14 16:40:34,"During today's HHS budget hearing, Hawley brought up that junk science report & asked RFK if he believes this is reason enough to restrict access to the abortion pill mifepristone. 

RFK: “The new data... it’s alarming & clearly it indicates that at very least that the label should be changed.""",74,39,Health News,Health
HuffPost,2025-05-15 10:32:49,Some reviewers say it’s even “better than a Dyson.”,0,0,Product Reviews,Product Reviews
HuffPost,2025-05-15 10:00:09,"The ""Modern Family"" star knows exactly what she wants.",2,0,Entertainment,Entertainment
HuffPost,2025-05-15 08:42:30,"“How much money can I give to get this?"" a surprised Meyers asked the actor, who played Kate in Mike White's hit show.",4,0,Entertainment,Entertainment
HuffPost,2025-05-15 08:25:39,"""We expected that it would have the integrity of the President of the United States,"" the unhappy recipient said.",17,4,Politics,Politics
HuffPost,2025-05-15 07:54:00,"Trump's aides released just 20% of the transcripts of his speeches and interactions with the press over his first 100 days, excluding many of his most unhinged comments",137,62,Politics,Politics
HuffPost,2025-05-15 07:03:44,Reviewers are “gobsmacked” and “delighted” at its effectiveness.,1,0,Entertainment,Entertainment
HuffPost,2025-05-15 07:03:43,Stretch every last drop of your purchases with these money-saving finds.,0,0,Finance,Business & Economy
HuffPost,2025-05-15 07:03:41,These portable air conditioners from brands like Black + Decker and Arctic Air will cool the air around you without a standard-sized window.,2,0,Home & Garden,Lifestyle
HuffPost,2025-05-15 07:03:41,And it's way cheaper to make. We found six bullet ice machines that reviewers love.,2,0,Consumer Products,Consumer Products
HuffPost,2025-05-15 07:03:40,"This cordless smart vacuum doubles as a mop, and reviewers have achieved jaw-dropping results.",1,1,Technology,Technology
HuffPost,2025-05-15 07:03:40,"These common understandings are actually misunderstandings, and they’re affecting your hair care.",0,0,Health & Beauty,Health & Beauty
HuffPost,2025-05-15 07:03:38,Social media pressures only makes this condition more prevalent.,0,0,Health,Health
HuffPost,2025-05-15 07:03:36,"From keys to luggage, we break down which trackers will help you keep tabs on your stuff.",0,0,Technology,Technology
HuffPost,2025-05-15 07:03:34,Here's what you should know about aerial inspections — and how it could affect your insurance costs going forward.,0,0,Insurance,Insurance
HuffPost,2025-05-15 07:03:33,These time-consuming efforts don't necessarily make a meaningful impact.,1,1,Opinion,Opinion
HuffPost,2025-05-15 06:12:43,The movie star had a sarcastic message for anchor Jesse Watters.,18,3,Entertainment,Entertainment
HuffPost,2025-05-15 06:01:15,"Trump's presidential opponent in 2016 had a sharp response to him saying, ""Why wouldn't I accept a free gift?""",48,7,Politics,Politics
HuffPost,2025-05-15 05:06:04,"The comedian also rebranded Donald Trump’s MAGA slogan and issued a message ""to the people who voted this s**t in.""",22,2,Entertainment,Entertainment
HuffPost,2025-05-15 04:05:20,"""We still talking about planes?” asked Jordan Klepper.",19,3,Politics,Politics
HuffPost,2025-05-15 03:20:26,"The ""Late Show"" host teed up the line, saying: ""That was pretty upsetting until I said the words...""",18,1,Entertainment,Entertainment
HuffPost,2025-05-14 22:18:48,"“Congress pays for bombs that kill kids in Gaza!” Ben Cohen, the 74-year-old co-founder of the ice cream company, shouted before being yanked away by a police officer.",156,33,Politics,Politics
HuffPost,2025-05-14 21:51:36,"The CNN host described parts of his new book about Biden's reported health decline, including a behavior that the public ""only got glimpses of.""",12,2,Politics,Politics
HuffPost,2025-05-14 21:38:54,"Rep. Kim Schrier (D-Wash.), a pediatrician, warned that one of the real-world effects of the GOP's massive tax plan is women potentially being forced to give birth in their cars. 🇺🇸 www.huffpost.com/entry/trump-...",109,42,Politics,Politics
HuffPost,2025-05-14 21:34:19,"The Boss called upon ""the righteous power of art, of music, of rock and roll"" during a concert in Manchester, England, on Wednesday.",99,24,Entertainment,Entertainment
HuffPost,2025-05-14 20:22:43,"“I don’t think people should be taking medical advice from me,” Kennedy said during a House subcommittee hearing on Wednesday.",72,14,Health News,Health
HuffPost,2025-05-14 19:55:42,"Instead, they elected a Democrat and the city's first Black mayor.",98,18,Politics,Politics
HuffPost,2025-05-14 19:53:16,"South African President Cyril Ramaphosa announced he will meet with Trump next week.
www.huffpost.com/entry/trump-...",10,5,Politics,Politics
HuffPost,2025-05-14 19:16:44,"Harry Enten broke down exactly why the Republican proposal is ""not popular on any part of the aisle.""",19,4,Politics,Politics
HuffPost,2025-05-14 19:00:39,"Justin Baldoni's attorney accused Lively's lawyer of demanding that Swift ""release a statement of support for Ms. Lively.""",4,0,Entertainment News,Entertainment
HuffPost,2025-05-14 18:54:45,Researcher Kseniia Petrova has been sitting in ICE detention for three months.,42,31,Immigration News,World
HuffPost,2025-05-14 18:16:52,The congressman hit the Homeland Security secretary with a simple series of questions on the Trump administration's edited photo.,64,6,Politics,Politics
HuffPost,2025-05-14 17:55:51,"The transportation secretary admitted to redirecting his wife through New York's LaGuardia airport but said it was because of Newark’s reliability, not safety.",27,7,Transportation,Infrastructure
HuffPost,2025-05-14 17:55:50,Social Security faces a growing backlog of retirement claims that agency officials hope their remaining workers can clear with a little encouragement.,9,6,Economy,Business & Economy
HuffPost,2025-05-14 17:41:45,"NEW— Trump's Syria move was a clear break with Israel & its hawkish allies in DC.

Does the moment indicate a meaningful shift in their influence that affects broader Middle East policy? And what does it show about factionalism among key admin officials? My analysis:
www.huffpost.com/entry/syria-...",23,8,Politics,Politics
HuffPost,2025-05-14 17:43:40,The Democratic congresswoman was criticized for addressing the hearing's camera instead of GOP House members ... and then said “hello” to the camera.,57,8,Politics,Politics
HuffPost,2025-05-14 17:42:39,"Republicans and anti-abortion advocates have been pushing the report, published by a conservative think tank, as a reason to ban telehealth for abortion care.",18,5,Politics,Politics
HuffPost,2025-05-14 17:38:45,"Now leading HuffPost: 

www.huffpost.com/entry/tulsi-...",15,4,Politics,Politics
HuffPost,2025-05-14 17:36:19,"“It would be like the United States moving into the Qatari embassy,” Sen. Roger Wicker told Politico.",36,10,Politics,Politics
HuffPost,2025-05-14 17:32:55,"The president's decision on sanctions does not mean he's chosen to side with self-described ""restraint"" advocates over foreign policy hawks in Washington.",6,0,Politics,Politics
HuffPost,2025-05-14 15:05:45,"The GOP's Medicaid bill does not directly target benefits for people with disabilities.

Yet some folks with disabilities see it as an existential threat. One woman even yelled ""YOU WILL KILL ME"" as a Republican spoke yesterday.

www.huffpost.com/entry/medica...",20,5,Health Care,Health
HuffPost,2025-05-14 17:27:08,"""This was never about government efficiency,"" she told Stephen Colbert on Tuesday.",56,10,Politics,Politics
HuffPost,2025-05-14 17:10:22,"Temu and Shein will likely use the reprieve in tariffs with China to stock up U.S. warehouses, experts said.",4,0,Business,Business & Economy
HuffPost,2025-05-14 17:08:36,"DHS Sec. Kristi Noem said Andry Hernández Romero was simply not her problem – despite the Trump administration having banished him to a notorious Salvadoran prison camp without charge or trial two months ago. 

www.huffpost.com/entry/andry-...",55,21,Politics,Politics
HuffPost,2025-05-14 17:05:02,"The talent competition show from the '80s helped launch the careers of Britney Spears, Adam Sandler and more.",6,0,Entertainment,Entertainment
HuffPost,2025-05-14 16:59:24,"Andry Hernández Romero was spotted by a photojournalist crying and shouting ""I'm innocent"" and ""I'm gay” as CECOT guards shaved his head.",30,13,Breaking News,Breaking News
HuffPost,2025-05-14 16:43:09,"The administration accused the Georgetown University academic, Dr. Badar Khan Suri, of "" spreading Hamas propaganda.""",15,1,Politics,Politics
HuffPost,2025-05-14 16:26:25,"Barack Obama's former chief of staff said the White House has a ""for sale"" sign on its front lawn as Donald Trump plans to accept a luxury jet from Qatar.",34,8,Politics,Politics
HuffPost,2025-05-14 16:15:29,A Saab being towed swerved back and forth between various freeway lanes on Houston's I-610 loop.,6,1,Traffic News,Infrastructure
HuffPost,2025-05-14 15:53:18,"The entire basis for Trump invoking the Alien Enemies Act is probably false, according to an assessment from the National Intelligence Council.",91,34,Politics,Politics
HuffPost,2025-05-14 15:30:52,"The products in question were shipped out up until recently. The distributor recommends that further use of the products ""should immediately cease.""",8,3,Recall Alerts,Recall Alerts
HuffPost,2025-05-14 15:08:55,"One critic said Republican Sen. Mike Lee's bill's definition of “obscenity” is so broad that ""Game of Thrones"" would not be protected by the First Amendment.",33,15,Legislation,Legislation
HuffPost,2025-05-14 15:03:05,"More than two dozen activists, including many in wheelchairs, were arrested Tuesday while protesting the Republican bill.",46,21,Politics,Politics
HuffPost,2025-05-14 14:40:34,"Reality TV is headed back to the ball with a brand-new series from BET+.
www.huffpost.com/entry/2025-t...",0,1,Entertainment,Entertainment
HuffPost,2025-05-14 14:34:34,"""I don't think people should be taking medical advice from me,” said the health and human services secretary, whose job is to drive America’s health policy.",38,16,Health News,Health
HuffPost,2025-05-14 14:02:23,"The president's press conference on drug prices took a bizarre turn Monday when he began rambling about a ""highly neurotic"" friend trying to lose weight.",11,1,Politics,Politics
HuffPost,2025-05-14 13:57:12,The Oscar winner said a single comment from a cinematographer made her go under the knife.,0,0,Entertainment,Entertainment
HuffPost,2025-05-14 13:46:23,The nifty gadget saved reviewers “countless hours of vacuuming.”,0,0,Technology,Technology
HuffPost,2025-05-14 13:35:00,"""The good news is I have a drawer full of stationery from the last time around,"" a company CEO joked.",11,1,Business,Business & Economy
HuffPost,2025-05-14 13:22:53,"It's our 20th birthday! To celebrate, HuffPost staffers volunteered in cities across the country.",14,1,Lifestyle,Lifestyle
HuffPost,2025-05-14 13:17:19,The Beats Flex wireless earbuds securely hang around your neck so you'll never lose them — plus they're on sale right now.,3,0,Technology,Technology
HuffPost,2025-05-14 13:17:12,The billionaire acknowledged the upsides and risks of having machine helpers during a trip to Saudi Arabia alongside President Donald Trump.,4,0,Technology,Technology
HuffPost,2025-05-14 13:11:39,"Prosecutors’ star witness returned to the stand on Wednesday to continue her testimony in ex-partner Sean ""Diddy"" Combs' criminal trial.",8,1,Crime,Crime
HuffPost,2025-05-14 13:00:06,"Rep. Shri Thanedar, a Democrat from Michigan, swears he's acting on principle and not for the attention.",6,0,Politics,Politics
HuffPost,2025-05-14 12:48:00,"“I own Hokas, Nikes, ASICs, Skechers and I walk regularly. These shoes are the most comfortable of all of them.”",3,1,Lifestyle,Lifestyle
HuffPost,2025-05-14 12:30:46,"Social media has erupted over the first promo image for ""Madden,"" which stars Cage as the titular NFL commentator and Bale as former Raiders owner Al Davis.",4,1,Entertainment,Entertainment
HuffPost,2025-05-14 12:03:27,The Constitution forbids presidents from accepting gifts from foreign governments without congressional approval.,28,10,Government Ethics,Government Ethics
HuffPost,2025-05-14 11:48:30,"Alcohol use is linked to cognitive decline, and a recent study found that consuming a certain number of drinks each week increases the chance of brain injuries that can increase your risk of dementia. www.huffpost.com/entry/dement...",9,5,Health,Health
HuffPost,2025-05-14 11:47:26,"The Illinois governor, a potential Democratic presidential contender, weighed in after a bombshell new book renewed the party's election postmortem.",17,4,Politics,Politics
HuffPost,2025-05-14 11:36:44,"Good riddance. ""There was really no business justification to allow hidden fees that are mandatory...The only justification was that businesses made more money than they otherwise would make.” www.huffpost.com/entry/ftc-ne...",3,2,Business,Business & Economy
HuffPost,2025-05-14 11:08:28,"The CNN host told “Mr. Wonderful” the ""Constitution would like to have a word.""",22,8,Politics,Politics
HuffPost,2025-05-14 10:51:45,"The Tony nominee says portraying the iconic character, particularly as a Black woman, has been a “life-changing” experience.",9,4,Entertainment,Entertainment
HuffPost,2025-05-14 10:34:37,"The former transportation secretary took the stage Tuesday at a town hall in Cedar Rapids, Iowa.",20,2,Politics,Politics
HuffPost,2025-05-14 10:20:41,"Now leading HuffPost:

www.huffpost.com/entry/house-...",13,3,Politics,Politics
HuffPost,2025-05-14 10:16:03,"For details on how Middle East deal-making by Trump and Steve Witkoff on Syria, Iran & more relate to the American approach to Gaza's continued pain, read my  feature based on extensive conversations with US + regional sources: www.huffpost.com/entry/trump-...",8,3,Politics,Politics
HuffPost,2025-05-14 10:02:32,The Health and Human Services secretary shared photos of himself and his grandchildren swimming in a bacteria-laden body of water.,18,9,Health,Health
HuffPost,2025-05-14 10:02:31,“It's like having a mini chiropractor at home!”,0,0,Health & Wellness,Health
HuffPost,2025-05-14 09:51:38,It has the perfect amount of firmness and protects against allergens.,2,1,Health,Health
HuffPost,2025-05-14 09:29:27,The action film star made his comment after Shriver bared her soul about their divorce in a recent book.,1,1,Entertainment,Entertainment
HuffPost,2025-05-14 08:44:15,The president reportedly had one particular request for his personal Boeing 757 that has been dubbed Trump Force One.,7,0,Politics,Politics
HuffPost,2025-05-14 07:59:20,The wartime leader said he needs to convince Trump that the Russian president is not a trustworthy partner.,27,2,Politics,Politics
HuffPost,2025-05-14 07:32:23,Are you going 'recession blonde'? You're not alone.,8,2,Lifestyle,Lifestyle
HuffPost,2025-05-14 07:27:29,The Fox News host served the president talking points on Air Force One like a flight attendant serving coffee.,18,8,Politics,Politics
HuffPost,2025-05-14 07:10:36,"""She was the love of my life. We were together — willingly — for 36 years.""",8,2,Obituaries,Obituaries
HuffPost,2025-05-14 07:05:41,"From mini disposable toothbrushes to a travel cup holder, these items boast thousands of 5-star reviews.",0,0,Lifestyle,Lifestyle
HuffPost,2025-05-14 07:05:41,"""I will purchase these for the rest of my life,"" writes one reviewer.",0,0,Product Reviews,Product Reviews
HuffPost,2025-05-14 07:05:40,"A new study shows how it can lead to overeating, especially in obese people.",2,0,Health,Health
HuffPost,2025-05-14 07:05:37,Give your bedroom a mini spring makeover with one of this Amazon-famous bedding.,0,0,Home & Garden,Lifestyle
HuffPost,2025-05-14 07:05:35,Good riddance.,4,0,Opinion,Opinion
HuffPost,2025-05-14 07:05:35,"Find comfortable, everyday bras that look flattering and seamless underneath your favorite fitted tee.",0,0,Fashion,Arts & Culture
HuffPost,2025-05-14 07:05:34,Intergenerational travel is a chance to have unforgettable experiences with your whole family — but you just want to avoid these potential pitfalls.,1,1,Travel,Food & Lifestyle
HuffPost,2025-05-14 07:05:33,Dad definitely doesn’t need another tie — he needs a time machine.,1,0,Lifestyle,Lifestyle
HuffPost,2025-05-14 07:05:32,"Vivaia's sneakerinas have piqued the interest of women of all ages thanks to their playful, classic vibe and ultra-comfy construction.",0,0,Fashion,Arts & Culture
HuffPost,2025-05-14 07:05:32,"BoohooMan, Nordstrom, DXL and other places to get men's big and tall and plus-size clothes.",0,0,Fashion,Arts & Culture
HuffPost,2025-05-14 05:59:58,Conservatives lost it over a bilingual post from the House Republican Conference.,19,3,Politics,Politics
HuffPost,2025-05-14 04:49:49,The MSNBC anchor also pointed out a daming irony of the president's Qatari jet controversy.,24,6,Politics,Politics
HuffPost,2025-05-14 04:16:19,"Rep. Jim McGovern slammed Republicans for making Marie Antoinette ""look down to earth"" with a proposal to slash SNAP spending.",35,14,Politics,Politics
HuffPost,2025-05-14 03:36:19,Louis Prevost also revealed the big change he's made since his younger sibling was elected as the first U.S.-born pope.,5,1,Religion,Religion
HuffPost,2025-05-14 01:58:59,"The ""Late Show"" host knocked the White House press secretary's response to a ""surprisingly reasonable"" Trump question.",29,6,Entertainment,Entertainment
HuffPost,2025-05-14 00:51:18,"Jordan Klepper spotted exactly why the president regretted not taking a ""caffeine shot"" while visiting Saudi Arabia.",45,6,Politics,Politics
HuffPost,2025-05-13 22:57:58,"CNN's Kasie Hunt questioned the senator on seeing the former president ""up close and personal"" several months before he abandoned his reelection bid.",13,0,Politics,Politics
HuffPost,2025-05-13 21:04:13,"I'll be on @democracynow.org tomorrow morning to discuss Trump's Middle East trip.

Tune in ~8am ET for insider details on dynamics among the president, Steve Witkoff & regional officials + analysis on Syria, Iran, Gaza & more.

For a sense of my findings + analysis: www.huffpost.com/entry/trump-...",3,2,Politics,Politics
HuffPost,2025-05-13 19:21:48,"Major League Baseball's announcement that it was lifting the lifetime ban on Pete Rose and Shoeless Joe Jackson was a big hit for some, while others cried foul.",7,0,Sports,Sports
HuffPost,2025-05-13 19:04:51,Then came that question — the one that’s quietly echoed in the minds of many Americans for years.,36,10,Opinion,Opinion
