username,created_at,text,likes,reposts,section,merged_section
HuffPost,2025-05-08 12:56:07,The Israeli-born reality star has a connection to the Jan. 6 attack on the U.S. Capitol.,7,7,Politics,Politics
HuffPost,2025-05-08 12:45:22,"“It's easy to clean, perfect for travel and it's powerful.”",0,0,Lifestyle,Lifestyle
HuffPost,2025-05-08 12:34:44,"""This case was such a tragedy,"" said the Meigs County sheriff of 28-year-old Ohio woman Rosanna Kinsinger's death.",0,0,Local News,Local News
HuffPost,2025-05-08 12:23:00,"Now leading HuffPost:

www.huffpost.com/entry/new-po...",34,7,Politics,Politics
HuffPost,2025-05-08 12:17:49,"“We have somebody else that will be great,” Trump said of his pick for D.C.’s top attorney, who faced bipartisan opposition over his defense of Jan. 6 rioters.",7,3,Politics,Politics
HuffPost,2025-05-08 12:16:12,JUST IN: A new pope has been elected.,7,2,Religion,Religion
HuffPost,2025-05-08 12:12:01,"The new pontiff is expected to reveal himself soon now that the conclave, a top-secret vote by cardinals at the Vatican, has concluded.",18,5,Religion,Religion
HuffPost,2025-05-08 11:55:20,HuffPost talked to actor-writer-creator Paul W. Downs and other Hollywood experts about whether the network format is on its deathbed.,3,1,Entertainment,Entertainment
HuffPost,2025-05-08 11:55:19,We’d rather forget those dorky Team Jolie/Team Aniston shirts.,3,0,Entertainment,Entertainment
HuffPost,2025-05-08 11:44:07,"The facial cream, beloved by professional make-up artists, fights redness and irritation and doubles as a makeup primer.",0,0,Beauty,Lifestyle
HuffPost,2025-05-08 11:38:19,Experts explain why — and share how to stop the behavior.,3,0,Health,Health
HuffPost,2025-05-08 11:21:16,"“It cradled my body with softness …there is no wrong way to sleep with this. Sleep on your back, front or side — it all works!”",4,0,Lifestyle,Lifestyle
HuffPost,2025-05-08 11:21:15,No more pinching or ride-ups with these comfy panties.,1,0,Fashion,Arts & Culture
HuffPost,2025-05-08 11:10:10,"Iope's lifting, firming Bio-PDRN Caffeine Face Shot serum is beloved for a reason.",2,0,Beauty,Lifestyle
HuffPost,2025-05-08 10:44:06,"Some Trump officials are filling two, three, even four roles simultaneously. The personnel practice ""just makes no sense,"" says a White House expert.",27,12,Politics,Politics
HuffPost,2025-05-08 10:04:52,"Help them prepare for their first apartment, new job and next chapter with these gift ideas that are actually useful.",1,0,Lifestyle,Lifestyle
HuffPost,2025-05-08 10:04:51,The two first began seeing each other in April 2023.,1,0,Entertainment,Entertainment
HuffPost,2025-05-08 09:59:45,"Recent reports have revealed the administration was planning to send migrants to Libya, a nation plagued by conflict and human rights violations.",18,7,International News,World
HuffPost,2025-05-08 09:45:26,"New: Abortion bans are disproportionately hurting LGBTQ+ people.

“The attacks on gender-affirming care, the attacks on LGBT rights are about bodily autonomy in the same way that anti-choice efforts are attacks on our bodily autonomy,"" Caleb Smith, from @americanprogress.bsky.social told me.",234,92,Health,Health
HuffPost,2025-05-08 09:20:06,British comic Stewart Lee explained why “I wouldn’t work in the States at the moment.”,27,7,Entertainment,Entertainment
HuffPost,2025-05-08 09:03:20,Abortion restrictions are having an outsized impact on LGBTQ+ people — making it harder for them to access a wide range of care compared to non-LGBTQ+ people.,17,7,Health,Health
HuffPost,2025-05-08 08:46:47,"""I thought I was on the road to recovery,"" the actor said.",7,1,Entertainment,Entertainment
HuffPost,2025-05-08 08:23:16,"“By then, more than a decade had passed, and I had moved to a different country. But I didn’t hesitate.”",4,0,Personal Narrative,Personal Narrative
HuffPost,2025-05-08 08:13:13,"The California Democrat warned against abandoning NATO allies, noting the support its members previously offered the country at a critical moment.",23,2,Politics,Politics
HuffPost,2025-05-08 08:01:47,The newcomer plays a complicated teen swept into a love more tangled than he ever imagined in Mara Brock Akil’s Judy Blume adaptation.,2,1,Entertainment,Entertainment
HuffPost,2025-05-08 07:44:45,The chief justice also had a strong five-word response when asked about his retirement plans.,8,1,Judiciary,Crime
HuffPost,2025-05-08 07:07:14,"The ""Late Night"" comedian mocked the president with a new book idea.",13,1,Entertainment,Entertainment
HuffPost,2025-05-08 07:01:34,"You don't want to ""Fried Green Tomatoes"" a parking spot — or these eight other inconsiderate behaviors.",2,0,Lifestyle,Lifestyle
HuffPost,2025-05-08 07:01:33,"Not cleaning it at the suggested frequency can cause grease fires, air pollution and respiratory problems.",3,1,Health and Safety,Health
HuffPost,2025-05-08 07:01:32,These melts are the key to cleaner skin while I travel.,3,0,Health & Wellness,Health
HuffPost,2025-05-08 07:01:31,"Since ingredient labels aren’t always straightforward, it often falls on consumers to decode them. Here’s what to watch for and how to cut through the buzzwords.",0,0,Health & Wellness,Health
HuffPost,2025-05-08 07:01:30,"Beloved by everyone from farmers to fashion influencers, meet Carhartt’s classic pocket T-shirt.",0,0,Fashion,Arts & Culture
HuffPost,2025-05-08 07:01:29,"If your closet and drawers are overflowing, these hacks will help you de-clutter.",0,0,Lifestyle,Lifestyle
HuffPost,2025-05-08 07:01:26,Experts break down this potentially transformative concept.,1,0,Technology,Technology
HuffPost,2025-05-08 07:01:25,Being really honest about what I wanted (and didn't want) for Mother's Day made the day so much better for me.,0,0,Lifestyle,Lifestyle
HuffPost,2025-05-08 06:39:17,The former president's BBC interview generated a memorable facial expression and comment from the CNN host.,6,2,Entertainment,Entertainment
HuffPost,2025-05-08 05:46:42,The hit show has yielded a seriously impressive array of helpful gadgets and inventions.,3,0,Technology,Technology
HuffPost,2025-05-08 05:08:05,"FLOTUS “vanishes from view for weeks at a time,"" per The New York Times.",23,2,Politics,Politics
HuffPost,2025-05-08 04:45:45,Critics fired back at the conspiracy theorist lawmaker on social media.,20,8,Politics,Politics
HuffPost,2025-05-08 04:07:56,"University of Michigan's Justin Wolfers also warned why ""everything we buy is at risk.""",31,4,Economy,Business & Economy
HuffPost,2025-05-08 03:23:01,The late night host warns of what could happen by summer.,11,4,Entertainment,Entertainment
HuffPost,2025-05-08 03:01:18,"""For that trade we could have elected Democrats,"" argued the conservative newspaper's editorial board.",12,4,Politics,Politics
HuffPost,2025-05-08 02:50:02,"The Minnesota governor blasted the president over his ""ludicrous philosophy"" in justifying his tariffs.",92,25,Politics,Politics
HuffPost,2025-05-08 01:31:56,"The ""Late Show"" host said the president finally revealed the only thing he really wants.",27,3,Entertainment,Entertainment
HuffPost,2025-05-08 01:21:38,"Ryan Calkins issued a ""stark reminder"" about the potential fallout of the president's trade policy.",25,3,Politics,Politics
HuffPost,2025-05-07 23:56:15,"Now leading HuffPost:

www.huffpost.com/entry/john-f...",22,4,Politics,Politics
HuffPost,2025-05-07 23:22:51,"Desi Lydic said Scott Bessent made one thing ""very clear"" when he reassured children that they'll see ""economic freedom"" under Trump.",32,4,Politics,Politics
HuffPost,2025-05-07 21:53:32,Rep. Greg Casar revealed one reason why the congresswoman may be using her position to go after vulnerable people.,50,10,Politics,Politics
HuffPost,2025-05-07 20:37:00,"At a DOGE subcommittee hearing, the congresswoman mocked Republicans for not focusing on ""actual"" instances of ""waste, abuse and mismanagement"" in the federal government.",69,8,Politics,Politics
HuffPost,2025-05-07 19:42:03,"The ""Last of Us"" star said their emetophobia made them see “everything outside [as] a threat.”",7,0,Entertainment,Entertainment
HuffPost,2025-05-07 19:31:15,"In his first interview since leaving office, Joe Biden offered sharp criticism of President Donald Trump on foreign policy and international trade.",40,5,Politics,Politics
HuffPost,2025-05-07 19:14:08,"Now leading HuffPost:

www.huffpost.com/entry/trump-...",20,6,Politics,Politics
HuffPost,2025-05-07 19:09:09,Tony Dukoupil's on-air colleagues couldn't help but laugh at his surprising comment.,7,0,Entertainment,Entertainment
HuffPost,2025-05-07 19:03:18,"Rep. Randy Fine has a documented history of racist rhetoric, recently calling Rep. Rashida Tlaib a terrorist and endorsing the starvation campaign in Gaza.",28,8,Politics,Politics
HuffPost,2025-05-07 18:36:08,Mark Carney had a clear response to Trump's rhetoric about Canada becoming the 51st state. But body language experts say both leaders' nonverbal cues revealed a lot.,33,4,Politics,Politics
HuffPost,2025-05-07 18:16:10,"“As humans, we want to be seen and recognized by others. We care about what other people think about us,” said Sven Nyholm, a prof of the ethics of AI. “Other people have minds, whereas AI chatbots are mindless zombies”

My story today, on the limits of AI companions
www.huffpost.com/entry/mark-z...",41,13,Technology,Technology
HuffPost,2025-05-07 18:14:58,"“You obviously don't know my father at all,” the “These Boots Are Made for Walkin'” singer said.",66,10,Entertainment,Entertainment
HuffPost,2025-05-07 17:59:03,The two-time Oscar winner didn’t hold back on his fears for the future.,25,6,Entertainment,Entertainment
HuffPost,2025-05-07 17:59:03,"“We need some better data,” Dr. Marty Makary said Tuesday on approving booster shots before the winter season.",10,5,Health,Health
HuffPost,2025-05-07 17:59:00,The tech billionaire also suggested there may be untapped potential in AI girlfriends and therapists.,3,0,Technology,Technology
HuffPost,2025-05-07 17:47:00,"Kelly accused the event’s theme, which celebrated Black style, of being “leftist academic gobbledygook nonsensical talk.”",19,3,Culture,Arts & Culture
HuffPost,2025-05-07 17:41:33,"""The View"" host's visible disdain for Trump remains on full display.",21,2,Entertainment,Entertainment
HuffPost,2025-05-07 17:36:39,"Cameras are barred from the court, but the network wants to film a case of “profound national significance” as Trump attempts to end the guarantee.",50,18,Politics,Politics
HuffPost,2025-05-07 17:30:37,"“I understood what it was like to be hated,"" she said.",7,1,Opinion,Opinion
HuffPost,2025-05-07 17:30:34,Sen. Elizabeth Warren (D-Mass.) led Democrats in a letter demanding answers from Frank Bisignano.,14,6,Politics,Politics
HuffPost,2025-05-07 17:30:34,"""The biggest blessing I've ever had in my life, actually,"" the ""Used To Be Young"" singer shared.",8,2,Entertainment,Entertainment
HuffPost,2025-05-07 17:24:51,"Jackson Collum Arnold, 25, said the alleged assault was meant to be a ""prank"" to ""lighten the mood,"" police reported.",4,0,Crime News,Crime
HuffPost,2025-05-07 17:14:10,"Lawyers say that Libya is ""notorious for its human rights violations, especially with respect to migrant residents.""",19,12,Human Rights,Social Issues
HuffPost,2025-05-07 17:13:19,"""Thank you guys so much,"" said Brad Arnold in an emotional video announcing the news. ""God loves you. We love you. See you.""",12,1,Entertainment,Entertainment
HuffPost,2025-05-07 17:02:14,"""This nightmare is over,"" Clayton Echard reacted to the charges.",1,0,Entertainment,Entertainment
HuffPost,2025-05-07 17:02:12,The retired NFL star says he'll “never forget” talking to his children with ex-wife Gisele Bündchen the day after last year's vulgar special aired.,4,0,Sports,Sports
HuffPost,2025-05-07 17:02:11,"The Riverside County Sheriff’s Office said there is ""nothing to indicate that this is anything more than a tragic accident.""",2,0,Local News,Local News
HuffPost,2025-05-07 16:52:05,During Monday’s event — the singer and actor’s first time attending fashion’s biggest night — she became the subject of digital outrage.,4,0,Entertainment,Entertainment
HuffPost,2025-05-07 16:03:30,"On Monday, fashion’s biggest night unfolded — and a white pantsuit was a popular outfit choice.",7,0,Fashion,Arts & Culture
HuffPost,2025-05-07 15:47:06,"The political satirist sang his heart out to call the whole administration ""Incompetent!""",14,3,Politics,Politics
HuffPost,2025-05-07 15:47:04,The absence of a major Republican figure will be the elephant in the room at the first lady’s upcoming White House event.,10,1,Politics,Politics
HuffPost,2025-05-07 15:30:12,"Great for anyone who types all day, deals with hand pain, or just loves a good massage.",1,0,Health,Health
HuffPost,2025-05-07 15:19:18,"Trump’s tariffs could spike prices and create a MAGA malaise, but the president says children should be happy with fewer dolls and pencils.",31,8,Economy,Business & Economy
HuffPost,2025-05-07 15:13:56,"""Still in my early years in an industry that already judged me by my race and gender, I was now in another box—one shaped by stigma, silence and misunderstanding.""",12,1,Social Issues,Social Issues
HuffPost,2025-05-07 15:07:57,No pope today. Check back tomorrow.,15,0,Religion,Religion
HuffPost,2025-05-07 14:29:26,"The “Accountant 2” star slammed the paparazzi, claiming they intentionally antagonize celebrities until they have a breakdown.",18,0,Entertainment,Entertainment
HuffPost,2025-05-07 14:02:28,The Justice Department and FBI are being urged by Sen. Dick Durbin (D-Ill.) to investigate the suspected acts of intimidation.,36,6,Politics,Politics
HuffPost,2025-05-07 14:02:27,Here’s the secret to grabbing a discounted Kindle today.,1,0,Deals,Deals
HuffPost,2025-05-07 13:45:57,"""Love On The Spectrum"" star Abbey Romeo will bring you to tears with her performance on ""The Kelly Clarkson Show.""",6,0,Entertainment,Entertainment
HuffPost,2025-05-07 13:40:53,"Bye-bye cold food, icky microwaves and time-sucking lines with co-workers.",3,0,Food,Food & Lifestyle
HuffPost,2025-05-07 13:40:51,"The three flags represent Juneteenth, LGBTQ residents and transgender residents.",30,5,Community News,Community News
HuffPost,2025-05-07 13:02:46,The conversation got off to a rocky start and only got worse from there.,8,0,Politics,Politics
HuffPost,2025-05-07 12:56:33,"New: Sen. Hawley intro'd a law to ban abortion pills by mail, citing an anti-abortion junk science report that has been making the rounds in conservative media.",25,22,Politics,Politics
HuffPost,2025-05-07 12:56:55,"It’s unlikely the bill will pass, but it sends a clear message that Republicans are unafraid to use misinformation to ramp up attacks on abortion.",23,15,Politics,Politics
HuffPost,2025-05-07 12:50:52,"""I never owed anyone that truth,"" the singer said after sharing her devastating experience.",5,0,Entertainment,Entertainment
HuffPost,2025-05-07 12:50:49,"""He always shows up when I least expect it ― and I really should expect it by now.""",2,0,Lifestyle,Lifestyle
HuffPost,2025-05-07 12:40:22,"“Nothing but comfort when I walk,” wrote a happy buyer.",1,0,Lifestyle,Lifestyle
HuffPost,2025-05-07 12:34:37,An authoritative analysis by Congressional Budget Office is House Speaker Mike Johnson's latest headache.,15,7,Politics,Politics
HuffPost,2025-05-07 12:23:57,The actor has pleaded not guilty to the charges.,4,2,Crime,Crime
HuffPost,2025-05-07 11:33:01,This “little ball of power” is a beautiful solution to controlling cord clutter.,4,0,Technology,Technology
HuffPost,2025-05-07 11:30:16,"Type C is the personality that tends to be overlooked and doesn’t get as much attention as Type A and B on social media, but there are a whole swath of people who will surely relate to these traits. www.huffpost.com/entry/signs-...",6,3,Lifestyle,Lifestyle
HuffPost,2025-05-07 11:04:34,"Daniel Dale said the president did “better than usual,” and told only two enormous lies about America’s trade relationship with Canada.",28,7,Politics,Politics
HuffPost,2025-05-07 10:51:46,"Now leading HuffPost:

www.huffpost.com/entry/us-may...",3,3,Politics,Politics
HuffPost,2025-05-07 10:38:11,"Now leading HuffPost:

www.huffpost.com/entry/vatica...",13,2,Religion,Religion
HuffPost,2025-05-07 10:15:16,The former talk show host did the most country thing at home on the British countryside.,0,1,Entertainment,Entertainment
HuffPost,2025-05-07 08:05:42,Elizabeth Warren on the prospect of Congress helping crypto in the midst of Trump's crypto self-enrichment schemes:,147,31,Politics,Politics
HuffPost,2025-05-07 08:37:40,"“At 38, I’m feeling real joy for the first time. Not a high or a buzz, but something lasting.""",15,0,Lifestyle,Lifestyle
HuffPost,2025-05-07 08:15:12,The former president’s interview with the BBC took a surprising turn when he looked back at the election.,16,2,Politics,Politics
HuffPost,2025-05-07 07:47:08,"Wait, Jessica Biel and Chris Evans were a thing?",5,1,Entertainment,Entertainment
HuffPost,2025-05-07 07:30:41,"""It's a big post. You better do well, Andrew,"" Trump told the 2022 New York gubernatorial candidate.",3,4,Politics,Politics
HuffPost,2025-05-07 07:03:36,"If you didn’t understand it before, you will now.",15,9,Opinion,Opinion
HuffPost,2025-05-07 07:03:36,Doctors share the possibilities and limitations of using semaglutide as treatment for substance use disorder.,4,0,Health,Health
HuffPost,2025-05-07 07:03:35,The cost of rising prices may be landing heaviest on primary caregivers' shoulders.,9,1,Health,Health
HuffPost,2025-05-07 07:03:33,"""It's one of my favorite moisturizers in the entire world,"" one dermatologist told us of this moisturizing cream for the body and face.",0,0,Beauty,Lifestyle
HuffPost,2025-05-07 07:03:33,"Goodbye stuffy winter bedding, hello breezy and affordable summer blankets.",0,0,Lifestyle,Lifestyle
HuffPost,2025-05-07 07:03:31,"“I work construction and am very very hard on wristwatches,” wrote one reviewer. “This watch is worth every penny.”",1,0,Product Reviews,Product Reviews
HuffPost,2025-05-07 07:03:30,"Just like the ones you use on the kitchen sink, these filters can remove “minerals and chemicals [that] can potentially dry or irritate hair and skin,” said a dermatologist.",0,1,Health,Health
HuffPost,2025-05-07 07:03:29,"You are probably familiar with ""Type A"" and ""Type B"" — but this personality type tends to fly under the radar.",3,2,Psychology,Psychology
HuffPost,2025-05-07 07:03:28,"""Is this medicine? Is this candy? Is this a laundry pod? Is this a really yummy dessert?""",0,0,Health,Health
HuffPost,2025-05-07 06:46:16,"“I’ve been in this business a really long time and nobody does that unless they’re a coward,"" fumed the NewsNation anchor.",9,3,Media,Entertainment
HuffPost,2025-05-07 06:23:28,"One media outlet cited the ""uncanny resemblance"" of this Fox News figure to the conservative channel's prominent host.",5,0,Media News,Entertainment
HuffPost,2025-05-07 05:55:57,Donald Trump’s longtime adviser meant one thing but critics joked about him meaning something completely different.,27,5,Politics,Politics
HuffPost,2025-05-07 05:50:34,"Shop items like fresh home decor, stylish clothing, and the new line of viral Stanley tumblers.",1,0,Lifestyle,Lifestyle
HuffPost,2025-05-07 05:50:33,Your tech-obsessed dad can get a real kick out of these gifts.,0,1,Lifestyle,Lifestyle
HuffPost,2025-05-07 05:16:50,"The MSNBC host shows how the Canadian prime minister told off Trump ""to his face.""",34,6,Politics,Politics
HuffPost,2025-05-07 05:06:06,"The former president slammed one Trump moment as ""beneath America"" and accused him of “modern day appeasement” over Russia and Ukraine.",31,6,Politics,Politics
HuffPost,2025-05-07 04:05:46,The late night host sounded the alarm about the president after Mark Carney's visit to the White House.,21,6,Politics,Politics
HuffPost,2025-05-07 03:54:41,Canada's prime minister was asked what was going through his mind during the meeting with Donald Trump.,15,5,Politics,Politics
HuffPost,2025-05-07 03:26:10,"""Is that right?"" the president asked.",13,4,Politics,Politics
HuffPost,2025-05-07 03:09:21,"Peter Navarro tore apart Trump's former vice president after he shared his vision of the ""American Dream.""",9,3,Politics,Politics
HuffPost,2025-05-07 02:32:31,"The ""Late Show"" host mocked the president for the place he seemed to get his latest idea from.",31,3,Entertainment,Entertainment
HuffPost,2025-05-07 01:42:47,"The New York Times journalist described the exact headline that Trump ""wants to see"" after meeting with Canadian Prime Minister Mark Carney.",14,3,Politics,Politics
HuffPost,2025-05-07 00:47:42,The disgraced TV preacher says he's out of money and wants his viewers to pony up to save his ministry and his home.,27,5,Religion,Religion
HuffPost,2025-05-07 00:36:56,"Desi Lydic joked that the Canadian prime minister ""friend-zoned"" the president in the Oval Office.",59,4,Entertainment,Entertainment
HuffPost,2025-05-06 22:09:22,"Harry Enten said the president's proposal for the former prison reflects an issue that sees one of his ""best"" polling returns.",12,1,Politics,Politics
HuffPost,2025-05-06 21:36:59,Pete Muntean said the Federal Aviation Administration needs to respond amid delays that have plagued air travel for over a week.,23,2,Transportation,Infrastructure
HuffPost,2025-05-06 20:09:00,"Now leading HuffPost:

www.huffpost.com/entry/ap-as-...",31,7,News,General News
HuffPost,2025-05-06 20:07:57,"The ""View"" panelists discussed a range of hot topics, including Trump’s recent remark about the U.S. Constitution.",27,5,Politics,Politics
HuffPost,2025-05-06 19:56:57,"“STOPPP. I know she was fuming when she found out,”a fan said of the Vogue editor-in-chief, who is known for her perfectionism.",6,0,Entertainment,Entertainment
HuffPost,2025-05-06 19:27:07,"The vice president warned people attending the five-week tournament next year not to overstay their welcome, or there would be consequences.",37,16,Sports,Sports
HuffPost,2025-05-06 19:16:15,Some social media users argued that she “didn’t need to show her groin” to pull off the look.,2,0,Entertainment,Entertainment
HuffPost,2025-05-06 19:06:20,The president shrugged off backlash to an artificial intelligence-generated image that depicted him as the pope. One expert in religious studies weighs in.,20,6,Politics,Politics
HuffPost,2025-05-06 18:37:39,"""Their crowns stood out most to me.""",14,0,Fashion,Arts & Culture
HuffPost,2025-05-06 18:15:21,"""This is a policy that would legitimize corruption,” Sen. Elizabeth Warren (D-Mass.) warned on Tuesday.",55,17,Politics,Politics
HuffPost,2025-05-06 17:57:45,"Columbia University student Mohsen Mahdawi, who was detained for 16 days, said he will not stop speaking out against Israel and the Trump administration.",66,6,Politics,Politics
HuffPost,2025-05-06 17:51:40,"""Pam will come after you, and you will have a big problem.""",32,8,Crime,Crime
HuffPost,2025-05-06 17:49:21,"According to Wired, the password included the word ""shraddha.""",145,47,Cybersecurity,Technology
HuffPost,2025-05-06 17:45:47,"During a meeting with Canada's prime minister, the president claimed his predecessor ""didn’t use good, hard, tough, mean construction workers.""",19,4,Politics,Politics
HuffPost,2025-05-06 17:40:54,"Sky announced it will be bringing the iconic late night sketch comedy show to the U.K. in 2026, replacing the famous opener with “Live from London, it’s Saturday Night!""",19,1,Entertainment,Entertainment
HuffPost,2025-05-06 17:04:53,It would be the end of a long fascination he’s had with energy efficient appliances.,17,8,Home & Garden,Lifestyle
HuffPost,2025-05-06 17:00:09,A second federal judge has ruled that it was not appropriate for Trump to use the Alien Enemies Act of 1798 to summarily deport more than 200 immigrants without due process.,66,21,Legal News,Crime
HuffPost,2025-05-06 16:52:28,"NEW -- President Keyboard Warrior wasn't so brave when talking to the Canadian PM face-to-face.

Long and short of it is this: Canada elected a former central banker with a doctorate in economics. We elected a reality game show host who bankrupted casinos.
www.huffpost.com/entry/trump-...",127,30,Politics,Politics
HuffPost,2025-05-06 16:50:05,But the president continued pushing his profound misunderstanding of how international trade works in his continued defense of high tariffs.,37,7,Economy,Business & Economy
HuffPost,2025-05-06 16:33:22,"Both actors got the memo for Monday’s night's theme, ""Superfine: Tailoring Black Style.""",9,0,Entertainment,Entertainment
HuffPost,2025-05-06 16:28:33,"""I am mixed-up but I am not bad or broken,"" she wrote in an excerpt from her new book, according to People.",5,0,Entertainment,Entertainment
HuffPost,2025-05-06 16:12:26,"The Oscar-winning director also argued that his ""Malcolm X"" biopic could not be made in today’s political climate.",49,9,Entertainment,Entertainment
HuffPost,2025-05-06 16:07:20,Reviewers call it a “magical eye hugger” for relaxation that can even play music.,1,0,Lifestyle,Lifestyle
HuffPost,2025-05-06 16:01:38,"Tabloids attempted to negatively sensationalize a video of Kardashian getting visibly annoyed at the Met Gala, but social media users called BS.",1,0,Entertainment,Entertainment
HuffPost,2025-05-06 16:01:38,"The clock is ticking, and your chance to save and ship in time is slipping away.",0,0,Business,Business & Economy
HuffPost,2025-05-06 15:26:17,"“Even then he seemed like a caricature of a rich, pushy New Yorker with diabolical taste,” Keith McNally said.",36,11,Entertainment,Entertainment
