username,created_at,text,likes,reposts,urls,expanded_urls,section,merged_section,subsection
NBC News,2025-06-23 10:20:12,"Taking up a new religious rights case, the Supreme Court agrees to weigh a claim for damages brought by a devout Rastafarian whose dreadlocks were cut by Louisiana prison officials against his wishes.",45,7,['https://nbcnews.to/44dUBLM'],['https://www.nbcnews.com/politics/supreme-court/supreme-court-takes-religious-claim-rastafarian-whose-dreadlocks-cut-p-rcna212718?link_source=ta_bluesky_link&taid=6859629bbd022a000147b807&utm_campaign=trueanthem&utm_medium=social&utm_source=bluesky'],Legal News,Crime,
NBC News,2025-06-23 10:00:20,"U.S. benchmark oil prices were only marginally higher Monday morning, an outcome that reflects investors shifting into wait-and-see mode as they take stock of Iran’s response to U.S. strikes on its nuclear facilities.",22,7,['https://nbcnews.to/3G87Qps'],['https://www.nbcnews.com/business/markets/oil-prices-after-us-strikes-iran-world-awaits-response-rcna214453?link_source=ta_bluesky_link&taid=68595df2bd022a000147b7cf&utm_campaign=trueanthem&utm_medium=social&utm_source=bluesky'],Energy,Climate & Environment,
NBC News,2025-06-23 09:41:56,"Mahmoud Khalil, who was held for several months in a detention center in Louisiana after being detained by ICE, spoke to supporters.",91,26,[],[],Immigration,World,
NBC News,2025-06-23 09:20:12,Marine Corps veteran Adrian Clouatre doesn't know how to tell his children where their mother went after ICE officers detained her last month.,128,72,['https://nbcnews.to/3FOviIk'],['https://www.nbcnews.com/news/us-news/ice-detains-marine-corp-veterans-wife-was-still-breastfeeding-3-month-rcna214446?link_source=ta_bluesky_link&taid=6859548bbd022a000147b776&utm_campaign=trueanthem&utm_medium=social&utm_source=bluesky'],Immigration,World,
NBC News,2025-06-23 06:13:49,"🌡️ Dangerous heat: Monday’s high temperature is set to hit 100°, with high humidity and little relief. Storm Team4 lays out what to expect – and how to stay safe.",16,7,['https://www.nbcwashington.com/weather/current_forecast_dc/91018/'],['https://www.nbcwashington.com/weather/current_forecast_dc/91018/'],Weather,Weather,
NBC News,2025-06-23 08:18:48,"American citizens in Qatar should “shelter in place” until further notice, the country's U.S. Embassy says.

This is issued ""out of an abundance of caution.""",35,18,['https://nbcnews.to/4kTyy48'],['https://www.nbcnews.com/world/middle-east/live-blog/live-updates-iran-top-diplomat-meets-putin-us-braces-retaliation-rcna214428/rcrd83285?canonicalCard=true'],Breaking News,Breaking News,
NBC News,2025-06-23 07:42:07,LATEST: Israeli troops continue military operations in Gaza as it carries out more attacks on Iran.,24,7,['https://nbcnews.to/3T4mjWk'],['https://www.nbcnews.com/world/middle-east/live-blog/live-updates-iran-top-diplomat-meets-putin-us-braces-retaliation-rcna214428?canonicalCard=true'],World News,World,
NBC News,2025-06-23 07:40:13,Neither Pixar nor zombies were enough to topple 'How to Train Your Dragon' from the No. 1 slot at North American box offices over the weekend. ,25,4,['https://nbcnews.to/4lhRUjc'],['https://www.nbcnews.com/pop-culture/pop-culture-news/-train-dragon-tops-us-box-office-elio-marks-new-low-pixar-rcna214434?link_source=ta_bluesky_link&taid=68593d1cbd022a000147b688&utm_campaign=trueanthem&utm_medium=social&utm_source=bluesky'],Entertainment,Entertainment,
NBC News,2025-06-23 07:09:42,"The Israeli military is “attacking regime targets and government repression bodies in the heart of Tehran with unprecedented force,” the Israeli defense minister says.

The targets include the Evin prison for political prisoners and opponents of the regime. ",23,9,['https://nbcnews.to/3T4mjWk'],['https://www.nbcnews.com/world/middle-east/live-blog/live-updates-iran-top-diplomat-meets-putin-us-braces-retaliation-rcna214428?canonicalCard=true'],International News,World,
NBC News,2025-06-23 07:06:40,"An extremely dangerous heat wave is predicted to hit the Midwest and the East Coast on Monday and Tuesday, with the National Weather Service warning that triple-digit heat is expected.",14,11,['https://nbcnews.to/3HRbYdY'],['https://www.nbcnews.com/weather/heat/heat-wave-safety-tips-rcna214263?link_source=ta_bluesky_link&taid=6859353fbd022a000147b65c&utm_campaign=trueanthem&utm_medium=social&utm_source=bluesky'],Weather,Weather,
NBC News,2025-06-23 07:05:10,A settlement in a Massachusetts lawsuit that accused a crisis pregnancy center of endangering a woman’s life may be prompting changes within the faith-based nonprofits.,19,14,['https://nbcnews.to/3FQ6NKR'],['https://www.nbcnews.com/health/womens-health/crisis-pregnancy-centers-prenatal-ultrasound-ectopic-pregnancy-rcna214171?link_source=ta_bluesky_link&taid=685934e5bd022a000147b658&utm_campaign=trueanthem&utm_medium=social&utm_source=bluesky'],Health,Health,
NBC News,2025-06-23 07:04:10,A man was shot dead by a security guard on Sunday after he opened fire outside a Michigan church during a service has been identified as a 31-year-old who attended the church with his mother.,21,6,['https://nbcnews.to/448Q1yn'],['https://www.nbcnews.com/news/us-news/police-identify-michigan-church-shooting-suspect-local-man-attended-mo-rcna214440?link_source=ta_bluesky_link&taid=685934a9bd022a000147b657&utm_campaign=trueanthem&utm_medium=social&utm_source=bluesky'],Crime,Crime,
NBC News,2025-06-23 06:48:14,"Closing the Strait of Hormuz, where 20% of the world’s oil passes through, would hurt Iran’s own exports and antagonize oil-producing neighbors in the Gulf.",38,15,['https://nbcnews.to/3HTxSx4'],['https://www.nbcnews.com/world/middle-east/irans-parliament-backs-blocking-strait-hormuz-closure-will-alienate-te-rcna214443?link_source=ta_bluesky_link&taid=685930edbd022a000147b62d&utm_campaign=trueanthem&utm_medium=social&utm_source=bluesky'],Geopolitics,Geopolitics,
NBC News,2025-06-23 06:39:10,"Mahmoud Khalil, recently released from immigration custody, on Sunday described the conditions of his detention and decried the ""hypocrisy"" of Columbia University, where he is a graduate student.",49,7,['https://nbcnews.to/44rRP6Z'],['https://www.nbcnews.com/news/us-news/mahmoud-khalil-describes-ice-detention-decries-columbia-hypocrisy-rcna214412?link_source=ta_bluesky_link&taid=68592ecdbd022a000147b624&utm_campaign=trueanthem&utm_medium=social&utm_source=bluesky'],News,General News,
NBC News,2025-06-23 05:37:10,"President Trump’s decision to order strikes in Iran is the latest example of a U.S. president’s taking military action without first seeking congressional approval. 

And experts say that, while his power over American armed forces isn’t absolute, there’s most likely little lawmakers will do.",36,7,['https://nbcnews.to/40jQcFY'],['https://www.nbcnews.com/politics/white-house/presidents-ordering-military-action-congress-approval-become-routine-rcna214379?link_source=ta_bluesky_link&taid=68592045bd022a000147b5b5&utm_campaign=trueanthem&utm_medium=social&utm_source=bluesky'],Politics,Politics,Trump Administration
NBC News,2025-06-23 05:05:25,"A suicide bomber in Syria opened fire then detonated an explosive vest inside a Greek Orthodox church filled with people praying on Sunday, killing at least 22 and wounding 63 others, state media reports. ",21,9,['https://nbcnews.to/4eggVJw'],['https://www.nbcnews.com/world/middle-east/suicide-bomber-kills-least-22-greek-orthodox-church-syria-rcna214432?link_source=ta_bluesky_link&taid=685918d5bd022a000147b58e&utm_campaign=trueanthem&utm_medium=social&utm_source=bluesky'],World News,World,
NBC News,2025-06-23 04:50:12,"Actor Lynn Hamilton, who was best known for her characters in sitcom 'Sanford and Son' and historical drama 'The Waltons,' has died. She was 95.",65,11,['https://nbcnews.to/4lknL30'],['https://www.nbcnews.com/news/us-news/lynn-hamilton-sanford-son-waltons-actor-dies-95-rcna214435?link_source=ta_bluesky_link&taid=68591543bd022a000147b564&utm_campaign=trueanthem&utm_medium=social&utm_source=bluesky'],Obituaries,Obituaries,
NBC News,2025-06-23 04:45:11,"Two key advisers to President Trump are launching a group to unseat Rep. Thomas Massie, a Kentucky Republican with a pattern of opposing Trump who most recently lambasted his decision Saturday to strike three Iranian nuclear facilities.",26,10,['https://nbcnews.to/448Im35'],['https://www.nbcnews.com/politics/donald-trump/trump-thomas-massie-criticism-us-strikes-iran-kentucky-maga-rcna214387?link_source=ta_bluesky_link&taid=68591415bd022a000147b560&utm_campaign=trueanthem&utm_medium=social&utm_source=bluesky'],Politics,Politics,Trump Administration
NBC News,2025-06-23 04:35:10,"The government on Sunday appealed a federal judge's order to release of Kilmar Abrego Garcia pending trial on human smuggling charges, another chapter in the saga of the Maryland father who had been erroneously deported to El Salvador.",29,8,['https://nbcnews.to/40iUBcd'],['https://www.nbcnews.com/news/us-news/government-files-appeal-kilmar-abrego-garcia-ordered-released-judge-rcna214405?link_source=ta_bluesky_link&taid=685911bdbd022a000147b558&utm_campaign=trueanthem&utm_medium=social&utm_source=bluesky'],Crime,Crime,
NBC News,2025-06-23 04:23:41,Indiana Pacers guard Tyrese Haliburton left Game 7 of the NBA Finals in the first quarter with a right leg injury.,12,1,['https://nbcnews.to/44lFTTk'],['https://www.nbcnews.com/sports/nba/tyrese-haliburton-injury-game-7-rcna214415?link_source=ta_bluesky_link&taid=68590f0dbd022a000147b544&utm_campaign=trueanthem&utm_medium=social&utm_source=bluesky'],Sports,Sports,
NBC News,2025-06-23 04:19:03,Tens of millions of people across the Midwest and East endured dangerously hot temperatures again on Sunday as a rare June heat wave that gripped much of the U.S. was expected to last into the coming week.,19,7,['https://nbcnews.to/40iU9e1'],['https://www.nbcnews.com/weather/heat/eastern-half-us-sweltering-dangerous-heat-wave-expected-last-midweek-rcna214385?link_source=ta_bluesky_link&taid=68590df6bd022a000147b540&utm_campaign=trueanthem&utm_medium=social&utm_source=bluesky'],Weather,Weather,
NBC News,2025-06-22 23:07:46,Follow live updates and real-time coverage of NBA Finals game 7 as the Thunder and Pacers face off for the championship. Tyrese Haliburton was hurt in the first quarter.,20,2,['https://nbcnews.to/45vyJ0T'],['https://www.nbcnews.com/sports/nba/live-blog/nba-finals-game-7-thunder-pacers-live-updates-rcna214091?link_source=ta_bluesky_link&taid=6858c501bd022a000147b3a6&utm_campaign=trueanthem&utm_medium=social&utm_source=bluesky'],Sports,Sports,
NBC News,2025-06-22 20:53:46,Indiana Pacers guard Tyrese Haliburton leaves Game 7 of the NBA Finals in the first quarter with an apparent right leg injury.,32,2,['https://www.nbcnews.com/sports/nba/tyrese-haliburton-injury-game-7-rcna214415'],['https://www.nbcnews.com/sports/nba/tyrese-haliburton-injury-game-7-rcna214415'],Sports,Sports,
NBC News,2025-06-22 19:00:19,"Oil prices jump and stock futures slip, indicating concern among investors about the possibility of economic fallout from the ongoing unrest in the Middle East.",86,32,['https://nbcnews.to/4kTNoI8'],['https://www.nbcnews.com/business/markets/oil-prices-jump-us-strike-iranian-nuclear-facilities-rcna214388?link_source=ta_bluesky_link&taid=68588b02bd022a000147b202&utm_campaign=trueanthem&utm_medium=social&utm_source=bluesky'],Finance,Business & Economy,
NBC News,2025-06-22 18:00:20,"The Phoenix Suns are trading Kevin Durant to the Houston Rockets, according to multiple reports.",25,4,['https://nbcnews.to/44sTOYL'],['https://www.nbcnews.com/sports/nba/houston-rockets-kevin-durant-phoenix-suns-rcna213253?link_source=ta_bluesky_link&taid=68587cf3bd022a000147b194&utm_campaign=trueanthem&utm_medium=social&utm_source=bluesky'],Sports,Sports,
NBC News,2025-06-21 01:02:44,"They're 35 years late. I say good on her.

www.nbcnews.com/pop-culture/...",17,5,['https://www.nbcnews.com/pop-culture/pop-culture-news/bassist-carol-kaye-says-s-declining-rock-hall-fame-induction-permanent-rcna214235'],['https://www.nbcnews.com/pop-culture/pop-culture-news/bassist-carol-kaye-says-s-declining-rock-hall-fame-induction-permanent-rcna214235'],Entertainment,Entertainment,
NBC News,2025-06-22 15:53:16,"Foreign intervention skeptic Vance is selling Trump's Iran attack as different to former Mid East conflicts because ""back then, we had dumb presidents.""

www.nbcnews.com/politics/jd-...",126,39,['https://www.nbcnews.com/politics/jd-vance/iran-vance-intervention-skeptic-role-salesman-rcna214345'],['https://www.nbcnews.com/politics/jd-vance/iran-vance-intervention-skeptic-role-salesman-rcna214345'],Politics,Politics,Foreign Policy
NBC News,2025-06-22 16:56:38,"I know there's a lot of news but you should make time for this big, big read from @pilarmelendez.bsky.social 

www.nbcnews.com/tech/interne...",3,2,['https://www.nbcnews.com/tech/internet/anti-porn-crusaders-winning-pornhub-age-verification-rcna210684'],['https://www.nbcnews.com/tech/internet/anti-porn-crusaders-winning-pornhub-age-verification-rcna210684'],Technology,Technology,
NBC News,2025-06-22 15:02:28,"An Afghan man who worked as a translator with the U.S. military has tried for years to get his family to the U.S., but the travel ban's carveout for those who worked with the U.S. government during the war doesn't apply to their families.",80,41,[],[],Immigration,World,
NBC News,2025-06-22 15:00:13,A Virginia woman has been arraigned in court in connection with a hit-and-run in the Hamptons that killed New York City-based luxury real estate agent and former Netflix star Sara Burack.,16,4,['https://nbcnews.to/45BXDMs'],['https://www.nbcnews.com/news/us-news/woman-arrested-netflix-fatal-hit-run-rcna214280?link_source=ta_bluesky_link&taid=685852bcbd022a000147b075&utm_campaign=trueanthem&utm_medium=social&utm_source=bluesky'],Local News,Local News,
NBC News,2025-06-22 14:00:23,"Former U.S. Rep. Blake Farenthold, who left Congress amid sexual harassment allegations, has died at age 63, his former political consultant says.  ",39,8,['https://nbcnews.to/46dOny2'],['https://www.nbcnews.com/politics/congress/former-us-rep-blake-farenthold-left-office-harassment-allegations-dies-rcna214299?link_source=ta_bluesky_link&taid=685844b4bd022a000147b006&utm_campaign=trueanthem&utm_medium=social&utm_source=bluesky'],Obituaries,Obituaries,
NBC News,2025-06-22 13:00:29,"A longtime Minnesota lobbyist has been charged after allegedly making violent threats “with the purpose to terrorize another” person, according to court documents.",39,11,['https://nbcnews.to/3ZKBurn'],['https://www.nbcnews.com/news/us-news/minnesota-lobbyist-arrested-allegedly-sending-threatening-texts-rcna214283?link_source=ta_bluesky_link&taid=685836acbd022a000147afa5&utm_campaign=trueanthem&utm_medium=social&utm_source=bluesky'],Crime,Crime,
NBC News,2025-06-22 12:00:17,The MAGA movement's top influencers were divided over bombing Iran until President Trump did just that Saturday night.,30,15,['https://nbcnews.to/4n4A6tE'],['https://www.nbcnews.com/politics/donald-trump/maga-influencers-fall-line-trump-airstrikes-hit-iran-rcna214314?link_source=ta_bluesky_link&taid=68582890bd022a000147af1c&utm_campaign=trueanthem&utm_medium=social&utm_source=bluesky'],Politics,Politics,Foreign Policy
NBC News,2025-06-22 11:00:23,"Dozens of people suffer minor injuries when a yacht carrying 352 passengers crashed into a pier on the Hudson River in New York City, authorities say.",28,5,['https://nbcnews.to/3HSSgyz'],['https://www.nbcnews.com/news/us-news/yacht-crashes-hudson-river-harbor-injuring-dozens-rcna214300?link_source=ta_bluesky_link&taid=68581a86bd022a000147aec6&utm_campaign=trueanthem&utm_medium=social&utm_source=bluesky'],Breaking News,Breaking News,
NBC News,2025-06-22 10:52:10,"The U.S. is bracing for Iran’s response after President Trump launched strikes on Iranian nuclear energy sites overnight, plunging the region into an unprecedented new phase of a decades-old conflict.",47,16,['https://nbcnews.to/4kVjEdT'],['https://www.nbcnews.com/world/iran/iran-trump-nuclear-israel-bombing-what-next-rcna214328?link_source=ta_bluesky_link&taid=68581899bd022a000147aeb0&utm_campaign=trueanthem&utm_medium=social&utm_source=bluesky'],International News,World,
NBC News,2025-06-22 10:00:21,"New York’s 2025 municipal races feature a scandal-laden cast whose alleged or proven misdeeds have made front-page headlines for years. 

And they include the front-runner heading into the Democratic mayoral primary.",36,8,['https://nbcnews.to/3T3ty0D'],['https://www.nbcnews.com/politics/elections/cast-scandal-plagued-candidates-tests-limits-new-york-city-voters-will-rcna210911?link_source=ta_bluesky_link&taid=68580c73bd022a000147ae65&utm_campaign=trueanthem&utm_medium=social&utm_source=bluesky'],Politics,Politics,Elections
NBC News,2025-06-22 09:38:08,"“We’re not at war with Iran. We’re at war with Iran’s nuclear program,” VP @jd-vance-1.bsky.social says on Meet The Press. www.nbcnews.com/meet-the-pre...",60,10,['https://www.nbcnews.com/meet-the-press/video/vice-pres-vance-says-us-has-substantially-delayed-iran-s-nuclear-weapon-program-full-interview-242050117543'],['https://www.nbcnews.com/meet-the-press/video/vice-pres-vance-says-us-has-substantially-delayed-iran-s-nuclear-weapon-program-full-interview-242050117543'],Politics,Politics,Foreign Policy
NBC News,2025-06-22 09:20:35,"VP Vance: “We’re not at war with Iran. We’re at war with Iran’s nuclear program.”

@kristenwelker.bsky.social's newsy interview with the VP this AM on @meetthepress.com 👇👇

www.nbcnews.com/politics/tru...",9,2,['https://www.nbcnews.com/politics/trump-administration/vance-says-us-not-war-iran-re-war-irans-nuclear-program-rcna214329'],['https://www.nbcnews.com/politics/trump-administration/vance-says-us-not-war-iran-re-war-irans-nuclear-program-rcna214329'],Politics,Politics,Foreign Policy
NBC News,2025-06-22 09:09:21,"JUST IN: VP Vance tells NBC News that the U.S. is ""not at war with Iran, we’re at war with Iran’s nuclear program.""",85,19,['https://nbcnews.to/3HTBfEw'],['https://www.nbcnews.com/politics/trump-administration/vance-says-us-not-war-iran-re-war-irans-nuclear-program-rcna214329?link_source=ta_bluesky_link&taid=68580081bd022a000147ae1a&utm_campaign=trueanthem&utm_medium=social&utm_source=bluesky'],International News,World,
NBC News,2025-06-22 09:00:13,"In the wake of Robert F. Kennedy Jr.'s decision to shake-up a key federal vaccine advisory committee, outside organizations and independent experts are looking for alternate sources of unbiased information and even considering forming their own.",102,30,['https://nbcnews.to/468w4ue'],['https://www.nbcnews.com/health/health-news/groups-organize-form-unbiased-independent-vaccine-panel-rcna212468?link_source=ta_bluesky_link&taid=6857fe5bbd022a000147adf4&utm_campaign=trueanthem&utm_medium=social&utm_source=bluesky'],Health,Health,
NBC News,2025-06-22 08:00:29,"Indianapolis is home to 30,000 Burmese who face tariffs hitting their businesses that sell goods from Myanmar and a travel ban on visits from loved ones facing a civil war at home.",44,10,['https://nbcnews.to/3TxWZYW'],['https://www.nbcnews.com/news/asian-america/indianapolis-largest-us-burmese-population-tariffs-travel-ban-hit-hard-rcna213803?link_source=ta_bluesky_link&taid=6857f05dbd022a000147adac&utm_campaign=trueanthem&utm_medium=social&utm_source=bluesky'],International News,World,
NBC News,2025-06-22 00:17:27,"From support for a return to diplomacy to outright condemnation, the reaction to the U.S. strikes on Iran from Latin American leaders is less enthusiastic than what has been seen from Trump's domestic allies tonight.
www.nbcnews.com/world/middle...",14,2,['https://www.nbcnews.com/world/middle-east/live-blog/israel-iran-conflict-rcna214241/rcrd82987?canonicalCard=true'],['https://www.nbcnews.com/world/middle-east/live-blog/israel-iran-conflict-rcna214241/rcrd82987?canonicalCard=true'],International News,World,
NBC News,2025-06-22 07:09:16,"LIVE UPDATES: President Trump claims success on U.S. strikes on Iran, Iranian retaliatory strikes hit Tel Aviv. ",61,20,['https://nbcnews.to/4l0sLdq'],['https://www.nbcnews.com/world/middle-east/live-blog/live-updates-iran-israel-trump-rcna214325?link_source=ta_bluesky_link&taid=6857e45cbd022a000147ad5e&utm_campaign=trueanthem&utm_medium=social&utm_source=bluesky'],Breaking News,Breaking News,
NBC News,2025-06-22 07:00:11,"States are implementing online age verification laws, and some politicians are pursuing aggressive bans on explicit content like porn.",21,1,['https://nbcnews.to/3HSDtnk'],['https://www.nbcnews.com/tech/internet/anti-porn-crusaders-winning-pornhub-age-verification-rcna210684?link_source=ta_bluesky_link&taid=6857e239bd022a000147ad3a&utm_campaign=trueanthem&utm_medium=social&utm_source=bluesky'],Legislation,Legislation,
NBC News,2025-06-21 23:04:10,Several members of Congress in both parties question the legality of President Trump’s move to launch military strikes on Iran.,274,93,['https://nbcnews.to/3HR2Mq4'],['https://www.nbcnews.com/politics/congress/lawmakers-both-parties-question-legality-trumps-iran-strikes-rcna214316?link_source=ta_bluesky_link&taid=685772a9bd022a000147ab7e&utm_campaign=trueanthem&utm_medium=social&utm_source=bluesky'],Politics,Politics,Foreign Policy
NBC News,2025-06-21 22:51:01,"NEW: Some lawmakers in both parties question the legality of Trump's Iran strikes

Multiple Republicans and Democrats raised constitutional concerns about Trump acting without approval by Congress.

But GOP leaders offered support for his move.

www.nbcnews.com/politics/con...",746,147,['https://www.nbcnews.com/politics/congress/lawmakers-both-parties-question-legality-trumps-iran-strikes-rcna214316'],['https://www.nbcnews.com/politics/congress/lawmakers-both-parties-question-legality-trumps-iran-strikes-rcna214316'],Politics,Politics,Foreign Policy
NBC News,2025-06-21 21:02:43,"The U.S. bombed multiple nuclear sites in Iran, President Trump said.

The airstrikes are the first time the United States has conducted a direct military attack on Iran, and they further escalated a military conflict between Iran and Israel that began on June 13.

Read more: nbcnews.to/4kVAqcS",55,45,['https://nbcnews.to/4kVAqcS'],['https://www.nbcnews.com/politics/national-security/us-strikes-iranian-nuclear-site-trump-says-rcna213781'],World News,World,
NBC News,2025-06-21 20:44:04,A reminder that Trump’s “big beautiful bill” contains $150 billion in new military spending. This doesn’t get as much attention because there’s no dispute over it — Republicans not named Massie or Paul are all supporting it.,191,58,[],[],Politics,Politics,Trump Administration
NBC News,2025-06-21 20:48:21,Live coverage: www.nbcnews.com/world/middle...,9,5,['https://www.nbcnews.com/world/middle-east/live-blog/israel-iran-conflict-rcna214241'],['https://www.nbcnews.com/world/middle-east/live-blog/israel-iran-conflict-rcna214241'],World News,World,
NBC News,2025-06-21 20:45:15,"BREAKING: U.S. conducted strikes on multiple nuclear sites in Iran, President Trump announces in a social media post. ",142,81,['https://nbcnews.to/4lf72Oe'],['https://www.nbcnews.com/politics/national-security/us-strikes-iranian-nuclear-site-trump-says-rcna213781?link_source=ta_bluesky_link&taid=6857521abd022a000147aaaa&utm_campaign=trueanthem&utm_medium=social&utm_source=bluesky'],World News,World,
NBC News,2025-06-21 20:42:56,"The United States bombed multiple nuclear sites in Iran, President Donald Trump announced in a social media post. nbcnews.app.link/5tE99ktroUb",54,22,['https://nbcnews.app.link/5tE99ktroUb'],['https://nbcnews.app.link/5tE99ktroUb'],World News,World,
NBC News,2025-06-21 19:00:26,"The pilot of a small plane that crashed near a North Carolina airport this month had raised a wheel after landing to avoid hitting a turtle on the runway, according to a NTSB preliminary report.",40,9,['https://nbcnews.to/465Meo4'],['https://www.nbcnews.com/news/us-news/pilot-killed-north-carolina-crash-was-trying-avoid-hitting-turtle-runw-rcna214225?link_source=ta_bluesky_link&taid=68573989bd022a000147aa21&utm_campaign=trueanthem&utm_medium=social&utm_source=bluesky'],Aviation News,Infrastructure,
NBC News,2025-06-21 18:02:05,Latino Trump voters shared their views on President Trump's decision to deploy the National Guard and Marines in Los Angeles amid the protests surrounding immigration. Interviews were filmed before an appeals court ruled that Trump is within his rights to deploy the California National Guard.,34,13,[],[],Politics,Politics,Immigration
NBC News,2025-06-21 17:00:43,"A scandal over allegations of plagiarism is rocking the book community on TikTok, becoming the latest drama to unfold in a pocket of the internet.",20,2,['https://nbcnews.to/463W0aj'],['https://www.nbcnews.com/pop-culture/pop-culture-news/booktok-rocked-recent-scandals-rcna213832?link_source=ta_bluesky_link&taid=68571d7bbd022a000147a993&utm_campaign=trueanthem&utm_medium=social&utm_source=bluesky'],Entertainment,Entertainment,
NBC News,2025-06-21 16:01:05,Former President Barack Obama warns that U.S. democracy is “dangerously close” to sliding into autocracy.,362,108,[],[],Politics,Politics,Democracy
NBC News,2025-06-21 15:00:43,"A Wisconsin boyfriend and girlfriend who have been charged with attempted murder are accused of trying to poison two women the man previously dated after he met them online, authorities say.",29,12,['https://nbcnews.to/467YrJ0'],['https://www.nbcnews.com/news/us-news/wisconsin-pair-charged-alleged-plot-stalk-poison-kill-dating-app-liais-rcna214160?link_source=ta_bluesky_link&taid=6857015abd022a0001006a8c&utm_campaign=trueanthem&utm_medium=social&utm_source=bluesky'],Crime,Crime,
