username,created_at,text,likes,reposts,urls,expanded_urls,section,merged_section,subsection
NBC News,2025-06-14 10:22:08,Israel's latest action pits traditional Republican support for Israel — and antipathy toward Iran — against the MAGA base's fear that the U.S. will be drawn into a new foreign war.,40,11,['https://nbcnews.to/3ZYGrwQ'],['https://www.nbcnews.com/politics/donald-trump/israel-iran-conflict-splits-maga-leaving-trump-navigate-rcna212786?link_source=ta_bluesky_link&taid=684d858f64f5a20001b69d9d&utm_campaign=trueanthem&utm_medium=social&utm_source=bluesky'],Politics,Politics,Foreign Policy
NBC News,2025-06-14 08:01:05,Amazon founder and billionaire Jeff Bezos is set to marry in a lavish celebration in Venice as some residents protest his presence by hanging anti-Bezos banners.,308,72,[],[],Entertainment,Entertainment,
NBC News,2025-06-14 00:13:03,"Oklahoma City outscored Indiana by 14 points in the fourth quarter to win Game 4 and even the best-of-seven series, 2-2",30,2,['https://nbcnews.to/3TsxGaw'],['https://www.nbcnews.com/sports/nba/thunder-pacers-game-4-nba-finals-result-rcna213023?link_source=ta_bluesky_link&taid=684cf6ce64f5a20001b69a8e&utm_campaign=trueanthem&utm_medium=social&utm_source=bluesky'],Sports,Sports,
NBC News,2025-06-13 22:02:49,ICE's recent tactics of taking undocumented immigrants into custody in public spaces that don't require warrants have fueled protests for more than a week. NBC News' David Noriega spoke with a teenager whose father's arrest was seen in a viral video.,188,72,[],[],Immigration,World,
NBC News,2025-06-13 21:02:29,"The U.S. is assisting in shooting down Iranian missiles and projectiles targeting Israel, according to three U.S. officials.",65,39,[],[],International News,World,
NBC News,2025-06-13 19:18:23,"Coral Gables, Florida, known for its multi-million dollar homes, isn’t where you’d expect groups of undocumented migrants to be arriving. NBC News' Jesse Kirsch breaks down the reasons why it might have become a hot spot for human smuggling operations.",46,17,[],[],Immigration,World,
NBC News,2025-06-13 18:00:13,"UPF clothing adds a layer of defense against UV rays, but not all options protect adequately, dermatologists tell @nbcselect.nbcnews.com.",7,3,['https://nbcnews.to/3FTtyNP'],['https://www.nbcnews.com/select/shopping/best-upf-clothing-rcna212695?link_source=ta_bluesky_link&taid=684c9f6b64f5a200016362b0&utm_campaign=trueanthem&utm_medium=social&utm_source=bluesky'],Health,Health,
NBC News,2025-06-13 16:52:50,"NEW: The burning of five Waymo cars is now a federal investigation, as ATF says it's sending in a national team of investigators to Los Angeles: www.nbcnews.com/news/us-news...",112,30,['https://www.nbcnews.com/news/us-news/live-blog/ice-protests-live-updates-weekend-rallies-planned-nationwide-rcna212809/rcrd82063?canonicalCard=true'],['https://www.nbcnews.com/news/us-news/live-blog/ice-protests-live-updates-weekend-rallies-planned-nationwide-rcna212809/rcrd82063?canonicalCard=true'],Crime,Crime,
NBC News,2025-06-13 17:30:12,"Before writing “Materialists,” Celine Song spent 6 months as a matchmaker, and now, she’s turning those lessons into a story about modern romance.",12,1,['https://nbcnews.to/4jP1M2K'],['https://www.nbcnews.com/pop-culture/movies/celine-songs-secret-making-heartbreaking-rom-coms-personal-life-rcna212904?link_source=ta_bluesky_link&taid=684c986464f5a2000163626d&utm_campaign=trueanthem&utm_medium=social&utm_source=bluesky'],Arts & Entertainment,Arts & Entertainment,
NBC News,2025-06-13 17:15:03,Mel Brooks will reprise his “Spaceballs” role as Yogurt in the upcoming sequel to the hit 1987 “Star Wars” spoof that will be released in theaters.,98,11,['https://nbcnews.to/43FYslY'],['https://www.nbcnews.com/pop-culture/movies/mel-brooks-announces-spaceballs-sequel-video-rcna212873?link_source=ta_bluesky_link&taid=684c94d664f5a2000163623b&utm_campaign=trueanthem&utm_medium=social&utm_source=bluesky'],Entertainment,Entertainment,
NBC News,2025-06-13 17:01:22,Missouri Sen. Josh Hawley questions 23andMe interim CEO over the sale of users’ genetic information.,59,17,[],[],Health,Health,
NBC News,2025-06-13 16:30:51,"As Iran launched retaliatory missiles into Israel, NBC News' foreign correspondent Matt Bradley received an ""extreme alert"" during a live broadcast.",53,16,[],[],International News,World,
NBC News,2025-06-13 16:00:59,"Israel launched strikes on Iranian nuclear facilities early Friday local time, a dramatic escalation of long-running tensions between the two countries.",29,14,[],[],World News,World,
NBC News,2025-06-13 15:55:01,"After missing the last five games due to an injury, Indiana Fever star Caitlin Clark is expected to be in the lineup when the Fever face the reigning WNBA champion, New York Liberty, on Saturday afternoon.",32,2,['https://nbcnews.to/3Tbxywl'],['https://www.nbcnews.com/sports/wnba/caitlin-clark-return-indiana-fever-rcna212963?link_source=ta_bluesky_link&taid=684c821564f5a20001636140&utm_campaign=trueanthem&utm_medium=social&utm_source=bluesky'],Sports,Sports,
NBC News,2025-06-13 15:45:55,"Following Israel's strikes on Iran, President Trump told NBC News' Garrett Haake that Iran ""missed the opportunity to make a deal. Now they may have another opportunity."" NBC News' Monica Alba shares more about their phone call.",14,9,[],[],International News,World,
NBC News,2025-06-13 15:14:47,Air raid sirens blare across Israel as the Iron Dome intercepts missile strikes from Iran — a retaliatory response to Israel’s overnight attack on Iranian nuclear facilities.,28,12,[],[],World News,World,
NBC News,2025-06-13 15:01:37,"Ye, the controversial rapper formerly known as Kanye West, made a surprise courthouse appearance. He told reporters he was in attendance to show his support for Sean “Diddy” Combs. NBC News' Chloe Melas reports from outside the courthouse.",11,3,[],[],Entertainment News,Entertainment,
NBC News,2025-06-13 14:45:04,"Kilmar Abrego Garcia, the Maryland resident who was erroneously sent to a prison in El Salvador and returned to the U.S. last week, pleads not guilty to human smuggling charges.",58,7,['https://nbcnews.to/4jV3ekl'],['https://www.nbcnews.com/news/us-news/kilmar-abrego-garcia-pleads-not-guilty-human-smuggling-charges-rcna212679?link_source=ta_bluesky_link&taid=684c71af64f5a20001636056&utm_campaign=trueanthem&utm_medium=social&utm_source=bluesky'],Crime News,Crime,
NBC News,2025-06-13 14:33:27,"BREAKING: Iran has launched missiles into Israel, according to the Israel Defense Forces.",46,24,['https://nbcnews.to/4mWPEzL'],['https://www.nbcnews.com/world/iran/live-blog/israel-strikes-iran-middle-east-conflict-live-updates-rcna212727?link_source=ta_bluesky_link&taid=684c6ef664f5a20001636037&utm_campaign=trueanthem&utm_medium=social&utm_source=bluesky'],World News,World,
NBC News,2025-06-13 14:01:16,U.S. officials quickly worked to distance the United States from Israel’s overnight airstrikes in Iran. NBC News’ Courtney Kube explains what the Trump administration is most concerned about.,28,11,[],[],International News,World,
NBC News,2025-06-13 13:48:40,"British soccer legend David Beckham has received a knighthood from King Charles III for services to sport and charity, Buckingham Palace announces.",43,3,['https://nbcnews.to/4n1Jmie'],['https://www.nbcnews.com/world/united-kingdom/david-beckham-receives-knighthood-king-charles-birthday-honors-list-se-rcna211386?link_source=ta_bluesky_link&taid=684c647764f5a20001635f97&utm_campaign=trueanthem&utm_medium=social&utm_source=bluesky'],Sports,Sports,
NBC News,2025-06-13 13:15:03,"The four people were unaccounted for Thursday night, and federal authorities were looking into whether they were still on the grounds of the facility, or had somehow escaped.",60,16,['https://nbcnews.to/4kPpkpF'],['https://www.nbcnews.com/news/us-news/four-detainees-newark-ice-facility-are-missing-senior-officials-say-rcna212893?link_source=ta_bluesky_link&taid=684c5c9664f5a20001635f44&utm_campaign=trueanthem&utm_medium=social&utm_source=bluesky'],Breaking News,Breaking News,
NBC News,2025-06-13 13:01:32,"As protests against immigration raids continue across the country, Brevard County Sheriff Wayne Ivey had strong words for possible violent protesters, saying ""we will kill you graveyard dead.""",99,75,[],[],Crime,Crime,
NBC News,2025-06-13 12:32:23,Sen. Alex Padilla reacts to being forcibly removed from DHS Sec. Kristi Noem’s briefing in Los Angeles in an interview with NBC News’ Jacob Soboroff.,82,23,[],[],Politics,Politics,Politician
NBC News,2025-06-13 12:15:03,"UPDATE: A federal appeals court rules the Trump administration can continue to deploy National Guard troops in Los Angeles, pausing a lower court ruling that had temporarily halted the deployment.",17,5,['https://nbcnews.to/4n07NN1'],['https://www.nbcnews.com/news/us-news/live-blog/ice-protests-live-updates-weekend-rallies-planned-nationwide-rcna212809?link_source=ta_bluesky_link&taid=684c4e8664f5a20001635e9c&utm_campaign=trueanthem&utm_medium=social&utm_source=bluesky'],Politics,Politics,Trump Administration
NBC News,2025-06-13 11:43:22,"The sole survivor of the Air India plane crash says he climbed out of a broken emergency exit after the aircraft hit a medical college hostel in the city of Ahmedabad, killing more than 240 people.",81,27,[],[],Breaking News,Breaking News,
NBC News,2025-06-13 11:31:13,Members of the Congressional Hispanic Caucus marched from the House floor to Senate Leader Thune and House Speaker Johnson’s offices after Sen. Alex Padilla was forcefully removed from a DHS news conference in Los Angeles. ,164,45,[],[],Politics,Politics,Immigration
NBC News,2025-06-13 11:00:11,A new study finds that patients hospitalized for Covid were less likely to suffer severe kidney damage if they were vaccinated.,159,75,['https://nbcnews.to/4kxGpnU'],['https://www.nbcnews.com/health/health-news/covid-kidneys-damage-vaccine-protect-study-rcna212667?link_source=ta_bluesky_link&taid=684c3cfa64f5a20001635dcb&utm_campaign=trueanthem&utm_medium=social&utm_source=bluesky'],Health,Health,
NBC News,2025-06-13 10:45:03,The survivor of the Air India flight 171 crash on Thursday reveals he miraculously survived by escaping through a broken emergency exit.,51,7,['https://nbcnews.to/45QZDjS'],['https://www.nbcnews.com/world/asia/lone-surviving-passenger-air-india-plane-crash-escape-rcna212813?link_source=ta_bluesky_link&taid=684c396e64f5a20001635da4&utm_campaign=trueanthem&utm_medium=social&utm_source=bluesky'],Breaking News,Breaking News,
NBC News,2025-06-13 10:30:06,The owner of a nightclub in the Dominican Republic whose roof collapsed in April and killed 236 people has been arrested along with his sister.,16,0,['https://nbcnews.to/4kK0M1i'],['https://www.nbcnews.com/news/latino/dominican-republic-authorities-arrest-owner-collapsed-dominican-republ-rcna212817?link_source=ta_bluesky_link&taid=684c35ed64f5a20001635d84&utm_campaign=trueanthem&utm_medium=social&utm_source=bluesky'],Breaking News,Breaking News,
NBC News,2025-06-13 09:50:48,We connected with over 90 LGBTQ+ owned brands and confirmed their ownership status.,13,7,['https://nbcnews.to/4e3ZxHF'],['https://www.nbcnews.com/select/shopping/lgbtq-owned-business-ncna1272731?link_source=ta_bluesky_link&taid=684c2cb864f5a20001635d21&utm_campaign=trueanthem&utm_medium=social&utm_source=bluesky'],Business,Business & Economy,
NBC News,2025-06-13 09:06:09,NBC News’ Keir Simmons shares what we know about Israel’s massive attack on Iran that struck nuclear sites and killed senior Iranian scientists and top military officials.,27,14,[],[],World News,World,
NBC News,2025-06-13 09:00:10,"President Trump is set to host a major military parade in Washington on Saturday.

The event will feature thousands of soldiers, hundreds of vehicles, dozens of military aircraft, and is expected to cost tens of millions of dollars. ",15,9,['https://nbcnews.to/440QZgj'],['https://www.nbcnews.com/politics/trump-administration/trump-military-parade-dc-what-know-rcna211040?link_source=ta_bluesky_link&taid=684c20d864f5a20001635ca4&utm_campaign=trueanthem&utm_medium=social&utm_source=bluesky'],Military News,Defense & Security,
NBC News,2025-06-13 08:48:43,Analysis: The momentum comes after months of Democratic intraparty squabbling and an inability to find a coherent post-election message.,34,12,['https://nbcnews.to/406mILF'],['https://www.nbcnews.com/politics/trump-administration/democrats-make-mark-rowdy-pushback-trump-rcna212708?link_source=ta_bluesky_link&taid=684c1e2b64f5a20001635c86&utm_campaign=trueanthem&utm_medium=social&utm_source=bluesky'],Politics,Politics,Elections
NBC News,2025-06-13 04:35:01,"Iranian state media reports that the country's top military official, Mohammad Hossein Bagheri, has been killed in Israeli strikes along with Hossein Salami, the commander in chief of the Islamic Revolutionary Guards Corps. ",37,13,['https://nbcnews.to/4jYK9hm'],['https://www.nbcnews.com/world/iran/live-blog/israel-strikes-iran-middle-east-conflict-live-updates-rcna212727?canonicalCard=true'],World News,World,
NBC News,2025-06-13 04:17:47,BREAKING: Judge blocks President Trump from deploying National Guard troops in L.A. but puts order on temporary hold.,55,14,['https://nbcnews.to/3TksIwz'],['https://www.nbcnews.com/politics/trump-administration/judge-blocks-trump-administration-deploying-members-california-nationa-rcna212775?link_source=ta_bluesky_link&taid=684bdeaa64f5a20001635a92&utm_campaign=trueanthem&utm_medium=social&utm_source=bluesky'],Politics,Politics,Trump Administration
NBC News,2025-06-13 03:44:07,"Iran has launched more than 100 drones towards Israel, the Israeli military says, the first sign of retaliation to Israel’s strikes on Iran. ",40,25,['https://nbcnews.to/4jYK9hm'],['https://www.nbcnews.com/world/iran/live-blog/israel-strikes-iran-middle-east-conflict-live-updates-rcna212727?canonicalCard=true'],World News,World,
NBC News,2025-06-12 22:57:27,LATEST: Israeli airstrikes hit Iran's nuclear program. ,21,14,['https://nbcnews.to/4l1ab4b'],['https://www.nbcnews.com/world/iran/live-blog/israel-strikes-iran-middle-east-conflict-live-updates-rcna212727?link_source=ta_bluesky_link&taid=684b939664f5a20001635860&utm_campaign=trueanthem&utm_medium=social&utm_source=bluesky'],World News,World,
NBC News,2025-06-12 22:47:36,"Follow the latest news after Israel launched strikes at Iran, a dramatic escalation in long-running tensions between the two countries.",47,19,['https://nbcnews.to/4e6VGtE'],['https://www.nbcnews.com/world/iran/live-blog/israel-strikes-iran-middle-east-conflict-live-updates-rcna212727?link_source=ta_bluesky_link&taid=684b914864f5a20001635850&utm_campaign=trueanthem&utm_medium=social&utm_source=bluesky'],International News,World,
NBC News,2025-06-12 22:30:06,Sen. Alex Padilla disputed the White House’s account of the events surrounding his forcible removal from a news conference held by Homeland Security Secretary Kristi Noem in Los Angeles.,298,83,['https://nbcnews.to/4kETXhx'],['https://www.nbcnews.com/politics/congress/sen-alex-padilla-disputes-trump-administrations-account-incident-led-f-rcna212760?link_source=ta_bluesky_link&taid=684b8d2d64f5a20001635827&utm_campaign=trueanthem&utm_medium=social&utm_source=bluesky'],Politics,Politics,Biden Administration
NBC News,2025-06-12 22:09:36,Newsom had previously requested the administration return thousands of National Guard troops to his command.,168,30,['https://nbcnews.to/4l5sdCx'],['https://www.nbcnews.com/politics/trump-administration/judge-blocks-trump-administration-deploying-members-california-nationa-rcna212775?link_source=ta_bluesky_link&taid=684b885f64f5a20001635801&utm_campaign=trueanthem&utm_medium=social&utm_source=bluesky'],Politics,Politics,Biden Administration
NBC News,2025-06-12 20:55:48,"BREAKING: The Israeli military has begun airstrikes against Iran, two U.S. officials said Thursday evening, a dramatic escalation that increased the chances of an all-out war between the countries and expanding the long-running regional conflict.",57,29,['https://nbcnews.to/3HT6fnL'],['https://www.nbcnews.com/world/israel/israel-iran-strikes-rcna212729?link_source=ta_bluesky_link&taid=684b771364f5a20001635736&utm_campaign=trueanthem&utm_medium=social&utm_source=bluesky'],World News,World,
NBC News,2025-06-12 19:15:05,"Teeth whitening strips won't instantly erase years of discoloration, but over time, they'll make a difference. - @nbcselect.nbcnews.com",18,2,['https://nbcnews.to/4l9norX'],['https://www.nbcnews.com/select/shopping/best-teeth-whitening-strips-rcna201114?link_source=ta_bluesky_link&taid=684b5f7864f5a20001635628&utm_campaign=trueanthem&utm_medium=social&utm_source=bluesky'],Health,Health,
NBC News,2025-06-12 18:31:07,"Democratic Sens. Chuck Schumer, Cory Booker and Adam Schiff react to Sen. Alex Padilla being removed from DHS Secretary Kristi Noem’s press conference.",145,68,[],[],Politics,Politics,Biden Administration
NBC News,2025-06-12 17:46:01,"The body of a missing U.S. Navy sailor has been found, days after her friends say Seaman Angelina ‘Angie’ Petra Resendiz went missing. NCIS says a Navy sailor has been placed in pretrial confinement in connection to her death and charges are pending.",47,17,[],[],Crime News,Crime,
NBC News,2025-06-12 17:41:43,"A Trump voter who owns a small roofing company in Florida says ICE detained a third of his workers.

""You get to know these guys, you become their friends ... It's quite a shock."" 

@nbcmiami.com reports:  nbcnews.to/3Tm60Eh",234,93,['https://nbcnews.to/3Tm60Eh'],['https://www.nbcmiami.com/news/local/small-business-owner-says-ice-detained-a-third-of-his-employees/3634370/'],Immigration,World,
NBC News,2025-06-12 17:30:07,Canadian wildfire smoke triggers air quality alerts across the U.S. Midwest and Northeast.,29,8,['https://nbcnews.to/4l5dAiB'],['https://www.nbcnews.com/science/environment/smoke-canadian-wildfires-hits-air-quality-us-midwest-northeast-rcna212696?link_source=ta_bluesky_link&taid=684b46de64f5a200016354ea&utm_campaign=trueanthem&utm_medium=social&utm_source=bluesky'],Environment,Climate & Environment,
NBC News,2025-06-12 17:15:03,"Bacon prices have risen almost 20% since last year, and experts say these prices may not be coming down.",33,13,['https://nbcnews.to/3FT5Xge'],['https://www.nbcnews.com/data-graphics/bacon-prices-eggs-inflation-economy-grocery-cost-rcna212174?link_source=ta_bluesky_link&taid=684b435664f5a200016354c3&utm_campaign=trueanthem&utm_medium=social&utm_source=bluesky'],Economy,Business & Economy,
NBC News,2025-06-12 17:11:29,"LATEST: A plane carrying 242 people crashed near a major international airport in the western Indian city of Ahmedabad shortly after takeoff, killing all but one passenger, who was seen walking away from the crash with bruises on his arms. nbcnews.to/4l1k6qm",33,10,['https://nbcnews.to/4l1k6qm'],['https://www.nbcnews.com/world/asia/air-india-plane-ai171-crashes-ahmedabad-boeing-242-survivors-rcna212545'],Breaking News,Breaking News,
NBC News,2025-06-12 17:00:09,A cyberattack on a primary organic food distributor has led to empty shelves at Whole Foods stores across the country.,46,34,['https://nbcnews.to/4e5r23I'],['https://www.nbcnews.com/tech/security/whole-foods-sees-shortages-united-natural-foods-cyberattack-rcna212379?link_source=ta_bluesky_link&taid=684b3fd864f5a20001635484&utm_campaign=trueanthem&utm_medium=social&utm_source=bluesky'],Business,Business & Economy,
NBC News,2025-06-12 16:33:48,"NEW: The Republican-led House votes 214-212, passing a proposal from President Trump to cancel $9.4 billion in previously approved federal funding for foreign aid, NPR and PBS.",44,31,['https://nbcnews.to/3ZwfO2d'],['https://www.nbcnews.com/politics/congress/house-republicans-vote-claw-back-94-billion-funding-foreign-aid-npr-pb-rcna211740?link_source=ta_bluesky_link&taid=684b39ac64f5a2000163544e&utm_campaign=trueanthem&utm_medium=social&utm_source=bluesky'],Politics,Politics,Foreign Policy
NBC News,2025-06-12 16:30:05,"A Harvard scientist, who was arrested last month on a federal smuggling charge, is being released from ICE custody following a detention hearing in Boston.",74,25,['https://nbcnews.to/43WtAfN'],['https://www.nbcnews.com/news/us-news/harvard-researcher-released-ice-arrest-immigration-kseniia-petrova-rcna212678?link_source=ta_bluesky_link&taid=684b38cb64f5a20001635431&utm_campaign=trueanthem&utm_medium=social&utm_source=bluesky'],Crime,Crime,
NBC News,2025-06-12 16:04:30,"NEW: House Republicans vote to claw back $9.4 billion in funding for foreign aid, NPR and PBS

The vote is 214-212.

4 Rs + 208 Ds vote NO.

4 Ds + 2 Rs miss the vote.

Reminder: 3 safe blue seats are vacant after their Dem reps died.

This now goes to the Senate.

www.nbcnews.com/politics/con...",291,156,['https://www.nbcnews.com/politics/congress/house-republicans-vote-claw-back-94-billion-funding-foreign-aid-npr-pb-rcna211740'],['https://www.nbcnews.com/politics/congress/house-republicans-vote-claw-back-94-billion-funding-foreign-aid-npr-pb-rcna211740'],Politics,Politics,Foreign Policy
NBC News,2025-06-12 16:15:32,"President Donald Trump says he doesn’t “feel like a king” as a reporter asks about the upcoming “No Kings” protests planned to take place across the country on the same day as the military parade in Washington, D.C.",34,8,[],[],Politics,Politics,Trump Administration
NBC News,2025-06-12 16:00:18,"Protests against immigration raids in Los Angeles have triggered a flood of falsehoods and conspiracy theories online, and Russia has sought to exploit and amplify them, experts say.",85,50,['https://nbcnews.to/4e4aVn1'],['https://www.nbcnews.com/politics/national-security/russia-amplifying-conspiracy-theories-l-protests-rcna212652?link_source=ta_bluesky_link&taid=684b31d164f5a200016353da&utm_campaign=trueanthem&utm_medium=social&utm_source=bluesky'],Politics,Politics,Immigration
NBC News,2025-06-12 15:46:27,"Harvey Weinstein's retrial ended abruptly when the jury foreman refused to join the deliberations on the remaining rape charge. The New York state judge declared a mistrial, and prosecutors vowed to try Weinstein again on the charge the jury had been deadlocked on, NBC News' Chloe Melas reports.",21,6,[],[],Crime,Crime,
NBC News,2025-06-12 15:21:26,Sen. Alex Padilla was forcibly removed from a news conference in Los Angeles on Thursday and detained after trying to question Homeland Security Secretary Kristi Noem.,159,84,[],[],Politics,Politics,Biden Administration
NBC News,2025-06-12 15:15:08,"Rescue workers in India are searching for survivors after a plane carrying 242 people crashed shortly after takeoff into a building where medical students were sitting down to lunch in Ahmedabad, India.
nbcnews.to/3HF1Rcg 
",31,8,['https://nbcnews.to/3HF1Rcg'],['https://www.nbcnews.com/world/asia/air-india-plane-ai171-crashes-ahmedabad-boeing-242-survivors-rcna212545'],Breaking News,Breaking News,
NBC News,2025-06-12 14:35:14,"""Padilla's office shared a video of the incident with NBC News. The video shows Padilla being taken into a hallway outside and pushed face forward onto the ground as officers with FBI-identifying vests told the senator to put his hands behind his back.""

www.nbcnews.com/politics/con...",62,24,['https://www.nbcnews.com/politics/congress/sen-alex-padilla-forcibly-removed-dhs-sec-kristi-noems-press-conferenc-rcna212688'],['https://www.nbcnews.com/politics/congress/sen-alex-padilla-forcibly-removed-dhs-sec-kristi-noems-press-conferenc-rcna212688'],Politics,Politics,Crime
NBC News,2025-06-12 14:37:58,Senator Padilla’s office sends me this video of his take-down and detention at Sec. Noem’s press conference in L.A.,3322,1572,[],[],Politics,Politics,Politician
NBC News,2025-06-12 14:51:22,BREAKING: California Sen. Alex Padilla is forcibly removed from DHS Secretary Kristi Noem's press conference in Los Angeles.,85,39,['https://www.nbcnews.com/politics/congress/sen-alex-padilla-forcibly-removed-dhs-sec-kristi-noems-press-conferenc-rcna212688'],['https://www.nbcnews.com/politics/congress/sen-alex-padilla-forcibly-removed-dhs-sec-kristi-noems-press-conferenc-rcna212688'],Politics,Politics,Politician
NBC News,2025-06-12 14:15:04,President Trump signs three resolutions barring California from mandating electric vehicle sales and setting tailpipe emissions standards designed to galvanize the transition away from combustion engines.,36,20,['https://nbcnews.to/3FSM0pQ'],['https://www.nbcnews.com/politics/trump-administration/trump-signs-resolutions-blocking-californias-ev-rules-rcna212596?link_source=ta_bluesky_link&taid=684b192564f5a20001635293&utm_campaign=trueanthem&utm_medium=social&utm_source=bluesky'],Politics,Politics,Environment
NBC News,2025-06-12 14:11:01,"At least four people died and three went missing in San Antonio, Texas, after floodwaters swept 13 vehicles away early in the morning.",23,10,['https://nbcnews.to/3ZtL8i4'],['https://www.nbcnews.com/news/us-news/13-vehicles-swept-away-san-antonio-flooding-leaving-4-dead-3-missing-rcna212639?link_source=ta_bluesky_link&taid=684b183564f5a20001635292&utm_campaign=trueanthem&utm_medium=social&utm_source=bluesky'],Breaking News,Breaking News,
NBC News,2025-06-12 10:01:04,"The brand has pants, shirts and dresses in this go-to summer material marked way down.",1,1,['https://nbcnews.to/4jJHRSP'],['https://www.nbcnews.com/select/shopping/jcrew-linen-sale-44-happening-now-rcna212163?link_source=ta_bluesky_link&taid=684add9f64f5a20001634fe6&utm_campaign=trueanthem&utm_medium=social&utm_source=bluesky'],Fashion,Arts & Culture,
NBC News,2025-06-12 13:46:07,"Sen. Rand Paul said on Wednesday that he was ""uninvited"" to an annual White House picnic, though a day later President Trump posted on social media that “of course” Paul was invited.",55,11,[],[],Politics,Politics,Trump Administration
