username,created_at,text,likes,reposts,urls,expanded_urls,section,merged_section,subsection
NBC News,2025-06-07 14:00:20,“Love Island USA” contestant Yulissa Escobar has broken her silence about her sudden exit from the show.,10,1,['https://nbcnews.to/4jFn2rN'],['https://www.nbcnews.com/pop-culture/tv/love-island-yulissa-escobar-breaks-silence-rcna211629?link_source=ta_bluesky_link&taid=68447e34144f890001ee0d2b&utm_campaign=trueanthem&utm_medium=social&utm_source=bluesky'],Entertainment,Entertainment,
NBC News,2025-06-07 13:45:04,"The CDC and the FDA are investigating a multistate Salmonella outbreak linked to at least 1.7 million eggs, according to a news release.",85,54,['https://nbcnews.to/4kYzGmN'],['https://www.nbcnews.com/health/recall/cdc-fda-eggs-salmonella-recall-rcna211610?link_source=ta_bluesky_link&taid=68447a9f144f890001ee0d05&utm_campaign=trueanthem&utm_medium=social&utm_source=bluesky'],Health,Health,
NBC News,2025-06-07 13:30:06,"Simone Biles is going head-to-head with one of the most vocal opponents of transgender girls and women competing in female sports, former college swimmer Riley Gaines.",163,27,['https://nbcnews.to/43AmSNC'],['https://www.nbcnews.com/sports/gymnastics/simone-biles-riley-gaines-transgender-athletes-rcna211597?link_source=ta_bluesky_link&taid=6844771c144f890001ee0cf4&utm_campaign=trueanthem&utm_medium=social&utm_source=bluesky'],Sports,Sports,
NBC News,2025-06-07 12:45:04,The three women identified as victims in the federal case against Sean “Diddy” Combs took the stand to describe how his double-sided personality straddled the line between praiseworthy and predatory.,27,4,['https://nbcnews.to/443lPG6'],['https://www.nbcnews.com/news/us-news/diddys-accusers-testified-volatile-relationships-man-loved-feared-rcna210994?link_source=ta_bluesky_link&taid=68446c8f144f890001ee0ca0&utm_campaign=trueanthem&utm_medium=social&utm_source=bluesky'],Entertainment News,Entertainment,
NBC News,2025-06-07 12:30:06,Authorities have closed a wide swath of popular campgrounds and backpacking areas along the Pacific Crest Trail in Washington as they search for a former Army soldier wanted in the deaths of his three young daughters.,29,13,['https://nbcnews.to/3ZljF20'],['https://www.nbcnews.com/news/us-news/washington-girls-killed-father-travis-decker-rcna211616?link_source=ta_bluesky_link&taid=6844690c144f890001ee0c8b&utm_campaign=trueanthem&utm_medium=social&utm_source=bluesky'],Crime News,Crime,
NBC News,2025-06-07 12:15:08,"BREAKING: Coco Gauff defeated Aryna Sabalenka in a blockbuster French Open championship match, becoming the first American to win the tournament since Serena Williams held the trophy a decade ago.",112,14,['https://nbcnews.to/3ZmWp3E'],['https://www.nbcnews.com/sports/tennis/coco-gauff-wins-french-open-final-rcna211603?link_source=ta_bluesky_link&taid=6844658b144f890001ee0c78&utm_campaign=trueanthem&utm_medium=social&utm_source=bluesky'],Sports,Sports,
NBC News,2025-06-07 12:15:04,The Russia-backed Wagner Group says it's leaving Mali after more than three and a half years of fighting Islamic extremists and insurgents in the country.,29,14,['https://nbcnews.to/43Wiojp'],['https://www.nbcnews.com/world/africa/wagner-group-leaving-mali-heavy-losses-russia-africa-corps-remain-rcna211591?link_source=ta_bluesky_link&taid=68446588144f890001ee0c75&utm_campaign=trueanthem&utm_medium=social&utm_source=bluesky'],World News,World,
NBC News,2025-06-07 12:14:02,"BREAKING: Coco Gauff defeated Aryna Sabalenka in a blockbuster French Open championship match, becoming the first American to win the tournament since Serena Williams held the trophy a decade ago.",135,24,[],[],Sports,Sports,
NBC News,2025-06-07 12:00:26,"The biggest night in theater is back Sunday as fans gear up for the 78th annual Tony Awards, which gave nods to nearly three dozen Broadway shows.

Here’s what to know:",18,3,['https://nbcnews.to/3Fv0NXI'],['https://www.nbcnews.com/pop-culture/pop-culture-news/2025-tony-awards-watch-time-host-rcna211271?link_source=ta_bluesky_link&taid=68446219144f890001ee0c67&utm_campaign=trueanthem&utm_medium=social&utm_source=bluesky'],Entertainment,Entertainment,
NBC News,2025-06-07 11:45:04,"A top Taliban official says all Afghans who fled the country after the collapse of the former Western-backed government are free to return home, promising they would not be harmed if they come back.",19,7,['https://nbcnews.to/43OVmuv'],['https://www.nbcnews.com/world/afghanistan/top-taliban-official-offers-amnesty-afghans-fled-country-urges-return-rcna211593?link_source=ta_bluesky_link&taid=68445e7f144f890001ee0c42&utm_campaign=trueanthem&utm_medium=social&utm_source=bluesky'],International News,World,
NBC News,2025-06-07 11:30:06,"A convicted killer in Utah who developed dementia while on death row for 37 years is competent enough to be executed, a state judge rules.",18,3,['https://nbcnews.to/3FGSU1q'],['https://www.nbcnews.com/news/crime-courts/convicted-killer-dementia-competent-executed-rcna211598?link_source=ta_bluesky_link&taid=68445afd144f890001ee0c34&utm_campaign=trueanthem&utm_medium=social&utm_source=bluesky'],Crime,Crime,
NBC News,2025-06-07 11:15:05,"A 16-year-old from Port-au-Prince with heart disease is constantly short of breath and can't attend school.

The travel ban has upended plans for the lifesaving surgery she can't get in Haiti.",69,48,['https://nbcnews.to/3HoK5Ka'],['https://www.nbcnews.com/news/nbcblk/trumps-ban-stalls-surgeries-haitian-children-rcna211267?link_source=ta_bluesky_link&taid=68445778144f890001ee0c1f&utm_campaign=trueanthem&utm_medium=social&utm_source=bluesky'],Health,Health,
NBC News,2025-06-07 11:00:09,"From 2004 to 2024, there have been dramatic shifts in the nation’s politics along geographic, racial, educational and economic lines.

Here's a look at where the vote has shifted most in that time and the story the change tells:",25,7,['https://nbcnews.to/4kRTcRN'],['https://www.nbcnews.com/politics/elections/breaking-20-years-election-data-shows-two-parties-evolved-trump-era-rcna211197?link_source=ta_bluesky_link&taid=684453f7144f890001ee0bfa&utm_campaign=trueanthem&utm_medium=social&utm_source=bluesky'],Politics,Politics,Elections
NBC News,2025-06-07 10:45:05,"A large Russian drone-and-missile attack targeted Ukraine’s eastern city of Kharkiv on Saturday, killing at least three people and injuring 21, local Ukrainian officials say.",15,7,['https://nbcnews.to/4mMI5vv'],['https://www.nbcnews.com/world/ukraine/russian-drones-missiles-target-kharkiv-ukraine-rcna211584?link_source=ta_bluesky_link&taid=68445070144f890001ee0bed&utm_campaign=trueanthem&utm_medium=social&utm_source=bluesky'],World News,World,
NBC News,2025-06-07 10:30:05,The Department of Homeland Security is requesting that National Guard troops search for unaccompanied children in some cases and transport them between states.,23,18,['https://nbcnews.to/4kpTdww'],['https://www.nbcnews.com/politics/immigration/dhs-wants-national-guard-search-transport-unaccompanied-migrant-childr-rcna211484?link_source=ta_bluesky_link&taid=68444cec144f890001ee0bdd&utm_campaign=trueanthem&utm_medium=social&utm_source=bluesky'],Immigration,World,
NBC News,2025-06-06 22:47:08,"BREAKING: A federal judge signs off on arguably the biggest change in college sports, clearing the way for schools to begin paying their athletes as soon as next month.",83,24,['https://nbcnews.to/4kPJr6B'],['https://www.nbcnews.com/sports/college-sports/us-judge-approves-28-billion-settlement-paving-way-colleges-pay-athlet-rcna211577?link_source=ta_bluesky_link&taid=6843a82b144f890001ee0866&utm_campaign=trueanthem&utm_medium=social&utm_source=bluesky'],Sports,Sports,
NBC News,2025-06-06 21:15:04,"The National Park Service and U.S. Park Police close Dupont Circle Park, widely known as the heart of Washington’s LGBTQ neighborhood, ahead of the final weekend of WorldPride, an international Pride celebration being held in the nation’s capital this year.",63,34,['https://nbcnews.to/4kTY09i'],['https://www.nbcnews.com/nbc-out/out-news/national-park-service-closes-dupont-circle-park-worldpride-rcna211426?link_source=ta_bluesky_link&taid=68439297144f890001ee07c4&utm_campaign=trueanthem&utm_medium=social&utm_source=bluesky'],Local News,Local News,
NBC News,2025-06-06 18:15:04,"13 House Republicans who voted for President Donald Trump's ""big, beautiful bill"" send a letter urging Senate GOP leaders to scale back some of its clean energy cuts, sparking pushback from conservative hardliners.",68,25,['https://nbcnews.to/45MUnOb'],['https://www.nbcnews.com/politics/congress/13-house-republicans-urge-senate-scale-back-clean-energy-cuts-bill-vot-rcna211516?link_source=ta_bluesky_link&taid=68436868144f890001ee0628&utm_campaign=trueanthem&utm_medium=social&utm_source=bluesky'],Politics,Politics,Environment
NBC News,2025-06-06 18:00:27,"Los Angeles takes a huge step toward linking airplanes to trains, as the nation's fifth busiest hub joins the modern travel world and offers Southern Californians an off-ramp from traffic-clogged freeways.",57,14,['https://nbcnews.to/43Q8VKg'],['https://www.nbcnews.com/news/us-news/rail-los-angeles-international-airport-rcna211515?link_source=ta_bluesky_link&taid=684364fa144f890001ee0606&utm_campaign=trueanthem&utm_medium=social&utm_source=bluesky'],Transportation,Infrastructure,
NBC News,2025-06-06 17:45:14,The case of a 19-year-old Mexico-born college student in Georgia who ended up in a detention center following a mistaken traffic stop shows what millions of Dreamers are facing under President Trump's immigration crackdown.,43,18,['https://nbcnews.to/3HviczT'],['https://www.nbcnews.com/news/latino/dreamers-deportation-risks-georgia-college-student-rcna209802?link_source=ta_bluesky_link&taid=68436169144f890001ee05ce&utm_campaign=trueanthem&utm_medium=social&utm_source=bluesky'],Immigration,World,
NBC News,2025-06-06 17:30:14,Top-ranked Jannik Sinner beats Novak Djokovic to set up a French Open final against defending champion Carlos Alcaraz.,17,4,['https://nbcnews.to/3HKCci3'],['https://www.nbcnews.com/sports/tennis/french-open-jannik-sinner-novak-djokovic-rcna211534?link_source=ta_bluesky_link&taid=68435de6144f890001ee05a2&utm_campaign=trueanthem&utm_medium=social&utm_source=bluesky'],Sports,Sports,
NBC News,2025-06-06 17:23:45,"Tyrese Haliburton and the Indiana Pacers only led for 0.3 seconds of Game 1 of the NBA Finals — the last 0.3 seconds that is.

But this isn't the first time the Thunder have been there in these playoffs. ",12,2,['https://nbcnews.to/3HvEilU'],['https://www.nbcnews.com/sports/nba/thunder-pacers-nba-finals-pressure-rcna211444?link_source=ta_bluesky_link&taid=68435c61144f890001ee0590&utm_campaign=trueanthem&utm_medium=social&utm_source=bluesky'],Sports,Sports,
NBC News,2025-06-06 17:15:05,"HHS Sec. Robert F. Kennedy Jr. has begun to transform U.S. health policy: shrinking staff at health agencies, restructuring the focus of some regulators and researchers, changing Covid vaccine regulations and reshaping the mission of his department to focus more on alternative medicine.",39,24,['https://nbcnews.to/43Ig5lf'],['https://www.nbcnews.com/politics/trump-administration/rfk-jr-quickly-changing-us-health-agencies-rcna210505?link_source=ta_bluesky_link&taid=68435a59144f890001ee0576&utm_campaign=trueanthem&utm_medium=social&utm_source=bluesky'],Health Policy,Health,
NBC News,2025-06-06 16:48:58,"BREAKING: Supreme Court allows DOGE to access Social Security Administration records, including sensitive data.",96,75,['https://nbcnews.to/443ebvk'],['https://www.nbcnews.com/politics/supreme-court/supreme-court-trump-doge-social-security-data-access-elon-musk-rcna206515?link_source=ta_bluesky_link&taid=68435439144f890001ee051a&utm_campaign=trueanthem&utm_medium=social&utm_source=bluesky'],Technology,Technology,
NBC News,2025-06-06 16:45:04,"Former college athletes who were caught up in the data breach involving former University of Michigan coach Matt Weiss say they were told a coach may have hacked into their private photos. But they still don’t know much else, and now are demanding answers.",26,11,['https://nbcnews.to/4jBqGTu'],['https://www.nbcnews.com/news/us-news/former-college-athletes-coach-hacked-private-photo-rcna210869?link_source=ta_bluesky_link&taid=6843534f144f890001ee0511&utm_campaign=trueanthem&utm_medium=social&utm_source=bluesky'],Sports News,Sports,
NBC News,2025-06-06 16:30:16,"Four years ago, a chorus of New York Democrats called on then-Gov. Andrew Cuomo to resign amid sexual harassment allegations, saying he was not fit to lead the state.

Now, a growing group of them are endorsing him for mayor of New York City.",23,10,['https://nbcnews.to/3ZTwEYK'],['https://www.nbcnews.com/politics/elections/democrats-called-andrew-cuomo-resign-2021-are-endorsing-2025-rcna211441?link_source=ta_bluesky_link&taid=68434fd7144f890001ee04e5&utm_campaign=trueanthem&utm_medium=social&utm_source=bluesky'],Politics,Politics,Politician
NBC News,2025-06-06 14:48:23,"National Park Service closes D.C.’s historic Dupont Circle Park — the site of some of the capitol’s earliest Pride celebrations, LGBTQ protests and AIDS memorial services — during WorldPride

For @nbcnews.com, w/ @joekottke.bsky.social & @producerpegram.bsky.social 
www.nbcnews.com/feature/nbc-...",37,21,['https://www.nbcnews.com/feature/nbc-out/national-park-service-closes-dupont-circle-park-worldpride-rcna211426'],['https://www.nbcnews.com/feature/nbc-out/national-park-service-closes-dupont-circle-park-worldpride-rcna211426'],Local News,Local News,
NBC News,2025-06-06 16:15:30,"BREAKING: Kilmar Abrego Garcia, who was mistakenly deported to El Salvador, has been returned to the U.S. to face federal criminal charges. nbcnews.to/44cYDnZ",96,24,['https://nbcnews.to/44cYDnZ'],['https://www.nbcnews.com/news/us-news/kilmar-abrego-garcia-was-mistakenly-deported-el-salvador-will-face-fed-rcna211514?link_source=ta_bluesky_link&taid=aa42ac77-c85f-4ef3-9b87-7218b533589e&utm_campaign=trueanthem&utm_medium=social&utm_source=bluesky'],Crime,Crime,
NBC News,2025-06-06 16:08:41,"BREAKING: Kilmar Abrego Garcia, who was mistakenly deported to El Salvador, has been returned to the U.S. to face federal criminal charges.",62,11,['https://nbcnews.to/3SHKklQ'],['https://www.nbcnews.com/news/us-news/kilmar-abrego-garcia-was-mistakenly-deported-el-salvador-will-face-fed-rcna211514?link_source=ta_bluesky_link&taid=68434ac9144f890001ee04a5&utm_campaign=trueanthem&utm_medium=social&utm_source=bluesky'],Crime,Crime,
NBC News,2025-06-06 16:00:11,"An upcoming Netflix documentary reveals new details about the June 2023 Titan submersible, which was traveling to the wreck of the Titanic when it imploded, killing all five people aboard.",20,6,['https://nbcnews.to/45c1IGX'],['https://www.nbcnews.com/news/us-news/new-details-2023-titan-submersible-implosion-revealed-netflix-document-rcna211483?link_source=ta_bluesky_link&taid=684348ca144f890001ee0475&utm_campaign=trueanthem&utm_medium=social&utm_source=bluesky'],News,General News,
NBC News,2025-06-06 15:45:06,A nationwide coordinated crackdown on retail crime led to hundreds of arrests in 28 states last week.,26,7,['https://nbcnews.to/3SEjT0k'],['https://www.nbcnews.com/business/business-news/nationwide-coordinated-retail-crime-crackdown-results-hundreds-arrests-rcna210953?link_source=ta_bluesky_link&taid=68434541144f890001ee044f&utm_campaign=trueanthem&utm_medium=social&utm_source=bluesky'],Crime,Crime,
NBC News,2025-06-06 13:02:03,The Cetaphil Hydrating Gel Moisturizer uses ingredients like hyaluronic acid to restore and repair dry skin.,4,2,['https://nbcnews.to/4mKy2a1'],['https://www.nbcnews.com/select/shopping/cetaphil-hydrating-gel-deal-of-the-day-2025-rcna211273?link_source=ta_bluesky_link&taid=68431f0a144f89000160ea65&utm_campaign=trueanthem&utm_medium=social&utm_source=bluesky'],Beauty,Lifestyle,
NBC News,2025-06-06 15:30:06,"Three Latino restaurateurs in Wyoming, Alabama and Idaho earn the prestigious 2025 James Beard nominations. ",35,11,['https://nbcnews.to/44cVxQT'],['https://www.nbcnews.com/news/latino/latino-restaurateurs-james-beard-awards-nominees-rcna210583?link_source=ta_bluesky_link&taid=684341be144f890001ee0423&utm_campaign=trueanthem&utm_medium=social&utm_source=bluesky'],Food News,Food & Lifestyle,
NBC News,2025-06-06 15:15:07,What began as a fist fight at a high school graduation in Michigan on Tuesday has turned into a search for a 20-year-old suspect in what officials are calling a prevented mass shooting attempt.,37,20,['https://nbcnews.to/4n4IJVg'],['https://www.nbcnews.com/news/us-news/mass-shooting-thwarted-michigan-high-school-graduation-one-suspect-arr-rcna211473?link_source=ta_bluesky_link&taid=68433e3a144f890001ee03fa&utm_campaign=trueanthem&utm_medium=social&utm_source=bluesky'],Crime News,Crime,
NBC News,2025-06-06 15:00:22,"The National Park Service and U.S. Park Police close Dupont Circle Park, widely known as the heart of Washington’s LGBTQ neighborhood, ahead of the final weekend of WorldPride, an international Pride celebration being held in the nation’s capital this year.",28,27,['https://nbcnews.to/4jH2H5o'],['https://www.nbcnews.com/nbc-out/out-news/national-park-service-closes-dupont-circle-park-worldpride-rcna211426?link_source=ta_bluesky_link&taid=68433ac5144f890001ee03c7&utm_campaign=trueanthem&utm_medium=social&utm_source=bluesky'],Local News,Local News,
NBC News,2025-06-06 14:45:06,Boeing CEO says its airplane deliveries to China will resume next month after handovers paused amid a trade war with the Trump administration. ,21,8,['https://nbcnews.to/3SADZIW'],['https://www.nbcnews.com/business/travel/boeing-resume-airplane-deliveries-china-month-ramp-max-production-ceo-rcna211488?link_source=ta_bluesky_link&taid=68433732144f890001ee0398&utm_campaign=trueanthem&utm_medium=social&utm_source=bluesky'],Business,Business & Economy,
NBC News,2025-06-06 14:30:09,"A crucial National Weather Service office that  keeps an eye on the flood-prone Mississippi River and the heart of Tornado Alley was battered by cuts.

As tornado season approaches, those left are putting on a brave face.",122,57,['https://nbcnews.to/43O06k3'],['https://www.nbcnews.com/science/science-news/tired-tornado-alley-rcna208527?link_source=ta_bluesky_link&taid=684333af144f890001ee0372&utm_campaign=trueanthem&utm_medium=social&utm_source=bluesky'],Weather,Weather,
NBC News,2025-06-06 14:15:05,"A former federal inmate, who was pardoned by President Trump in his first term for drug trafficking crimes, has been tapped as deputy director of the federal Bureau of Prisons, according to a spokesperson.",70,59,['https://nbcnews.to/444mV4u'],['https://www.nbcnews.com/politics/politics-news/former-federal-inmate-pardoned-trump-tapped-bureau-prisons-deputy-dire-rcna211396?link_source=ta_bluesky_link&taid=68433028144f890001ee0347&utm_campaign=trueanthem&utm_medium=social&utm_source=bluesky'],Politics,Politics,Crime
NBC News,2025-06-06 14:00:23,"Education Secretary Linda McMahon defends President Trump's attacks on elite universities like Harvard and Columbia, while saying that she is seeing ""progress"" from the institutions on the administration's demands.",17,5,['https://nbcnews.to/3Hv7lGn'],['https://www.nbcnews.com/politics/trump-administration/linda-mcmahon-progress-harvard-columbia-trump-attacks-rcna210413?link_source=ta_bluesky_link&taid=68432cb7144f890001ee0318&utm_campaign=trueanthem&utm_medium=social&utm_source=bluesky'],Education,Education,
NBC News,2025-06-06 13:45:05,"A hungry and mud-caked wild elephant surprised shopkeepers at a grocery store in Thailand this week, ransacking shelves in search of food.",51,6,['https://nbcnews.to/4kXqMpD'],['https://www.nbcnews.com/world/asia/bull-china-shop-no-elephant-grocery-store-thailand-rcna211104?link_source=ta_bluesky_link&taid=68432920144f890001ee02e1&utm_campaign=trueanthem&utm_medium=social&utm_source=bluesky'],Wildlife News,Climate & Environment,
NBC News,2025-06-06 13:30:14,Defending champion Carlos Alcaraz reaches the French Open final after Lorenzo Musetti retired from their semifinal early in the fourth set.,15,1,['https://nbcnews.to/43QltkX'],['https://www.nbcnews.com/sports/tennis/carlos-alcaraz-reaches-french-open-rcna211463?link_source=ta_bluesky_link&taid=684325a6144f890001ee02c5&utm_campaign=trueanthem&utm_medium=social&utm_source=bluesky'],Sports,Sports,
NBC News,2025-06-06 13:15:05,"As transgender service members face a deadline to leave the U.S. military, hundreds are taking the financial bonus to depart voluntarily. But others say they will stay and fight.",31,14,['https://nbcnews.to/4dX3XAi'],['https://www.nbcnews.com/nbc-out/out-politics-and-policy/transgender-troops-face-deadline-difficult-decision-stay-go-rcna211468?link_source=ta_bluesky_link&taid=68432218144f890001ee0295&utm_campaign=trueanthem&utm_medium=social&utm_source=bluesky'],Military News,Defense & Security,
NBC News,2025-06-06 13:00:25,"An executor of the estate for a 16-year-old Florida girl who police say was kidnapped, tortured and killed by a man and his girlfriend in February after meeting on a dating application is suing Grindr for what is alleged to be their role in the murder.",30,7,['https://nbcnews.to/4kYoR4m'],['https://www.nbcnews.com/news/us-news/executor-estate-slain-florida-teen-sues-grindr-protect-minors-rcna211407?link_source=ta_bluesky_link&taid=68431ea9144f89000160ea55&utm_campaign=trueanthem&utm_medium=social&utm_source=bluesky'],Crime News,Crime,
NBC News,2025-06-06 12:45:05,"NBC News analyzed leaked reports, satellite images and interviews to reveal the extent of Rwanda's carefully concealed and high-tech war in the Congo, as the U.S. tries to strike a deal for peace and access to the region's minerals.",34,14,['https://nbcnews.to/3ZMDCik'],['https://www.nbcnews.com/world/africa/rwanda-congo-war-hidden-invasion-trump-peace-talks-rcna209051?link_source=ta_bluesky_link&taid=68431b10144f89000160ea18&utm_campaign=trueanthem&utm_medium=social&utm_source=bluesky'],International News,World,
NBC News,2025-06-06 12:16:40,JUST IN: Trump administration asks Supreme Court to allow the Education Department to carry out broad layoffs that were blocked by a federal judge.,41,30,['https://nbcnews.to/43vaQ8g'],['https://www.nbcnews.com/politics/trump-administration/live-blog/trump-administration-elon-musk-travel-ban-tariffs-live-updates-rcna210179?canonicalCard=true'],Politics,Politics,Trump Administration
NBC News,2025-06-06 11:45:07,"The vest Matthew Broderick donned nearly 40 years ago for ""Ferris Bueller’s Day Off"" is going under an auctioneer's hammer with an estimated price of between $300,000 and $600,000.",24,3,['https://nbcnews.to/3ZPlgx8'],['https://www.nbcnews.com/pop-culture/pop-culture-news/matthew-brodericks-vest-ferris-buellers-day-sell-600k-auction-rcna211154?link_source=ta_bluesky_link&taid=68430d02144f89000160e978&utm_campaign=trueanthem&utm_medium=social&utm_source=bluesky'],Entertainment,Entertainment,
NBC News,2025-06-06 11:30:06,"A critically missing person alert is issued for Angelina Petra Resendiz, a 21-year-old sailor last seen on the morning of May 29 at her barracks at the Naval Station Norfolk.",28,26,['https://nbcnews.to/3HvS0FC'],['https://www.nbcnews.com/news/us-news/21-year-old-sailor-angelina-resendiz-goes-missing-navy-barracks-virgin-rcna211409?link_source=ta_bluesky_link&taid=6843097d144f89000160e94a&utm_campaign=trueanthem&utm_medium=social&utm_source=bluesky'],Local News,Local News,
NBC News,2025-06-06 10:45:07,"President Trump will not be calling Elon Musk on Friday after their feud exploded into public, according to White House chief of staff Susie Wiles.",39,5,['https://nbcnews.to/4kX8AfP'],['https://www.nbcnews.com/politics/white-house/no-plans-trump-musk-call-tamp-feud-white-house-chief-staff-says-rcna211397?link_source=ta_bluesky_link&taid=6842fef2144f89000160e8d2&utm_campaign=trueanthem&utm_medium=social&utm_source=bluesky'],Politics,Politics,Trump Administration
NBC News,2025-06-06 10:30:33,"President Trump’s pick to be the next U.S. surgeon general has criticized the health, medical and food systems for being influenced by profit-driven special interests.

Yet, she has profited off promoting wellness products and partnerships, according to an Associated Press review.",50,20,['https://nbcnews.to/443IkdZ'],['https://www.nbcnews.com/health/health-news/trumps-surgeon-general-pick-criticizes-others-conflicts-profits-wellne-rcna211420?link_source=ta_bluesky_link&taid=6842fb89144f89000160e8bc&utm_campaign=trueanthem&utm_medium=social&utm_source=bluesky'],Health,Health,
NBC News,2025-06-06 10:15:10,"Scientists have long been trying to discover whether taurine, a nutrient found in meat and shellfish, can slow aging.

A new study raises questions about its use as a supplement. ",15,1,['https://nbcnews.to/43vkHLh'],['https://www.nbcnews.com/health/aging/taurine-longevity-supplement-healthy-aging-study-rcna210604?link_source=ta_bluesky_link&taid=6842f7ed144f89000160e892&utm_campaign=trueanthem&utm_medium=social&utm_source=bluesky'],Health,Health,
NBC News,2025-06-06 10:00:23,"Mahmoud Khalil, a Columbia University student detained in March by immigration agents, responds to the charges against him and described the ""irreparable harm"" his arrest has had on him and his family. ",52,19,['https://nbcnews.to/4kR3e5A'],['https://www.nbcnews.com/news/us-news/mahmoud-khalil-responds-grotesque-charges-new-legal-filing-says-arrest-rcna211399?link_source=ta_bluesky_link&taid=6842f477144f89000160e877&utm_campaign=trueanthem&utm_medium=social&utm_source=bluesky'],Immigration News,World,
