date,content,tweet_url,embedded_links,section,merged_section
2025-06-06 00:50:58+00:00,Japan-based Ispace's Resilience lander has failed in company's second attempt to land on the moon,https://x.com/CNN/status/1930789477871464869,"['https://www.cnn.com/science/live-news/moon-landing-mission-ispace-06-05-25?Date=20250606&Profile=CNN&utm_content=1749171051&utm_medium=social&utm_source=twitter#cmbk1uxaf000r3b6mcl2ve7dc', 'https://www.cnn.com/science/live-news/moon-landing-mission-ispace-06-05-25?Date=20250606&Profile=CNN&utm_content=1749171051&utm_medium=social&utm_source=twitter#cmbk1uxaf000r3b6mcl2ve7dc']",Space News,Space News
2025-06-06 00:07:49+00:00,Russia launches an aerial assault on Kyiv days after Ukraine's audacious drone attack on bomber fleet.,https://x.com/CNN/status/1930778618839376026,"['https://www.cnn.com/2025/06/05/europe/russia-launches-retaliatory-strike-on-kyiv-latam-hnk-intl?Date=20250606&Profile=CNN&utm_content=1749168343&utm_medium=social&utm_source=twitter', 'https://www.cnn.com/2025/06/05/europe/russia-launches-retaliatory-strike-on-kyiv-latam-hnk-intl?Date=20250606&Profile=CNN&utm_content=1749168343&utm_medium=social&utm_source=twitter']",World News,World News
2025-06-05 18:48:48+00:00,A Massachusetts teen who was arrested by ICE on his way to volleyball practice is expected to be released after a judge granted him bond,https://x.com/CNN/status/1930698333871329291,"['https://www.cnn.com/2025/06/05/us/massachusetts-teen-detained-ice-bond-granted?Date=20250605&Profile=CNN&utm_content=1749149297&utm_medium=social&utm_source=twitter', 'https://www.cnn.com/2025/06/05/us/massachusetts-teen-detained-ice-bond-granted?Date=20250605&Profile=CNN&utm_content=1749149297&utm_medium=social&utm_source=twitter']",Immigration,Immigration
2025-06-05 14:58:45+00:00,Supreme Court sides with Catholic Charities in case over whether religiously affiliated groups are entitled to an exemption from certain state taxes,https://x.com/CNN/status/1930640440291704863,"['https://www.cnn.com/2025/06/05/politics/supreme-court-backs-catholic-charities-push-to-object-to-state-taxes-on-religious-grounds?Date=20250605&Profile=cnnbrk&utm_content=1749135513&utm_medium=social&utm_source=twitter', 'https://www.cnn.com/2025/06/05/politics/supreme-court-backs-catholic-charities-push-to-object-to-state-taxes-on-religious-grounds?Date=20250605&Profile=cnnbrk&utm_content=1749135513&utm_medium=social&utm_source=twitter']",Legal News,Legal News
2025-06-05 14:40:55+00:00,Supreme Court tosses Mexico's lawsuit that alleged US gun manufacturers should be held responsible for cartel violence on the Southwest border,https://x.com/CNN/status/1930635954609361174,"['https://www.cnn.com/2025/06/05/politics/supreme-court-smith-wesson-mexico?Date=20250605&Profile=CNN&utm_content=1749134417&utm_medium=social&utm_source=twitter', 'https://www.cnn.com/2025/06/05/politics/supreme-court-smith-wesson-mexico?Date=20250605&Profile=CNN&utm_content=1749134417&utm_medium=social&utm_source=twitter']",Legal News,Legal News
2025-06-05 14:38:35+00:00,"Supreme Court sides with a straight woman who sued her employer in a ruling that makes it easier to file ""reverse discrimination"" suits.",https://x.com/CNN/status/1930635365741711814,"['https://www.cnn.com/2025/06/05/politics/supreme-court-reverse-discrimination-suits?Date=20250605&Profile=cnnbrk&utm_content=1749134280&utm_medium=social&utm_source=twitter', 'https://www.cnn.com/2025/06/05/politics/supreme-court-reverse-discrimination-suits?Date=20250605&Profile=cnnbrk&utm_content=1749134280&utm_medium=social&utm_source=twitter']",Legal News,Legal News
2025-06-05 13:38:23+00:00,"US President Trump held a long-awaited phone call with Chinese leader Xi Jinping, a person familiar with the matter tells CNN",https://x.com/CNN/status/1930620217916342732,"['https://edition.cnn.com/2025/06/05/politics/trump-xi-trade-call?Date=20250605&Profile=CNN&utm_content=1749130677&utm_medium=social&utm_source=twitter', 'https://edition.cnn.com/2025/06/05/politics/trump-xi-trade-call?Date=20250605&Profile=CNN&utm_content=1749130677&utm_medium=social&utm_source=twitter']",Politics,Politics
2025-06-05 07:37:43+00:00,"Bodies of two Israeli-American hostages abducted by Hamas on October 7 recovered from southern Gaza, Israeli authorities say",https://x.com/CNN/status/1930529450011087269,"['https://www.cnn.com/2025/06/05/middleeast/israel-hostages-gaza-recovered-intl?Date=20250605&Profile=cnn&utm_content=1749109025&utm_medium=social&utm_source=threads', 'https://www.cnn.com/2025/06/05/middleeast/israel-hostages-gaza-recovered-intl?Date=20250605&Profile=cnn&utm_content=1749109025&utm_medium=social&utm_source=threads']",World News,World News
2025-06-05 00:36:21+00:00,President Trump signs a proclamation to suspend visas for new Harvard international students.,https://x.com/CNN/status/1930423410787516525,"['https://www.cnn.com/2025/06/04/us/trump-harvard-student-visas-suspended?Date=20250605&Profile=CNN&utm_content=1749083412&utm_medium=social&utm_source=twitter', 'https://www.cnn.com/2025/06/04/us/trump-harvard-student-visas-suspended?Date=20250605&Profile=CNN&utm_content=1749083412&utm_medium=social&utm_source=twitter']",Politics,Politics
2025-06-04 23:59:57+00:00,President Trump has signed a proclamation banning travel from several countries to the US,https://x.com/CNN/status/1930414253229425004,"['https://www.cnn.com/2025/06/04/politics/trump-travel-ban-proclamation?Date=20250604&Profile=CNN&utm_content=1749081593&utm_medium=social&utm_source=twitter', 'https://www.cnn.com/2025/06/04/politics/trump-travel-ban-proclamation?Date=20250604&Profile=CNN&utm_content=1749081593&utm_medium=social&utm_source=twitter']",Politics,Politics
2025-06-04 22:30:31+00:00,A federal judge has ruled that migrants flown to El Salvador under the Alien Enemies Act must be allowed to challenge their removal,https://x.com/CNN/status/1930391745734271373,"['https://www.cnn.com/2025/06/04/politics/migrants-el-salvador-alien-enemies-act?Date=20250604&Profile=CNN&utm_content=1749076221&utm_medium=social&utm_source=twitter', 'https://www.cnn.com/2025/06/04/politics/migrants-el-salvador-alien-enemies-act?Date=20250604&Profile=CNN&utm_content=1749076221&utm_medium=social&utm_source=twitter']",Immigration Law,Immigration Law
2025-06-04 22:18:17+00:00,"The Trump administration has returned a Guatemalan national who was hastily deported to Mexico back to the US, his legal team says",https://x.com/CNN/status/1930388666901286962,"['https://www.cnn.com/2025/06/04/politics/migrant-deported-mexico-returned-trump-administration?Date=20250604&Profile=CNN&utm_content=1749075488&utm_medium=social&utm_source=twitter', 'https://www.cnn.com/2025/06/04/politics/migrant-deported-mexico-returned-trump-administration?Date=20250604&Profile=CNN&utm_content=1749075488&utm_medium=social&utm_source=twitter']",Immigration,Immigration
2025-06-04 20:46:58+00:00,"A federal judge has issued an order stopping the deportation of family of the man charged in the firebomb attack in Boulder, Colorado",https://x.com/CNN/status/1930365685730812230,"['https://www.cnn.com/2025/06/04/us/boulder-colorado-terror-attack?Date=20250604&Profile=CNN&utm_content=1749070013&utm_medium=social&utm_source=twitter', 'https://www.cnn.com/2025/06/04/us/boulder-colorado-terror-attack?Date=20250604&Profile=CNN&utm_content=1749070013&utm_medium=social&utm_source=twitter']",Legal News,Legal News
2025-06-04 20:27:24+00:00,The US Department of Education has declared that Columbia University does not meet accreditation standards due to antisemitism concerns,https://x.com/CNN/status/1930360759579533472,"['https://www.cnn.com/2025/06/04/us/columbia-university-accreditation-antidiscrimination?Date=20250604&Profile=CNN&utm_content=1749068842&utm_medium=social&utm_source=twitter', 'https://www.cnn.com/2025/06/04/us/columbia-university-accreditation-antidiscrimination?Date=20250604&Profile=CNN&utm_content=1749068842&utm_medium=social&utm_source=twitter']",Education,Education
2025-06-04 17:18:09+00:00,President Trump says that Russian President Putin told him in a phone call earlier today that he would respond to Ukraine's weekend drone attacks,https://x.com/CNN/status/1930313134259990598,"['https://www.cnn.com/2025/06/04/politics/trump-putin-phone-call-ukraine-response?Date=20250604&Profile=CNN&utm_content=1749057485&utm_medium=social&utm_source=twitter', 'https://www.cnn.com/2025/06/04/politics/trump-putin-phone-call-ukraine-response?Date=20250604&Profile=CNN&utm_content=1749057485&utm_medium=social&utm_source=twitter']",International News,International News
2025-06-03 21:05:01+00:00,The New York Knicks fired head coach Tom Thibodeau after five seasons in charge and just days after being knocked out of the NBA playoffs.,https://x.com/CNN/status/1930007839617007714,"['https://www.cnn.com/2025/06/03/sport/tom-thibodeau-fired-knicks-spt?Date=20250603&Profile=cnn&utm_content=1748978909&utm_medium=social&utm_source=threads', 'https://www.cnn.com/2025/06/03/sport/tom-thibodeau-fired-knicks-spt?Date=20250603&Profile=cnn&utm_content=1748978909&utm_medium=social&utm_source=threads']",Sports,Sports
2025-06-03 19:53:25+00:00,Defense Secretary Pete Hegseth has ordered the Navy to rename a ship named after gay rights activist and Navy veteran Harvey Milk.,https://x.com/CNN/status/1929989819699994710,"['https://www.cnn.com/2025/06/03/politics/hegseth-orders-renaming-ship-named-harvey-milk?Date=20250603&Profile=CNN&utm_content=1748980312&utm_medium=social&utm_source=twitter', 'https://www.cnn.com/2025/06/03/politics/hegseth-orders-renaming-ship-named-harvey-milk?Date=20250603&Profile=CNN&utm_content=1748980312&utm_medium=social&utm_source=twitter']",Politics,Politics
2025-06-03 18:22:41+00:00,"Elon Musk blasted President Trump's domestic agenda bill, calling it a ""disgusting abomination."" The White House shrugged off the criticism.",https://x.com/CNN/status/1929966987146350684,"['https://www.cnn.com/2025/06/03/politics/elon-musk-trump-republican-bill?Date=20250603&Profile=CNN&utm_content=1748974947&utm_medium=social&utm_source=twitter', 'https://www.cnn.com/2025/06/03/politics/elon-musk-trump-republican-bill?Date=20250603&Profile=CNN&utm_content=1748974947&utm_medium=social&utm_source=twitter']",Politics,Politics
2025-06-03 14:13:33+00:00,"US job openings unexpectedly increased in April, signaling strength in America's labor market despite broader economic uncertainty",https://x.com/CNN/status/1929904289087955413,"['https://www.cnn.com/2025/06/03/economy/us-job-openings-layoffs-jolts-april?Date=20250603&Profile=cnnbrk&utm_content=1748959977&utm_medium=social&utm_source=twitter', 'https://www.cnn.com/2025/06/03/economy/us-job-openings-layoffs-jolts-april?Date=20250603&Profile=cnnbrk&utm_content=1748959977&utm_medium=social&utm_source=twitter']",Economy,Economy
2025-06-03 13:22:35+00:00,"President Donald Trump has privately complained that the Supreme Court justices he appointed have not sufficiently stood behind his agenda, according to multiple sources familiar with the conversations",https://x.com/CNN/status/1929891466505064878,"['https://www.cnn.com/2025/06/03/politics/amy-coney-barrett-justice-trump?Date=20250603&Profile=CNN&utm_content=1748956942&utm_medium=social&utm_source=twitter', 'https://www.cnn.com/2025/06/03/politics/amy-coney-barrett-justice-trump?Date=20250603&Profile=CNN&utm_content=1748956942&utm_medium=social&utm_source=twitter']",Politics,Politics
2025-06-03 12:10:06+00:00,"Ukraine says it has struck bridge connecting Russia to Crimea with underwater explosives, days after its audacious attack on Russian air bases",https://x.com/CNN/status/1929873224512237895,"['https://www.cnn.com/2025/06/03/europe/ukraine-crimea-bridge-russia-underwater-intl?Date=20250603&Profile=CNN&utm_content=1748952591&utm_medium=social&utm_source=twitter', 'https://www.cnn.com/2025/06/03/europe/ukraine-crimea-bridge-russia-underwater-intl?Date=20250603&Profile=CNN&utm_content=1748952591&utm_medium=social&utm_source=twitter']",Military News,Military News
2025-06-03 07:53:59+00:00,"Dozens killed and injured near a Gaza aid distribution point, health officials say, in the third day of shooting near the site",https://x.com/CNN/status/1929808768721727912,"['https://www.cnn.com/2025/06/03/middleeast/gaza-rafah-shooting-aid-distribution-point-intl?Date=20250603&Profile=cnnbrk&utm_content=1748937218&utm_medium=social&utm_source=twitter', 'https://www.cnn.com/2025/06/03/middleeast/gaza-rafah-shooting-aid-distribution-point-intl?Date=20250603&Profile=cnnbrk&utm_content=1748937218&utm_medium=social&utm_source=twitter']",Breaking News,Breaking News
2025-06-02 20:52:42+00:00,Boulder attack suspect Mohamed Sabry Soliman has been charged with 16 counts of attempted murder and faces a federal hate crime charge,https://x.com/CNN/status/1929642354480185352,"['https://www.cnn.com/us/live-news/boulder-colorado-antisemitic-attack-06-01-25?Date=20250602&Profile=CNN&utm_content=1748897561&utm_medium=social&utm_source=twitter#cmbfhpylb002c3b6nkomx8lfb', 'https://www.cnn.com/us/live-news/boulder-colorado-antisemitic-attack-06-01-25?Date=20250602&Profile=CNN&utm_content=1748897561&utm_medium=social&utm_source=twitter#cmbfhpylb002c3b6nkomx8lfb']",Crime News,Crime News
2025-06-02 17:31:58+00:00,"The suspect in the Colorado flamethrower attack has been charged with a federal hate crime, according to an affidavit. The FBI says the suspect had planned the attack for a year.",https://x.com/CNN/status/1929591837699780668,"['https://www.cnn.com/us/live-news/boulder-colorado-antisemitic-attack-06-01-25?Date=20250602&Profile=CNN&utm_content=1748885517&utm_medium=social&utm_source=twitter#cmbfaf63u00053b6nij2w1yus', 'https://www.cnn.com/us/live-news/boulder-colorado-antisemitic-attack-06-01-25?Date=20250602&Profile=CNN&utm_content=1748885517&utm_medium=social&utm_source=twitter#cmbfaf63u00053b6nij2w1yus']",Crime,Law & Order
2025-06-02 15:22:32+00:00,"The suspect in the Colorado flamethrower attack had an expired work visa and in the US illegally, officials say. He is due in court later today. Follow live updates:",https://x.com/CNN/status/1929559264370077917,"['https://www.cnn.com/us/live-news/boulder-colorado-antisemitic-attack-06-01-25?Date=20250602&Profile=cnnbrk&utm_content=1748877740&utm_medium=social&utm_source=twitter#cmbf3wx8w00003b6nyuvw30i5', 'https://www.cnn.com/us/live-news/boulder-colorado-antisemitic-attack-06-01-25?Date=20250602&Profile=cnnbrk&utm_content=1748877740&utm_medium=social&utm_source=twitter#cmbf3wx8w00003b6nyuvw30i5']",Crime,Law & Order
2025-06-02 13:03:34+00:00,"Mt. Etna erupts on the Italian island of Sicily, spewing ash and rock ""several kilometers high."" Witnesses say explosions can be heard miles away.",https://x.com/CNN/status/1929524291588047021,"['https://www.cnn.com/2025/06/02/travel/italy-mount-etna-erupts-intl', 'https://www.cnn.com/2025/06/02/travel/italy-mount-etna-erupts-intl']",Breaking News,Breaking News
2025-06-02 01:25:43+00:00,"Officials identified the suspect in the Boulder, Colorado, attack that injured 6 as 45-year-old Mohamed Soliman. Follow live updates.",https://x.com/CNN/status/1929348673026117799,"['https://www.cnn.com/us/live-news/boulder-colorado-antisemitic-attack-06-01-25', 'https://www.cnn.com/us/live-news/boulder-colorado-antisemitic-attack-06-01-25']",Breaking News,Breaking News
2025-06-01 22:51:33+00:00,"Suspect in custody after multiple people set on fire in attack at Boulder, Colorado, march for Israeli hostages, police say",https://x.com/CNN/status/1929309874959101970,"['https://www.cnn.com/2025/06/01/us/boulder-colorado-attack?Date=20250601&Profile=CNN&utm_content=1748818288&utm_medium=social&utm_source=twitter', 'https://www.cnn.com/2025/06/01/us/boulder-colorado-attack?Date=20250601&Profile=CNN&utm_content=1748818288&utm_medium=social&utm_source=twitter']",Breaking News,Breaking News
2025-06-01 22:05:49+00:00,"FBI is investigating an incident in Boulder, Colorado, that it describes as an ""act of terror"" with multiple injuries reported",https://x.com/CNN/status/1929298365423952134,"['https://www.cnn.com/2025/06/01/us/boulder-colorado-attack?Date=20250601&Profile=CNN&utm_content=1748815545&utm_medium=social&utm_source=twitter', 'https://www.cnn.com/2025/06/01/us/boulder-colorado-attack?Date=20250601&Profile=CNN&utm_content=1748815545&utm_medium=social&utm_source=twitter']",Breaking News,Breaking News
2025-06-01 07:06:42+00:00,"At least 26 Palestinians were killed after Israeli forces opened fire near a Gaza aid distribution center, the Palestine Red Crescent Society said",https://x.com/CNN/status/1929072096358891694,"['https://www.cnn.com/2025/06/01/middleeast/palestinians-killed-gaza-aid-center-intl-hnk?Date=20250601&Profile=CNN&utm_content=1748761592&utm_medium=social&utm_source=twitter', 'https://www.cnn.com/2025/06/01/middleeast/palestinians-killed-gaza-aid-center-intl-hnk?Date=20250601&Profile=CNN&utm_content=1748761592&utm_medium=social&utm_source=twitter']",World News,World News
2025-06-01 17:16:39+00:00,"Update: At least 31 Palestinians were killed amid chaotic scenes near an aid site run by a US-backed private foundation in Gaza, according to the Palestinian Ministry of Health.

CNN cannot independently verify who was responsible for the deaths. The health ministry blamed the",https://x.com/CNN/status/1929225592144023881,[],World News,World News
2025-06-01 15:13:21+00:00,Oscar Piastri wins Spanish Grand Prix as Max Verstappen and George Russell make contact in late drama,https://x.com/CNN/status/1929194564729856333,"['https://www.cnn.com/2025/06/01/sport/oscar-piastri-spanish-grand-prix-spt-intl?Date=20250601&Profile=CNN&utm_content=1748790794&utm_medium=social&utm_source=twitter', 'https://www.cnn.com/2025/06/01/sport/oscar-piastri-spanish-grand-prix-spt-intl?Date=20250601&Profile=CNN&utm_content=1748790794&utm_medium=social&utm_source=twitter']",Sports,Sports
2025-06-01 03:28:45+00:00,The Indiana Pacers reach their first NBA Finals in 25 years and will face the Oklahoma City Thunder after eliminating the New York Knicks,https://x.com/CNN/status/1929017246451437937,"['https://www.cnn.com/2025/05/31/sport/pacers-nba-finals-knicks-spt?Date=20250601&Profile=CNN&utm_content=1748748482&utm_medium=social&utm_source=twitter', 'https://www.cnn.com/2025/05/31/sport/pacers-nba-finals-knicks-spt?Date=20250601&Profile=CNN&utm_content=1748748482&utm_medium=social&utm_source=twitter']",Sports,Sports
2025-05-31 21:03:36+00:00,Paris Saint-Germain dominates Inter 5-0 to win its first ever Champions League trophy after years of chasing European glory.,https://x.com/CNN/status/1928920320292929659,"['https://www.cnn.com/sport/live-news/champions-league-final-inter-milan-psg-05-31-25-spt?Date=20250531&Profile=CNN&utm_content=1748725402&utm_medium=social&utm_source=twitter', 'https://www.cnn.com/sport/live-news/champions-league-final-inter-milan-psg-05-31-25-spt?Date=20250531&Profile=CNN&utm_content=1748725402&utm_medium=social&utm_source=twitter']",Sports,Sports
2025-05-31 01:31:03+00:00,Appeals court rules that the Trump administration's mass firings at several agencies will remain on hold as a legal challenge plays out.,https://x.com/CNN/status/1928625236817145916,"['https://www.cnn.com/2025/05/30/politics/appeals-court-decline-trump-request-resume-mass-firings?Date=20250531&Profile=CNN&utm_content=1748655049&utm_medium=social&utm_source=twitter', 'https://www.cnn.com/2025/05/30/politics/appeals-court-decline-trump-request-resume-mass-firings?Date=20250531&Profile=CNN&utm_content=1748655049&utm_medium=social&utm_source=twitter']",Politics,Politics
2025-05-30 22:20:17+00:00,"President Trump has announced that tariffs on steel imported into the US will be increased to 50%, doubling what they previously were",https://x.com/CNN/status/1928577230789070990,"['https://www.cnn.com/2025/05/30/business/trump-announces-50-percent-steel-tariff?Date=20250530&Profile=CNN&utm_content=1748643615&utm_medium=social&utm_source=twitter', 'https://www.cnn.com/2025/05/30/business/trump-announces-50-percent-steel-tariff?Date=20250530&Profile=CNN&utm_content=1748643615&utm_medium=social&utm_source=twitter']",Economy,Economy
2025-05-30 20:47:19+00:00,"Loretta Swit, the Emmy-winning actor best known for her role as Margaret ""Hot Lips"" Houlihan on TV's ""M*A*S*H,"" has died at 87",https://x.com/CNN/status/1928553835049427250,"['https://www.cnn.com/2025/05/30/entertainment/loretta-swit-death?Date=20250530&Profile=CNN&utm_content=1748638037&utm_medium=social&utm_source=twitter', 'https://www.cnn.com/2025/05/30/entertainment/loretta-swit-death?Date=20250530&Profile=CNN&utm_content=1748638037&utm_medium=social&utm_source=twitter']",Obituaries,Obituaries
2025-05-30 17:44:33+00:00,At least one person is dead and multiple others injured in a rural Kentucky county where a tornado struck with only minutes of warning,https://x.com/CNN/status/1928507840026526012,"['https://www.cnn.com/2025/05/30/weather/tornado-kentucky-severe-storm-climate?Date=20250530&Profile=CNN&utm_content=1748626964&utm_medium=social&utm_source=twitter', 'https://www.cnn.com/2025/05/30/weather/tornado-kentucky-severe-storm-climate?Date=20250530&Profile=CNN&utm_content=1748626964&utm_medium=social&utm_source=twitter']",Breaking News,Breaking News
2025-05-30 16:28:45+00:00,"Taylor Swift now owns her entire catalog of music, roughly six years after she protested the sale of her master recordings by her former label",https://x.com/CNN/status/1928488765103759504,"['https://www.cnn.com/2025/05/30/entertainment/taylor-swift-owns-catalog-masters-music?Date=20250530&Profile=CNN&utm_content=1748622500&utm_medium=social&utm_source=twitter', 'https://www.cnn.com/2025/05/30/entertainment/taylor-swift-owns-catalog-masters-music?Date=20250530&Profile=CNN&utm_content=1748622500&utm_medium=social&utm_source=twitter']",Entertainment,Entertainment
2025-05-30 16:06:03+00:00,"State Department orders all US embassies and consulates to ""immediately begin additional vetting"" for anyone seeking a visa to travel to Harvard",https://x.com/CNN/status/1928483052675596535,"['https://www.cnn.com/2025/05/30/politics/harvard-visas-state-department-vetting?Date=20250530&Profile=CNN&utm_content=1748621151&utm_medium=social&utm_source=twitter', 'https://www.cnn.com/2025/05/30/politics/harvard-visas-state-department-vetting?Date=20250530&Profile=CNN&utm_content=1748621151&utm_medium=social&utm_source=twitter']",Immigration Policy,Immigration Policy
2025-05-30 14:42:36+00:00,"Trump can suspend Biden-era program giving deportation protections to immigrants from Cuba, Haiti, Nicaragua and Venezuela, Supreme Court says",https://x.com/CNN/status/1928462049018884542,"['https://www.cnn.com/2025/05/30/politics/supreme-court-trump-deportations-parole?Date=20250530&Profile=CNN&utm_content=1748616129&utm_medium=social&utm_source=twitter', 'https://www.cnn.com/2025/05/30/politics/supreme-court-trump-deportations-parole?Date=20250530&Profile=CNN&utm_content=1748616129&utm_medium=social&utm_source=twitter']",Politics,Politics
2025-05-30 02:39:39+00:00,Faizan Zaki wins the Scripps National Spelling Bee a year after finishing runner-up.,https://x.com/CNN/status/1928280114288005335,"['https://www.cnn.com/2025/05/29/us/spelling-bee-faizan-zaki?Date=20250530&Profile=CNN&utm_content=1748572764&utm_medium=social&utm_source=twitter', 'https://www.cnn.com/2025/05/29/us/spelling-bee-faizan-zaki?Date=20250530&Profile=CNN&utm_content=1748572764&utm_medium=social&utm_source=twitter']",Sports,Sports
2025-05-29 19:45:50+00:00,A federal appeals court has paused the ruling from the Court of International Trade that blocked President Trump's tariffs,https://x.com/CNN/status/1928175973825982636,"['https://www.cnn.com/2025/05/29/business/appeals-court-pauses-trump-tariff-ruling?Date=20250529&Profile=CNN&utm_content=1748547945&utm_medium=social&utm_source=twitter', 'https://www.cnn.com/2025/05/29/business/appeals-court-pauses-trump-tariff-ruling?Date=20250529&Profile=CNN&utm_content=1748547945&utm_medium=social&utm_source=twitter']",Politics,Politics
2025-05-29 18:32:55+00:00,"Israel accepts new US proposal for a Gaza ceasefire-hostage deal, Israeli official says. Hamas says it is reviewing the proposal",https://x.com/CNN/status/1928157621510394350,"['https://www.cnn.com/2025/05/29/world/israel-us-proposal-ceasefire-hamas-latam-intl?Date=20250529&Profile=CNN&utm_content=1748543546&utm_medium=social&utm_source=twitter', 'https://www.cnn.com/2025/05/29/world/israel-us-proposal-ceasefire-hamas-latam-intl?Date=20250529&Profile=CNN&utm_content=1748543546&utm_medium=social&utm_source=twitter']",International News,International News
2025-05-29 16:26:12+00:00,The prosecution rests its case in the retrial of Karen Read for the murder of her police officer boyfriend in January 2022,https://x.com/CNN/status/1928125735643820414,"['https://www.cnn.com/2025/05/29/us/karen-read-trial-prosecution-rests', 'https://www.cnn.com/2025/05/29/us/karen-read-trial-prosecution-rests']",Crime News,Crime News
2025-05-29 15:38:45+00:00,Judge says she will issue a preliminary injunction to block Trump administration from making changes to Harvard's student visa program indefinitely,https://x.com/CNN/status/1928113794519097380,"['https://www.cnn.com/us/live-news/harvard-graduation-international-student-ban-hearing-05-29-25?Date=20250529&Profile=CNN&utm_content=1748533120&utm_medium=social&utm_source=twitter#cmb9hkpgk00053b60yqd9fea4', 'https://www.cnn.com/us/live-news/harvard-graduation-international-student-ban-hearing-05-29-25?Date=20250529&Profile=CNN&utm_content=1748533120&utm_medium=social&utm_source=twitter#cmb9hkpgk00053b60yqd9fea4']",Legal News,Legal News
