date,content,tweet_url,embedded_links,section,merged_section
2025-06-13 00:58:28+00:00,"Israel strikes targeted Iran's nuclear program and ""dozens of targets"" across different areas, Israeli military official says",https://x.com/CNN/status/1933328080761680122,"['https://www.cnn.com/world/live-news/israel-iran-strikes-news-06-12-25-hnk-intl?Date=20250613&Profile=CNN&utm_content=1749776298&utm_medium=social&utm_source=twitter', 'https://www.cnn.com/world/live-news/israel-iran-strikes-news-06-12-25-hnk-intl?Date=20250613&Profile=CNN&utm_content=1749776298&utm_medium=social&utm_source=twitter']",World News,World News
2025-06-13 00:23:20+00:00,"Israeli defense minister confirms ""preemptive strikes"" on Iran, Iranian state media says explosions heard in Tehran",https://x.com/CNN/status/1933319237482774850,"['https://www.cnn.com/2025/06/12/middleeast/israel-iran-strikes-intl-hnk?Date=20250613&Profile=CNN&utm_content=1749774194&utm_medium=social&utm_source=twitter', 'https://www.cnn.com/2025/06/12/middleeast/israel-iran-strikes-intl-hnk?Date=20250613&Profile=CNN&utm_content=1749774194&utm_medium=social&utm_source=twitter']",World News,World News
2025-06-12 17:11:02+00:00,"Texas Gov. Greg Abbott deployed over 5,000 National Guard soldiers across the state ""to maintain law and order."" Follow live updates:",https://x.com/CNN/status/1933210446804242601,"['https://www.cnn.com/us/live-news/la-protests-ice-raids-trump-06-12-25?Date=20250612&Profile=CNN&utm_content=1749748252&utm_medium=social&utm_source=twitter#cmbtecpii000r356p473g5b9k', 'https://www.cnn.com/us/live-news/la-protests-ice-raids-trump-06-12-25?Date=20250612&Profile=CNN&utm_content=1749748252&utm_medium=social&utm_source=twitter#cmbtecpii000r356p473g5b9k']",Breaking News,Breaking News
2025-06-12 16:27:52+00:00,Police say a British man survived the Air India plane crash and that a few other survivors may be in the hospital. Follow live updates:,https://x.com/CNN/status/1933199584555127127,"['https://www.cnn.com/world/live-news/ahmedabad-india-plane-crash-06-12-25?Date=20250612&Profile=cnnbrk&utm_content=1749745571&utm_medium=social&utm_source=twitter#cmbtgi1zc00053b6m7m1yc43t', 'https://www.cnn.com/world/live-news/ahmedabad-india-plane-crash-06-12-25?Date=20250612&Profile=cnnbrk&utm_content=1749745571&utm_medium=social&utm_source=twitter#cmbtgi1zc00053b6m7m1yc43t']",Breaking News,Breaking News
2025-06-12 09:22:51+00:00,An Air India passenger plane bound for London has crashed at an airport in the western Indian city of Ahmedabad,https://x.com/CNN/status/1933092623213871398,"['https://www.cnn.com/2025/06/12/asia/plane-crash-india-ahmedabad?Date=20250612&Profile=cnnbrk&utm_content=1749720137&utm_medium=social&utm_source=twitter', 'https://www.cnn.com/2025/06/12/asia/plane-crash-india-ahmedabad?Date=20250612&Profile=cnnbrk&utm_content=1749720137&utm_medium=social&utm_source=twitter']",Breaking News,Breaking News
2025-06-12 02:01:39+00:00,National Guard commander walks back his comments and says troops have not detained civilians in Los Angeles,https://x.com/CNN/status/1932981593661984985,"['https://www.cnn.com/us/live-news/la-protests-ice-raids-trump-06-11-25?Date=20250612&Profile=CNN&utm_content=1749693696&utm_medium=social&utm_source=twitter#cmbsazv4a0005356m8sz6bey3', 'https://www.cnn.com/us/live-news/la-protests-ice-raids-trump-06-11-25?Date=20250612&Profile=CNN&utm_content=1749693696&utm_medium=social&utm_source=twitter#cmbsazv4a0005356m8sz6bey3']",Local News,Local News
2025-06-12 02:03:08+00:00,A previous post was deleted and this story has been updated.,https://x.com/CNN/status/1932981967915565066,[],Corrections,Corrections
2025-06-12 00:05:41+00:00,"Ananda Lewis, former MTV VJ who shared her breast cancer journey, has died at 52.",https://x.com/CNN/status/1932952409623470313,"['https://www.cnn.com/2025/06/11/entertainment/ananda-lewis-death?Date=20250612&Profile=CNN&utm_content=1749686731&utm_medium=social&utm_source=twitter', 'https://www.cnn.com/2025/06/11/entertainment/ananda-lewis-death?Date=20250612&Profile=CNN&utm_content=1749686731&utm_medium=social&utm_source=twitter']",Obituaries,Obituaries
2025-06-11 22:43:00+00:00,Federal judge blocks Trump administration from continuing to detain Palestinian activist Mahmoud Khalil,https://x.com/CNN/status/1932931602918543667,"['https://www.cnn.com/2025/06/11/us/mahmoud-khalil-columbia-university-update?Date=20250611&Profile=CNN&utm_content=1749681774&utm_medium=social&utm_source=twitter', 'https://www.cnn.com/2025/06/11/us/mahmoud-khalil-columbia-university-update?Date=20250611&Profile=CNN&utm_content=1749681774&utm_medium=social&utm_source=twitter']",Politics,Politics
2025-06-11 22:25:58+00:00,US withdraws some diplomats and military families from the Middle East amid Iran tensions,https://x.com/CNN/status/1932927312758034742,"['https://www.cnn.com/2025/06/11/politics/us-middle-east-security-concerns?Date=20250611&Profile=CNN&utm_content=1749680749&utm_medium=social&utm_source=twitter', 'https://www.cnn.com/2025/06/11/politics/us-middle-east-security-concerns?Date=20250611&Profile=CNN&utm_content=1749680749&utm_medium=social&utm_source=twitter']",World News,World News
2025-06-11 22:10:57+00:00,HHS Secretary Robert F. Kennedy Jr. names new members of CDC vaccine advisory panel days after removing previous advisers,https://x.com/CNN/status/1932923534168277184,"['https://www.cnn.com/2025/06/11/health/kennedy-new-members-vaccine-advisory-panel?Date=20250611&Profile=CNN&utm_content=1749679851&utm_medium=social&utm_source=twitter', 'https://www.cnn.com/2025/06/11/health/kennedy-new-members-vaccine-advisory-panel?Date=20250611&Profile=CNN&utm_content=1749679851&utm_medium=social&utm_source=twitter']",Health News,Health News
2025-06-11 18:16:26+00:00,Jury convicts Harvey Weinstein of top charge in the retrial of his landmark #metoo sex crimes case,https://x.com/CNN/status/1932864518771581157,"['https://www.cnn.com/2025/06/11/us/harvey-weinstein-trial-verdict?Date=20250611&Profile=CNN&utm_content=1749665777&utm_medium=social&utm_source=twitter', 'https://www.cnn.com/2025/06/11/us/harvey-weinstein-trial-verdict?Date=20250611&Profile=CNN&utm_content=1749665777&utm_medium=social&utm_source=twitter']",Crime,Law & Order
2025-06-11 17:24:29+00:00,"Brian Wilson, co-founder of The Beach Boys and creative force behind some of the group's hit songs, dies at 82",https://x.com/CNN/status/1932851444274565297,"['https://www.cnn.com/2025/06/11/entertainment/brian-wilson-death?Date=20250611&Profile=CNN&utm_content=1749662606&utm_medium=social&utm_source=facebook', 'https://www.cnn.com/2025/06/11/entertainment/brian-wilson-death?Date=20250611&Profile=CNN&utm_content=1749662606&utm_medium=social&utm_source=facebook']",Obituaries,Obituaries
2025-06-11 12:43:59+00:00,"Inflation rose less than expected in May, despite President Trump's massive tariff rollout",https://x.com/CNN/status/1932780853995675987,"['https://www.cnn.com/2025/06/11/economy/us-consumer-price-index-may?Date=20250611&Profile=CNN&utm_content=1749645835&utm_medium=social&utm_source=twitter', 'https://www.cnn.com/2025/06/11/economy/us-consumer-price-index-may?Date=20250611&Profile=CNN&utm_content=1749645835&utm_medium=social&utm_source=twitter']",Economy,Economy
2025-06-11 07:56:19+00:00,"Elon Musk says some of his social media posts about Donald Trump ""went too far""",https://x.com/CNN/status/1932708458941267970,"['https://www.cnn.com/2025/06/11/business/musk-regrets-some-posts-about-trump-intl?Date=20250611&Profile=CNN&utm_content=1749628574&utm_medium=social&utm_source=twitter', 'https://www.cnn.com/2025/06/11/business/musk-regrets-some-posts-about-trump-intl?Date=20250611&Profile=CNN&utm_content=1749628574&utm_medium=social&utm_source=twitter']",Politics,Politics
2025-06-11 05:03:33+00:00,CNN footage shows police detaining several protesters after curfew in downtown Los Angeles begins. Follow live updates.,https://x.com/CNN/status/1932664981138358465,"['https://www.cnn.com/us/live-news/la-protests-ice-raids-trump-06-10-25?Date=20250611&Profile=cnnbrk&utm_content=1749618178&utm_medium=social&utm_source=twitter', 'https://www.cnn.com/us/live-news/la-protests-ice-raids-trump-06-10-25?Date=20250611&Profile=cnnbrk&utm_content=1749618178&utm_medium=social&utm_source=twitter']",Breaking News,Breaking News
2025-06-11 01:19:45+00:00,"Mikie Sherrill, a Navy helicopter pilot turned four-term congresswoman, will win the Democratic primary for New Jersey governor, CNN projects",https://x.com/CNN/status/1932608661446144333,"['https://www.cnn.com/2025/06/10/politics/new-jersey-governor-primaries?Date=20250611&Profile=CNN&utm_content=1749604780&utm_medium=social&utm_source=twitter', 'https://www.cnn.com/2025/06/10/politics/new-jersey-governor-primaries?Date=20250611&Profile=CNN&utm_content=1749604780&utm_medium=social&utm_source=twitter']",Politics,Politics
2025-06-11 00:54:21+00:00,"President Trump's most sweeping tariffs can remain in effect while legal challenges play out, appeals court rules",https://x.com/CNN/status/1932602268638974333,"['https://www.cnn.com/2025/06/10/business/tariffs-appeals-court-stay-trump?Date=20250611&Profile=CNN&utm_content=1749603240&utm_medium=social&utm_source=twitter', 'https://www.cnn.com/2025/06/10/business/tariffs-appeals-court-stay-trump?Date=20250611&Profile=CNN&utm_content=1749603240&utm_medium=social&utm_source=twitter']",Economy,Economy
2025-06-11 00:46:34+00:00,"LA officials will enact curfew for parts of downtown Los Angeles, source says. Follow live updates.",https://x.com/CNN/status/1932600310033219607,"['https://www.cnn.com/us/live-news/la-protests-ice-raids-trump-06-10-25?Date=20250611&Profile=CNN&utm_content=1749602782&utm_medium=social&utm_source=twitter#cmbr7ndbw000r3b6mja5pdbfd', 'https://www.cnn.com/us/live-news/la-protests-ice-raids-trump-06-10-25?Date=20250611&Profile=CNN&utm_content=1749602782&utm_medium=social&utm_source=twitter#cmbr7ndbw000r3b6mja5pdbfd']",Local News,Local News
2025-06-11 00:31:11+00:00,"US and China agree on trade framework after two days of talks in London, Chinese negotiator says",https://x.com/CNN/status/1932596438568935563,"['https://www.cnn.com/2025/06/10/business/us-china-trade-talks-london-agreement-intl-hnk?Date=20250611&Profile=CNN&utm_content=1749601859&utm_medium=social&utm_source=twitter', 'https://www.cnn.com/2025/06/10/business/us-china-trade-talks-london-agreement-intl-hnk?Date=20250611&Profile=CNN&utm_content=1749601859&utm_medium=social&utm_source=twitter']",Business,Business
2025-06-11 00:22:59+00:00,"Jack Ciattarelli will win the GOP primary for New Jersey governor, CNN projects. The former state assemblyman was endorsed by President Trump.",https://x.com/CNN/status/1932594376900808998,"['https://www.cnn.com/2025/06/10/politics/new-jersey-governor-primaries?Date=20250611&Profile=CNN&utm_content=1749601372&utm_medium=social&utm_source=twitter', 'https://www.cnn.com/2025/06/10/politics/new-jersey-governor-primaries?Date=20250611&Profile=CNN&utm_content=1749601372&utm_medium=social&utm_source=twitter']",Politics,Politics
2025-06-10 23:50:09+00:00,Southern Baptists overwhelmingly endorse a ban on gay marriage — including a call for reversing the Supreme Court's precedent legalizing it nationwide,https://x.com/CNN/status/1932586113706664105,"['https://www.cnn.com/2025/06/10/us/southern-baptists-gay-marriage-ban-vote?Date=20250610&Profile=CNN&utm_content=1749599406&utm_medium=social&utm_source=twitter', 'https://www.cnn.com/2025/06/10/us/southern-baptists-gay-marriage-ban-vote?Date=20250610&Profile=CNN&utm_content=1749599406&utm_medium=social&utm_source=twitter']",Politics,Politics
2025-06-10 21:28:10+00:00,"Judge denies California's request to immediately block Trump from using Marines and National Guard to enforce law, sets arguments for Thursday",https://x.com/CNN/status/1932550380904214704,"['https://www.cnn.com/us/live-news/la-protests-ice-raids-trump-06-10-25?Date=20250610&Profile=CNN&utm_content=1749590878&utm_medium=social&utm_source=twitter#cmbqvql660000356mqpt6znw1', 'https://www.cnn.com/us/live-news/la-protests-ice-raids-trump-06-10-25?Date=20250610&Profile=CNN&utm_content=1749590878&utm_medium=social&utm_source=twitter#cmbqvql660000356mqpt6znw1']",Politics,Politics
2025-06-10 19:08:19+00:00,California asks court for an emergency order blocking Trump administration from using National Guard to enforce laws in the state,https://x.com/CNN/status/1932515185069011348,"['https://www.cnn.com/us/live-news/la-protests-ice-raids-trump-06-10-25?Date=20250610&Profile=CNN&utm_content=1749582493&utm_medium=social&utm_source=twitter#cmbqryi2k00003b6nikxuuxzo', 'https://www.cnn.com/us/live-news/la-protests-ice-raids-trump-06-10-25?Date=20250610&Profile=CNN&utm_content=1749582493&utm_medium=social&utm_source=twitter#cmbqryi2k00003b6nikxuuxzo']",Politics,Politics
2025-06-10 16:49:39+00:00,"Deployment of National Guard and Marines in response to Los Angeles protests will cost $134 million, defense official testifies at House hearing",https://x.com/CNN/status/1932480290787651793,"['https://www.cnn.com/us/live-news/la-protests-ice-raids-trump-06-10-25?Date=20250610&Profile=cnnbrk&utm_content=1749574142&utm_medium=social&utm_source=twitter#cmbqpuadw00003b6n8feqi3wz', 'https://www.cnn.com/us/live-news/la-protests-ice-raids-trump-06-10-25?Date=20250610&Profile=cnnbrk&utm_content=1749574142&utm_medium=social&utm_source=twitter#cmbqpuadw00003b6n8feqi3wz']",National Security,National Security
2025-06-10 10:00:19+00:00,"Several people were killed in a shooting at a school in Graz, Austria, police say",https://x.com/CNN/status/1932377275648950678,"['https://www.cnn.com/2025/06/10/europe/austria-graz-suspected-shooting-incident-intl', 'https://www.cnn.com/2025/06/10/europe/austria-graz-suspected-shooting-incident-intl']",Breaking News,Breaking News
2025-06-10 01:04:57+00:00,"President Trump has authorized the deployment of 2,000 more National Guard troops to LA even as California sues to have his orders overturned",https://x.com/CNN/status/1932242550116491617,"['https://www.cnn.com/us/live-news/la-protests-ice-raids-trump-06-09-25?Date=20250610&Profile=CNN&utm_content=1749517490&utm_medium=social&utm_source=twitter#cmbpqlhkl0000356mg1bpu0q3', 'https://www.cnn.com/us/live-news/la-protests-ice-raids-trump-06-09-25?Date=20250610&Profile=CNN&utm_content=1749517490&utm_medium=social&utm_source=twitter#cmbpqlhkl0000356mg1bpu0q3']",Politics,Politics
2025-06-09 21:18:05+00:00,"In an unprecedented move, US Health and Human Services Secretary Robert F. Kennedy Jr. removed all 17 members of the CDC's expert panel of vaccine advisers, citing conflicts of interest",https://x.com/CNN/status/1932185455254020339,"['https://www.cnn.com/2025/06/09/health/rfk-cdc-vaccine-advisers-removed?Date=20250609&Profile=CNN&utm_content=1749503867&utm_medium=social&utm_source=twitter', 'https://www.cnn.com/2025/06/09/health/rfk-cdc-vaccine-advisers-removed?Date=20250609&Profile=CNN&utm_content=1749503867&utm_medium=social&utm_source=twitter']",Health News,Health News
2025-06-09 17:42:19+00:00,"Judge dismisses ""It Ends With Us"" director Justin Baldoni's $400 million defamation lawsuit against co-star Blake Lively and husband Ryan Reynolds",https://x.com/CNN/status/1932131156725543252,"['https://www.cnn.com/2025/06/09/entertainment/blake-lively-justin-baldoni?Date=20250609&Profile=CNN&utm_content=1749490939&utm_medium=social&utm_source=twitter', 'https://www.cnn.com/2025/06/09/entertainment/blake-lively-justin-baldoni?Date=20250609&Profile=CNN&utm_content=1749490939&utm_medium=social&utm_source=twitter']",Entertainment News,Entertainment News
2025-06-09 01:16:10+00:00,"Israeli military has boarded Gaza-bound aid ship carrying Greta Thunberg, the Freedom Flotilla Coalition says",https://x.com/CNN/status/1931882983708852508,"['https://www.cnn.com/2025/06/08/middleeast/freedom-flotilla-gaza-aid-ship-thunberg-intl-hnk?Date=20250609&Profile=CNN&utm_content=1749431767&utm_medium=social&utm_source=twitter', 'https://www.cnn.com/2025/06/08/middleeast/freedom-flotilla-gaza-aid-ship-thunberg-intl-hnk?Date=20250609&Profile=CNN&utm_content=1749431767&utm_medium=social&utm_source=twitter']",International News,International News
2025-06-08 19:24:25+00:00,"Multiple people airlifted to hospitals after a plane crashed in Tennessee, about 60 miles south of Nashville, highway patrol says",https://x.com/CNN/status/1931794463199744511,"['https://www.cnn.com/2025/06/08/us/coffee-county-tennessee-plane-crash?Date=20250608&Profile=CNN&utm_content=1749410659&utm_medium=social&utm_source=twitter', 'https://www.cnn.com/2025/06/08/us/coffee-county-tennessee-plane-crash?Date=20250608&Profile=CNN&utm_content=1749410659&utm_medium=social&utm_source=twitter']",Breaking News,Breaking News
2025-06-08 19:03:34+00:00,"Carlos Alcaraz wins Roland Garros, completing an extraordinary comeback from two sets down against Jannik Sinner in men's final",https://x.com/CNN/status/1931789215202791663,"['https://www.cnn.com/2025/06/08/sport/carlos-alcaraz-jannik-sinner-french-open-final-spt?Date=20250608&Profile=CNN&utm_content=1749409407&utm_medium=social&utm_source=twitter', 'https://www.cnn.com/2025/06/08/sport/carlos-alcaraz-jannik-sinner-french-open-final-spt?Date=20250608&Profile=CNN&utm_content=1749409407&utm_medium=social&utm_source=twitter']",Sports,Sports
2025-06-08 16:06:13+00:00,"National Guard troops have arrived in Los Angeles in response to immigration protests, and a Democratic congresswoman says she's been told to expect 30 days of ICE enforcement. Follow live updates.",https://x.com/CNN/status/1931744582322073952,"['https://www.cnn.com/politics/live-news/trump-presidency-news-06-08-25?Date=20250608&Profile=CNN&utm_content=1749398747&utm_medium=social&utm_source=twitter', 'https://www.cnn.com/politics/live-news/trump-presidency-news-06-08-25?Date=20250608&Profile=CNN&utm_content=1749398747&utm_medium=social&utm_source=twitter']",Politics,Politics
2025-06-08 12:04:43+00:00,"Moscow claims its soldiers are advancing into a region of central Ukraine for the first time, which could create problems for Kyiv's stretched forces",https://x.com/CNN/status/1931683806651486622,"['https://www.cnn.com/2025/06/08/europe/russia-claims-offensive-dnipropetrovsk-intl?Date=20250608&Profile=CNN&utm_content=1749384275&utm_medium=social&utm_source=twitter', 'https://www.cnn.com/2025/06/08/europe/russia-claims-offensive-dnipropetrovsk-intl?Date=20250608&Profile=CNN&utm_content=1749384275&utm_medium=social&utm_source=twitter']",World News,World News
2025-06-08 01:53:58+00:00,President Trump deploys the National Guard after second day of Los Angeles immigration protests,https://x.com/CNN/status/1931530106033381684,"['https://www.cnn.com/2025/06/06/us/los-angeles-immigration-enforcement-protesters?Date=20250608&Profile=CNN&utm_content=1749347620&utm_medium=social&utm_source=twitter', 'https://www.cnn.com/2025/06/06/us/los-angeles-immigration-enforcement-protesters?Date=20250608&Profile=CNN&utm_content=1749347620&utm_medium=social&utm_source=twitter']",National News,National News
2025-06-08 00:09:32+00:00,"Colombian presidential candidate Miguel Uribe has been shot in Bogota, police say",https://x.com/CNN/status/1931503828274176230,"['https://www.cnn.com/2025/06/07/americas/colombian-presidential-candidate-uribe-shot-bogota-intl-latam?Date=20250608&Profile=CNN&utm_content=1749341366&utm_medium=social&utm_source=twitter', 'https://www.cnn.com/2025/06/07/americas/colombian-presidential-candidate-uribe-shot-bogota-intl-latam?Date=20250608&Profile=CNN&utm_content=1749341366&utm_medium=social&utm_source=twitter']",Breaking News,Breaking News
2025-06-07 23:33:55+00:00,"Sovereignty crosses the finish line first at the Belmont Stakes, winning two legs of the Triple Crown after not competing at Preakness https://cnn.it/4jIiNfb",https://x.com/CNN/status/1931494863687594057,['https://www.cnn.com/2025/06/07/sport/sovereignty-2025-belmont-stakes-spt?Date=20250607&Profile=CNN&utm_content=1749339156&utm_medium=social&utm_source=twitter'],Sports,Sports
2025-06-07 22:58:46+00:00,"Happening Now: See George Clooney's ""Good Night, and Good Luck"" in a historic Broadway first. Watch live on CNN, http://CNN.com and streaming on Max: https://cnn.it/4jPCvWw",https://x.com/CNN/status/1931486017745236039,"['https://www.cnn.com/', 'https://www.cnn.com/?Date=20250607&Profile=CNN&utm_content=1749337083&utm_medium=social&utm_source=twitter']",Entertainment,Entertainment
2025-06-07 16:17:48+00:00,"Coco Gauff becomes the first American since Serena Williams to win the French Open, defeating world No. 1 Aryna Sabalenka in a thrilling women's final",https://x.com/CNN/status/1931385112710582464,"['https://www.cnn.com/2025/06/07/sport/coco-gauff-aryna-sabalenka-french-open-final-spt?Date=20250607&Profile=CNN&utm_content=1749313061&utm_medium=social&utm_source=twitter', 'https://www.cnn.com/2025/06/07/sport/coco-gauff-aryna-sabalenka-french-open-final-spt?Date=20250607&Profile=CNN&utm_content=1749313061&utm_medium=social&utm_source=twitter']",Sports,Sports
2025-06-07 02:27:48+00:00,A federal judge has signed off on a $2.8 billion settlement that will pave the way for US colleges to pay athletes millions,https://x.com/CNN/status/1931176232760094874,"['https://www.cnn.com/2025/06/06/sport/settlement-colleges-pay-athletes-millions-spt?Date=20250607&Profile=CNN&utm_content=1749263234&utm_medium=social&utm_source=twitter', 'https://www.cnn.com/2025/06/06/sport/settlement-colleges-pay-athletes-millions-spt?Date=20250607&Profile=CNN&utm_content=1749263234&utm_medium=social&utm_source=twitter']",Sports News,Sports News
2025-06-06 23:00:25+00:00,The Supreme Court mistakenly sent emails about which cases would be granted or denied this afternoon. It's the second major technical error in a year.,https://x.com/CNN/status/1931124044754989368,"['https://www.cnn.com/2025/06/06/politics/supreme-court-mistakenly-emails-orders?Date=20250606&Profile=CNN&utm_content=1749250823&utm_medium=social&utm_source=twitter', 'https://www.cnn.com/2025/06/06/politics/supreme-court-mistakenly-emails-orders?Date=20250606&Profile=CNN&utm_content=1749250823&utm_medium=social&utm_source=twitter']",Legal News,Legal News
2025-06-06 22:51:48+00:00,"A former Arkansas police chief who escaped from prison has been recaptured, sheriff's office says",https://x.com/CNN/status/1931121876954177687,"['https://www.cnn.com/2025/06/06/us/grant-hardin-arkansas-captured?Date=20250606&Profile=CNN&utm_content=1749250297&utm_medium=social&utm_source=twitter', 'https://www.cnn.com/2025/06/06/us/grant-hardin-arkansas-captured?Date=20250606&Profile=CNN&utm_content=1749250297&utm_medium=social&utm_source=twitter']",Crime,Law & Order
2025-06-06 21:40:57+00:00,The suspect accused of carrying out the Colorado antisemitic attack appeared in court for a hate crime charge today. He faces nearly 120 state charges.,https://x.com/CNN/status/1931104045306933515,"['https://www.cnn.com/2025/06/06/us/boulder-attack-mohamed-soliman-court-hnk?Date=20250606&Profile=CNN&utm_content=1749246020&utm_medium=social&utm_source=twitter', 'https://www.cnn.com/2025/06/06/us/boulder-attack-mohamed-soliman-court-hnk?Date=20250606&Profile=CNN&utm_content=1749246020&utm_medium=social&utm_source=twitter']",Crime,Law & Order
2025-06-06 20:47:39+00:00,The Supreme Court says DOGE can access sensitive Social Security data and doesn't have to hand over documents in court case,https://x.com/CNN/status/1931090632367341637,"['https://www.cnn.com/2025/06/06/politics/supreme-court-restores-doges-access-to-sensitive-social-security-data?Date=20250606&Profile=CNN&utm_content=1749242824&utm_medium=social&utm_source=twitter', 'https://www.cnn.com/2025/06/06/politics/supreme-court-restores-doges-access-to-sensitive-social-security-data?Date=20250606&Profile=CNN&utm_content=1749242824&utm_medium=social&utm_source=twitter']",Legal News,Legal News
2025-06-06 19:45:20+00:00,"Kilmar Abrego Garcia, who was mistakenly deported to El Salvador in March, will be returned to the US, where he will face federal criminal charges",https://x.com/CNN/status/1931074950250582195,"['https://www.cnn.com/2025/06/06/politics/kilmar-abrego-garcia?Date=20250606&Profile=CNN&utm_content=1749239102&utm_medium=social&utm_source=twitter', 'https://www.cnn.com/2025/06/06/politics/kilmar-abrego-garcia?Date=20250606&Profile=CNN&utm_content=1749239102&utm_medium=social&utm_source=twitter']",Crime,Law & Order
2025-06-06 18:39:14+00:00,"President Trump is preparing a large-scale cancellation of federal funding for California, sources say",https://x.com/CNN/status/1931058317251461550,"['https://www.cnn.com/2025/06/06/politics/trump-california-federal-funding?Date=20250606&Profile=CNN&utm_content=1749235131&utm_medium=social&utm_source=twitter', 'https://www.cnn.com/2025/06/06/politics/trump-california-federal-funding?Date=20250606&Profile=CNN&utm_content=1749235131&utm_medium=social&utm_source=twitter']",Politics,Politics
2025-06-06 02:33:56+00:00,A judge has halted a proclamation to suspend new international student visas at Harvard hours after the university filed an amended lawsuit.,https://x.com/CNN/status/1930815392286441753,"['https://www.cnn.com/2025/06/05/us/harvard-trump-proclamation?Date=20250606&Profile=CNN&utm_content=1749177230&utm_medium=social&utm_source=twitter', 'https://www.cnn.com/2025/06/05/us/harvard-trump-proclamation?Date=20250606&Profile=CNN&utm_content=1749177230&utm_medium=social&utm_source=twitter']",Education,Education
