create_time,username,video_description,view_count,like_count,share_count,comment_count,region_code,id,section,merged_section
2025-06-02 22:50:00,nytimes,"Tourists on the Italian island of Sicily were forced to flee on Monday from the slopes of Mount Etna, one of Europe’s largest and most active volcanoes, after an eruption sent clouds of gas, rock and ash billowing into the sky. #etna #sicily #eruption #volcano",68391,799,86,16,US,7511481811470519598,World News,World News
2025-06-02 17:27:54,nytimes,"If you missed the northern lights on Sunday, here's your chance: This time-lapse video shows how streaks of colorful light painted the night sky across parts of the U.S. as a geomagnetic storm made the northern lights, or aurora borealis, visible. #northernlights #auroraborealis",12550,408,16,8,US,7511404138169683246,Science/Environment,Science/Environment
2025-06-02 17:02:43,nytimes,"Presidential threats. Onerous investigations. Extensive funding cuts. The Trump administration has wielded all three against Harvard University, and the battle has continued to escalate. Tap the link for a full look at all the actions Trump has taken against Harvard so far. #harvard #trump #donaldtrump",17416,783,12,23,US,7511398343336267054,Politics,Politics
2025-06-02 08:30:11,nytimes,"Eight people were hospitalized, and two of them were in serious condition, after a man in Boulder, Colorado, used a “makeshift flamethrower” on Sunday to attack a crowd of peaceful demonstrators honoring Israeli hostages in Gaza. The authorities said they were investigating the attack as an act of terrorism. #Boulder #Colorado",127962,2637,336,150,US,7511265826079804718,Breaking News,Breaking News
2025-06-02 01:56:57,nytimes,"Creatine has long been a popular supplement among athletes and body builders. But on social media, claims about creatine go beyond the weight room. Julia Calderone, an editor for Well, explains. #creatine #wellness #supplements #muscles #exercise #health  ",78952,3043,312,97,US,7511164998735908142,Health,Health
2025-06-01 23:25:35,nytimes,"Ukraine launched on Sunday one of its broadest aerial assaults of the war against air bases inside Russia, a coordinated operation that targeted sites from eastern Siberia to Russia’s western border. Russia also struck a Ukrainian military training base on Sunday, killing at least 12 soldiers. Read the latest at the link in our bio. #russia #ukraine ",19967,375,14,19,US,7511126040069147950,World News,World News
2025-06-01 18:28:08,nytimes,"Miley Cyrus said we could ask her anything. In an in-depth conversation with The New York Times, she discussed stardom, rage, therapy, Dolly Parton, her new album and more. Watch our full conversation with @Miley Cyrus for “The Interview” on YouTube at the link in our bio. Video by Eddie Costas, Alfredo Chiarappa, Pat Gunther, Felice León and Brooke Minters/The New York Times #mileycyrus #somethingbeautiful #tattoos ",90344,4646,113,33,US,7511049335207939370,Entertainment,Entertainment
2025-06-01 17:12:34,nytimes,"For the first time in Mexico’s history, voters will elect more than 2,600 judges and magistrates, including those who will sit on the Supreme Court and hundreds of other federal, state and local tribunals. Our reporter breaks down why the new approach is so controversial. Learn more about the election at the link in our bio. Video by Emiliano Rodriguez Mega, Christina Thornell, David Seekamp and Laura Salaberry/The New York Times #mexico #elections  ",31408,2140,132,141,US,7511029844432407850,Politics,Politics
2025-06-01 14:46:10,nytimes,"The Pacers came in as the returning Eastern Conference finalist most had forgotten about. After ousting the Knicks and booking their first Finals ticket in 25 years, all of New York, and the basketball world, remembers them now. Read more from @The Athletic at the link in our bio. #pacers #knicks #nba #playoffs",12034,166,1,8,US,7510992011504241966,Sports,Sports
2025-06-03 23:50:00,nytimes,"The governing coalition in the Netherlands collapsed on Tuesday after the populist leader Geert Wilders withdrew his party over a dispute about migration policy, ending a rocky 11-month rule by the country’s first far-right government and triggering early elections. #netherlands",29550,964,52,24,US,7511869351494946094,Politics,Politics
2025-06-03 17:14:05,nytimes,"Raw milk. Vaccine skepticism. Natural births. The so-called ""Make America Healthy Again"" movement, associated with Health Secretary Robert F. Kennedy Jr., is changing the kind of information parents see on their social media feeds, including misinformation. Emma Goldberg, a reporter covering societal change for The New York Times, talks with a mom about how MAHA ideas are resonating and how the trend is changing the way parents raise their kids. Video by Emma Goldberg, Melanie Bencosme, Karen Hanley, Gabriel Blanco, David Jouppi, James Surdam, Shivani Khattar/The New York Times #maha #healthy #rfk",17164,683,29,22,US,7511772325214735662,Health,Health
2025-06-03 15:56:57,nytimes,"Israeli soldiers opened fire Tuesday morning near crowds of Palestinians walking toward a new food distribution site in southern Gaza, the Israeli military said. The Red Cross and Gaza health ministry said at least 27 people had been killed. This is the second large-scale deadly shooting in three days near the distribution site in the southern city of Rafah, where thousands of Palestinians have tried to secure aid. #Gaza #GazaAid #IsraeliMilitary",27772,1481,119,97,US,7511752413469183278,World News,World News
2025-06-04 17:03:08,nytimes,"At least 10 people were killed and dozens were injured on Wednesday in a crowd crush outside a stadium in the Indian city of Bengaluru as tens of thousands celebrated a Premier League cricket championship, officials said. #Cricket #India #PremierLeague",11551,252,4,20,US,7512140642085096747,Breaking News,Breaking News
2025-06-04 16:17:47,nytimes,"As a child, Shamsa Sharawe was brutally cut. As an adult, she underwent hours of reconstruction surgery. As a mother, she vowed to protect her daughter from female genital cutting. And now as a social media influencer, she is persuading others to do the same. @Official Araweelo Photos by Nariman El-Mofty ",910030,29926,320,36,US,7512129040568864031,Health,Health
2025-06-04 09:45:25,nytimes,"Smoke from Canadian wildfires is expected to shroud parts of the Northeast on Wednesday, creating airborne pollution and hazy skies that had passed through sections of the Upper Midwest on Tuesday.",11707,166,7,8,US,7512027351157574958,Environment,Environment
2025-06-04 03:30:00,nytimes,"Lee Jae-myung has won South Korea's presidential election by a wide margin, after the country faced months of political turmoil. Lee’s campaign has ridden a wave of anger against former President Yoon Suk Yeol after he tried to impose martial law in December. Video by Choe Sang-Hun and Nikolay Nikolov/The New York Times. #SouthKorea #Elections #LeeJaemyung",80953,6876,297,100,US,7511794221658115374,Politics,Politics
2025-06-05 21:52:27,nytimes,"Elon Musk and President Trump’s unlikely alliance deteriorated in a remarkably swift and public fashion over the course of a few hours on Thursday, with each posting about the other from their own social media platforms, escalating their feud with attacks over matters significant and petty. #Trump #Musk",2733,44,5,4,US,7512586416782691626,Politics,Politics
2025-06-05 20:57:11,nytimes,"The Nintendo Switch 2 is out now — and the company is relying on 90’s nostalgia and celebrity power to market its new console. Zachary Small, a culture reporter for The New York Times, analyzes Nintendo’s marketing over the years and what it tells us about the company. Video by Zachary Small, Claire Hogan and David Jouppi/The New York Times #nintendo #switch2 #videogames",1134290,115624,3844,1355,US,7512572188357266734,Entertainment,Entertainment
2025-06-05 20:28:07,nytimes,"In the first debate of the New York City mayoral primary, former Gov. Andrew Cuomo faced a barrage of attacks from his Democratic rivals. The two-hour debate descended into chaos on more than one occasion, as the candidates shouted at one another, the cacophony worsening when the moderators jumped in to interrupt. #nyc #nycmayoraldebate #nycmayor ",148157,3148,102,104,US,7512564698307464490,Politics,Politics
2025-06-05 17:53:57,nytimes,"Before Addison Rae became part of TikTok’s first wave of superstars, she remembers promoting popular songs on the app for $20 a video. Watch or listen to the full interview on @popcast at the link above where @addisonre talks about redefining her public image, finding her artistic voice, and the long road from viral fame to debut album. Video by Pat Gunther, Jamie Hefetz, Mark Zemel, Dave Mayers and Sophie Erickson #AddisonRae #Popcast #music",12852,395,4,6,US,7512524966877908270,Entertainment,Entertainment
2025-06-05 16:51:16,nytimes,"New Zealand’s Parliament on Thursday suspended three opposition lawmakers over their performance of the haka, a traditional Māori dance, as a protest while the body was considering a contentious bill last year. #NewZealand #Parliament #Haka",1264923,36540,1826,1294,US,7512508817976905003,Politics,Politics
2025-06-05 14:05:30,nytimes,"Video of a child escaping a burning building after an Israeli airstrike garnered widespread attention online. We found her in a hospital in Gaza and pieced together what had happened. Video by Nader Ibrahim, Saher Alghorra, Bilal Shbair, Axel Boada, Sanjana Varghese, Laura Salaberry, Jon Hazell and Monika Cvorak/The New York Times",983503,175081,19244,5098,US,7512466081882180907,World News,World News
2025-06-06 21:26:12,nytimes,An interstate has been closed. A drone has been deployed. Professional tracking groups and trained dogs have been dispatched. They’re all on the case of this missing zebra that has been running wild in Tennessee. #zebra #wildlife #tennessee,90194,3846,508,112,US,7512950693741759790,Wildlife News,Wildlife News
2025-06-06 16:22:03,nytimes,"Ryan Mac has covered Elon Musk for years and was co-author of a book about him, but he’s never seen anything quite like this. He describes what set off the meltdown in Musk and President Trump’s relationship, and its potential effects. Video by Ryan Mac, Gabriel Blanco and Nikolay Nikolov/The New York Times #trump #elonmusk",206889,10802,362,376,US,7512872250429672750,Politics,Politics
2025-06-06 15:45:59,nytimes,"Hamed Aleaziz, who covers the Department of Homeland Security and immigration policy for The New York Times, explains the new travel ban President Trump signed this week — and how it differs from the one from Trump's first term. #trump #travel #travelban",20397,589,40,12,US,7512862971979124014,Politics,Politics
2025-06-06 14:26:12,nytimes,"From @theathletic: Tyrese Haliburton, the new king of the playoff winner, hit a jumper with 0.3 seconds left to give the Indiana Pacers an improbable win over the Oklahoma City Thunder in Game 1 of the NBA Finals. #NBA #Playoffs #TyreseHaliburton #NBAFinals",9432,171,5,7,US,7512842276960439598,Sports,Sports
2025-06-06 12:49:51,nytimes,"Before Addison Rae’s rise to fame on TikTok, she got her start on social media creating fan pages for One Direction and a “Dance Moms” star, Brooke Hyland. Read, watch or listen to the full interview on ""Popcast"" at the link above. Video by Pat Gunther, Jamie Hefetz, Mark Zemel, Dave Mayers and Sophie Erickson/The New York Times #AddisonRae #Popcast #DanceMoms",9427,430,2,6,US,7512817451243949354,Entertainment,Entertainment
2025-06-06 10:00:59,nytimes,"Russia on Friday launched one of the largest barrages of missiles and drones of the war at targets across Ukraine, killing at least four people and damaging buildings in Kyiv, two days after Moscow vowed retaliation for Ukraine’s recent audacious assault on Russian strategic bomber bases. #Ukraine #Kyiv #Russia",53241,2246,35,288,US,7512773867127967018,World News,World News
2025-06-06 02:09:34,nytimes,"Miley Cyrus’s new album, “Something Beautiful,” is her attempt to reclaim and reimagine what “beautiful” means. To watch @Miley Cyrus’s full conversation with Lulu Garcia-Navarro and see more clips, follow “The Interview” on YouTube: youtube.com/@theinterviewpodcast. Video by Eddie Costas, Alfredo Chiarappa, Pat Gunther, Felice León and Brooke Minters/The New York Times #mileycyrus #somethingbeautiful  ",6847,255,16,14,US,7512652584998653230,Entertainment,Entertainment
2025-06-07 20:20:40,nytimes,"The mayor of Kharkiv, Ukraine, described an overnight Russian air assault as “the most powerful attack” since the beginning of the war. At least four people were killed on Saturday, according to the local authorities. #kharkiv #ukraine #russia",128756,4083,61,505,US,7513304863405542698,World News,World News
2025-06-07 15:41:02,nytimes,"Misty Copeland is retiring from American Ballet Theatre after a groundbreaking career. In an in-depth conversation with The New York Times, she discussed preparing for her final performance, her unstable childhood, after-parties with Prince and more. Watch our full conversation with @mistycopeland for “The Interview” at the link in our bio. Video by Pat Gunther, Eddie Costas, Alfredo Chiarappa, Abhita Austin, Felice León and Brooke Minters #mistycopeland #americanballettheater #ballet",8382,427,4,5,US,7513232756646612267,Arts,Arts
2025-06-08 15:01:25,nytimes,"Kilmar Abrego Garcia, who was wrongly deported to El Salvador, was flown back to the U.S. on Friday to face federal criminal charges. Devlin Barrett, who covers the Justice Department, explains the charges and what may come next for Garcia. Video by Devlin Barrett, Laura Bult, Alexandra Ostasiewicz #kilmarabregogarcia #trump ",156514,11546,401,493,US,7513593628242070830,Crime,Law & Order
2025-06-08 00:39:28,nytimes,"Federal immigration officials on Saturday squared off with hundreds of protesters in Paramount, California, using tear gas, rubber bullets and flash-bang grenades to disperse people. The standoff followed a series of immigration raids that swept through Los Angeles on Friday. #losangeles #immigration #ice #california",2104090,117757,10375,9041,US,7513371552210095406,National News,National News
2025-06-09 23:10:00,nytimes,"Brianna Vargas, 24, stood on an overpass above a highway in Los Angeles with a megaphone in hand. She said she was protesting against recent federal immigration raids for her parents, who had emigrated from Mexico and El Salvador, and for others who were too afraid to leave their homes. Reposting messages of solidarity with victims of immigration enforcement raids on social media is one thing, she said. “It’s different when you’re actually here.” #losangeles#protests #immigration",16162,816,8,24,US,7514081774553828654,Local News,Local News
2025-06-09 21:49:48,nytimes,"The app Yuka, which Robert F. Kennedy Jr., the U.S. health secretary, has called “invaluable,” assigns health scores to food. But can it actually help people make better choices? Caroline Hopkins Legaspi, a reporter for Well, explains. Video by Caroline Hopkins Legaspi and Theodore Tae/The New York Times #Yuka #YukaApp",65123,2819,460,111,US,7514070003193253163,Health,Health
2025-06-09 19:10:04,nytimes,"The New York City mayoral primary is just under three weeks away. Our City Hall bureau chief, Emma Fitzsimmons, highlights the two front-runners, Andrew Cuomo and Zohran Mamdani, and their plans for the three main issues for voters. Video by Emma G. Fitzsimmons, Karen Hanley and James Surdam #nyc #nycmayor #AndrewCuomo #ZohranMamdani",1091707,132190,3595,1803,US,7514028782328548654,Politics,Politics
2025-06-09 18:32:14,nytimes,"A federal judge on Monday dismissed a lawsuit that the actor Justin Baldoni had filed against his former co-star Blake Lively and her husband, Ryan Reynolds, as well as his defamation lawsuit against The New York Times. This is a developing story. Photo by Cindy Ord/Getty Images ",9568,149,9,15,US,7514019086183976234,Entertainment,Entertainment
2025-06-09 17:54:16,nytimes,"California officials will sue President Trump for taking control of the state’s National Guard and deploying troops to the streets of Los Angeles. The legal challenge, announced by Gov. Gavin Newsom, was expected to be filed on Monday morning, as protests were planned in more cities over federal immigration enforcement. Photos by Gabriela Bhaskar/The New York Times, Eric Thayer/Associated Press and Jae Hong/Associated Press #LosAngeles #ICE #ICEraids #NationalGuard ",217976,8368,65,393,US,7514009363783126302,Politics,Politics
2025-06-09 14:40:30,nytimes,"Waymo, the robot taxi company, cut off service to the downtown Los Angeles area after people protesting President Trump's immigration policies set multiple self-driving vehicles on fire on Sunday. #LA #immigration #fire",40599,1000,70,87,US,7513959181624380715,Local News,Local News
2025-06-09 11:30:22,nytimes,"Footage from the Freedom Flotilla Coalition and the Israeli authorities shows what happened when Israel diverted a civilian ship, with Greta Thunberg onboard, that was headed to Gaza.",52812,3210,125,178,US,7513910150453857582,International News,International News
2025-06-09 07:46:12,nytimes,"Law enforcement officers in Los Angeles clashed for a third day on Sunday with crowds of people demonstrating against the Trump administration’s crackdown on immigration. But even as tear gas wafted over pockets of downtown, the rest of the sprawling city kept to its usual sunlit rhythms. #LosAngeles #Protests #NationalGuard",68000,4082,272,298,US,7513852313669340459,National News,National News
2025-06-09 02:29:07,nytimes,"Misty Copeland made history as the first Black woman ever to be named a principal dancer with the American Ballet Theater. She recently reflected on her groundbreaking career, motherhood and growing up in near poverty. Watch our full conversation with @Misty Copeland for “The Interview” at the link in our bio. Video by Pat Gunther, Eddie Costas, Alfredo Chiarappa, Abhita Austin, Felice León and Brooke Minters. #mistycopeland #americanballettheater #ballet #journaling ",4849,151,5,5,US,7513770948709879086,Arts,Arts
2025-06-09 01:49:02,nytimes,"Saturday’s WorldPride parade was part of the three-week WorldPride festival, one of the biggest celebrations for the LGBTQ community in the world. Amid the joy and celebration, there was an undercurrent of anger and worry. Video by Amy Harmon, Claire Hogan and Karen Hanley/The New York Times #WorldPride #pride #trump ",20966,950,19,14,US,7513760548014673194,LGBTQ+ News,LGBTQ+ News
2025-06-10 22:17:13,nytimes,The police in Northern Ireland have condemned an outbreak of disorder in the town of Ballymena on Monday night in which 15 officers were injured and houses and shops were set on fire. The police said the attacks were being investigated as racially motivated. #northernireland #ballymena,102121,6161,412,218,US,7514448233565850926,Crime,Law & Order
2025-06-10 22:00:00,nytimes,"Experts say that some aggressive measures used by the authorities in the Los Angeles protests have violated polices as well as injunctions put into place after the George Floyd protests. Livia Albeck-Ripka, a New York Times reporter based in Los Angeles, describes how she was one of the reporters struck by crowd control munitions. Video by Livia Albeck-Ripka, Gabriel Blanco, Christina Shaman and Nikolay Nikolov/The New York Times #LosAngeles #ICE #ICEraids #NationalGuard",68750,13581,900,208,US,7514427567613529387,Breaking News,Breaking News
2025-06-10 20:29:04,nytimes,RM and V of the K-pop boy band BTS emerged from a base in South Korea on Wednesday and gave fans a brief saxophone performance. Three other members of the group will finish their national service this month. #BTS #KPop #RM #V,19080,554,40,10,US,7514420188431928618,Entertainment,Entertainment
2025-06-10 15:05:00,nytimes,"The protests against the Trump administration’s immigration policies that started in Los Angeles have spread to at least two dozen cities, including San Francisco, Dallas, Austin and New York City. Follow live updates. #immigration #LosAngeles #NYC #SanFrancisco #Dallas #Austin #Trump #ICE",22900,2094,98,47,US,7514332363392830763,Politics,Politics
2025-06-11 21:26:46,nytimes,"A wildfire that started on Tuesday afternoon north of the San Bernardino Mountains in Southern California had exploded to more than 4,200 acres by Wednesday morning, officials said.  #California #Wildfire #SanBernadino",37786,619,60,40,US,7514806216766393642,Breaking News,Breaking News
2025-06-11 20:55:00,nytimes,"California has sued the Trump administration over its move to deploy troops to Los Angeles. Eric Schmitt, our national security correspondent, explains the laws governing the use of American troops on U.S. soil. #LosAngeles #California #NationalGuard #Marines #Trump",16341,561,15,23,US,7514793079161851178,National News,National News
2025-06-11 18:58:27,nytimes,"Three paramedics and a photographer with them were killed late Monday in Gaza. Among the medics killed was Hussein Mohsen, who was interviewed by The New York Times last month after rescuing two 5-year-old girls from the aftermath of an Israeli strike. #Palestine #Gaza #Israel",19148,425,33,13,US,7514767970468482350,World News,World News
2025-06-11 15:51:43,nytimes,"A New York Times immigration reporter traveled to Miami to observe how immigrant arrest operations have changed under pressure from the Trump administration. Here’s what he found. Video by Hamed Aleaziz, Nicole Salazar, Carlos Prieto and Mark Boyer. #Miami #ICE #DonaldTrump #Immigration",21555,740,52,40,US,7514719859503123758,Immigration,Immigration
2025-06-11 16:05:00,nytimes,"A second night of rioting struck the town of Ballymena in Northern Ireland on Tuesday, as anti-immigrant protests spread to several other areas and the police warned of “hate-fueled acts.” #Ballymena #NorthernIreland #Ireland",95030,2454,263,132,US,7514719185063333166,News,News
2025-06-11 10:25:55,nytimes,Cities across the U.S. are bracing for a new round of immigration protests on Wednesday after the Los Angeles mayor imposed an overnight curfew downtown and Governor Gavin Newsom of California blamed President Trump for unrest that began with deportation raids last week. Follow live updates at the link in our bio. #losangeles #LA #protests #california #curfew,128914,11948,130,308,US,7514636018503453994,Politics,Politics
2025-06-11 07:59:43,nytimes,"Hamed Aleaziz, a New York Times immigration reporter, traveled to Miami to observe how immigrant arrest operations have changed under pressure from the Trump administration. Video by: Hamed Aleaziz, Nicole Salazar, Carlos Prieto and Mark Boyer #Miami #ICE #Deportations",102292,8132,1187,322,US,7514598338310802730,Immigration,Immigration
2025-06-11 03:16:51,nytimes,Gov. Gavin Newsom made the case in a televised address Tuesday evening that President Trump’s decisions to send military forces to immigration protests in Los Angeles have put the U.S. at the precipice of authoritarianism. #newsom #california #losangeles #trump,1562177,236639,4826,3134,US,7514525467731299627,Politics,Politics
2025-06-12 21:51:31,nytimes,"Senator Alex Padilla, Democrat of California, was forcibly removed from a news conference being held by Kristi Noem, the Homeland Security secretary, and handcuffed on Thursday after he pushed past guards at a federal building in West Los Angeles. #AlexPadilla #KristiNoem #California #LosAngeles #immigration",593138,35399,3607,1975,US,7515183775098375470,Politics,Politics
2025-06-12 20:12:24,nytimes,"Gov. Gavin Newsom of California sat down with Michael Barbaro to discuss President Trump, illegal immigration, the protests and how he thinks the standoff in Los Angeles will end. Listen to ""The Daily.""  #Newsom#TheDaily#LosAngeles#california#Trump",37492,7041,55,124,US,7515158247322455342,Politics,Politics
2025-06-12 16:59:21,nytimes,"Rescuers were combing the wreckage of an Air India passenger jet bound for London that crashed moments after takeoff Thursday in Ahmedabad, searching for survivors. More than 200 people had died and dozens remained unaccounted for, according to officials. It was not immediately clear what had caused the plane to crash. #AirIndia #Ahmedabad #India",1544841,20331,672,345,US,7515108492445895982,Breaking News,Breaking News
2025-06-12 15:22:18,nytimes,"From @theathletic: Game 3 of the NBA Finals revealed what the Indiana Pacers look like at their best: dogged, determined and dominant when it matters most.  Click the link above to read our game recap. #nbafinals #nba #playoffs",102044,402,5,6,US,7515083466988457258,Sports,Sports
2025-06-12 13:58:41,nytimes,"More than 200 people were killed when an Air India flight bound for London crashed into a medical college shortly after taking off in the western Indian city of Ahmedabad on Thursday, the city police commissioner said. #Ahmedabad #India",17948,333,19,11,US,7515061907158781230,Breaking News,Breaking News
2025-06-12 11:35:10,nytimes,"Aid agencies say Gaza faces the threat of widespread starvation in the wake of the 80-day Israeli blockade on food deliveries that ended in mid-May. Two young Gazans, Salem Madhat Alaydi and Aya Ehab Zaid, describe what it is like to fight hunger.",60257,5653,211,89,US,7515024920708009259,World News,World News
2025-06-12 01:10:00,nytimes,"Brian Wilson, the leader and chief songwriter of The Beach Boys, wrote several hits in the 1960s, a musical counterpart to the myth of Southern California as paradise. He has died at 82. #BrianWilson #BeachBoys",8052,194,5,10,US,7514854597589060906,Obituaries,Obituaries
