create_time,username,video_description,view_count,like_count,share_count,comment_count,region_code,id,section,merged_section
2025-06-13 23:40:00,nytimes,"Iran fired ballistic missiles that struck at least seven sites around Tel Aviv on Friday night, injuring dozens of Israelis. The move was in retaliation to the Israeli attacks on Iranian nuclear sites and military leaders. #Iran #Israel",93393,4185,267,131,US,7515576688898510126,World News,World News
2025-06-13 22:40:44,nytimes,"The seven New York City mayoral candidates sparred over immigration, affordability and President Trump’s policies in the final Democratic debate ahead in the primary. #nyc #nycmayor #AndrewCuomo #ZohranMamdani ",99245,1430,552,73,US,7515567400922860846,Politics,Politics
2025-06-13 20:40:14,nytimes,Viswash Kumar Ramesh was one of 242 people on the Air India plane that went down shortly after takeoff from the international airport in Ahmedabad. He's also the only known survivor.  #AirIndia #plane #Ahmedabad #India,19094,205,11,3,US,7515536382870179118,News,News
2025-06-13 19:29:24,nytimes,"“I still can’t believe how I got out alive.” When the Air India plane with 242 people on board crashed into a building moments after taking off from the international airport in Ahmedabad, India, it burst into flames. Viswash Kumar Ramesh was the only passenger who survived. Photo: Still image taken from Narendra Modi Youtube Channel, via Agence France-Presse — Getty Images #AirIndia #Flight171 #ViswashKumarRamesh ",183983,1469,48,30,US,7515518190957464862,Breaking News,Breaking News
2025-06-13 14:00:06,nytimes,"From @The Athletic: Some Stanley Cup Final games are not easily forgotten. If the Edmonton Oilers go on to win two more games and end Canada’s 32-year Cup drought, everyone will remember where they were on June 12, 2025. Click the link above to read more. #stanleycup #stanleycupfinal #EdmontonOilers #Canada ",16779,314,8,8,US,7515433368813767982,Sports,Sports
2025-06-13 06:40:39,nytimes,"Israel launched a stunning series of strikes against Iran on Friday morning, targeting the country’s nuclear program and killing three of the nation’s security chiefs. The wide-ranging attack prompted fears that long-simmering tensions between the heavily armed rivals were spiraling into a full-blown regional war. #Israel #Iran",24175,693,38,53,US,7515320132143566126,World News,World News
2025-06-13 05:22:55,nytimes,"The Trump administration is facing legal challenges to its deployment of Marines and National Guard troops to Los Angeles. Shawn Hubler, the Los Angeles bureau chief for The New York Times, talks with Katrin Bennhold, a senior writer, about what she’s seen on the ground in the city. #Trump #LAProtests #Deportations",46719,5167,317,158,US,7515300101326196011,Politics,Politics
2025-06-14 21:15:00,nytimes,"In sweeping attacks that started Friday, Israel struck at the regime in Tehran, hitting Iranian nuclear and military assets. Iran retaliated with barrages of ballistic missiles and drones. It is the most intense fighting in decades between the two heavily armed countries. To understand what’s happening in the region, Katrin Bennhold, a New York Times senior writer, spoke with Patrick Kingsley, the Jerusalem bureau chief. Video by Katrin Bennhold, Patrick Kingsley, Melanie Bencosme, Nikolay Nikolov, Christina Thornell, Christina Shaman and Laura Salaberry/The New York Times #iran #israel",117184,6220,185,122,US,7515908444675853614,World News,World News
2025-06-14 20:43:38,nytimes,"Officials in Minnesota were searching for the person who shot and killed State Representative Melissa Hortman and her husband in their home, in what Gov. Tim Walz described as a politically motivated attack. The suspect also shot and injured another Democratic lawmaker and his wife. Follow live updates. #minnesota #melissahortman #timwalz",23558,829,30,16,US,7515908306083417390,Breaking News,Breaking News
2025-06-14 17:36:38,nytimes,"From The Athletic: The Pacers had made it a habit of pulling off stunning victories in these playoffs. But in Game 4 of the NBA Finals, it was the Thunder who pulled off a comeback. #nba #pacers #okc #thunder #nbafinals",89941,202,5,10,US,7515860177741188398,Sports,Sports
2025-06-14 17:06:11,nytimes,"A person pretending to be a police officer assassinated a Democratic state legislator in Minnesota and killed the lawmaker’s husband in “an act of targeted political violence,” Gov. Tim Walz said Saturday.  Photos by Tim Gruber for The New York Times and Dan Haugen for The New York Times #minnesota #timwalz #melissahortman",40765,1656,23,125,US,7515852345159257387,Politics,Politics
2025-06-14 14:37:55,nytimes,"Rizwan Vahora lost three relatives in the Air India flight that crashed on Thursday, killing more than 260 people. He joined other grieving family members at the hospital in Ahmedabad to give DNA samples to help identify the badly damaged bodies. Video by Nailah Morgan, Karan Deep Singh, Meg Felling and Raunaq Chopra/The New York Times #AirIndia #Ahmedabad",126611,3306,86,32,US,7515814061142019374,Breaking News,Breaking News
2025-06-14 01:00:35,nytimes,"Business owners and locals in the Little Tokyo neighborhood of Los Angeles say they are conflicted: frustrated as they scrub graffiti and clean up after looting, but also holding a deep sense of solidarity with anti-immigration raid protesters and their cause. #LittleTokyo #LosAngeles #immigration #protests",227134,21923,1601,338,US,7515603510113750315,Local News,Local News
2025-06-15 23:32:08,nytimes,"President Trump appointed Amy Coney Barrett to the Supreme Court to clinch a conservative legal revolution. But as soon as she arrived, she began surprising her colleagues. Jodi Kantor, our investigative reporter who has spent the past three years reporting on the Supreme Court, explains. Video by Jodi Kantor, Christina Shaman, Claire Hogan and Laura Salaberry/The New York Times #AmyConeyBarrett #SupremeCourt #Trump ",693023,61127,2980,1080,US,7516322885565304110,Politics,Politics
2025-06-15 23:12:31,nytimes,"Israel and Iran traded attacks late into Sunday night, as the three days of fighting intensified on both sides despite international pleas for de-escalation. Iranians and Israelis have been bracing for further violence. Read more at the link in our bio. #israel #iran ",300910,6805,126,387,US,7516317826815167790,World News,World News
2025-06-15 09:10:35,nytimes,"Protesters organizing under the slogan ""No Kings,"" calling for protecting American democracy from President Trump, filled plazas, streets and parks across the U.S. on Saturday, the same day that Trump held a military parade in Washington. Read more at the link in our bio. #NoKings #Trump #Protest",202489,24827,660,473,US,7516100340186467626,Politics,Politics
2025-06-16 23:10:00,nytimes,"State and federal officials announced charges, including murder, stalking and firearms offenses against a man who has been accused of assassinating a Minnesota state lawmaker and injuring another during multiple shootings. #minnesota",19534,648,5,38,US,7516681945686740267,Crime,Law & Order
2025-06-16 17:30:00,nytimes,"Iran’s deadly strike on Monday hit Israeli residential buildings and energy infrastructure, and Israel has since expanded its attacks on Iran. The war is in its fourth day now, with civilian casualties climbing on both sides. #Iran #Israel #middleeast",53066,1630,42,130,US,7516596644280945934,World News,World News
2025-06-16 16:15:00,nytimes,"At least five people, including a toddler, died in West Virginia after flash floods destroyed homes and washed away roads over the weekend. A flood watch remained in the hardest-hit parts of the state on Monday, officials said. Three people were missing.  #WestViriginia #flooding #weather",3940,50,0,3,US,7516577327799651626,Breaking News,Breaking News
2025-06-16 15:45:00,nytimes,"President Trump has lumped together violent and peaceful protesters when speaking about the demonstrations in Los Angeles. David Sanger, a White House correspondent for The New York Times, explains how that is a break from history. #LosAngeles #immigration #protests #Trump",2333217,222041,5389,6163,US,7516569160520846605,Politics,Politics
2025-06-17 22:00:00,nytimes,"Akash Patni, 14, was dropping off lunch for his mother, Sitaben, who ran a tea stall, when an Air India plane crashed into a nearby building. While she is receiving treatment for burns, he did not make it. Read more about the lives lost in the disaster.  An earlier version of this video included an incorrect translation for remarks by the aunt of a deceased teenager. The video has been re-edited to include the correct remarks and translation.  #AirIndia #plane #Ahmedabad #India",856683,60245,2703,584,US,7517037369527143735,Breaking News,Breaking News
2025-06-17 21:55:00,nytimes,"Watch as Sen. Alex Padilla spoke on the Senate floor about his removal from a news conference held by Kristi Noem, the homeland security secretary, and President Trump's immigration enforcement. Senate Democrats have called on her to testify at a hearing.  #AlexPadilla #LosAngeles #California #immigration #Trump",24012,1685,16,31,US,7517035497064025399,Politics,Politics
2025-06-17 21:26:50,nytimes,"Brad Lander, the New York City comptroller who is running for mayor, was arrested by ICE agents after he tried to steer a migrant out of the building to avoid his arrest. Lander was released several hours later on Tuesday afternoon.  #BradLander #NYC #immigration #ICE",49896,3355,296,67,US,7517032785324838158,Politics,Politics
2025-06-17 20:00:00,nytimes,"The Israeli military said it was “aware of reports regarding a number of injured individuals from IDF fire,"" after the Gaza Ministry of Health said that more than 50 Palestinians were killed near an aid distribution site in Khan Younis on Tuesday and blamed Israel for the deaths. #Gaza #Israel #middleast",1010597,95978,3254,477,US,7517006191327710494,World News,World News
2025-06-17 16:18:00,nytimes,"A couple visiting the Palazzo Maffei museum were posing for photos pretending to sit on Nicola Bolla’s “Van Gogh” chair, when the man sat down on the artwork, smashing it. Video shows the two of them fleeing the scene after. #Italy",27695,527,26,24,US,7516953138562108727,Arts & Culture,Arts & Culture
2025-06-17 14:27:21,nytimes,"From @theathletic: Jalen Williams played the best playoff game of his life, the Oklahoma City Thunder survived one of the Indiana Pacers’ patented, double-digit comebacks, and the NBA Finals could be nearly decided. Read our Game 5 recap at the link above. #NBA#playoffs #nbafinals #JalenWilliams",42382,139,2,6,US,7516924552543227149,Sports,Sports
2025-06-17 12:25:12,nytimes,Prime Minister Keir Starmer of Britain scrambled at President Trump’s feet to pick up the papers he dropped as he showed off a finalized trade agreement between the U.S. and Britain in a viral moment at the G7 Summit in Canada. #Trump #Starmer #tariff,39672,388,40,81,US,7516892934122360078,Politics,Politics
2025-06-17 10:40:22,nytimes,"President Trump returned to Washington on Tuesday after leaving early from the G7 summit in Canada to deal with the war between Iran and Israel. On the flight home, he told reporters that he was looking for something ""better than a cease-fire"" between Israel and Iran. Follow live updates at the link in our bio. #Trump #Iran #Israel",54675,673,25,14,US,7516865790663068941,Politics,Politics
2025-06-18 22:45:23,nytimes,"In recent extraordinary moves, Health Secretary Robert F. Kennedy Jr. has fired and replaced a team that makes vaccine recommendations for the U.S. Apoorva Mandavilli, our science and global health reporter, explains how this change could impact vaccine accessibility. #vaccines #health ",1385565,205196,27490,1947,US,7517424086218280206,Health,Health
2025-06-18 23:10:00,nytimes,"President Trump said that he had not made a final decision on whether to order American forces to join Israeli attacks on Iran’s nuclear sites. Iran’s supreme leader, Ayatollah Ali Khamenei, rejected Trump’s demand for an “unconditional surrender” and rebuffed his threats. #Israel #Iran #Trump",81336,4249,152,181,US,7517423850032745783,International News,International News
2025-06-18 21:42:28,nytimes,"A jury in Massachusetts on Wednesday found Karen Read not guilty of murder and manslaughter in the death of her boyfriend, John O’Keefe, a Boston police officer — ending a legal saga that has gripped the area since January 2022. The jury convicted Read on one charge, operating a vehicle under the influence. The verdict was delivered almost a year after an earlier trial in the case ended in a mistrial. Pool photo by Greg Derr #KarenRead #JohnOKeefe #Boston ",36756,1914,13,105,US,7517407922020764959,Crime,Law & Order
2025-06-18 20:09:32,nytimes,"An 80-year-old Italian man tried to navigate a car down the iconic Spanish Steps in Rome, which are closed to vehicles, according to the police department. The vehicle made it part of the way down but got stuck, the authorities said. #Rome #Italy #SpanishSteps ",3857962,146623,47571,1355,US,7517383925174439181,Local News,Local News
2025-06-18 00:40:00,nytimes,"President Trump spent the first months of his term holding back Israel’s push for an assault on Iran’s nuclear program. With the war underway, he has now expressed support for Israel. Jonathan Swan, a White House reporter for The New York Times, breaks down how the president got to this point. #Israel #Iran #Trump",64060,2979,63,133,US,7517072581057416462,Politics,Politics
2025-06-19 23:02:42,nytimes,"The Port of Los Angeles is the largest port in the Western Hemisphere as well as the place that first saw the signs of President Trump’s tariff war. Our reporter explains what the port illustrates about U.S. trade. Video by Ana Swanson, Laura Bult, Laura Salaberry/The New York Times #losangeles #trade #trump #tariffs ",7751,445,18,17,US,7517799636959071502,Business,Business
2025-06-19 22:50:00,nytimes,Israel and Iran continued to exchange attacks on Thursday as European diplomats made an attempt to de-escalate the conflict. The strikes highlight the risks to civilians in Israel and Iran after days of fighting between the two countries. #Israel #Iran,27752,802,23,39,US,7517792338014407991,World News,World News
2025-06-19 22:20:00,nytimes,"Hurricane Erick weakened Thursday and was downgraded to a tropical storm after hitting Mexico’s southern coastline as a Category 3 storm, leaving flash floods, landslides and tides of washed-up debris along its path.  #HurricaneErick #storms #Mexico #Oaxaca #Acapulco #Guerrero",16875,376,34,33,US,7517784208065056013,Weather,Weather
2025-06-19 22:15:00,nytimes,"The Supreme Court on Wednesday upheld a Tennessee law that prohibits some medical treatments for transgender youths, shielding similar laws in more than 20 other states. Adam Liptak, who covers the Supreme Court, describes the three factions of justices in the 6-to-3 decision. Video by Adam Liptak, Alexandra Ostasiewicz, David Jouppi and Jon Hazell/The New York Times. #transgender #SCOTUS #Tennessee",29235,2040,42,122,US,7517783247653227790,Politics,Politics
2025-06-19 19:45:00,nytimes,"On June 19, 1865, enslaved African Americans in Texas were told they were free. A century and a half later, people across the U.S. continue to celebrate the day, which is now a federal holiday. Here's what to know.  #Juneteenth #Texas #history #FreedomDay #EmancipationDay",27766,2978,241,37,US,7517744712447528247,National News,National News
2025-06-19 18:09:45,nytimes,"The national park of Zhangjiajie in central China is famous for the towering sandstone pillars that inspired the alternate universe in the 2009 blockbuster “Avatar.” But in recent weeks, the area has become known for its trash-filled caves.  #zhangjiajie #china #environment #caves #avatar ",1298874,48918,1226,445,US,7517724140472683789,Environment,Environment
2025-06-19 16:00:26,nytimes,"A cremation ceremony was held for Kinal Mistry, a victim of the Air India crash who hailed from a community that took pride in those who went abroad. Her family said she was someone who would “fulfill everyone’s dreams.” #AirIndia #PlaneCrash",237732,10910,208,372,US,7517690716710112526,Obituaries,Obituaries
2025-06-19 15:50:00,nytimes,"After weeks of federal agents mounting increasingly aggressive ICE raids across the U.S., President Trump’s border czar, Tom Homan, spoke with The New York Times about the administration’s deportation strategy and what is to come. Listen to ""The Daily."" #TheDaily #ICE #immigration #Trump",94207,4265,122,812,US,7517683179965123895,Politics,Politics
2025-06-19 08:37:16,nytimes,A SpaceX Starship rocket exploded in a huge fireball on a test stand during preparations for its next launch at the Elon Musk-led company’s base in South Texas. #SpaceX #Rocket #Texas,175072,9716,1419,943,US,7517576261682711821,Science/Technology,Science/Technology
2025-06-20 21:10:00,nytimes,"Lawmakers in the UK approved plans to introduce medically assisted suicide for terminally ill patients in England and Wales. Legislators supported the proposal by a vote of 314 to 291. The bill now goes to the unelected second chamber of the Parliament, the House of Lords. #UK #England #Wales #health",23353,1215,11,35,US,7518137702382849293,Health,Health
2025-06-20 17:46:56,nytimes,"Tens of thousands of demonstrators took to the streets across Iran, Lebanon and Iraq on Friday to protest against Israel’s attacks as Israel and Iran continued to trade fire.  #Iran #Lebanon #Iraq #middleeast",36878,2562,132,246,US,7518089435276119309,World News,World News
2025-06-20 15:00:04,nytimes,"This summer marks the 50th anniversary of “Jaws,” the first blockbuster. But would a movie like that be greenlit today? Probably not. Our film critic explains why. #Jaws #Movie #MovieHistory #FilmHistory",37208,4615,108,58,US,7518046429579906317,Entertainment,Entertainment
2025-06-21 20:35:25,nytimes,"A video message by Campbell Wilson, Air India’s chief executive, drew criticism for closely resembling what the head of American Airlines said after a deadly crash in Washington months earlier. Read more at the link in our bio. #AirIndia #AmericanAirlines",262211,11832,2713,351,US,7518503802681527565,Business News,Business News
2025-06-21 19:46:24,nytimes,"The comedian Andrew Schulz is known for his defiantly anti-woke standup as well as his influential podcasts. He recently spoke about his growing political influence, frustrations with the media and more. Watch, read or listen to “The Interview.” An earlier version of this video included an editing error. We deleted the incorrect video. #AndrewSchulz #podcasts",46571,1615,29,183,US,7518491214715342135,Entertainment,Entertainment
2025-06-21 03:20:00,nytimes,"President Trump’s executive orders have sought to reframe the history of race and culture in America. Erica L. Green, a White House correspondent for The New York Times, describes the efforts to erase Black history. #Trump",13050,1017,54,35,US,7518232842258746637,Politics,Politics
2025-06-22 19:10:27,nytimes,"“There are no rights in such situations. It felt like kidnapping.” Mahmoud Khalil, a Columbia University graduate and pro-Palestinian activist, was the first student protester targeted and detained by the Trump administration. On Friday, after having spent more than three months in detention, he was released on bail. #trump #mahmoudkhalil",12448,818,13,24,US,7518853040552578318,Politics,Politics
2025-06-22 18:32:31,nytimes,"In a briefing at the Pentagon, officials said the U.S. strikes caused “severe damage” to Iranian nuclear sites. But neither Defense Secretary Pete Hegseth nor the chairman of the Joint Chiefs of Staff could immediately say whether Iran still retained the ability to make a nuclear weapon. #iran #trump",28929,1437,76,97,US,7518843248970845495,International News,International News
2025-06-22 06:41:40,nytimes,"American warplanes and submarines attacked three key nuclear sites in Iran early Sunday, bringing the U.S. military directly into Israel’s war and prompting fears that the strikes could lead to more dangerous escalations across the Middle East. After attacking Iran, President Trump warned of more strikes “if peace does not come quickly.” #trump #israel #iran ",79702,4685,556,207,US,7518659936168021262,World News,World News
2025-06-22 03:49:41,nytimes,"The U.S. has entered Israel’s war against Iran, attacking three nuclear sites on Saturday. In an address from the White House, President Trump said the aim “was the destruction of Iran’s nuclear capacity” and warned of more attacks “if peace does not come quickly.” Follow live updates and see analysis at the link in our bio. #trump #iran #israel ",750190,39603,3687,1291,US,7518615750521703735,World News,World News
2025-06-22 03:08:13,nytimes,"American warplanes and submarines attacked three nuclear sites in Iran, bringing the U.S. military directly into the war after days of uncertainty about whether President Trump would intervene. #iran #israel #trump #US ",27561,744,37,171,US,7518605058347437325,World News,World News
2025-06-23 23:10:00,nytimes,"Iran launched missiles on Monday at the Al Udeid Air Base, the largest U.S. military installation in the Middle East, in retaliation for U.S. strikes on its nuclear sites. Qatar said its air defenses had intercepted the missiles, and the U.S. Defense Department reported no injuries. #Iran #Qatar #missiles",30604,1143,62,37,US,7519276452878060814,World News,World News
2025-06-23 22:40:00,nytimes,"Over the past week, President Trump claimed he would make a decision about Iran in “two weeks” and repeatedly pressed it to come to the negotiating table. But the swiftness of the attack on Saturday night suggests that plans were underway after Israel began its bombing campaign against Iran a little more than a week ago. #Israel #Iran #Trump",20742,1356,44,76,US,7519273008859516174,Politics,Politics
2025-06-23 21:02:09,nytimes,"With his strikes on Iran, President Trump is betting that the U.S. can repel any retaliation and that the attacks destroyed the regime’s chances of reconstituting Iran’s nuclear program. David Sanger, the White House and national security correspondent for The New York Times, explains the risk. Video by David E. Sanger, Alexandra Ostasiewicz and James Surdam #Iran#Israel#Trump",108918,5992,238,485,US,7519252917346389303,World News,World News
2025-06-23 18:15:00,nytimes,"More than 190 firefighters in Greece are battling a series of wildfires on the island of Chios, where officials declared an emergency and a dozen communities were evacuated over the weekend, according to state media. The authorities are investigating the fires as arson.  #Greece #Chios #wildfires",219896,13118,1288,184,US,7519205348658384142,Breaking News,Breaking News
2025-06-23 15:25:00,nytimes,"When President Trump took office, USAID was one of the first agencies to be dismantled, as he froze aid funding and Elon Musk's DOGE team cut most staff members. Amy Schoenfeld Walker, our reporter who has been tracking the foreign aid cuts and restorations, shares what she’s learned.  Video by Amy Schoenfeld Walker, Christina Thornell, Nikolay Nikolov, Claire Hogan, Melanie Bencosme, Laura Salaberry #USAID #aid #Trump #ElonMusk #DOGE",29619,3520,138,125,US,7519161677879774478,Politics,Politics
2025-06-23 14:05:21,nytimes,"Protests were held around the world on Sunday against the Trump administration’s airstrikes on Iran. Demonstrators at several locations carried Iranian flags, and some held signs and placed banners across fences and buildings that read “No War in Iran!” Video by Nailah Morgan/The New York Times #Iran#Israel#Trump#protests",19240,1223,43,57,US,7519145362813226254,World News,World News
2025-06-23 12:49:59,nytimes,From @theathletic: The Thunder capped off one of the greatest seasons in NBA history after defeating the Indiana Pacers in seven games to clinch the franchise's first NBA championship since it relocated from Seattle to Oklahoma City. #NBA #nbafinals #playoffs #tyresehaliburton,10128,247,7,8,US,7519125818572934413,Sports,Sports
2025-06-24 23:10:00,nytimes,"Christina Goldbaum, a New York Times reporter, and Katrin Bennhold, a senior writer on the international desk, discuss how the power dynamics in the Middle East could change as Iran has become more isolated. #Iran",19924,603,22,44,US,7519652770513685773,World News,World News
2025-06-24 19:36:05,nytimes,"Mish and Lucy, two 5-year-old brown bears, escaped their enclosure on Monday and broke into their stockpile of treats at a wildlife sanctuary in Devon, England. The two of them devoured a week’s worth of honey in about an hour. #Bears #Devon",12744,299,11,29,US,7519601814665170189,Animals,Animals
2025-06-24 14:21:31,nytimes,"President Trump lashed out at Israel and Iran on Tuesday for launching attacks after he had announced a cease-fire. Iran denied violating the truce and Israel’s retaliation appeared limited, suggesting that the deal remained intact for now. Follow live updates. #Trump #Iran #Israel #ceasefire",8032474,488228,50220,17624,US,7519520646267768119,Politics,Politics
2025-06-25 21:45:44,nytimes,"President Trump laid into Spain during the NATO summit at The Hague on Wednesday, after it broke ranks with the other member states and declined to increase its military spending to 5% of its economic output over a decade. #NATO",28382,659,18,63,US,7520006316165778702,Politics,Politics
2025-06-25 20:28:05,nytimes,"President Trump said on Wednesday that the cease-fire between Israel and Iran was “going very well.” After a shaky start, a sense of normalcy returned to the warring countries on Wednesday as the truce appeared to hold. #Iran #Israel #ceasefire",80925,5600,138,286,US,7519986316109434125,International News,International News
