create_time,username,video_description,view_count,like_count,share_count,comment_count,region_code,id,section,merged_section
2025-06-25 19:49:24,nytimes,"After one of the most brutal wars of this century, a new flag flies across Syria: the emblem of the rebels who toppled the dictator Bashar al-Assad. Ben Hubbard, The New York Times’s Istanbul bureau chief, describes what our journalists learned as they drove across Syria, meeting people in towns and cities along the way as they strove to rise from the wreckage and build new lives. Video by Ben Hubbard, David Guttenfelder, Rebecca Suner and James Surdam #syria #middleeast",49134,3911,129,139,US,7519976312761568526,World News,World News
2025-06-25 18:05:14,nytimes,"Videos show smoke coming out of the right engine of an American Airlines passenger jet heading from Las Vegas to Charlotte, North Caolina. The plane turned around and landed safely after the crew reported an engine issue, the FAA said.",36287,864,45,43,US,7519949572551052557,Aviation News,Aviation News
2025-06-25 17:14:59,nytimes,"Kenyan police fired live rounds, tear gas and rubber projectiles at protesters who were in the streets a year after massive anti-government demonstrations against a contentious tax plan turned deadly. #Kenya #kenyaprotests",27154,1395,130,99,US,7519936604497136951,World News,World News
2025-06-25 11:00:52,nytimes,"A Falcon 9 rocket propelled four people toward the International Space Station on Wednesday morning, including astronauts from Hungary, India and Poland — three countries that have never sent anyone to the orbiting laboratory before. #astronaut #space",8989,448,7,34,US,7519840194791574797,Science,Science
2025-06-25 09:10:48,nytimes,"Zohran Mamdani, a little-known state lawmaker whose progressive platform and campaign trail charisma electrified younger voters, stunned former Gov. Andrew Cuomo in the Democratic primary for mayor of New York City on Tuesday night, building a lead so commanding that Cuomo conceded. #NewYork #mayor",15276,1423,27,98,US,7519811850087730487,Politics,Politics
2025-06-25 00:50:00,nytimes,"A group of six young men traveled to Atlanta before dawn and tore Pride flags at a rainbow crosswalk, the police said. Four of them had been arrested but two remain at large as the authorities consider hate crime charges. #Atlanta",3124640,137835,7627,28218,US,7519676721260498189,Local News,Local News
2025-06-26 21:23:48,nytimes,"Two swirling waterspouts were spotted in the Tampa Bay, Florida, area on Sunday. Waterspouts are a common occurrence in Florida during the summer. #Tampa #Waterspout #Florida",582617,69529,8434,687,US,7520371831069609271,Weather,Weather
2025-06-26 18:34:22,nytimes,"Wesley Morris has a confession to make: He loves Bruno Mars. Nothing wrong with that, right? With the help of the culture writer Niela Orr, Wesley untangles his crush from his discomfort with the pop star’s cozy relationship to Blackness on ""Cannonball,"" a new weekly culture podcast. Watch or listen to the first episode at the link above or at youtube.com/@CannonballPodcast. #BrunoMars#Cannonball #WesleyMorris #NielaOrr",53752,3377,474,591,US,7520328174006209805,Entertainment,Entertainment
2025-06-26 17:05:00,nytimes,"The Ecuadorean president said José Adolfo Macías, the leader of the infamous Los Choneros criminal organization, who is known as “Fito,” will be extradited to the U.S., where he’s accused of drug trafficking and weapons smuggling. #ecuador",20793,747,38,13,US,7520300206169050381,Crime,Law & Order
2025-06-26 18:00:00,nytimes,"President Trump has signaled plans to phase out the Federal Emergency Management Agency after this year’s hurricane season. As storms continue to hit, smaller nonprofit groups and individuals are stepping in to help aid recovery efforts. Emily Cochrane, a reporter for The New York Times, takes us to Kentucky, where one group is cleaning up after tornadoes hit in May. Video by Emily Cochrane, Kassie Bracken, Christina Shaman, Laura Bult and Allison Joyce/The New York Times #fema #hurricane #trump",12302,545,13,36,US,7520299617792150798,National News,National News
2025-06-26 16:40:59,nytimes,"For the last decade, car companies have received credits as an incentive to provide start-stop technology, which shuts off a stopped car’s engine, to reduce emissions. The EPA administrator, Lee Zeldin, says “everyone hates” the feature and has vowed to eliminate the credit. Ben Blatt, who writes about regulatory conundrums, looks at its history and future. Video by Ben Blatt, Gabriel Blanco, Karen Hanley and David Jouppi #cars #environment #climate",49173,3137,121,194,US,7520298961408740663,Automotive News,Automotive News
2025-06-26 11:20:56,nytimes,"This week, Jeff Bezos, the founder of Amazon and one of the world’s richest men, is set to marry Lauren Sánchez, a former TV reporter, in Venice, Italy, where some locals are already upset about the event. Read everything we know about the wedding at the link in our bio. #Venice #wedding",54563,1124,44,91,US,7520216465564241207,Entertainment,Entertainment
2025-06-26 03:10:00,nytimes,"Emma Fitzsimmons, City Hall bureau chief for The New York Times, explains how State Assemblyman Zohran Mamdani claimed victory over former Gov. Andrew Cuomo. #Mamdani #newyorkcity",147037,12831,140,328,US,7520082336763923725,Politics,Politics
2025-06-27 23:10:00,nytimes,"Mohsen Naghib-Hashemi, a graphic designer from Tehran, said his home and car were significantly damaged during the fighting between Israel and Iran. He described to The New York Times the challenges he faces in rebuilding his life. #iran #israel",10878,453,2,18,US,7520759649260309773,World News,World News
2025-06-27 14:06:41,nytimes,"Sam Altman, the founder of OpenAI, and Brad Lightcap, the company's chief operating officer, joined the hosts Casey Newton and Kevin Roose for a special live recording of @hardfork where the group discussed Mark Zuckerberg and Meta's poaching of OpenAI's employees. Listen to the recap at the link above. Video by Pat Gunther, Chris Schodt and Sophie Erickson #SamAltman #OpenAI #HardFork",276948,13783,938,180,US,7520630108361624846,Technology,Technology
2025-06-27 12:55:09,nytimes,"More than 500 directors, actors and other names in Hollywood and around the world voted on the best films released since Jan. 1, 2000. See the full list at the link in our bio. Video by By Kyle Buchanan, Mekado Murphy, Leila Medina, Laura Salaberry, Alexandra Ostasiewicz, Gabriel Blanco and Harvey Glen #bestmovies",7055,260,29,6,US,7520611499312778510,Entertainment,Entertainment
2025-06-27 00:53:04,nytimes,Tanner Martin documented his five-year-long battle against colon cancer for his hundreds of thousands of followers on social media before passing away at age 30. He left behind his young family and a legacy of candid honesty about living with cancer. #cancer,124737,11231,198,158,US,7520425650830855438,Obituaries,Obituaries
2025-06-28 23:48:48,nytimes,"Facing drought after drought, Los Angeles has managed to reduce its water use by more than a third, even as the population has grown. Michael Kimmelman, editor at large of Headway, a team at The New York Times focused on paths to progress on big challenges, reports. #losangeles #water #environment #drought ",72031,6222,176,165,US,7521151299820227895,Environment,Environment
2025-06-28 23:06:43,nytimes,"Minnesota State Representative Melissa Hortman and her husband, Mark, were remembered at their funeral on Saturday as “extraordinary public servants” who were killed in an inexplicable act of political violence. #Minnesota #MelissaHortman #Minneapolis #TimWalz ",7602,458,2,52,US,7521140447150935310,Obituaries,Obituaries
2025-06-28 02:10:00,nytimes,"Global demand for Labubu plush toys, sold by the Chinese company Pop Mart, has sparked a wave of fakes — putting Chinese customs authorities in a near-daily battle against counterfeits.",7073,152,24,18,US,7520778234548555063,Business,Business
2025-06-28 00:10:00,nytimes,"At the Minnesota State Capitol, mourners lined up to pay their respects to State Representative Melissa Hortman and her husband, Mark, who were assassinated at their home earlier this month. #Minnesota",29494,2276,26,68,US,7520776720677375287,Breaking News,Breaking News
2025-06-30 20:58:33,nytimes,"Crew members rescued two passengers from a Disney cruise after they drifted in the sea away from the ship. Witnesses said that they had seen a girl fall overboard and a man, possibly her father, go in after her. #DisneyCruise",22532,647,25,35,US,7521849651570511117,Breaking News,Breaking News
2025-06-30 20:10:00,nytimes,"Spain, France, Portugal, Greece and Italy have experienced record temperatures, and the extreme heat is forecast to persist into the middle of the week. Meteorologists warn that Europe can expect more and hotter heat waves in the future because of climate change. #Spain #France #Portugal #Greece #Italy #heatwave #climatechange",76039,5845,583,115,US,7521832688135802126,Weather/Climate,Weather/Climate
2025-06-30 14:13:38,nytimes,"Sam Altman, the founder of OpenAI, joined the hosts Kevin Roose and Casey Newton for a special live recording of @hardfork where he talked about how he'd feel if his child had an ""A.I. friend."" Video by Pat Gunther, Chris Schodt and Sophie Erickson #SamAltman #OpenAI #HardFork #ChatGPT",6656,246,11,19,US,7521745314651327799,Technology,Technology
2025-06-30 08:24:12,nytimes,"A gunman deliberately started a wildfire in a rugged mountain area of Idaho and then shot at the firefighters who responded, killing two and injuring another on Sunday afternoon in what the local sheriff described as a “total ambush.” #Idaho #News",108356,10092,1215,380,US,7521655262785080590,Breaking News,Breaking News
2025-06-30 00:12:18,nytimes,"These nuns in Brazil went viral for beatboxing. Using their newfound fame to draw attention to the Catholic Church, they are part of a wider movement within the church to let go, loosen up and meet younger audiences where they are: online. Jack Nicas, our Brazil bureau chief, went behind the scenes as the nuns recorded their first music video. Read more at the link in our bio. Video by Jack Nicas, Victor Moriyama, Christina Shaman, Rebecca Suner and Laura Salaberry/The New York Times #Brazil #CatholicChurch ",4415,329,35,20,US,7521528409676205367,Culture,Culture
